评论内容,评论时间,评论人等级,评论类型
让我看看有多少戏迷[脱单doge],2021-09-19 19:52:31,6,评论
宝，这次单个来看质量依旧很高，但我能看出来，因为非遗很多，所以想展示的重点的东西太多了。这反而让人抓不住重点了，而且因为想表达太多了。节奏有点快，有点浅尝辄止不过瘾的感觉，和之前慵懒华美的让人沉浸感觉比，有些略逊一筹，不是那么顺畅，明朗，希望下次的节目还是有一个或两个突出的重点，由点及面，步步深入，方能惊艳，让人沉浸。文化事业急不得，贪多嚼不烂，这个菜系讲究诚心，匠心，真心，切绝不能太急躁。要细品，仔细，认真的品，不要急，还有那么多次机会来展示，慢慢来，把它当成一种事业，一种使命，一种精神，一点点进步就好。中华传统文化复兴是有远大前景的，你们确实做的非常好！坚持，思考，改进，继续努力加油💪💪爱你😘。,2021-09-19 21:01:03,3,回复
回复 @宇爹考研数学一 :同感，太细了，你仔细看会发现有太多太多想表达的东西只出现了一两个镜头，还没看清呢就过去了更别说细细品了，只能说文化太丰盛了时长感觉被压缩了，像是看了电影解说而不是完整版的电影呀河短短,2021-09-19 21:16:52,4,回复
我....来了[微笑][微笑][微笑],2021-09-20 14:13:31,6,评论
你为甚么这么晚又沉[调皮],2021-09-20 14:18:47,5,回复
我河南95后 可以完整的唱出 刘大哥讲话  朝阳沟 五世请缨 穆桂英挂帅   然而我并不是戏迷[脱单doge],2021-09-20 17:02:40,5,回复
回复 @陶画运 :我不信[滑稽],2021-09-20 18:45:47,4,回复
象象是戏迷！[脱单doge],2021-09-19 20:04:05,6,评论
象象太重了，快来捞捞呗[吃瓜],2021-09-19 20:06:06,6,回复
回复 @大象新闻 :捞,2021-09-19 20:08:05,5,回复
我河南95后 可以完整的唱出 刘大哥讲话  朝阳沟 五世请缨 穆桂英挂帅   然而我并不是戏迷[脱单doge],2021-09-19 23:34:59,5,回复
最经典的几句话“别乱动 这是规矩！” 真是讽刺了 现在那些把“女驸马”改的面目全非的二货们   传统文化真是被它们嚯嚯的够够的了[吐],2021-09-19 20:06:32,5,评论
女驸马唱成女花魁，简直了！,2021-09-19 20:21:31,5,回复
回复 @nana337 :黄梅戏唱成了黄媚戏。我差点憋出内伤。,2021-09-19 22:21:45,2,回复
短短几分钟硬是拍成了电影的质感，审美炸裂！,2021-09-19 20:59:04,3,评论
确实，太有沉浸感了，有一瞬间真把它当成电影了[喜极而泣],2021-09-19 22:06:01,6,回复
唐小月穿梭在戏台幕后，看着角儿们粉墨登场，这本是团圆夜，戏曲艺术家们用十年苦功，在台前为观众庆贺团圆，为节日带来欢乐，自己只能却奔走于各地梨园独自过节。,2021-09-19 22:57:36,3,回复
回复 @耘丞 :粉墨登场是贬义词，宝友这可不兴混用啊。,2021-09-24 13:07:51,5,回复
这是规矩，我挺喜欢这句话的，有些文化就得按照原本的方式来演绎，抖音上那些个网红自己改编的真的是难以接受。,2021-09-19 20:47:13,4,评论
本以为年轻人会厌烦规矩两字，破旧立新，看来文化传承做得还好。放心了,2021-09-19 22:11:08,3,回复
回复 @音吉义质 :十几岁的时候说实话不喜欢这种传统文化，因为我家里还算是那种传统的家庭吧，就是父亲管教的比较严，很偶尔的一次机会，第1次在新华书店看到了一本中国的乡土的小说，从那以后才开始慢慢了解中国本土的小说，戏曲，各地风俗，这种东西确实需要年龄的增长来慢慢学着去欣赏。,2021-09-19 22:45:26,4,回复
好喜欢这个节目啊，每年春晚也有戏曲串烧，梨园贺新春，表演者应该也是每派的代表人物，可是春晚时间太宝贵，都只节选了一段，匆匆上台匆匆下台，而意犹未尽。戏韵从靴子、戏服、头盔制作入手，带我领略各种非遗技艺的高超，带我看到台上一分钟台下十年功的辛苦，让我一一看清了青衣、武生、老生、武丑传人的脸，看着他们一丝不苟地装扮，看着他们在台上投入的表演，我感受到了戏曲的魅力，戏曲的美。尽管受到现代文化的冲击，但是这韵是存在于我们的血液里、基因里，热烈而激荡。致敬每一位曲艺工作者，致敬传承。[爱心],2021-09-19 20:12:50,5,评论
春晚的太真实了，一小段，都来不及品，轰轰地上来匆匆的下台了。,2021-09-19 23:12:40,4,回复
回复 @是你的悔吗 :春晚戏曲主角配角一堆人，乌泱泱的，我甚至看不清谁是谁，背景也花团锦簇得有点乱了，每组只唱七八句短的不能再短的一小节，真的不能展现戏曲魅力万分之一。这个节目有，又好像没有。感觉近几年春晚的问题就是人多，杂，一首歌7/8个人，这是偷懒的表现，看似阵容强大，还不如河大卫这样细细琢磨，短小精悍但却深入人心。,2021-09-20 00:54:48,5,回复
运镜牛逼,2021-09-19 20:09:56,5,评论
可恶，为什么我只会说牛逼！,2021-09-19 20:10:11,5,回复
回复 @哔站撩神_兰陵小鬼 :木有事，千年之后这也是国粹！[doge],2021-09-19 21:42:39,5,回复
跟我一样，文化荒漠[大哭],2021-09-19 21:48:16,5,回复
我想起一句话——他们都成角儿了，得挨多少打啊……致敬真·角儿……,2021-09-19 20:36:52,5,评论
突然想吃糖葫芦[tv_腼腆],2021-09-19 21:06:13,5,回复
以前吃了苦受了罪熬出头就好了，可是看看现在流量都给谁了！那些吃过苦受过罪的人却没有姓名！,2021-09-19 21:44:56,5,回复
回复 @枸亿拓 :吃吧吃吧，带着纸巾，看着月亮……,2021-09-19 21:58:26,5,回复
以前说人是戏子是骂人的话 但是看了这出节目.....卧槽你跟我说那些流量明星是戏子试试？抽你丫的！戏子是谁想当就当的了的吗？！别以为哼哼两句就算唱了，走两步就叫跳了，上个镜头就算演了！看不起谁呢！,2021-09-20 00:46:17,5,评论
就这过去还是下九流的，上九流是骑马耍猴儿，然后就不知道了[笑哭],2021-09-20 02:05:19,3,回复
所以说挺可笑的，戏子是骂人的话，明星竟然不是,2021-09-20 04:41:06,5,回复
回复 @鹤澜山川 :明星最初应该是启明星起引导作用的，现在他们连明星都配不上,2021-09-21 09:46:14,5,回复
"节目里好多知识点。奈何本人没文化，以下是我一条一条搜索来的。漏掉的请大家帮忙补充：[热词系列_热乎]1.【戏剧靴子制作技艺】厚底靴又叫高方靴，长筒、方头，底厚2～4寸,黑缎面、白底。2.【京绣】北京市房山区、河北省定兴县传统美术，国家级非物质文化遗产之一。3.【戏曲盔头制作技艺】民间传说盔头制作始于唐代。北京曾有的盔头作、盔头巷等坊巷。4. 【荀派】荀慧生(1900~1968)，男，字慧声，号留香，艺名白牡丹。京剧旦角表演艺术家，荀派艺术的创始人。为“四大名旦”之一。5. 【叶派】叶盛章(1912~1966)，男，字耀如，中国京剧演员、教育家，工丑行，文武双全（武戏和文戏都能做），尤擅武丑。6. 【余派】余叔岩(1890~1943)，男，中国京剧演员，工生行，师承谭鑫培。祖父余三胜和父亲余紫云都是京剧表演艺术家。 他的京剧声腔艺术影响很大。7. 【谭派】谭鑫培(1847~1917)，男，本名金福，字望重，京剧演员，工老生。 谭鑫培是一位承先启后的京剧表演艺术家，影响极大，故去后，梁启超写挽联“四海一人谭鑫培，声名卅载轰如雷”。8. 【京剧脸谱】一种具有中国文化特色的特殊化妆方法。由于每个历史人物或某一种类型的人物都有一种大概的谱式，所以称为“脸谱”。9. 【张派】张君秋(1920~1997)，男，原名滕家鸣，字玉隐，京剧表演艺术家，工旦行。旦角张派创始人，四小名旦之一。10. 【杨派】杨小楼(1878~1938)，男，名三元，谱名嘉训，为京剧武生一代宗师。其父杨月楼、义父谭鑫培皆为清末名伶。在当时和梅兰芳、余叔岩并称为“三贤”，成为京剧界的代表人物。除此之外，还出现了【戏剧服装师】 【戏曲盔箱师】等词条。[热词系列_吹爆][热词系列_吹爆][热词系列_吹爆][热词系列_吹爆]",2021-09-20 19:29:21,5,评论
真的漏掉了 [委屈]【李派】李万春(1911~1985)，男，中国京剧表演艺术家，工生行。马连良大弟子，曾师从载涛学猴戏。 其父李永利是红遍江南、称绝一时的清末著名武花脸演员。,2021-09-20 20:57:13,5,回复
荀慧生，男，京剧旦角。原名词，又名秉彝、秉超，字慧生，号留香，艺名白牡丹。出生于河北省东光县（现为阜成县）一个捻售线香的手工业之家。荀慧生幼年家贫无以生计。1907年随父母到天津谋生，父亲将他与兄慧荣卖予小桃红梆子戏班学戏。不久其兄不堪忍受打骂私自逃走，只剩慧生，后被卖给花旦为私房徒弟，自此，荀慧生沦为家奴，吃尽苦头，但他仍以巨大的耐力与毅力坚持每天练功。夏天穿棉袄，冬天穿单衣，头顶大碗，足履冰水，点香火头练转眼珠，日复一日，年复一年，苦功练出了硬本领，唱、念、做、打无一不精。1909年，荀慧生以“白牡丹”艺名随师常在冀中、冀东一带农村市镇唱庙会和野台子戏。1910年荀慧生随师进京，先后搭庆寿和、义顺和、鸿顺和、天庆和等梆子班。1918年拜王瑶卿门下学习正工青衣。同年杨小楼应上海天蟾舞台之邀和尚小云、谭小培合作演出，请荀慧生担任“刀马旦”，公演引起轰动，人称“三小一白”（即小楼、小云、小培和牡丹）。荀慧生的表演生动活泼，扮相俊俏，使上海观众耳目一新，被赞为“誉满春申”。荀慧生喜欢作画，1924年正式拜吴昌硕为师，他又向齐白石、陈半丁、傅抱石、李苦禅、王雪涛等名师求教，丰富了他的艺术生活，提高了他的艺术素养。1927年北京报界举办京剧旦行评选，他与梅、尚、程一起被誉为“四大名旦”，这也标志着他艺术走向成熟，得到社会肯定，赢得了观众的赞赏。,2021-09-20 22:18:10,5,回复
张君秋，男，京剧旦角。别名家鸿。祖籍江苏丹徒，生于北京。幼从李凌枫学戏，后拜尚小云、梅兰芳为师。在上海一炮而红，与李世芳、毛世来、宋德珠被誉为“四小名旦”。他学习前人不拘形似，追求神似。他的唱腔，兼容梅、尚、程、荀之腔，结合自己嗓音明亮、甜润、高中低音运用自如的优越条件，另辟蹊径。经过他的润色修饰，其唱腔有一种刚健清新的美感，形成他独特的艺术风格。他在《状元媒》中饰柴郡主、《望江亭》中饰谭记儿、《赵氏孤儿》中饰庄姬、《西厢记》中饰崔莺莺、《秦香莲》中饰秦香莲，这些角色的唱腔，均成为张派的艺术精品。他的新唱腔，不离京剧风格，不落俗套，他的艺术风格，在于自然率真。他创造的张派艺术影响深远，可以说“十旦九张”。1962年在文化部主持与武生名家高盛麟“走马换将”交流演出，红遍大江南北，轰动全国，一直被传为梨园佳话。晚年参与中国京剧音配像工程，任艺术总顾问，为保留传统剧目，再现老艺术家舞台形象做出了巨大贡献。,2021-09-20 22:34:21,5,回复
纸做的靴子底，京剧生旦净末丑传承人，京剧，戏服还有啥我没注意到的[doge],2021-09-19 19:56:20,5,评论
又看了一遍，刺绣[打call],2021-09-19 20:06:31,5,回复
有一个旦上台镜头是三寸金莲,2021-09-19 20:50:42,4,回复
回复 @改名为抽奖我真牛 :那是跷,2021-09-19 20:51:50,5,回复
小可爱们和河南台说的是一辈子[热词系列_爱了爱了]差一年，一个月，一天、一个时辰…都不算一辈子哦～[热词系列_再来亿遍],2021-09-19 20:13:23,5,评论
捞捞小味[给心心],2021-09-19 21:01:02,5,回复
捞捞小胖[doge],2021-09-19 22:10:53,5,回复
回复 @枸亿拓 :让河小味吃完饭再捞,2021-09-19 22:59:40,5,回复
我们的传统文化真的好精致哦，就是这种精致造就了美，其实好多人不喜欢传统文化只是因为不了解，了解之后真的很难不喜欢,2021-09-19 20:29:16,5,评论
全世界也只有中国有这么细致入微能传承多年 且能被大众喜爱的艺术了！！,2021-09-19 21:07:22,4,回复
真的，太精致了，完全不是现在一些粗制滥造的东西可以比的[打call][打call],2021-09-20 15:08:38,5,回复
太短了，真不用替我节约时间[藏狐],2021-09-19 22:44:01,5,评论
哈哈哈哈哈哈哈哈哈，也不用替我节约时间,2021-09-19 23:55:23,4,回复
想白嫖就直说[吃瓜][吃瓜][吃瓜],2021-09-20 12:17:17,5,回复
后台衣箱只有丑角能坐,2021-09-19 22:08:27,5,评论
没错，丑角在戏剧里地位最高，化妆好像也是先给丑角化,2021-09-20 01:54:54,4,回复
回复 @绯色万物 :以前很多台柱子，班主什么的，都是丑角担任的。,2021-09-20 08:41:06,4,回复
02:38 索明芳老师上台时穿翘鞋，表演的翘功，俗称东方芭蕾舞，不同的是，芭蕾舞不是全程踮脚尖，而翘脚是穿上到表演完毕都是脚掌受力表演的，就类似穿上了一双没有跟的高跟鞋，表演难度很大的。之前七夕奇妙游里面戏曲《爱》中有一段舞蹈水袖舞里面就有一段在椅子上的翘功表演，很可惜剪的完全看不出来，不过还好后面河太丑放了完整版的，真的是特别震撼！！！传送门BV1if4y137na [藏狐][藏狐]都必须！给我点进来看！,2021-09-20 01:12:54,5,评论
哎其他卫视是一点戏曲不整呀，堂堂央视，有钱请京剧名家王珮瑜，结果是请去唱歌[微笑],2021-09-20 08:21:51,6,评论
也就以前梨园春总决赛时能请到名角儿，不然老前辈们都不愿出去,2021-09-21 01:33:52,6,回复
其实14年春晚央视请了很多角儿唱同光十三绝，那个质量真的高，请的于魁智李胜素迟小秋王艳还有佳春~但不知道后来就不怎么搞了。。。,2021-09-21 15:05:41,4,回复
回复 @六卷_lcc :那首同光13绝是真的好听，念念不忘了很久，可惜再没有好的了,2021-09-21 20:49:41,5,回复
超爱这个长镜头！！！估计拍了不少遍吧，辛苦节目组人员了[点赞],2021-09-19 19:56:00,4,评论
我觉得这回是所有奇妙游系列整体质量最高的一期了,2021-09-20 13:37:46,5,评论
[喜极而泣][喜极而泣][喜极而泣]是，格局太高了,2021-09-20 13:41:59,4,回复
其实最喜欢的不是节目，是后台，所有东西都让我觉得很奇妙,2021-09-19 22:51:02,5,评论
+10086,2021-09-20 12:15:21,5,回复
加一,2021-09-20 15:40:07,5,回复
我也喜欢，一听锣鼓浑身来劲,2021-09-20 23:55:55,5,回复
我感觉这次的节目是这几次奇妙夜最佳的，尤其是这个和大唐行者，少林功夫，和，歌曲都好好看。好家伙我变报幕的了[笑哭][笑哭],2021-09-20 08:23:36,4,评论
回复 @每天都在努力学习的 :报幕都报错了，扣工资，不对，扣硬币[吃瓜],2021-09-24 18:50:13,3,回复
不好意思，东都行者[笑哭],2021-09-24 07:07:01,4,回复
宣传其他剧种也是格局，都是中华文化,2021-09-19 21:12:50,5,评论
传承不会因为时间而改变，那怕百年千年！[打call][打call][打call],2021-09-19 19:50:31,6,评论
这个节目没上热门，在坐的各位都有责任！我真的太爱这个节目了[物述有栖_好耶],2021-09-19 21:49:12,4,评论
回复 @陆曼夕 :确实，就周深上了热搜，另一个还不是河南卫视上的[笑哭]。我觉得这次反响肯定不止这些，b站真的让人很失望，下个月我都不准备充会员了,2021-09-21 09:30:46,5,回复
B站要推自己的晚会，你看这播放量都压成什么样了。,2021-09-21 02:04:23,5,回复
B站的晚会也很好看啊,2021-09-24 21:56:46,3,回复
好喜欢河南卫视的运镜和特效，虽然有一些反对的声音，但每个人爱好不同吧，我就很喜欢这种形式,2021-09-19 23:17:03,5,评论
我觉得后来特效太多了真没有春晚和元宵更具观赏性，记忆点也会淡很多，希望官方看到,2021-09-19 21:11:38,3,评论
宝子，可以去私信他们的。官方一直在听取大家意见改进,2021-09-19 21:27:21,5,回复
我觉得这个节目很好啊,2021-09-19 21:41:22,5,回复
回复 @天空收藏夹 :这个京剧节目你都目不暇接？不至于吧哥哥,2021-09-20 08:12:09,5,回复
昨天帮我邻居拍孩子学习918的视频照片。我邻居是做高空吊篮的，俗称的农民工。两口子都没什么文化，老师布置的观看视频作业，俩人也看不明白，不知道怎么找。两口子挺不好意思地找我帮忙。其实就是一个公众号。孩子边看视频，我边拍了几张照片。孩子爸爸对孩子说了几句粗话∶小崽子你给我记住！到什么时候都得爱国！尤其小日*子！它们杀过我们的人！这是世仇！记住没有？！孩子什么都不懂地说∶那不是以前么？孩他爸说∶什么以前！等特么以后杀你的时候就晚了！他们两口子一直拿我当文化人，我觉得他们才是给我上了一课。祖宗的东西不能丢，祖宗的伤不能忘。,2021-09-19 22:26:47,3,评论
所以现在就要警惕文化入侵，以倭代华,2021-09-22 00:20:51,6,回复
河南这波直接超神了。,2021-09-19 20:07:35,3,评论
用一镜到底来象征传承，用大篇幅幕后准备和很短的唱段来表现“台上一分钟台下十年功”，太绝了！太用心了！,2021-09-20 02:48:15,4,评论
分析的好,2021-09-20 23:39:23,4,回复
我觉得这个节目做的是最棒的！！！但是我不会说话[大哭]不知道用什么好词来形容 我只会说太好看了 好看到让我词穷,2021-09-19 21:06:55,5,评论
以后多读书，找点词儿来夸[doge],2021-09-19 22:59:49,4,回复
回复 @陳襯谶 :对！只恨自己读书不多 词汇不多 语言组织能力瞬间在这个视频面前失去了[doge],2021-09-20 11:17:25,5,回复
回复 @陳襯谶 :前街唱戏，后街万人空巷[脱单doge],2021-09-20 10:36:16,4,回复
所以 行头之所以贵是有道理的[doge]厚底儿 盔头 蟒 官衣 箭衣 褶子 马褂 等等,2021-09-19 20:21:00,5,评论
回覆 @匹夫1234 :我说的是配箭衣穿的[笑哭],2021-09-20 00:25:17,5,回复
马褂就算了,2021-09-19 23:41:31,4,回复
初看不解其中意，再看已成泪面人，河南卫视的节目让本观众觉得被尊重，而不是糊弄，一群做文化节目的导演团队遇到那么多等待文化复兴的网友们，每个节目又寓意深远，总是在潜移默化中表达暗含的思想、价值观，中华民族有那么多优秀的非遗文化，传承不会因时间而改变，中秋佳节，愿祖国统一，阖家团圆，万世太平,2021-09-20 07:34:23,5,评论
镜头和节奏把控的YYDS！台前幕后都是功夫！,2021-09-19 23:16:46,5,评论
捉[doge]期待今晚的节目,2021-09-20 11:19:31,5,回复
你怎么没有标标呀？,2021-09-21 00:53:04,4,回复
捞捞小陕~（是暂时没有小闪电的官方账号哇）,2021-09-20 19:25:58,5,回复
这一段超级惊艳的，想到以前看电视剧和电影，也喜欢挑有戏剧的看，比如霸王别姬和刀马旦，一个人在家还喜欢看戏曲频道，各个剧种都有，虽然需要看字幕才能听懂内容，但是他们的一举一动都特别有板有眼，认真从事自己热爱的事业的人都会闪闪发光，特别迷人～,2021-09-19 21:12:08,5,评论
[笑哭]卧槽，都这么拍的话，再来60分钟也愿意看啊！,2021-09-19 20:40:11,6,评论
就这么拍唱戏，我可太愿意看了[大哭]恨他太短,2021-09-20 18:50:39,4,回复
终于理解了为什么长辈们爱听戏了，好听又好看啊[给心心][给心心][给心心],2021-09-19 20:28:09,5,评论
韵味十足～,2021-09-19 20:28:56,5,回复
虽然这次节目都很牛逼都很特么好看但是还是戏曲最戳我脑仁[脱单doge],2021-09-19 20:58:34,5,评论
全场最喜欢这个节目，运镜舒适又畅快。整场晚会的审美，立意全部在线，我个人认为是几场奇妙游中平均质量最高的一次。大家夸了好多我也比不上大家，稍微感觉有点缺憾的就是，虽然每个节目的质量都很高，但是个别节目的剪辑有些零散，舞蹈大量采用子弹时间其实有些影响观感了（虽然知道是赞助爸爸要求）毕竟河卫的节目都是以传统文化为依托的，流畅飘逸我觉得要比炫技更排靠前些；然后就是，每个节目太！短！了！时长摩多摩多！！节目摩多摩多！！,2021-09-20 11:51:39,5,评论
最近几年最惊艳的戏曲节目，虽然唱的不多，但比大合唱漂亮太多了！！！,2021-09-19 20:29:45,6,评论
主要后台给予的镜头尊重了幕后角色，展示了许多非遗内容，也传达了以往戏曲没有的理念，属实格局磅礴,2021-09-20 12:17:30,5,回复
回复 @颍川郡公子唐 :说得好！,2021-09-20 13:11:16,6,回复
之前看写梅兰芳先生的书，这些后台规矩并不单纯是为了立威严管制人或者封建迷信啥的，很多背后是有一定原因和道理的,2021-09-20 09:39:07,4,评论
后台东西多，没有规矩，各自乱拿乱放就乱套了！,2021-09-20 18:18:47,4,回复
不知道是不是我审美疲劳了，从清明节后，我就觉得每个节目好割裂啊，这次更是，歌舞能不能是完整的歌舞？好多分心的独白和特效，影响观众观感，毕竟这是晚会，不是科普节目，传统文化也要创新，不是苍白的展现，我真的是从观众角度给的建议。,2021-09-19 21:37:21,5,评论
可以去私信他们的。官方一直在听取大家意见改进,2021-09-19 22:01:56,5,回复
回复 @卜委员 :对对，养成系电视台可不是白叫的,2021-09-19 22:11:54,5,回复
长镜头的确不好拍，问题确实存在，😂可以多多给他们些建议，上回凌晨三点多回的我，应该是能听进去建议的。,2021-09-19 22:23:28,6,回复
宝 你们做个戏曲电影吧！！！！真的太好看了！！！戏迷看的热泪盈眶！！！[打call][打call][打call],2021-09-20 06:45:35,6,评论
一直都有，电视戏曲电影，但也想看到类似今年粤剧电影那样的了[笑哭],2021-09-20 09:41:06,6,回复
没用的，出电影基本没票房，上半年出的粤剧电影基本凉了,2021-09-20 11:55:15,4,回复
刘大哥你坐下·咱们说说心里话[OK],2021-09-19 20:40:56,4,评论
真能串戏,2021-09-19 20:49:30,5,回复
回复 @99529574596_bili :刘大哥说得对,2021-09-19 20:55:32,4,回复
亲家母讲话，理太偏[doge],2021-09-19 21:27:57,3,回复
太喜欢这个了 运镜 表达 还有故事都好喜欢😭😭😭😭后台故事真的很新颖 真的好好啊 戏曲迷痛哭,2021-09-19 21:08:44,5,评论
抱抱，我一直都好喜欢戏曲角色的头冠，好漂亮[星星眼],2021-09-19 23:48:58,5,回复
京剧男演员帅气，女演员有种东方独特的大家闺秀的那种美，真的很不错啊[脱单doge][脱单doge][脱单doge],2021-09-19 20:21:37,5,评论
里边的服装师和盔箱师也是至关重要，他们决定了角衣服舒服不舒服，头勒的难受不难受。看起来不起眼，做起来难啊。,2021-09-20 12:47:47,5,评论
啊这，这些戏剧演员让我更难以直视古偶里面驼背、勾头的男演员了,2021-09-20 12:42:17,5,评论
播放量属实离谱了[微笑] 这么好的节目浪费了,2021-09-22 14:44:14,5,评论
阿b已经不是以前的阿b了,2021-09-24 23:43:34,6,回复
这一个眼神秒杀现在多少流量明星！建议央视好好学学[藏狐],2021-09-19 21:19:35,5,评论
人家是专业的，台上一分钟，台下十年功。流量明星是个蛋蛋呦！,2021-09-19 21:33:27,5,回复
你可以搜一下我国阅兵步伐的发展，就是从俄式步伐改的时候，发现一个战士看着状态精气神特别好，一问才知道原来是学武生的，习惯了亮相的动作,2021-09-19 21:51:27,4,回复
这样的节目也太棒了，让我们看到了戏曲幕后的样子，虽然没有唱很长时间，但是足以惊艳众人，真的放一台戏，恐怕没有那样的效果了。[星星眼],2021-09-19 22:42:12,4,评论
晚晚点出一个有意涵的点 有缘的喜欢的自己看完节目自己去挖 一台晚会没办法把很多东西讲深 只要立起文化复兴的大旗就行 节目嘛就只能是和大家结个缘,2021-09-20 04:31:16,3,回复
回复 @晓喻0379 :讲得好！节目是种下一颗颗种子，每颗种子都能长出很多东西，等待有缘人发现。,2021-09-20 08:51:15,4,回复
感觉不完整的，我说一个老观点。河南卫视只做抛砖引玉，希望友台能把更好的做出来，另外，河南卫视有的节目就像是一个成语，如果你有兴趣就可以主动去了解传播这些文化。歌舞完整歌舞？那戏曲要不要整部戏曲？歌舞创作出来肯定是完整的，但后期剪辑制作已经完全不同于过去了，大量的科技加成制作，就像声光影像加成已经连在一起了，还要有取舍。当然不足还是有的，毕竟没有完美@河南卫视 @大象新闻,2021-09-20 14:46:59,4,评论
