店铺名称,商品名,价格,产地,付款人数
闪电鞋行,新款外套棉衣休闲棉袄纯色男加厚立领黑色潮,286.00,北京,1人付款
benpanda熊猫本旗舰店,熊猫本 棉服男潮牌日系宽松工装冬季棒球外套休闲百搭飞行员棉衣,289.00,福建 福州,1000+人付款
suamoment旗舰店,Suamoment抓痕立体血爪PU棉服潮牌保暖情侣棉衣外套刘耀文同款,528.00,江苏 南京,3000+人付款
dangerouspeople旗舰,Dangerouspeople薛之谦dsp水波纹棉服男冬季新款潮流加厚棉衣外套,479.00,上海,3000+人付款
benpanda熊猫本旗舰店,熊猫本 2021冬季新款棉服潮牌宽松日系加厚棉袄外套男防泼水棉衣,268.00,福建 福州,900+人付款
胖胖哥旗舰店,羊羔绒外套男冬装加绒加厚2021年新款棉服潮牌ins冬季大码棉衣袄,148.00,浙江 杭州,6000+人付款
胖胖哥旗舰店,羽绒棉服男潮牌2021年新款棉衣冬季厚面包服韩版大码棉袄外套冬装,128.00,浙江 杭州,9000+人付款
leonbinno雷尔宾诺旗舰店,国潮刺绣立领棉衣男2021秋冬款潮牌宽松加厚羽绒棉服保暖情侣外套,148.00,浙江 杭州,3000+人付款
哈克汉贝旗舰店,2021年新款棉衣男冬季加厚棉袄外套韩版潮流宽松ins潮牌面包棉服,128.00,浙江 杭州,2万+人付款
旋律风车,棉衣男冬季连帽羊羔绒港风棉袄学生加厚保暖潮流冬天男士棉服外套,148.00,浙江 杭州,5000+人付款
dna双重否定组织,PCLP(PERCLIPS) 手枪印花PU皮棉服 国潮牌加厚棉衣男冬季外套棉袄,369.00,广东 广州,4000+人付款
achsawake旗舰店,ACHS AWAKE时代少年团-丁程鑫同款觉醒青年双头熊棉衣仿兔绒棉服,269.00,江苏 南通,5000+人付款
hang2009aa,兔先森2021冬季日系加厚工装连帽棉衣男潮流棉袄棉服保暖外套ins,258.00,浙江 杭州,2000+人付款
韵式优品旗舰店,nasa旗舰店官网联名2021年新款冬季羽绒棉服棉袄潮外套PU皮棉衣男,298.00,广东 广州,2000+人付款
vengetice,FPA(VENGETICE)冬季加厚PU皮棉衣国潮牌面包服羽绒棉服袄子外套男,369.00,广东 广州,4000+人付款
男势旗舰店,羊羔毛棉衣男冬季加厚青少年棉袄外套港风痞帅宽松百搭连帽棉服潮,128.00,浙江 杭州,7000+人付款
不洗脚先生旗舰店,胖子日系pu皮夹克棉服男大码宽松帅气棉袄羽绒棉衣潮冬季立领外套,128.00,浙江 杭州,4000+人付款
mlee420,你初恋老王外套厚款棉衣男冬季日系复古加厚保暖连帽休闲宽松棉袄,268.00,广东 广州,6000+人付款
tb564384708,森马棉衣男2021冬季情侣加厚港风宽松面包服纯色连帽羽绒棉服外套,198.00,浙江 杭州,2000+人付款
bdwptyn,男道冬季日系棉服男生潮牌休闲宽松棉衣短款加厚外套棉袄面包服,238.00,浙江 杭州,3000+人付款
hang2009aa,兔先森自制冬季宽松麂皮绒棉服机车服加绒加厚潮男羊羔毛棉衣外套,258.00,浙江 杭州,2000+人付款
禾子铁匠铺,禾子先生冬季新款男士棉衣立领羊羔毛棉袄潮宽松百搭学生棉服外套,188.00,浙江 杭州,8000+人付款
时光噜噜旗舰店,加厚棉衣男士秋冬季面包服潮牌男装pu皮外套棉袄韩版潮流情侣棉服,148.00,浙江 杭州,4000+人付款
加荣旗舰店,外套男冬季加绒加厚羊羔绒棉衣2021新款爆款羊羔毛棉袄中长款棉服,178.00,浙江 杭州,3000+人付款
末末叽,REEZ【店主穿搭】冬季工装棉衣男潮牌宽松立领加厚棉服面包服外套,258.00,浙江 杭州,3000+人付款
v37旗舰店,撞色羊羔绒棉衣外套男冬季新款加绒加厚宽松棉服港风休闲保暖棉袄,138.00,浙江 杭州,7000+人付款
行更远旗舰店,冬季羊羔毛棉衣男潮流宽松撞色卡通棉服韩版潮流情侣休闲立领外套,148.00,浙江 杭州,4000+人付款
vuug旗舰店,秋冬季羊羔绒毛棉衣男外套加绒加厚宽松棉袄男生韩版潮流冬装棉服,158.00,浙江 杭州,1万+人付款
铁尚旗舰店,羊羔绒外套男冬季加绒加厚工装棉衣宽松帅气男生棉袄冬装ins棉服,148.00,浙江 杭州,6000+人付款
eb服饰旗舰店,工装棉衣男士加厚棉服冬季外套2021年新款冬装三件套保暖棉袄套装,138.00,福建 厦门,3000+人付款
顶峰保罗旗舰店,羽绒棉服棉袄子男士冬季装2021新款潮牌加绒加厚男生面包棉衣外套,139.00,福建 厦门,2万+人付款
xunmoo旗舰店,男士外套秋冬季2021新款男装棉衣韩版潮流短款棉袄加厚羽绒棉服男,126.00,福建 泉州,3000+人付款
洪佳宾0725,秋冬加厚棉服MA1飞行员夹克棉衣棒球服外套男士潮流贴标工装棉袄,268.00,浙江 嘉兴,2000+人付款
tb6091512,CODICE国潮牌棉衣男冬季加厚黑色宽松面包服情侣棉袄PU皮棉服外套,388.00,福建 厦门,2000+人付款
禾子铁匠铺,2021冬季新款男装棉衣宽松立领单排扣刺绣潮牌情侣保暖棉服外套男,168.00,浙江 杭州,5000+人付款
rjkk旗舰店,日系冬季两面穿棉衣男士立领双面穿棉袄加厚保暖外套情侣棉服潮Y,268.00,浙江 杭州,2000+人付款
二更旗舰店,工装棉衣男冬季加厚韩版潮流棉袄ins潮牌港风宽松情侣款棉服外套,168.00,浙江 杭州,9000+人付款
wusenboshenxiaoyan,美丽的脏店美式克莱因蓝潮流立领棉衣外套情侣潮牌加厚保暖棉服男,178.00,浙江 杭州,4000+人付款
永言旗舰店,pu皮棉衣男士2021冬季立领加厚防寒外套大码宽松韩版羽绒棉服袄子,128.00,浙江 杭州,1万+人付款
格兰衣府服饰旗舰店,男士潮牌棉服加厚棉衣外套韩版潮流冬装夹克2021新款男装羽绒棉袄,178.00,浙江 杭州,2000+人付款
v37旗舰店,两面穿棉服男士冬季新款加绒羊羔毛外套韩版潮流PU皮棉衣加厚棉袄,158.00,浙江 杭州,4000+人付款
不洗脚先生旗舰店,胖子毛内胆风衣男中长款大码休闲棉衣潮牌大衣秋冬季保暖加绒外套,87.00,浙江 杭州,7000+人付款
tiaota旗舰店,立领棉服男2021年新款冬季韩版潮流棉衣外套冬装潮牌ins加厚棉袄,88.00,浙江 杭州,9000+人付款
tb629274321,A chock国潮羊羔绒加厚保暖刺绣卫衣潮woo专属拉链情侣连帽外套男,299.00,广东 广州,3000+人付款
末末叽,REEZ【店主穿搭】重磅假两件连帽棉衣男冬季加厚日系潮牌休闲外套,278.00,浙江 杭州,2000+人付款
拓菲旗舰店,两面穿涂鸦立领棉衣男冬季情侣chic外套面包棉服潮牌潮流ins棉袄,128.00,浙江 杭州,4000+人付款
柯喜蓝kexilan,悟空有货潮牌复古拼色立领棉衣男冬季宽松加厚保暖面包服休闲外套,188.00,浙江 杭州,4000+人付款
情侣套装空间,潮牌BF美式街头纯色面包服加厚外套男潮流高街hiphop情侣立领棉衣,168.00,广东 广州,5000+人付款
一梦寻千年,冬季美式潮牌羽绒服男情侣学生国潮白鸭绒棉衣保暖外套休闲棉服男,298.00,浙江 杭州,800+人付款
一梦寻千年,美式潮牌羽绒服男冬季情侣工装棉衣白鸭绒外套宽松保暖休闲棉服男,358.00,浙江 杭州,200+人付款
dickies品意专卖店,Dickies棉服外套男情侣款纯色印花秋冬新款迪克斯休闲夹克女8132f,544.00,江苏 苏州,100+人付款
谢振荣18020989217,森马棉衣男士2021新款衣服冬季外套韩版潮流工装羽绒棉服加厚棉袄,178.00,福建 泉州,6000+人付款
胖胖哥旗舰店,羽绒棉服男潮牌2021年新款棉衣冬季厚面包服韩版大码棉袄外套冬装,128.00,浙江 杭州,9000+人付款
迈特优服饰旗舰店,假两件棉衣男冬季2021新款潮流冬装情侣羽绒棉服男士外套加厚棉袄,168.00,上海,3000+人付款
leonbinno雷尔宾诺旗舰店,国潮刺绣立领棉衣男2021秋冬款潮牌宽松加厚羽绒棉服保暖情侣外套,148.00,浙江 杭州,3000+人付款
leonbinno雷尔宾诺旗舰店,恶魔两面穿棉衣男秋冬季日系潮牌宽松保暖情侣棉服防寒羊羔绒外套,158.00,浙江 杭州,3000+人付款
哈克汉贝旗舰店,2021年新款棉衣男冬季加厚棉袄外套韩版潮流宽松ins潮牌面包棉服,128.00,浙江 杭州,2万+人付款
旋律风车,棉衣男冬季连帽羊羔绒港风棉袄学生加厚保暖潮流冬天男士棉服外套,148.00,浙江 杭州,5000+人付款
dna双重否定组织,PCLP(PERCLIPS) 手枪印花PU皮棉服 国潮牌加厚棉衣男冬季外套棉袄,369.00,广东 广州,4000+人付款
kelme夸克专卖店,KELME卡尔美棉服长款 运动男冬足球训练官方旗舰店羽绒棉大衣外套,358.00,福建 泉州,1000+人付款
achsawake旗舰店,ACHS AWAKE时代少年团-丁程鑫同款觉醒青年双头熊棉衣仿兔绒棉服,269.00,江苏 南通,5000+人付款
爆眼服饰旗舰店,棒球服男棉服潮牌ins冬季加绒加厚大码棉衣2021新款冬装加棉外套,128.00,浙江 杭州,3000+人付款
朴致旗舰店,羊羔绒外套男爸爸冬装棉袄冬季中老年人加绒加厚棉服宽松大码棉衣,128.00,福建 泉州,3000+人付款
hang2009aa,兔先森2021冬季日系加厚工装连帽棉衣男潮流棉袄棉服保暖外套ins,258.00,浙江 杭州,2000+人付款
韵式优品旗舰店,nasa旗舰店官网联名2021年新款冬季羽绒棉服棉袄潮外套PU皮棉衣男,298.00,广东 广州,2000+人付款
vengetice,FPA(VENGETICE)冬季加厚PU皮棉衣国潮牌面包服羽绒棉服袄子外套男,369.00,广东 广州,4000+人付款
森喜龙旗舰店,爸爸冬装外套冬季羽绒加绒加厚棉衣中老年羊毛呢子大衣老人衣服男,268.00,上海,3000+人付款
森喜龙旗舰店,棉衣男加绒加厚短款毛呢爸爸冬装外套立领中老年人男士羽绒脱卸款,239.00,上海,1000+人付款
纽艾旗舰店,冬季面包服外套男加厚棉服男潮ins港风棉衣男宽松韩版潮流棉袄子,138.00,浙江 杭州,4000+人付款
罗度旗舰店,灯芯绒棉服男士港风2021年新款冬季加厚棉衣外套宽松冬装保暖棉袄,189.00,江苏 苏州,1000+人付款
男势旗舰店,羊羔毛棉衣男冬季加厚青少年棉袄外套港风痞帅宽松百搭连帽棉服潮,128.00,浙江 杭州,7000+人付款
不洗脚先生旗舰店,胖子日系pu皮夹克棉服男大码宽松帅气棉袄羽绒棉衣潮冬季立领外套,128.00,浙江 杭州,4000+人付款
mlee420,你初恋老王外套厚款棉衣男冬季日系复古加厚保暖连帽休闲宽松棉袄,268.00,广东 广州,6000+人付款
马克风暴旗舰店,冬季加厚外套男士棉衣2021新款潮流韩版帅气派克棉袄冬装潮牌棉服,139.00,江苏 苏州,3000+人付款
tb564384708,森马棉衣男2021冬季情侣加厚港风宽松面包服纯色连帽羽绒棉服外套,198.00,浙江 杭州,2000+人付款
酷森服饰专营,花花公子派克棉服男冬季加厚加绒棉衣外套韩版2021新款中长款袄子,269.00,上海,1000+人付款
纽艾旗舰店,冬季加厚外套男韩版潮小熊棉服男潮牌宽松棉袄子2021新款冬装棉衣,148.00,浙江 杭州,3000+人付款
iconslab旗舰店,ICONSLAB联名SSUR PLUS鳄鱼纹环状仿皮棉服潮保暖外套棉袄,379.00,浙江 绍兴,6000+人付款
pepsi百事服饰旗舰店,【薇娅推荐】Pepsi/百事可乐冬季新款潮牌宽松颗粒绒外套男女同款,459.00,浙江 杭州,4000+人付款
百多鸟旗舰店,爸爸冬装外套棉服中年男士棉衣加厚爷爷秋冬季保暖羽绒棉袄男衣服,158.00,江苏 苏州,4000+人付款
bdwptyn,男道冬季日系棉服男生潮牌休闲宽松棉衣短款加厚外套棉袄面包服,238.00,浙江 杭州,3000+人付款
hang2009aa,兔先森自制冬季宽松麂皮绒棉服机车服加绒加厚潮男羊羔毛棉衣外套,258.00,浙江 杭州,2000+人付款
禾子铁匠铺,禾子先生冬季新款男士棉衣立领羊羔毛棉袄潮宽松百搭学生棉服外套,188.00,浙江 杭州,8000+人付款
百多鸟旗舰店,中老年棉衣男40岁50爸爸冬装外套加厚羽绒棉服中年男士秋冬季棉袄,158.00,江苏 苏州,5000+人付款
能天服饰专营店,冬季加绒加厚多口袋工装棉衣男士大码宽松户外登山外套保暖冲锋衣,145.00,浙江 杭州,2000+人付款
时光噜噜旗舰店,加厚棉衣男士秋冬季面包服潮牌男装pu皮外套棉袄韩版潮流情侣棉服,148.00,浙江 杭州,4000+人付款
俞兆林章镇专卖店,冬季保暖男士爸爸装连帽棉衣中长款宽松加厚中老年羽绒棉服外套男,199.00,上海,3000+人付款
君帝尼旗舰店,中老年人棉衣男士加绒加厚中年爸爸冬装棉服爷爷棉袄父亲保暖外套,188.00,江苏 苏州,4000+人付款
加荣旗舰店,外套男冬季加绒加厚羊羔绒棉衣2021新款爆款羊羔毛棉袄中长款棉服,178.00,浙江 杭州,3000+人付款
benpanda熊猫本旗舰店,熊猫本 2021冬季日系棉服男士潮牌休闲教练外套棉袄宽松工装棉衣,258.00,福建 福州,900+人付款
胖胖哥旗舰店,羽绒棉衣男冬季加厚棉袄潮流oversize棉服2021新款潮ins外套冬装,148.00,浙江 杭州,4000+人付款
红蜻蜓服饰旗舰店,红蜻蜓冬季新款棉衣男外套加绒保暖中老年棉袄可拆连帽棉服爸爸装,298.00,福建 泉州,1000+人付款
一梦寻千年,美式潮牌带包工装棉衣男冬季情侣宽松面包服保暖外套休闲棉服上衣,228.00,浙江 杭州,700+人付款
维圣卡旗舰店,保安棉衣男秋冬季加厚棉服执勤工作服冬装套装制服防寒棉袄大衣女,125.00,湖北 武汉,30人付款
暴风后的祈祷,BJHG自制冬季潮牌两面穿羊羔绒棉服男女2021新款加厚棉衣袄子外套,328.00,浙江 杭州,2000+人付款
wangdapai_33,几物jiwuus冬日系工装自制棉衣男女学生两面穿面包服情侣棉袄外套,188.00,浙江 杭州,3000+人付款
youtian0606,GWIT 冬季新款休闲宽松羊羔绒夹克棉衣加厚潮流外套羊羔毛棉服男,358.00,浙江 杭州,1000+人付款
remedy服饰,【潮WOO专属】STA X RMD SR秋冬棉袄潮牌棉衣男面包服情侣棉服,359.00,广东 广州,1万+人付款
一梦寻千年,克莱因蓝工装棉衣男冬季情侣宽松压皱棉服加厚外套潮牌保暖棉服男,178.00,浙江 杭州,4000+人付款
rongxiurui,ANDYET AD1【刘念同款】潮牌冬季基础款立领棉服宽松百搭男女棉衣,349.00,浙江 杭州,4000+人付款
tb906001138,森马棉衣男冬季加厚外套2021新款潮精致韩风情侣羽绒服连帽学生帅,199.00,浙江 杭州,3000+人付款
benmyshower旗舰店,BENMYSHOWER国潮棉衣男  潮牌PU皮衣新款外套面包服宽松棉袄情侣,359.00,浙江 杭州,2000+人付款
煦加旗舰店,羊羔绒外套男冬季棉袄加绒加厚高级感冬装棉服潮流面包服牛仔棉衣,178.00,浙江 杭州,3000+人付款
v37旗舰店,2021冬季棉衣男士宽松潮流ins百搭休闲棉袄韩版时尚潮牌棉服外套,88.00,浙江 杭州,1万+人付款
梦中无泪iou,日系羊羔绒外套男秋冬加厚立领摇粒绒棉服学生抓绒羊羔毛夹克棉衣,158.00,浙江 杭州,4000+人付款
yoona19900530k,冬装2020年新款摇粒绒羊羔毛棉服男潮牌加厚韩版宽松立领棉衣外套,198.00,浙江 杭州,2000+人付款
孤焰烈火旗舰店,连帽加厚棉衣男冬季外套潮牌港风短款羽绒棉服宽松撞色潮流棉袄子,109.00,浙江 杭州,5000+人付款
twat旗舰店,TWAT日系新款潮流加厚保暖面包服男冬季纯色宽松加大码立领棉衣服,168.00,浙江 杭州,3000+人付款
暴风后的祈祷,【明星同款】BJHG不计后果冬季加厚羊羔绒棉服男女羊羔毛外套情侣,318.00,浙江 杭州,6000+人付款
er旗舰店,ER笑脸羊羔毛外套2021新款宽松国潮情侣装羊羔绒棉服男潮牌棉衣冬,299.00,浙江 杭州,3000+人付款
江南先生旗舰店,江南先生CityBoy日系菱格冬季外套男士棉衣潮牌宽松情侣工装棉服,199.00,浙江 杭州,5000+人付款
tb389902542,nasa联名棉衣男士秋冬季外套新款加厚棉袄撞色潮牌情侣羽绒棉服潮,218.00,浙江 杭州,6000+人付款
leonbinno雷尔宾诺旗舰店,羊羔毛棉衣男潮牌加绒加厚拼接棉袄ins情侣宽松棉服大码冬季外套,158.00,浙江 杭州,2000+人付款
vesibo旗舰店,假两件棉衣男冬季韩版宽松PU皮百搭连帽棉服港风潮牌帅气棉袄外套,158.00,浙江 杭州,1万+人付款
纽艾旗舰店,棉衣男冬季加厚面包服外套男韩版潮ins百搭棉袄子男潮棉服男冬装,108.00,浙江 杭州,6000+人付款
vengetice,FPA(VENGETICE)冬季情侣装PU皮棉衣国潮牌冬装白色面包棉服外套男,369.00,广东 广州,1万+人付款
dna双重否定组织,PCLP(PERCLIPS) 背后拼接标语棉服 国潮牌冬季加厚棉衣男外套棉袄,369.00,广东 广州,4000+人付款
传奇保罗旗舰店,传奇保罗假两件连帽棉衣男冬季加厚棉袄pu皮羽绒棉服男士外套冬装,138.00,福建 泉州,3000+人付款
迈特优服饰旗舰店,假两件羽绒棉衣男2021新款冬季加绒加厚棉服棉袄男装潮牌冬装外套,168.00,上海,6000+人付款
男势旗舰店,pu皮棉服男2021年痞帅羊羔绒双面穿棉衣ins潮牌宽松冬装棉袄外套,158.00,浙江 杭州,7000+人付款
哲源旗舰店,羊羔绒棉衣男冬季加厚PU皮外套潮ins宽松短款棉服冬装棉袄面包服,137.88,浙江 杭州,2000+人付款
范陌flx,森马棉衣男冬季外套加厚棉袄2021年新款学生宽松羽绒棉服情侣冬装,188.00,浙江 杭州,3000+人付款
古玛拉旗舰店,棉衣男士秋冬季外套2021年新款潮流加绒加厚棉袄冬装潮牌羽绒棉服,79.90,福建 泉州,8000+人付款
禾子铁匠铺,2021冬季新品男装棉衣假两件连帽棉袄外套宽松加厚保暖学生棉服潮,218.00,浙江 杭州,1万+人付款
行更远旗舰店,两面穿棉衣男ins潮流宽松百搭立领棉服港风冬季潮牌帅气格子外套,168.00,浙江 杭州,5000+人付款
牧系旗舰店,pu皮羽绒棉服男潮牌ins冬季美式街头风外套加厚保暖立领棉袄复古,128.00,浙江 杭州,3000+人付款
vesibo旗舰店,棉衣男秋冬季港风宽松字母印花休闲棉服韩版潮流立领学生棉袄外套,108.00,浙江 杭州,7000+人付款
胖胖哥旗舰店,美式高街棉服男冬季潮牌ins痞帅棉衣潮男外套小众设计感冬装加厚,138.00,浙江 杭州,3000+人付款
mikanoni旗舰店,羊羔绒外套男装三件套冬季连帽潮牌加厚棉衣棉服一套搭配帅气套装,198.00,浙江 杭州,8000+人付款
白鹤大大,白鹤大人美式街头棉衣外套男冬季棒球服复古加厚棉服潮牌潮流冬装,298.00,广东 广州,2000+人付款
mmoptop旗舰店,MMOPTOP2021秋冬季棉袄新款棉服情侣棉衣潮上衣羊羔绒外套男冬装,328.00,福建 泉州,1000+人付款
胖胖到家服饰旗舰店,冬季潮牌ins加厚加绒情侣棉衣男宽松大码菱形格棉服棒球服外套男,148.00,浙江 杭州,3000+人付款
dna双重否定组织,PCLP(PERCLIPS) 金属牌牛仔棉衣 国潮牌加厚棉服男冬季外套棉袄,399.00,广东 广州,2000+人付款
尹田旗舰店,男士羽绒棉衣立领冬季外套加厚短款面包服韩版潮流宽松棉袄PU皮衣,248.00,浙江 杭州,1000+人付款
气质有毒,@港仔文艺男 羊羔毛棉衣外套冬季加绒加厚棉袄男生潮流百搭绒棉服,108.00,浙江 杭州,7000+人付款
majiabo001,GBOY冬季纯色面包服棉衣男2021年新款棉服潮牌潮流帅气保暖棉袄男,248.00,浙江 宁波,2000+人付款
一梦寻千年,日系复古灯芯绒立领棉衣男冬季情侣宽松工装棉服休闲外套保暖棉袄,228.00,浙江 杭州,100+人付款
皇迹旗舰店,棉服男士潮流 撞色连帽保暖棉袄 男 青年,158.00,浙江 杭州,0人付款
一梦寻千年,克莱因蓝工装棉衣男冬季情侣宽松压皱棉服加厚外套潮牌保暖棉服男,178.00,浙江 杭州,4000+人付款
六哥最帅,FEAR OF GOD复线ESSENTIALS羽绒服FOG高街风宽松男女棉服加厚外套,378.00,浙江 宁波,1000+人付款
永言旗舰店,男士假两件棉衣外套冬季新款情侣羽绒棉服韩版加厚连帽潮牌棉袄男,118.00,浙江 杭州,3000+人付款
净化眼球潮流服饰,冬季复古工装棉衣男宽松潮牌加厚羊羔毛棉服保暖立领休闲棉袄外套,258.00,浙江 杭州,2000+人付款
第四十九天,第四十九天冬季加厚保暖立领棉衣男士面包服潮牌棉袄防寒衣服外套,168.00,浙江 杭州,3000+人付款
柒域旗舰店,爸爸冬装外套棉衣男中长款加绒加厚爷爷男装中老年人羽绒棉服棉袄,168.00,浙江 嘉兴,2000+人付款
youtian0606,GWIT 冬季新款休闲宽松羊羔绒夹克棉衣加厚潮流外套羊羔毛棉服男,358.00,浙江 杭州,4000+人付款
杉男旗舰店,爸爸冬装外套中老年人棉衣加绒加厚中年男士羽绒棉服冬季爷爷棉袄,278.00,江苏 苏州,1000+人付款
范索米旗舰店,羊羔绒外套男棉衣春秋冬季加绒加厚棉服摇粒抓绒羊羔毛棉袄上衣服,158.00,福建 泉州,2000+人付款
迈特优服饰旗舰店,羊羔毛外套男秋冬季2021新款韩版潮流加绒加厚宽松港风roora棉衣,168.00,浙江 杭州,3000+人付款
parm旗舰店,品牌正品棉衣男外套冬季男装冬装韩版潮流短款棉袄加厚羽绒棉服男,178.00,福建 泉州,2000+人付款
罗蒙伍琪辉专卖店,罗蒙男士棉服外套男冬装中年加厚保暖短款棉衣冬季连帽爸爸装棉袄,189.00,广东 广州,5000+人付款
慕甸旗舰店,棉衣男冬季加厚假两件羽绒棉服棉袄PU皮潮流潮牌宽松情侣连帽外套,138.00,浙江 杭州,4000+人付款
暴风后的祈祷,BJHG自制冬季潮牌两面穿羊羔绒棉服男女2021新款加厚棉衣袄子外套,328.00,浙江 杭州,2000+人付款
悍豪旗舰店,爸爸冬装外套中老年棉衣男爷爷加绒加厚羽绒棉服老年人中长款棉袄,168.00,江苏 苏州,1000+人付款
费森旗舰店,保安冬季服装棉服保安大衣工作服冬装棉衣多功能防寒服男加厚棉袄,126.00,天津,2000+人付款
wangdapai_33,几物jiwuus冬日系工装自制棉衣男女学生两面穿面包服情侣棉袄外套,188.00,浙江 杭州,3000+人付款
youtian0606,GWIT 冬季新款休闲宽松羊羔绒夹克棉衣加厚潮流外套羊羔毛棉服男,358.00,浙江 杭州,1000+人付款
remedy服饰,【潮WOO专属】STA X RMD SR秋冬棉袄潮牌棉衣男面包服情侣棉服,359.00,广东 广州,1万+人付款
一梦寻千年,克莱因蓝工装棉衣男冬季情侣宽松压皱棉服加厚外套潮牌保暖棉服男,178.00,浙江 杭州,4000+人付款
rongxiurui,ANDYET AD1【刘念同款】潮牌冬季基础款立领棉服宽松百搭男女棉衣,349.00,浙江 杭州,4000+人付款
tb906001138,森马棉衣男冬季加厚外套2021新款潮精致韩风情侣羽绒服连帽学生帅,199.00,浙江 杭州,3000+人付款
希际旗舰店,X-OJINEGY笑脸棉衣男外套秋冬新款情侣装衣服棉袄潮牌羊羔绒棉服,258.00,福建 福州,2000+人付款
南极人恩盛专卖店,南极人棉衣男士秋冬季外套2021新款潮流棉服潮牌棉袄保暖青年男装,59.00,江苏 苏州,1万+人付款
benmyshower旗舰店,BENMYSHOWER国潮棉衣男  潮牌PU皮衣新款外套面包服宽松棉袄情侣,359.00,浙江 杭州,2000+人付款
煦加旗舰店,羊羔绒外套男冬季棉袄加绒加厚高级感冬装棉服潮流面包服牛仔棉衣,178.00,浙江 杭州,3000+人付款
永言旗舰店,棉衣男士冬季加厚立领外套韩版潮牌pu皮棉袄帅气男生宽松羽绒棉服,128.00,浙江 杭州,5000+人付款
v37旗舰店,2021冬季棉衣男士宽松潮流ins百搭休闲棉袄韩版时尚潮牌棉服外套,88.00,浙江 杭州,1万+人付款
leonbinno雷尔宾诺旗舰店,两面穿克莱因蓝羊羔绒工装外套男冬季加厚保暖棉服情侣款少年棉衣,148.00,浙江 杭州,4000+人付款
衣衫风尚诚品店,皮尔卡丹棉衣男中年翻领蚕丝薄棉服中老年冬季加厚夹克外套爸爸装,226.00,上海,2000+人付款
梦中无泪iou,日系羊羔绒外套男秋冬加厚立领摇粒绒棉服学生抓绒羊羔毛夹克棉衣,158.00,浙江 杭州,4000+人付款
朴致旗舰店,羊羔绒外套男冬季中老年立领加绒加厚棉服爸爸冬装棉袄加大码棉衣,119.00,福建 泉州,5000+人付款
yoona19900530k,冬装2020年新款摇粒绒羊羔毛棉服男潮牌加厚韩版宽松立领棉衣外套,198.00,浙江 杭州,2000+人付款
孤焰烈火旗舰店,连帽加厚棉衣男冬季外套潮牌港风短款羽绒棉服宽松撞色潮流棉袄子,109.00,浙江 杭州,5000+人付款
twat旗舰店,TWAT日系新款潮流加厚保暖面包服男冬季纯色宽松加大码立领棉衣服,168.00,浙江 杭州,3000+人付款
暴风后的祈祷,【明星同款】BJHG不计后果冬季加厚羊羔绒棉服男女羊羔毛外套情侣,318.00,浙江 杭州,6000+人付款
轩男旗舰店,棉衣男韩版潮流短款羽绒棉服银灰色亮面棉袄男士冬季外套连帽潮牌,156.00,广东 广州,4000+人付款
er旗舰店,ER笑脸羊羔毛外套2021新款宽松国潮情侣装羊羔绒棉服男潮牌棉衣冬,299.00,浙江 杭州,3000+人付款
athief旗舰店,Athief爱心别针仿羊羔绒发泡加厚外套潮冬情侣款,339.00,江苏 南京,4000+人付款
江南先生旗舰店,江南先生CityBoy日系菱格冬季外套男士棉衣潮牌宽松情侣工装棉服,199.00,浙江 杭州,5000+人付款
tb389902542,nasa联名棉衣男士秋冬季外套新款加厚棉袄撞色潮牌情侣羽绒棉服潮,218.00,浙江 杭州,6000+人付款
朴致旗舰店,羊羔绒棉衣男士外套秋冬季2021新款大码潮牌加绒加厚棉袄冬装棉服,149.00,福建 福州,3000+人付款
一梦寻千年,美式潮牌带包工装棉衣男冬季情侣宽松面包服保暖外套休闲棉服上衣,228.00,浙江 杭州,700+人付款
策序旗舰店,vintage大毛领棉衣男美式潮牌bf风派克棉服冬季加厚保暖大码外套,168.00,浙江 杭州,0人付款
义珍旗舰店,冬季外套女新款棉衣小棉袄小个子面包服短款羽绒棉服oversize女潮,188.00,广东 广州,2人付款
f426旗舰店,【F426官方店】国潮牌情侣嘻哈秋冬四色大LOGO贴布绣羊羔毛外套,299.00,浙江 金华,2000+人付款
