店铺名称,商品名,价格,产地,付款人数
dickies官方旗舰店,Dickies棒球服 21秋冬新品撞色加厚男夹克情侣上衣学院9717,659.00,江苏 苏州,700+人付款
煦加旗舰店,冬装面包服男士潮牌羽绒棉服韩版痞帅气宽松高街棉衣加厚PU皮外套,128.00,浙江 杭州,2000+人付款
hang2009aa,兔先森2021款潮牌立领棉衣男潮流面包服棉袄冬季加厚学生外套潮,258.00,浙江 杭州,1000+人付款
西西里男装,CHICERRO西西里男装麂皮绒ins潮加绒加厚棉服外套秋冬宽松棉衣男,299.00,广东 广州,2000+人付款
古宾哲旗舰店,2021新款男士棉衣服韩版潮流宽松加厚棉袄棉服秋冬季男装加绒外套,168.00,浙江 杭州,1000+人付款
leonbinno雷尔宾诺旗舰店,水波纹立领羊羔毛棉衣男秋冬季港风潮牌宽松加绒加厚棉服保暖外套,138.00,浙江 杭州,3000+人付款
psobrand旗舰店,PSO Brand小熊刺绣款PU皮棒球服男潮牌情侣装夹克秋冬季夹棉外套,459.00,广东 广州,1000+人付款
品牌专柜6713,森马男士外套秋冬季2021新款男装棉衣潮流短款棉袄加厚羽绒棉服男,128.00,福建 泉州,2000+人付款
森马官方旗舰店,森马2021棉服男工装外套冬季2021潮流户外防风连帽厚冬装男士宽松,299.99,浙江 杭州,2000+人付款
穆绅旗舰店,翻领棉衣男秋冬季加厚羊羔绒棉服外套韩版宽松潮ins短款毛呢大衣,148.00,浙江 杭州,2000+人付款
罗绱旗舰店,棉衣外套男士秋冬季加绒加厚羊羔绒棉服潮美式工装复古飞行员夹克,198.00,福建 泉州,2000+人付款
稻草人男装旗舰店,棉服男士冬季2021年新款潮流潮牌加厚棉衣男装冬装轻薄棒球领外套,98.00,福建 泉州,4000+人付款
wavemad,【潮WOO专属】WORKSOUT(WKST)两面穿焰色棉服男女立领外套潮流冬,398.00,浙江 杭州,2000+人付款
柯喜蓝kexilan,悟空有货简约纯色PU皮立领棉衣男冬季潮牌宽松bf保暖休闲棉服外套,168.00,浙江 杭州,2000+人付款
kaalixto旗舰店,Kaalixto国潮牌毛呢大衣男新款棉衣冬季加厚大衣男中长款夹棉外套,398.00,山东 济南,1000+人付款
没有感觉的植物,GRINCH1928「GAHA」原创日系双领结构冲锋棉衣夹克男防风加厚外套,378.00,浙江 杭州,1000+人付款
dpxworkshop旗舰店,羊羔绒外套男宽松加厚保暖潮流国潮ins潮牌秋冬季棉服羊羔毛棉衣,219.00,浙江 杭州,1000+人付款
shixiawei0730,BDCT原创 日系棒球服外套男秋冬棉衣男潮牌加厚棉袄百搭休闲棉服,289.00,浙江 嘉兴,1000+人付款
vuug旗舰店,棉服男士秋冬季韩版潮流潮牌宽松棉袄加绒加厚冬装羊羔绒棉衣外套,108.00,浙江 杭州,2000+人付款
iconslab旗舰店,ICONSLAB联名SSUR PLUS鳄鱼纹环状仿皮棉服情侣男女潮加厚外套,379.00,浙江 绍兴,1000+人付款
森马官方旗舰店,森马棉服男薄款2021冬季新款落肩韩范宽松简约工装棒球领男生棉衣,199.99,浙江 杭州,1000+人付款
暴风后的祈祷,BJHG自制不计后果冬季设计感加厚羊羔毛棉服男女潮牌宽松棉衣外套,298.00,浙江 杭州,2000+人付款
gamulahe1,危机青年中长款棉衣男翻领日系复古冬季宽松大衣棕色夹棉风衣棉袄,238.00,浙江 杭州,1000+人付款
净化眼球潮流服饰,净化眼球冬季新款立领羊羔毛绒棉衣男女宽松加厚拼色字母棉服外套,248.00,浙江 杭州,2000+人付款
森马官方旗舰店,森马棉服男灯芯绒防风立领2021冬季新款男生简约宽松保暖加厚棉衣,299.99,浙江 杭州,1000+人付款
conklab旗舰店,conklab 字母logo棉服男冬加厚保暖pu皮外套高街立领面包服棉衣潮,387.00,广东 广州,2000+人付款
er旗舰店,ER复古串标棉服2021年新款羊羔绒情侣连帽外套冬季加厚潮牌棉衣男,299.00,浙江 杭州,1000+人付款
南极人恩盛专卖店,南极人2021棉衣男外套秋冬季潮流棉袄男士潮牌青年棉服痞帅上衣男,69.00,江苏 苏州,5000+人付款
lubbg,SAMESAME男士冬季棉袄棉服加棉棒球服外套情侣加绒加厚夹克棉衣男,345.00,广东 中山,1000+人付款
chicuz,NECOYEP2021冬新款PU皮复古字母立领棉服小众设计感百搭外套棉袄,168.00,广东 广州,3000+人付款
youtian0606,GWIT Sympatex 冬季新款宽松棉衣潮流面包服外套短款加厚棉服男,328.00,浙江 杭州,1000+人付款
youtian0606,GWIT Gore-Tex覆膜防风 冬季新款宽松外套工装棉衣加厚连帽棉服男,328.00,浙江 杭州,1000+人付款
tb481983920,版型帅气！阿尔泰绒！秋冬男士加绒加厚保暖复古工装夹克棉衣外套,125.00,江苏 苏州,3000+人付款
rubylau520,羽绒棉服男冬外套加厚棉袄2021新款韩版潮流ins潮牌情侣连帽棉衣,158.00,浙江 杭州,2000+人付款
南极人恩盛专卖店,南极人2020新款棉衣男立领冬季潮流加厚外套男女同款学生时尚棉袄,69.00,江苏 苏州,5000+人付款
煦加旗舰店,棉服男潮牌2021年新款冬季厚外套ins面包服加绒保暖棉衣男士棉袄,138.88,浙江 杭州,2000+人付款
huige20061111,东京衣柜2021冬季爆款棉衣男潮牌亮面日系新款潮流棉袄pu皮衣棉服,185.00,浙江 杭州,2000+人付款
语克旗舰店,羽绒棉衣男秋冬季2021新款潮牌宽松加厚棉服男士潮流冬装棉袄外套,128.00,浙江 杭州,2000+人付款
chinism旗舰店,CHINISM CH冬季棉服男潮牌LOGO贴标美式高街加厚棒球夹克棉衣外套,539.00,浙江 杭州,800+人付款
一梦寻千年,日系棒球服男秋冬情侣装宽松夹克男棉服潮流飞行夹克学生潮牌外套,168.00,浙江 杭州,1000+人付款
珂美多旗舰店,羽绒棉衣棉服冬装冬天小棉袄子夹棉厚外套,398.00,湖北 武汉,1人付款
珂美多旗舰店,小个子羽绒棉服棉衣洋气中年妈妈修身棉袄,398.00,湖北 武汉,3人付款
一梦寻千年,克莱因蓝美式潮牌棒球服棉衣男冬季宽松工装棉服外套休闲保暖棉袄,228.00,浙江 杭州,1000+人付款
铁尚旗舰店,羊羔毛棉衣男冬季外套韩版潮流学生情侣冬装棉袄2021新款加绒加厚,138.00,浙江 杭州,2000+人付款
柯喜蓝kexilan,悟空有货日系复古羊羔毛翻领棉衣男女潮牌宽松休闲面包服保暖外套,158.00,广东 广州,2000+人付款
rubylau520,【买一送一】两面穿羊羔毛绒外套男冬季加厚新款宽松立领棉衣服,258.00,浙江 杭州,1000+人付款
宇宙访客ˉ,FEAR OF GOD复线ESSENTIALS羽绒服FOG高街风宽松男女棉服加厚外套,238.00,广东 广州,1000+人付款
qiushanghang,森马立领羽绒棉服男冬季新款加厚保暖面包服休闲宽松情侣棉衣外套,198.00,福建 泉州,1000+人付款
lilbetter旗舰店,Lilbetter男士棉服2021韩版潮牌冬装袄子外套加厚棉衣港风棉袄LB,459.00,浙江 杭州,700+人付款
mardarry,棉衣男冬季加厚潮流21美式宽松情侣外套青年街头风棉服男INS潮牌,143.00,浙江 杭州,2000+人付款
丁渡生,冲锋衣外套秋冬季夹棉oversize中长款冬天棉衣ins港风棉服男女潮,139.00,广东 广州,2000+人付款
欧路得旗舰店,冬季假两件棉衣男ins潮牌痞帅加厚面包服棉袄外套韩版bf情侣棉服,158.00,浙江 杭州,2000+人付款
adidas官方旗舰店,adidas阿迪达斯官网三叶草男装冬季运动拉链棉服GE1301,681.00,江苏 苏州,800+人付款
铁尚旗舰店,加绒羊羔毛外套男冬季加厚棉衣保暖男生棉袄2021新款棉服立领冬装,108.00,浙江 杭州,3000+人付款
海澜之家运动户外旗舰店,HLA海澜之家情侣保暖棉服2021冬季新款可拆卸棉衣中长款外套男女,259.00,福建 泉州,1000+人付款
mmoptop旗舰店,MMOPTOP冬季口袋工装棉衣男士潮牌棉服男生加厚秋冬棉袄男装外套,288.00,福建 泉州,1000+人付款
athief旗舰店,Athief爱心别针羊羔绒  发泡印花拉链外套男潮加厚羔毛秋冬情侣款,339.00,江苏 南京,1000+人付款
谢振荣18020989217,森马棉衣男士2021新款衣服冬季外套韩版潮流工装羽绒棉服加厚棉袄,178.00,福建 泉州,6000+人付款
花花公子捷德专卖店,花花公子PU皮棉服男冬季加厚面包服秋冬款棉袄短款潮牌棉衣外套,269.00,福建 厦门,1000+人付款
lpz旗舰店,夜光宇航员羽绒棉服男冬季潮牌ins冬装棉袄反光棉衣学生加厚外套,138.00,浙江 杭州,6000+人付款
hiimhuum旗舰店,男士秋冬季外套2021年新款棉衣潮流潮牌立领加厚羽绒棉服短款棉袄,238.00,浙江 杭州,2000+人付款
e街酷堡旗舰店,棉衣男士外套秋冬季2021新款潮流工装羽绒棉服加绒加厚短款棉袄子,128.00,上海,4000+人付款
leonbinno雷尔宾诺旗舰店,港风小熊棉衣男秋冬季潮流宽松加绒加厚羽绒棉服休闲情侣保暖外套,125.00,浙江 杭州,7000+人付款
小俊俊1986,SANBAI 叁佰新款蓝色棉衣男ins美式棉服秋冬宽松休闲面包服外套潮,389.00,浙江 杭州,2000+人付款
南极人恩盛专卖店,南极人冬季棉衣男连帽潮牌痞帅棉服外套宽松休闲潮流青少年棉袄男,89.00,江苏 苏州,4000+人付款
wqk吾器酷运动旗舰店,李宁棉服加厚保暖潮流棉衣袄子冬装冬季短款衣服男士运动连帽外套,149.00,上海,3000+人付款
vesibo旗舰店,棉衣男2021新款帅气面包服港风宽松立领棉服潮流ins百搭棉袄外套,108.00,浙江 杭州,1万+人付款
leonbinno雷尔宾诺旗舰店,棉服男冬季加厚潮牌宽松大码设计感小众棉袄roora情侣装棉衣外套,138.00,浙江 杭州,3000+人付款
雅帝森旗舰店,棉服男韩版宽松潮流羊羔毛呢外套港风潮牌棉衣秋冬季加厚加绒棉袄,158.00,浙江 杭州,2000+人付款
youtian0606,GWIT 冬季新款休闲宽松羊羔绒夹克棉衣加厚潮流外套羊羔毛棉服男,358.00,浙江 杭州,4000+人付款
dzh旗舰店,男士立领棉衣男冬季加厚棉袄外套韩版潮流宽松棉服2021年新款冬装,158.00,浙江 杭州,6000+人付款
vesibo旗舰店,两面穿羊羔毛棉衣男秋冬季港风宽松满印棉服韩版潮流百搭情侣棉袄,158.00,浙江 杭州,4000+人付款
史家明54321,AHPH21AW国潮牌冬季情侣潮流拼接棉服宽松休闲外套加厚保暖男女,328.00,浙江 杭州,3000+人付款
希际旗舰店,X-OJINEGY笑脸棉衣男外套秋冬新款情侣装衣服棉袄潮牌羊羔绒棉服,258.00,福建 福州,2000+人付款
南极人男装定制旗舰店,南极人假两件棉衣男士冬季2021新款羽绒棉服潮牌加厚棉袄冬装外套,166.00,福建 厦门,2000+人付款
花花公子捷德专卖店,花花公子棉衣男冬季加厚加绒棉袄秋冬面包服宽松大码男生棉服外套,269.00,福建 厦门,1000+人付款
ccmkhf旗舰店,秋冬季羊羔绒外套男棉衣男羊羔毛韩版潮ins潮流加绒加厚宽松棉袄,168.00,浙江 杭州,1000+人付款
lqychlf8,KXLFCHN日系潮牌秋冬季轻薄棉服外套男情侣刺绣翻领棒球服棉衣,278.00,浙江 杭州,1000+人付款
第四十九天,第四十九天冬季加厚羊羔毛拼接立领棉衣男士宽松棉袄潮牌防寒外套,188.00,浙江 杭州,2000+人付款
一梦寻千年,美式潮牌羊羔毛棉衣男冬季情侣两面穿立领棉服男加厚外套保暖棉袄,198.00,浙江 杭州,2000+人付款
bjhg旗舰店,【明星同款】BJHG冬季加厚羊羔绒棉服男女潮牌情侣羊羔毛棉衣外套,318.00,浙江 杭州,1000+人付款
hang2009aa,兔先森自制冬季百搭潮牌刺绣棉服男宽松加厚保暖休闲棒球棉衣外套,259.00,浙江 杭州,2000+人付款
爆眼服饰旗舰店,棉服男冬季加厚潮牌ins宽松大码棉衣棉袄2021新款面包服冬装外套,119.00,浙江 杭州,4000+人付款
洪佳宾0725,冬季中长款假两件棉服男潮牌宽松加厚保暖毛呢外套情侣连帽棉衣潮,298.00,浙江 嘉兴,1000+人付款
kpb旗舰店,衣服衬衣kpb百搭休闲男男士衬衫秋季纯棉工装春秋寸衫打底男长袖,88.00,福建 泉州,25人付款
一梦寻千年,美式潮牌带包工装棉衣男冬季情侣宽松面包服保暖外套休闲棉服上衣,228.00,浙江 杭州,700+人付款
皇迹旗舰店,棉服男士潮流 撞色连帽保暖棉袄 男 青年,158.00,浙江 杭州,0人付款
行更远旗舰店,腰果花棉衣男冬季潮流立领宽松外套港风潮牌帅气大码加厚印花棉服,128.00,浙江 杭州,4000+人付款
忘了我的店,着调男士加厚美式棉衣棉服设计感小众冬季面包服棉袄情侣外套潮牌,279.00,浙江 杭州,1000+人付款
花花公子捷德专卖店,花花公子假两件棉衣外套男潮冬季加厚棉服连帽面包服青少年棉袄子,269.00,福建 厦门,1000+人付款
卢毅向前冲,WassupHouse基础羊羔绒拉链外套男士潮流情侣款冬季新款上衣女,379.00,福建 福州,1000+人付款
浪月天涯,冬季2021新款加厚连帽工装棉服男生潮牌潮流ins国潮宽松棉衣外套,158.00,浙江 杭州,2000+人付款
行更远旗舰店,冬季加厚棉衣男韩版宽松潮流羊羔毛加绒连帽棉服港风休闲新款外套,168.00,浙江 杭州,1000+人付款
emeisa旗舰店,棉服男冬季潮流加厚潮牌面包服ins港风大码棉衣外套宽松冬装棉袄,128.00,浙江 杭州,3000+人付款
suamoment旗舰店,SuaMoment抓痕波浪仿羊羔绒外套男秋冬潮流牌情侣棉服刘耀文同款,399.00,江苏 南京,900+人付款
浪月天涯,冬季两面穿加厚羊羔毛外套男士韩版潮流港风棉衣情侣宽松潮牌棉服,158.00,浙江 杭州,2000+人付款
benpanda熊猫本旗舰店,熊猫本 冬季新款棉衣男中长款棉服潮牌日系宽松加厚保暖大衣外套,298.00,福建 福州,93人付款
史上最年轻煤老板,蒙马特先生 秋冬双面穿抓绒连帽保暖外套男 纯色宽松毛绒棉衣风衣,168.00,广东 广州,2000+人付款
享歆男装旗舰店,冬季ins潮牌菱形格棉衣男日系复古棒球服棉袄情侣菱格棉服外套,188.00,浙江 杭州,1000+人付款
ncttg旗舰店,秋冬季港风加绒连帽棉袄男士大码厚保暖面包服学生潮流上衣服外套,118.00,浙江 杭州,2000+人付款
森马官方旗舰店,森马棉服男外套时尚宽松保暖休闲男士撞色连帽设计2021新款上衣潮,279.99,浙江 杭州,1000+人付款
bdwptyn,男道日系冬季两面穿羊羔毛棉衣男士美式加厚立领棉服棉袄外套潮牌,248.00,浙江 杭州,2000+人付款
邦邦依舍旗舰店,冬季新款獭兔毛棉衣男韩版潮流宽松羊羔毛棉服加绒牛仔夹克厚外套,178.00,浙江 杭州,1000+人付款
cynismo,【CYNISMO线上商店】潮牌棋盘格刺绣高领羊羔绒外套仿兔毛棉服ins,369.00,上海,1000+人付款
江南先生旗舰店,江南先生Cityboy日系菱格棉服男冬季情侣装潮牌ins棉衣外套面包服,269.00,浙江 杭州,1000+人付款
concordevent旗舰店,CONCORDEVENT小熊灯芯绒棉服2021年新款潮牌冬季外套男加厚棉衣,467.00,浙江 杭州,1000+人付款
柯喜蓝kexilan,悟空有货潮牌街头纯色百搭加厚立领面包服男ins宽松休闲棉服外套,178.00,浙江 杭州,2000+人付款
dannysdream旗舰店,pu皮棉服男2021年新款冬季潮流百搭棉衣冬装加厚潮牌学生棉袄外套,178.00,浙江 杭州,2000+人付款
惊浪旗舰店,羊羔绒牛仔外套男宽松潮牌加绒棉衣加肥加大码冬季加厚棉服夹克潮,179.00,广东 广州,1000+人付款
森马官方旗舰店,森马棉服男工装外套连帽冬季2021短款加厚潮流男士衣服短款面包服,299.99,浙江 杭州,2000+人付款
赵朝余,NOTHOMME 斜纹棉布 日系潮牌秋冬学院风棉衣情侣宽松外套棉服男,285.00,广东 广州,1000+人付款
atry旗舰店,ATRY真两件撞色冬季加厚连帽棉衣男国潮牌面包服宽松外套羽绒棉服,499.00,广东 广州,800+人付款
气质有毒,克莱因蓝假两件连帽棉服男冬季加厚宽松男生棉袄ins潮流棉衣外套,148.00,浙江 杭州,3000+人付款
shixiawei0730,BDCT 21AW 冬季加厚教练夹克棉衣外套男 日系cityboy宽松休闲棉服,278.00,浙江 嘉兴,1000+人付款
dzh旗舰店,男士绿色棉服男潮牌短款男装2021新款外套韩版潮流棉衣男冬季加厚,185.00,浙江 杭州,1000+人付款
罗奈旗舰店,棉衣冬季新款港风外套男棉袄学生加厚连帽羽绒棉服宽松面包服男士,118.00,浙江 杭州,2000+人付款
气质有毒,棉衣男冬季加厚2021年新款面包服港风ins潮宽松男生棉袄棉服外套,88.00,浙江 杭州,7000+人付款
七月份的小太阳,D/S冬季ins潮牌宽松菱形格棉衣男日系复古棒球服外套情侣加厚棉服,198.00,浙江 杭州,2000+人付款
vesibo旗舰店,贴标短款棉衣男冬季潮牌宽松百搭立领棉服港风情侣网红面包服外套,138.00,浙江 杭州,2000+人付款
柯喜蓝kexilan,悟空有货复古嘻哈拼接立领面包服棉衣男潮牌宽松情侣休闲百搭棉服,148.00,浙江 杭州,3000+人付款
vesibo旗舰店,立领棉衣男秋冬新款潮牌ins菱形格百搭棉服港风宽松学生棉袄外套,118.00,浙江 杭州,3000+人付款
森马官方旗舰店,森马棉服男日系菱格复古棉衣男士冬季新款运动立领外套短款面包服,259.99,浙江 杭州,700+人付款
柯喜蓝kexilan,悟空有货奶牛纹羊羔绒立领棉服外套男女冬季复古宽松百搭情侣棉袄,148.00,浙江 杭州,2000+人付款
benpanda熊猫本旗舰店,熊猫本\u0026STBEE联名款 冬季潮牌棉衣外套男士日系宽松帅气教练夹克,268.00,福建 福州,77人付款
bdwptyn,男道冬季日系加厚棒球棉服潮牌休闲宽松百搭学生上衣棉衣男生外套,238.00,浙江 杭州,1000+人付款
wengzhenyu,马切达秋冬羽绒棉服潮牌加厚连帽外套冬装假两件男士棉袄冬季棉衣,288.00,浙江 杭州,1000+人付款
阿爆cz,【罗云熙同款】CLIMAX VISION加厚保暖麂皮绒棉衣外套休闲棉服潮,479.00,浙江 杭州,1000+人付款
hanqiou123,12/15  冬季男女纯色简约立领棉衣学生青少年宽松百搭ins加厚外套,79.00,浙江 杭州,5000+人付款
珂美多旗舰店,派克服羽绒棉服棉衣女冬装棉袄子加厚外套,398.00,湖北 武汉,15人付款
一梦寻千年,克莱因蓝工装棉衣男冬季情侣宽松压皱棉服加厚外套潮牌保暖棉服男,178.00,浙江 杭州,4000+人付款
一梦寻千年,美式潮牌带包工装棉衣男冬季情侣宽松面包服保暖外套休闲棉服上衣,228.00,浙江 杭州,700+人付款
贵写旗舰店,棉衣男冬季潮牌痞帅羽绒棉服ins港风宽松休闲棉袄子潮流加厚外套,88.00,浙江 杭州,4000+人付款
bodydream旗舰店,bodydream冬新款潮流立领棉服宽松休闲运动短款加厚防风保暖棉衣,399.00,江苏 徐州,1000+人付款
wengzhenyu,马切达棉服冬季中长款棉衣假两件加厚毛呢外套冬装男士棉袄秋冬潮,268.00,浙江 杭州,1000+人付款
净化眼球潮流服饰,净化眼球冬季自制质感鳄鱼纹皮衣棉服男女宽松潮牌工装棉衣外套男,288.00,浙江 杭州,1000+人付款
男势旗舰店,克莱因蓝棉衣男冬季加厚假两件棉服国潮宽松保暖情侣连帽棉袄外套,148.00,浙江 杭州,2000+人付款
mystery8090,外套男士冬装宽松棒球服潮流菱形格棉衣冬季棉袄大码加厚PU皮棉服,178.00,浙江 杭州,1000+人付款
benpanda熊猫本旗舰店,熊猫本 冬季新款棉服男士潮流大口袋宽松加厚保暖休闲中长款棉衣,389.00,福建 福州,35人付款
tb747099397,Nobodyknows 秋冬日系复古潮宽松口袋学院风男女保暖休闲棉服外套,215.00,湖南 长沙,2000+人付款
leonbinno雷尔宾诺旗舰店,冬季毛呢外套男ins港风休闲宽松百搭帅气棉衣潮流高街痞帅羊羔毛,158.00,浙江 杭州,1000+人付款
纽艾旗舰店,冬季面包服外套男韩版潮流加厚棉服男潮牌ins港风休闲棉衣男宽松,115.00,浙江 杭州,2000+人付款
禾子铁匠铺,禾子先生冬季男士棉衣灯芯绒连帽加厚保暖外套宽松青少年学生棉服,268.00,浙江 杭州,1000+人付款
禾子铁匠铺,禾子先生冬装男士棉衣连帽撞色休闲加厚外套bf风情侣潮流学生棉服,168.00,浙江 杭州,2000+人付款
男势旗舰店,PU皮棉服男ins潮牌冬季加厚设计感小众韩版潮流宽松立领棉衣外套,158.00,浙江 杭州,2000+人付款
南极人范士专卖店,南极人棉衣男2021冬季新款潮流短款羽绒棉服潮牌外套加厚连帽棉袄,59.00,上海,4000+人付款
luybaidun服饰旗舰店,秋冬季棒球服男女情侣装宽松潮牌飞行夹克男棉服潮流学生加厚外套,118.00,北京,1000+人付款
vengetice,FPA(VENGETICE) 羊羔毛棉服外套 2021年新款潮牌冬季厚棉衣袄子男,369.00,广东 广州,1000+人付款
煦加旗舰店,冬季棉衣男加厚2021新款爆款羽绒棉服潮流面包服情侣oversize外套,148.00,浙江 杭州,2000+人付款
卡莱昂男装旗舰店,棉衣男士冬季学生棉服潮流加厚羽绒外套男装一套搭配帅气休闲套装,138.00,江苏 苏州,1000+人付款
森马官方旗舰店,森马棉服男2021冬季新款仿羊羔毛拼接翻领宽松保暖短款男生棉袄潮,199.99,浙江 杭州,1000+人付款
siqi5520,假两件棉衣男冬季加厚ins潮牌毛呢大衣港风棉服韩版潮流帅气外套,188.00,浙江 杭州,1000+人付款
朗普罗男装旗舰店,外套冬季棉衣男士潮流加厚潮牌ins宽松大码日系迷彩棉服反光棉袄,189.90,浙江 杭州,1000+人付款
欧路得旗舰店,冬季连帽棉衣男加厚保暖宽松帅气休闲面包服港风潮流情侣棉服外套,168.00,浙江 杭州,1000+人付款
kelme福州专卖店,KELME卡尔美棉服 男长款过膝冬季训练运动大衣羽绒棉袄官方旗舰店,318.00,福建 泉州,600+人付款
高高because,【DAIO ETHAN】冬韩国原创中长款男外套宽松翻领羽绒棉衣加厚棉服,338.00,广东 广州,1000+人付款
铁尚旗舰店,羊羔绒外套男高级感冬天衣服韩版潮流宽松棉衣潮牌帅气棉服男冬装,138.00,浙江 杭州,1000+人付款
f426旗舰店,【F426官方店】国潮牌秋季情侣嘻哈LOGO拼接棒球服羊羔毛外套,349.00,浙江 金华,1000+人付款
kelme旗舰店,KELME卡尔美 棉服男中长款冬季足球训练棉衣运动棉袄加厚儿童外套,328.00,福建 泉州,1000+人付款
铁尚旗舰店,呢子棉衣男冬季加厚棉服韩版潮流冬装假两件风衣外套宽松港风复古,168.00,浙江 杭州,1000+人付款
tiaota旗舰店,两面穿棉服男ins港风加绒羊羔毛外套潮流冬季皮棉衣冬装加厚棉袄,158.00,浙江 杭州,2000+人付款
emeisa旗舰店,美式棒球服外套男冬季韩版潮流棉服ins加厚棉衣冬装潮牌痞帅棉袄,138.00,浙江 杭州,2000+人付款
szon旗舰店,外套男美式潮牌字母刺绣拼色冬装加厚羊羔绒夹克棉袄男生潮流棉衣,178.00,广东 佛山,37人付款
启俊企业店,格自翻领棉衣男秋冬季加厚宽松棉袄ins韩版潮流百搭情侣棉服外套,89.80,广东 广州,5000+人付款
吕杰武l,美式街头刺绣机车棒球服外套男嘻哈潮牌情侣棉衣宽松加厚冬季棉服,248.00,广东 广州,1000+人付款
armexnlk旗舰店,棉衣男士外套2021冬季新款短款加厚修身棉服韩版潮流帅气冬装棉袄,128.00,浙江 杭州,2000+人付款
rjkk旗舰店,2021冬季美式加厚加绒立领棉衣男生潮牌日系羊羔毛两面穿棉服外套,268.00,浙江 杭州,1000+人付款
雅贵奴旗舰店,棉服男士冬季2021年新款爆款假两件面包棉衣男装加厚羽绒棉袄外套,148.00,浙江 杭州,1000+人付款
levis官方旗舰店,Levi\u0027s李维斯秋冬男士撞色休闲保暖厚外套时尚潮流棉服28349-0000,641.00,上海,600+人付款
尚幽旗舰店,2021年新款棉衣男冬季加厚棉袄外套韩版潮流ins爆款潮牌面包棉服,59.90,福建 泉州,4000+人付款
munsterlee,EviStub 20FW 日系复古Vintage棉衣外套宽松街头冬季棉服夹克男潮,389.00,浙江 杭州,1000+人付款
vesibo旗舰店,羊羔毛连帽棉衣男秋冬季宽松痞帅棉服外套港风vibe小熊图案棉袄潮,148.00,浙江 杭州,2000+人付款
benpanda熊猫本旗舰店,熊猫本 冬季棉服男潮流双面穿撞色外套宽松立领棉袄保暖加厚棉衣,355.00,福建 福州,55人付款
一梦寻千年,日系复古灯芯绒立领棉衣男冬季情侣宽松工装棉服休闲外套保暖棉袄,228.00,浙江 杭州,100+人付款
一梦寻千年,克莱因蓝工装棉衣男冬季情侣宽松压皱棉服加厚外套潮牌保暖棉服男,178.00,浙江 杭州,4000+人付款
义珍旗舰店,冬季外套女新款棉衣小棉袄小个子面包服短款羽绒棉服oversize女潮,188.00,广东 广州,2人付款
点萃旗舰店,秋冬季拼接工装棉衣男潮牌外套加绒加厚冲锋衣大码2021棉服棉袄子,118.00,浙江 杭州,1000+人付款
散场电影fly,【FPMZ官方店铺】国潮牌立领薄荷绿拼接羽绒棉服加厚外套宽松男女,379.00,山西 晋中,1000+人付款
beaster官方旗舰店,BEASTER小恶魔鬼脸潮牌拼色棉服男中长款防风防寒宽松2021年新款,599.00,浙江 杭州,600+人付款
气质有毒,@港仔文艺男 两面穿棉衣冬季羊羔毛外套oversize加绒加厚棉服棉袄,158.00,浙江 杭州,2000+人付款
柯喜蓝kexilan,悟空有货冬季撞色拼接立领棉衣男潮牌宽松bf风加厚保暖面包服棉袄,148.00,浙江 杭州,2000+人付款
净化眼球潮流服饰,净化眼球自制冬季加厚立领棉衣男潮牌宽松灯芯绒面包服情侣外套男,268.00,浙江 杭州,1000+人付款
爆眼服饰旗舰店,棉服男潮牌大码冬季加厚棉衣外套2021新款面包服韩版潮流羽绒棉袄,128.00,浙江 杭州,2000+人付款
benpanda熊猫本旗舰店,熊猫本 秋冬新款鱼尾棉衣男日系潮牌内胆可拆卸户外两穿风衣外套,425.00,福建 福州,41人付款
行更远旗舰店,牛仔假两件棉衣男韩版潮流宽松休闲外套港风大码加厚冬季款面包服,148.00,浙江 杭州,2000+人付款
leonbinno雷尔宾诺旗舰店,冬季棋盘格子羊羔毛棉衣男ins情侣宽松棉服外套韩版潮牌加厚棉袄,138.00,浙江 杭州,3000+人付款
