评论内容,评论时间,评论人等级,评论类型,评论内容-新,情感分值
本来就是人家有心算咱们无心，纯粹是恶心你中国的。希望Z F能保护好现有的文化遗产，不要在让亲者痛、仇者快了。,2017-11-17 06:22:30,5,评论,本来就是人家有心算咱们无心，纯粹是恶心你中国的。希望Z F能保护好现有的文化遗产，不要在让亲者痛、仇者快了。,0.0021
莱特兄弟发明了飞机，而现在客机主要是空客和波音的。那是不是莱特兄弟后代可以说空客波音是盗贼？赫梯人首先冶铁，那赫梯人后代是不是可以像全世界钢铁厂收专利费？漆器源于中国没错，可是日本漆器他们自己也发展了那么多年，没必要去否定。,2017-11-17 19:23:53,5,回复,莱特兄弟发明了飞机，而现在客机主要是空客和波音的。那是不是莱特兄弟后代可以说空客波音是盗贼？赫梯人首先冶铁，那赫梯人后代是不是可以像全世界钢铁厂收专利费？漆器源于中国没错，可是日本漆器他们自己也发展了那么多年，没必要去否定。,0.0015
回复 @流光晚邂 :好像只有日本有漆器似的，中国的漆器也没失传啊,2018-07-13 21:20:06,6,回复,回复 @流光晚邂 :好像只有日本有漆器似的，中国的漆器也没失传啊,0.0027
回复 @流光晚邂:嗯，中国当初流传了很多技术出去，如今没有发展好，大多是自己的问题。本土的文化理应是更有优势的，保护文化首先是国人自身的文化认同感，实在不该什么都是政府的功过。,2017-11-19 22:04:05,5,回复,回复 @流光晚邂:嗯，中国当初流传了很多技术出去，如今没有发展好，大多是自己的问题。本土的文化理应是更有优势的，保护文化首先是国人自身的文化认同感，实在不该什么都是政府的功过。,0.0027
从评论区就可以看出有多少人一点资料都没查，什么都没了解就窜出来自以为是，有空还是多看点书吧！用知识来武装一下你们贫瘠都大脑，起码这样窜出来还能拿点干货。,2017-11-11 22:23:27,5,评论,从评论区就可以看出有多少人一点资料都没查，什么都没了解就窜出来自以为是，有空还是多看点书吧！用知识来武装一下你们贫瘠都大脑，起码这样窜出来还能拿点干货。,0.9998
推荐2017年9月份的《中华遗产》有专门讲漆器。顺便安利一下中华遗产真的十分好看，不过买的人太少,2017-11-11 15:05:02,5,评论,推荐2017年9月份的《中华遗产》有专门讲漆器。顺便安利一下中华遗产真的十分好看，不过买的人太少,0.9998
回复 @你可懂我的风流 :中华遗产是一本杂志[笑哭],2020-01-10 22:51:07,5,回复,回复 @你可懂我的风流 :中华遗产是一本杂志,0.0014
我咋找不到啊，爱奇艺和央视，优酷都没,2020-01-10 19:44:01,5,回复,我咋找不到啊，爱奇艺和央视，优酷都没,0.0018
明年就要涨价了(´；ω；`),2017-11-11 16:22:47,6,回复,明年就要涨价了(´；ω；`),0.9999
复制一下324楼的评论，太赞同了！又不想自己去吃苦，又想要别人吃苦，大家都不愿意吃苦的时候，怪国家。很好很强大,2017-11-10 12:23:58,5,评论,复制一下324楼的评论，太赞同了！又不想自己去吃苦，又想要别人吃苦，大家都不愿意吃苦的时候，怪国家。很好很强大,0.0389
白皮对于中国的政治文化倾向于什么态度没点逼数吗？,2017-11-10 08:55:05,5,评论,白皮对于中国的政治文化倾向于什么态度没点逼数吗？,0.463
只有日本心里才知道这是源于中国吧（￣▽￣）,2017-11-03 17:05:14,6,评论,只有日本心里才知道这是源于中国吧（￣▽￣）,0.0013
扬州漆器精品都是当国礼赠与外国领         导 人 的，为啥在你这漆器跟凉了一样?,2017-11-03 12:58:39,5,评论,扬州漆器精品都是当国礼赠与外国领 导 人 的，为啥在你这漆器跟凉了一样?,0.9999
中国这些年才刚发展起来，还尚且是个发展中国家，日本作为发达国家已经很久了，物质条件的富裕早于中国，最基本的物质丰富了，所以才有余裕去搞精神层面的文化产业。传统文化的缺失，根本原因还是在于中国不够发达，没有相应的文化氛围去给匠人创造产品价值，不是匠人不争气，也不是国家不重视，只是起步晚了，步步都要追赶。,2017-11-03 12:42:11,6,评论,中国这些年才刚发展起来，还尚且是个发展中国家，日本作为发达国家已经很久了，物质条件的富裕早于中国，最基本的物质丰富了，所以才有余裕去搞精神层面的文化产业。传统文化的缺失，根本原因还是在于中国不够发达，没有相应的文化氛围去给匠人创造产品价值，不是匠人不争气，也不是国家不重视，只是起步晚了，步都要追赶。,0.0012
漆器叫Japan跟你的话一点苟屁关系都没有，八竿子打不着,2017-11-03 12:45:13,6,回复,漆器叫Japan跟你的话一点苟屁关系都没有，八竿子打不着,0.9997
回复 @僵硬的冰箱周美玲:漆器叫Japan是因为货源地问题。你说跟你的话有几毛钱关系?,2017-11-03 14:20:06,6,回复,回复 @僵硬的冰箱周美玲:漆器叫Japan是因为货源地问题。你说跟你的话有几毛钱关系?,0.0012
回复 @卐赢:不想和你嗦话，过于睿智。,2017-11-03 14:04:46,6,回复,回复 @卐赢:不想和你嗦话，过于睿智。,0.0018
自己人不珍惜没法，看个古装不是说日本就说韩国，看不起老祖宗的东西  还拿辫子当中国风  真是服了,2017-11-03 09:03:45,4,评论,自己人不珍惜没法，看个古装不是说日本就说韩国，看不起老祖宗的东西 还拿辫子当中国风 真是服了,0.0025
我突然发觉日本人宣传能力真厉害。,2017-11-03 08:32:46,6,评论,我突然发觉日本人宣传能力真厉害。,0.0027
侵华日军抢占中国国宝级别的一级文物上百万件！！！关于侵华日军在（北京）造成的部分财产损失如下：云居寺：被毁殿宇、房屋300多间；长城：破坏城段45公里、敌楼197座、瓮城2座、三火车皮城砖永寿禅寺：1938年2月18日，被日军点燃禅房，整个寺院变成一片废墟，仅存千佛殿及钟鼓楼。故宫：文物2953箱，大约60万件国宝级别文物！被征用铜品66口，铜炮4尊，铜灯亭91件。1938年被日本宪兵劫走书籍165册，撕毁书籍26册，焚毁书籍164册；劫走杂志3447册，撕毁杂志4131册，焚毁杂志3277册。1939年3月被日本宪兵劫走杂志6551册。共计损失书籍、杂志14764册。房山周口店遗址：头骨6具、头骨碎片12件、下颌骨15件、牙齿157枚、股骨7件、胫骨1件、肱骨3件、锁骨和月骨各一件，以及其它一些头骨和面骨碎片。北京大学：《俄蒙界线图》一份，古铜镜14件，古铜印7件，孟津出土之车器400余件，甲骨20余片，艺风堂拓片1000余件，北平碑志100余件，明兵部提行稿等文献360余件。国立北平图书馆：中西文图书损失6264册。清华大学：据1943年统计，图书损失175720册，包括在重庆北碚被日机炸毁的。此外还有1937年后自海外运来途中损失的，不可考。燕京大学：根据顾颉刚统计，普通书、杂志三万册，明清善本6000册，抄本5000册，小说唱本3000册，专科500册，稿本书300册，碑帖30件，印谱20部，金石拓本100种，书画40件，印章150方，古钱650枚，古镜3枚，石刀2柄，古经2卷。私立朝阳学院：损失图书25110册。北平民国学院：被日军劫走图书59836册。静生生物调查所：动物标本30余万件、植物标本22万号，图书10余万卷。其它损失：宋清瓷器、绣花屏风80多件，公私图书损失5836万册，古物2800件，碑帖2.1万件。日本侵华日抢占中国国宝级别的一级文物上百万件！！！所以精日的那帮人你们精的什么知道吗！很多都是抢夺了我们的文化他们弄起来的啊！所以我不觉得日本有啥文化 动漫顶多算是载体 和商品,2021-05-21 16:04:35,4,评论,侵华日军抢占中国宝级别的一级文物上百万件！关于侵华日军在（北京）造成的部分财产损失如下：云居寺：被毁殿宇、房屋30多间；长城：破坏城段45公里、敌楼197座、瓮城2座、三火车皮城砖永寿禅寺：1938年2月18日，被日军点燃禅房，整个寺院变成一片废墟，仅存千佛殿及钟鼓楼。故宫：文物2953箱，大约60万件国宝级别文物！被征用铜品6口，铜炮4尊，铜灯亭91件。1938年被日本宪兵劫走书籍165册，撕毁书籍26册，焚毁书籍164册；劫走杂志347册，撕毁杂志4131册，焚毁杂志327册。1939年3月被日本宪兵劫走杂志651册。共计损失书籍、杂志14764册。房山周口店遗址：头骨6具、头骨碎片12件、下颌骨15件、牙齿157枚、股骨7件、胫骨1件、肱骨3件、锁骨和月骨各一件，以及其它一些头骨和面骨碎片。北京大学：《俄蒙界线图》一份，古铜镜14件，古铜印7件，孟津出土之车器40余件，甲骨20余片，艺风堂拓片10余件，北平碑志10余件，明兵部提行稿等文献360余件。国立北平图书馆：中西文图书损失6264册。清华大学：据1943年统计，图书损失175720册，包括在重庆北碚被日机炸毁的。此外还有1937年后自海外运来途中损失的，不可考。燕京大学：根据顾颉刚统计，普通书、杂志三万册，明清善本60册，抄本50册，小说唱本30册，专科50册，稿本书30册，碑帖30件，印谱20部，金石拓本10种，书画40件，印章150方，古钱650枚，古镜3枚，石刀2柄，古经2卷。私立朝阳学院：损失图书2510册。北平民国学院：被日军劫走图书59836册。静生物调查所：动物标本30余万件、植物标本2万号，图书10余万卷。其它损失：宋清瓷器、绣花屏风80多件，公私图书损失5836万册，古物280件，碑帖2.1万件。日本侵华日抢占中国宝级别的一级文物上百万件！所以精日的那帮人你们精的什么知道吗！很多都是抢夺了我们的文化他们弄起来的啊！所以我不觉得日本有啥文化 动漫顶多算是载体 和商品,0.9999
抹茶，宋朝，现在以为抹茶是日本原产的应该蛮多。直接告诉你，日本自己制造的文化一只手能数清，基本上是抄袭中国的。,2020-01-14 00:25:21,6,评论,抹茶，宋朝，现在以为抹茶是日本原产的应该蛮多。直接告诉你，日本自己制造的文化一只手能数清，基本上是抄袭中国的。,0.9999
为什么说漆器失传了？因为漆器贵啊!根本不是普通人用得起的。看我在故宫修文物里面 乾隆用的那个漆器 光刷漆就刷了多少层？普通漆器至少要刷将近四十层才能做雕漆 而且这里用的都是天然大漆 不是现在的化学漆 光这些漆就是一大笔钱 还要算上人工 普通人家也就只能用瓷的 塑料的 金属的 漆器真的用不起,2019-01-06 20:47:36,5,评论,为什么说漆器失传了？因为漆器贵啊!根本不是普通人用得起的。看我在故宫修文物里面 乾隆用的那个漆器 光刷漆就刷了多少层？普通漆器至少要刷将近四十层才能做雕漆 而且这里用的都是天然大漆 不是现在的化学漆 光这些漆就是一大笔钱 还要算上人工 普通人家也就只能用瓷的 塑料的 金属的 漆器真的用不起,0.0014
国内很多没落的技艺就是这样的，非得国外申遗才引起警醒。真是可笑之极。,2017-11-13 12:49:03,6,评论,国内很多没落的技艺就是这样的，非得国外申遗才引起警醒。真是可笑之极。,0.002
我们用了几千年的东西谁知道哪些可以申遗哪些不可以。还有以前申遗数量没有限制自从人家一次性申遗10项之后每年只能申请一项，结果现在申遗数量远远超过批准数量，还有人家申遗打的是擦边球。更重要的是管理申遗的是外国人，没人愿意中国方方面面都强于他们。他们把诗歌小说当历史把神话传说当历史却又积极否定中国五千年历史。事实上七千年历史也是存在的。,2017-11-18 10:50:32,5,回复,我们用了几千年的东西谁知道哪些可以申遗哪些不可以。还有以前申遗数量没有限制自从人家一次性申遗10项之后每年只能申请一项，结果现在申遗数量远超过批准数量，还有人家申遗打的是擦边球。更重要的是管理申遗的是外国人，没人愿意中国方面都强于他们。他们把诗歌小说当历史把神话传说当历史却又积极否定中国五千年历史。事实上七千年历史也是存在的。,0.9999
回复 @伦理君_:韩国人申遗他们的端午节，中国人则可以申遗我们的端午节。不过可笑的是如今天坛祭天，还有赛龙舟，很多地方不穿汉族服饰，穿满清服饰。,2017-11-17 19:27:33,5,回复,回复 @伦理君_:韩国人申遗他们的端午节，中国人则可以申遗我们的端午节。不过可笑的是如今天坛祭天，还有赛龙舟，很多地方不穿汉族服饰，穿满清服饰。,0.0017
回复 @流光晚邂:被清廷剧洗脑了，都不知道被奴役的历史了。,2017-11-17 19:36:49,6,回复,回复 @流光晚邂:被清廷剧洗脑了，都不知道被奴役的历史了。,0.0032
其实很反感所谓的起源于哪国，就像韩国，最喜欢争起源，掀起这种风气。而世界压根不在意哪起源的，只在意谁做得最好。,2019-01-16 23:47:06,5,评论,其实很反感所谓的起源于哪国，就像韩国，最喜欢争起源，掀起这种风气。而世界压根不在意哪起源的，只在意谁做得最好。,0.9999
问题就算是做也比日本做得好啊。。。,2019-03-07 02:43:05,5,回复,问题就算是做也比日本做得好啊。,0.0013
这不正说明了，日本是中国的,2018-11-30 21:20:15,4,评论,这不正说明了，日本是中国的,0.0008
给我上去,2018-12-01 12:57:17,5,回复,给我上去,0.8016
优秀啊,2018-12-01 11:00:59,5,回复,优秀啊,0.9929
购物平台中：买衣服：韩式潮流，韩款潮流，韩款百搭..买家具：日式...，日款......买酒：法国进口.......买奢侈精致品：法国.....，意大利.......买中国风：没有找到此类商品。特别是服装衣物类：明明是自己家东西，不标个韩国日本你们就卖不出去，买入买了是呗？卑微到骨子里了，现在买东西见到韩式韩款的就烦。,2022-01-05 16:22:37,3,评论,购物平台中：买衣服：韩式潮流，韩款百搭.买家具：日式.，日款.买酒：法国进口.买奢侈精致品：法国.，意大利.买中国风：没有找到此类商品。特别是服装衣物类：明是自己家东西，不标个韩国日本你们就卖不出去，买入买了是呗？卑微到骨子里了，现在买东西见到韩式韩款的就烦。,0.9999
之前好像听说过一个关于脱胎漆器的故事，故事真假我并没有考证过。说早年有一次间周总理接待外宾，在人民大会堂一只手举起了一个青铜狮子。具体这个狮子有多大我是不知道，反正是不小。外国友人连连称赞总理神力。然后周总理跟他们解释，这是中国的脱胎漆器，实际上并不重。,2018-05-19 23:27:10,4,评论,之前好像听说过一个关于脱胎漆器的故事，故事真假我并没有考证过。说早年有一次间周总理接待外宾，在人民大会堂一只手举起了一个青铜狮子。具体这个狮子有多大我是不知道，反正是不小。外国友人连称赞总理神力。然后周总理跟他们解释，这是中国的脱胎漆器，实际上并不重。,0.9999
你说的是对的，确有此事，漆器一直被作为国礼的一种,2018-09-08 23:55:36,5,回复,你说的是对的，确有此事，漆器一直被作为国礼的一种,0.0021
主流生活用品中的漆器早在唐代就开始淘汰了，取代它的正是瓷器，不是说漆器的使用价值和工艺审美跟不上，而是出现了更好的替代品，因为瓷器生产比漆器容易，就是现代社会还是瓷器为主流,2018-02-28 20:42:05,6,评论,主流生活用品中的漆器早在唐代就开始淘汰了，取代它的正是瓷器，不是说漆器的使用价值和工艺审美跟不上，而是出现了更好的替代品，因为瓷器生产比漆器容易，就是现代社会还是瓷器为主流,0.9999
其实只是误会而已，没什么可悲的，就像国外一种以为“幸运饼干”是中国传统美食一样。,2017-11-11 19:51:19,6,评论,其实只是误会而已，没什么可悲的，就像国外一种以为“幸运饼干”是中国传统美食一样。,0.0544
幸运饼干是什么？,2017-11-19 22:25:04,6,回复,幸运饼干是什么？,0.9998
一直，打错了,2017-11-11 22:09:27,6,回复,一直，打错了,0.9989
哪些说漆器五千年历史的人能不能搜一下，搜一下会累死吗？现在已经出土了河姆渡的漆器了！请不要卖弄无知！,2017-11-11 14:58:30,5,评论,哪些说漆器五千年历史的人能不能搜一下，搜一下会累死吗？现在已经出土了河姆渡的漆器了！请不要卖弄无知！,0.9999
所以说这视频瞎吹，b站这种视频越来越多，成天带节奏,2017-11-11 22:17:59,5,回复,所以说这视频瞎吹，b站这种视频越来越多，成天带节奏,0.0015
……我学校课程就有漆……简直痛苦得不行，过敏的那一个星期，手肿到晚上睡觉都睡不着，痒得梦里都是各种挠。但是，这是值得的。,2017-11-11 01:34:15,5,评论,…我学校课程就有漆…简直痛苦得不行，过敏的那一个星期，手肿到晚上睡觉都睡不着，痒得梦里都是各种挠。但是，这是值得的。,0.9996
为你点赞,2017-11-13 11:40:58,6,回复,为你点赞,0.9998
我们大学美术学院的王牌就是漆画，材料非常的贵，而且几乎所有学漆画的同学都会过敏。之前有个学姐过敏的太严重，疯狂掉头发，只好转专业了,2017-11-10 21:52:32,6,评论,我们大学美术学院的王牌就是漆画，材料非常的贵，而且几乎所有学漆画的同学都会过敏。之前有个学姐过敏的太严重，疯狂掉头发，只好转专业了,0.9998
这是中国的japan,2017-11-10 21:51:44,5,评论,这是中国的japan,0.029
中国的一切，不需要欧美去定论。,2017-11-10 10:18:22,5,评论,中国的一切，不需要欧美去定论。,0.9999
漆器的手艺中国一直都有，每年故宫的文物修复里就有不少的漆器。能不要强行伤感，好不,2017-11-10 08:50:13,5,评论,漆器的手艺中国一直都有，每年故宫的文物修复里就有不少的漆器。能不要强行伤感，好不,0.9999
日本？好大的口气我们的祖先才是创始人,2017-11-03 19:19:49,3,评论,日本？好大的口气我们的祖先才是创始人,0.0009
总说创始人，足球呢( ´_ゝ｀),2017-11-03 20:08:03,6,回复,总说创始人，足球呢( ´_ゝ｀),0.0012
回复 @Rng:足球不一样的,2017-11-10 08:56:17,6,回复,回复 @Rng:足球不一样的,0.0113
韩国人暗中观察,2017-11-03 16:06:05,5,评论,韩国人暗中观察,0.3031
所以Japan是China的嘛=￣ω￣=,2017-11-03 14:44:20,5,评论,所以Japan是China的嘛=￣ω￣=,0.9992
但是日本要靠从中国进口做漆器的材料！不然做不出,2017-11-03 11:53:03,6,评论,但是日本要靠从中国进口做漆器的材料！不然做不出,0.9987
这个，听说刚改革开放，有日本人用卡车偷运稀土，当时中国人都不知道什么是稀土。,2017-11-03 12:01:42,4,回复,这个，听说刚改革开放，有日本人用卡车偷运稀土，当时中国人都不知道什么是稀土。,0.9997
而且日本长时期的阴中国，中国内部也有很多 间 谍。到现在还有日本人来中国学技艺，中国人没一点保护意识,2017-11-03 11:55:03,6,回复,而且日本长时期的阴中国，中国内部也有很多 间 谍。到现在还有日本人来中国学技艺，中国人没一点保护意识,0.0021
回复 @正好了:那是不可能的，你当稀土是平地里堆的么？是需要地矿工作者找的，卖土矿的都是国家机器。不知道稀土是什么这种说法，对平头百姓来讲是真的，可这并不会有什么影响，但对于卖它的人来讲，是不存在的。,2017-11-10 22:36:56,5,回复,回复 @正好了:那是不可能的，你当稀土是平地里堆的么？是需要地矿工作者找的，卖土矿的都是国家机器。不知道稀土是什么这种说法，对平头百姓来讲是真的，可这并不会有什么影响，但对于卖它的人来讲，是不存在的。,0.9999
其实中国这么悠久的历史，有些技艺会随着朝代更迭变化，更新，消失，都是很正常的事。现在最重要的是如何保护好还流传于世的技艺。中国虽然也建立了无形文遗的名录，但是到具体实施和立法，还是不及韩国和日本。,2017-11-03 10:13:12,5,评论,其实中国这么悠久的历史，有些技艺会随着朝代更迭变化，更新，消失，都是很正常的事。现在最重要的是如何保护好还流传于世的技艺。中国虽然也建立了无形文遗的名录，但是到具体实施和立法，还是不及韩国和日本。,0.9999
不是落寞，是这个成本真的太高，普通老百姓基本用不了的，没有普及而已,2017-11-03 09:58:08,6,评论,不是落寞，是这个成本真的太高，普通老百姓基本用不了的，没有普及而已,0.0027
了不起的匠人第二季里面有一集就是讲的中国自己制造犀皮漆器，看的真的很喜欢，希望这些美好能传承吧,2017-11-03 09:07:16,5,评论,了不起的匠人第二季里面有一集就是讲的中国自己制造犀皮漆器，看的真的很喜欢，希望这些美好能传承吧,0.9999
也就是说，就算你开始的早，不努力也会被别人山寨走，另外开始的晚也不用怕，山寨好了就能把别的国家的东西抢过来，,2017-11-03 09:05:25,6,评论,也就是说，就算你开始的早，不努力也会被别人山寨走，另外开始的晚也不用怕，山寨好了就能把别的国家的东西抢过来，,0.0014
不是每个朝代的贵族都喜欢漆器。改朝换代，或是在贵族面前失宠。靠平民还是很难发展的。文化也会有不同。审美服装也不一样，。历史上有很多文化，在近世纪不兴起淘汰是正常。因为本来就跟他们没多大关系了，生活的年代也不同。在说了中国近世纪也就明朝初期牛逼点。汉朝的漆器在我国算是出土最多的了，因为墓葬多嘛，。汉朝漆器主要是餐具，等生活用具，比如家具，化妆盒，壶，等等。也有漆棺材，和一些漆礼器等大物件。马王堆就出土大量汉朝的髹漆器物。主要是漆餐具。为何有人说漆器会有7千年历史。因为出土了河姆渡文化木胎朱漆碗，*****漆器。1977年河姆渡遗址T231出土。收藏于藏浙江省博物馆。河姆渡遗址，是新石器晚期的遗址。,2017-11-03 08:28:50,5,评论,不是每个朝代的贵族都喜欢漆器。改朝换代，或是在贵族面前失宠。靠平民还是很难发展的。文化也会有不同。审美服装也不一样，。历史上有很多文化，在近世纪不兴起淘汰是正常。因为本来就跟他们没多大关系了，生活的年代也不同。在说了中国近世纪也就明朝初期牛逼点。汉朝的漆器在我国算是出土最多的了，因为墓葬多嘛，。汉朝漆器主要是餐具，等生活用具，比如家具，化妆盒，壶，等。也有漆棺材，和一些漆礼器等大物件。马王堆就出土大量汉朝的髹漆器物。主要是漆餐具。为何有人说漆器会有7千年历史。因为出土了河姆渡文化木胎朱漆碗，*漆器。197年河姆渡遗址T231出土。收藏于藏浙江省博物馆。河姆渡遗址，是新石器晚期的遗址。,0.9999
漆器的存在和发展是因为还没有瓷器的产生。,2017-11-03 10:08:57,5,回复,漆器的存在和发展是因为还没有瓷器的产生。,0.9998
其实只能说漆器是由日本带向全世界的，国外对日本的认知应该最早来源于漆器，就跟中国的瓷器“China”一个道理。,2017-11-03 07:59:54,6,评论,其实只能说漆器是由日本带向全世界的，国外对日本的认知应该最早来源于漆器，就跟中国的瓷器“China”一个道理。,0.0014
就好像阿拉伯数字一个道理。。印度人发明阿拉伯人传播的所以西方叫他阿拉伯数字,2017-11-03 08:53:40,6,回复,就好像阿拉伯数字一个道理。印度人发明阿拉伯人传播的所以西方叫他阿拉伯数字,0.9997
回复 @翔哥奎哥:不能说感谢，日本英文名称的来源肯定是根据西方人的认知来的，西方人只记住了日本的漆器，哪还管技术从哪来的？先入为主罢了。,2017-11-03 08:31:58,6,回复,回复 @翔哥奎哥:不能说感谢，日本英文名称的来源肯定是根据西方人的认知来的，西方人只记住了日本的漆器，哪还管技术从哪来的？先入为主罢了。,0.0015
难道还要感谢日本吗？,2017-11-03 08:22:59,5,回复,难道还要感谢日本吗？,0.0829
