评论内容,评论时间,评论人等级,评论类型,评论内容-新,情感分值
回复 @NoirDrei:这些文化是很有意思的，多看看就当丰富知识也行，但文化脉络是肯定有源头的，必须要认清，我不管你们分叉枝桠到底结什么果，反正主干就一个，只是说随时防着点东亚邻居，这群东西分明思想都飘到西方了，还想在亚洲的身躯上多贴点金( ´_ゝ｀),2017-11-10 15:20:20,5,回复,回复 @NoirDrei:这些文化是很有意思的，多看就当丰富知识也行，但文化脉络是肯定有源头的，必须要认清，我不管你们分叉枝桠到底结什么果，反正主干就一个，只是说随时防着点东亚邻居，这群东西分明思想都飘到西方了，还想在亚洲的身躯上多贴点金( ´_ゝ｀),0.0019
就像弹幕说的  国家不重视个屁  明显大众没观念！ 国家不重视  所以你就不重视了？  自己也有问题  别什么都扯上国家 要没人做这类纪录片   说实话  可能内心会以为来源于中国  但是不是中国还真不知道  所以真心喜欢不起来日本  感觉这个国家  盗了我们很多东西和文化  日本厉害的一点在于  他把别国的文化带到自己国家发扬光大  然后自己再改良成为自己本国的  还让“某国一些人民”认为这些东西都是他们的 为他们争辩  殊不知  丢掉的岂止是物  还有你的心！（某国人民是谁  自己去想吧  我就不明说了）,2017-11-03 10:58:05,5,评论,就像弹幕说的 国家不重视个屁 明显大众没观念！ 国家不重视 所以你就不重视了？ 自己也有问题 别什么都扯上国家 要没人做这类纪录片 说实话 可能内心会以为来源于中国 但是不是中国还真不知道 所以真心喜欢不起来日本 感觉这个国家 盗了我们很多东西和文化 日本厉害的一点在于 他把别国的文化带到自己国家发扬光大 然后自己再改良成为自己本国的 还让“某国一些人民”认为这些东西都是他们的 为他们争辩 殊不知 丢掉的岂止是物 还有你的心！（某国人民是谁 自己去想吧 我就不明说了）,0.0014
大二三下乡调研过民间文化，说真的不是国家不重视，主要是大众不重视。很多申遗的项目当地政府都有设馆展示，有些老手艺人家里还会摆着国家领导拜访他们的照片。他们最愁的问题是现在年轻人都不愿意从事这些，不过现在情况也在改善,2017-11-03 12:06:20,5,回复,大二三下乡调研过民间文化，说真的不是国家不重视，主要是大众不重视。很多申遗的项目当地政府都有设馆展示，有些老手艺人家里还会摆着国家领导拜访他们的照片。他们最愁的问题是现在年轻人都不愿意从事这些，不过现在情况也在改善,0.9999
没人关注只能怪国家！,2017-11-03 11:44:58,4,回复,没人关注只能怪国家！,0.0073
回复 @双塔殊途:有政策啊，没人关注就感觉没有一样。,2017-11-03 11:37:52,6,回复,回复 @双塔殊途:有政策啊，没人关注就感觉没有一样。,0.001
中国自己的东西弄丢了非得要在人家发扬期间捡回来显得没风度,2018-12-19 22:24:50,6,评论,中国自己的东西弄丢了非得要在人家发扬期间捡回来显得没风度,0.0045
从清朝开始就有大量文化丢失,2019-03-08 15:59:39,5,回复,从清朝开始就有大量文化丢失,0.9989
这东西一直都是奢侈品，生活中当然不多见,2019-03-08 15:58:23,5,回复,这东西一直都是奢侈品，生活中当然不多见,0.9999
不对吗？（响指）仔细想想咱们生活中漆器这个词用的多不多？,2018-12-19 22:26:08,6,回复,不对吗？（响指）仔细想咱们生活中漆器这个词用的多不多？,0.0022
评论怎么那么多日杂?,2018-08-10 11:45:00,4,评论,评论怎么那么多日杂?,0.0042
回复 @沐沐KING :中国几十万间谍了解下，倭国就占至少半数,2018-10-05 10:27:54,6,回复,回复 @沐KING :中国几十万间谍了解下，倭国就占至少半数,0.0023
回复 @沐沐KING :精 日,2018-08-19 16:10:41,4,回复,回复 @沐KING :精 日,0.0388
日杂是啥？⊙∀⊙,2018-08-19 14:03:33,6,回复,日杂是啥？⊙∀⊙,0.0021
B站怎么知道我今天选修课听的就是漆器！！！(ﾟДﾟ≡ﾟдﾟ)!?,2017-11-12 00:11:04,5,评论,B站怎么知道我今天选修课听的就是漆器！(ﾟДﾟ≡ﾟдﾟ)!?,0.0014
呵呵 日本真是好造化 几千年的盗版终于成正版了,2017-11-10 12:42:05,6,评论,呵 日本真是好造化 几千年的盗版终于成正版了,0.0006
1.是古中国（先秦）人（包括带着手艺的人，工匠）移民到日本去的，传播了工艺还赖日本人？2.是古中国（隋唐）人同意古日本人派遣唐使到古中国来学习的，甚至还有鉴真等人主动东渡授教，这也赖日本？天下那有老师A的子孙怨学生的子孙的知识（及其创造）都是偷师A的的道理？3.日本传承（内化或改良）千年没有功劳也有苦劳；要是这也有罪的话，那么某国不到百年的依托自西洋发明发展的现代科技而来的所有事物不更是盗版？自己也大量地学习了别人，也有脸天天抹黑他人？,2017-11-10 12:55:33,5,回复,1.是古中国（先秦）人（包括带着手艺的人，工匠）移民到日本去的，传播了工艺还赖日本人？2.是古中国（隋唐）人同意古日本人派遣唐使到古中国来学习的，甚至还有鉴真等人主动东渡授教，这也赖日本？天下那有老师A的子孙怨学生的子孙的知识（及其创造）都是偷师A的道理？3.日本传承（内化或改良）千年没有功劳也有苦劳；要是这也有罪的话，那么某国不到百年的依托自西洋发明发展的现代科技而来的所有事物不更是盗版？自己也大量地学习了别人，也有脸天抹黑他人？,0.002
回复 @林晴雨:“老师”和“学生”的关系那是你的看法，至少是“老师”一方的看法，当老师被压制默默无闻，这个世界上就只有当年“学生”了,2017-11-10 14:26:08,5,回复,回复 @林晴雨:“老师”和“学生”的关系那是你的看法，至少是“老师”一方的看法，当老师被压制默无闻，这个世界上就只有当年“学生”了,0.0014
正版被盗版打败，丢脸啊,2017-11-10 14:31:09,5,回复,正版被盗版打败，丢脸啊,0.9935
7000年前中国还是*****，up主也真敢吹,2017-11-03 07:56:06,5,评论,70年前中国还是*，up主也真敢吹,0.001
为何有人说漆器会有7千年历史。因为出土了河姆渡文化木胎朱漆碗。1977年河姆渡遗址T231出土。收藏于藏浙江省博物馆。河姆渡遗址，是新石器晚期的遗址。,2017-11-03 09:17:37,6,回复,为何有人说漆器会有7千年历史。因为出土了河姆渡文化木胎朱漆碗。197年河姆渡遗址T231出土。收藏于藏浙江省博物馆。河姆渡遗址，是新石器晚期的遗址。,0.0019
回复 @匠仓TV:河姆渡那个是第三文化层发掘出的漆器，第三文化层是在6000年前，7000年前的是第四文化层,2017-11-03 10:04:57,5,回复,回复 @匠仓TV:河姆渡那个是第三文化层发掘出的漆器，第三文化层是在60年前，70年前的是第四文化层,0.0046
文化起源被遗忘，是整个民族以及国家的损失，文化是国家重要的部分，也是不可分割的部分，文化的起源是每个人都应该尊重和承认的。有些东西是必须去维护以及铭记的！让别人忘记文化的起源，相当于背叛国家！,2019-02-06 23:47:59,5,评论,文化起源被遗忘，是整个民族以及国家的损失，文化是国家重要的部分，也是不可分割的部分，文化的起源是每个人都应该尊重和承认的。有些东西是必须去维护以及铭记的！让别人忘记文化的起源，相当于背叛国家！,0.9999
任何人都没有资格让别人忘记文化起源！这是在羞辱对方！背叛国家！我呸！什么东西！,2019-02-06 23:51:56,5,回复,任何人都没有资格让别人忘记文化起源！这是在羞辱对方！背叛国家！我呸！什么东西！,0.0027
有些人背叛，是耻辱，更不可原谅！,2019-02-06 23:50:26,5,回复,有些人背叛，是耻辱，更不可原谅！,0.9974
我中华文化源远流长博大精深，岂是他东瀛可以窥探的。,2021-12-19 12:50:06,3,评论,我中华文化源远流长博大精深，岂是他东瀛可以窥探的。,0.9999
漆器真的很美[爱心],2021-12-18 15:03:33,5,评论,漆器真的很美,0.9997
不过是个代名词罢了，无感,2018-07-26 19:27:05,5,评论,不过是个代名词罢了，无感,0.8766
其实也正常，中国瓷器的名声太大了，把漆器掩盖了。而且到了唐代以后瓷器的发展比瓷器好很多，所以别人认为瓷器是中国的，漆器是日本的也正常。况且，漆器后来在日本的发展也比中国要好。大概中国在忙着发展瓷器吧╮(￣▽￣)╭,2018-02-25 18:05:00,5,评论,其实也正常，中国瓷器的名声太大了，把漆器掩盖了。而且到了唐代以后瓷器的发展比瓷器好很多，所以别人认为瓷器是中国的，漆器是日本的也正常。况且，漆器后来在日本的发展也比中国要好。大概中国在忙着发展瓷器吧╮(￣▽￣)╭,0.0018
我真的很害怕日本偷着偷着有些东西就真的变成他们的了[委屈],2021-09-11 15:59:45,3,评论,我真的很害怕日本偷着有些东西就真的变成他们的了,0.5279
已经是了，比如相扑，《东京梦华录》就说了，宋代就有的，以前叫角抵。还有木屐，甚至有男方女圆的区分，樱花也是，茶道也是，插花也是,2021-09-11 18:39:22,5,回复,已经是了，比如相扑，《东京梦华录》就说了，宋代就有的，以前叫角抵。还有木屐，甚至有男方女圆的区分，樱花也是，茶道也是，插花也是,0.9999
弹幕伞兵：“活了七千年的up主啊？”故意带偏关注点是吧？,2021-08-15 20:21:10,5,评论,弹幕伞兵：“活了七千年的up主啊？”故意带偏关注点是吧？,0.9998
太贵了，当然它值这个价，漆器是可以作为国礼的高档物品，如果你说传播，我们普通老百姓确实用不起，在网购不发达的时代，一般人也不知道到哪买，至少超市是没得卖的，但你要说工艺，一直有传承，因为任何时代都不缺有钱人，瞧瞧故宫里的漆器，不能说我们身边看不见就说传承断了，这只能说明我们太穷了，接触不到这个圈子。,2021-07-16 18:09:06,4,评论,太贵了，当然它值这个价，漆器是可以作为国礼的高档物品，如果你说传播，我们普通老百姓确实用不起，在网购不发达的时代，一般人也不知道到哪买，至少超市是没得卖的，但你要说工艺，一直有传承，因为任何时代都不缺有钱人，瞧故宫里的漆器，不能说我们身边看不见就说传承断了，这只能说明我们太穷了，接触不到这个圈子。,0.0018
确实，漆艺也是一直在发展的，现在国内比较出名的大漆古琴都三到五万了，好点的螺钿古琴都能到十万，一套桌椅十几万，普通人哪买的起，要不是我学漆器了我这辈子都见不到五米长的大漆屏风,2021-08-16 20:02:18,6,回复,确实，漆艺也是一直在发展的，现在国内比较出名的大漆古琴都三到五万了，好点的螺钿古琴都能到十万，一套桌椅十几万，普通人哪买的起，要不是我学漆器了我这辈子都见不到五米长的大漆屏风,0.9999
世界也不过如此，所谓的世界申遗只不过是对文化原产地的亵渎，不论文化的起源胡乱定为别国文化，可恶万分，但这反而激起了我们对自己文化的重视和保护，希望有朝一日能在国家文化方面能献点力，保护和传承我们美丽的中华文明！！[打call][打call],2021-07-12 21:19:46,5,评论,世界也不过如此，所谓的世界申遗只不过是对文化原产地的亵渎，不论文化的起源胡乱定为别国文化，可恶万分，但这反而激起了我们对自己文化的重视和保护，希望有朝一日能在国家文化方面能献点力，保护和传承我们美丽的中华文明！,0.9998
红色金纹，我喜欢鲜红色，不知从何时起,2017-11-21 23:11:32,6,评论,红色金纹，我喜欢鲜红色，不知从何时起,0.9999
漆器这种东西，怎么也不可能源自日本这种小地方，单从原料漆的发掘使用来说，得是多闲的蛋疼的人做了多少实验用了多少漆割了多少漆树试出来的。日本有这条件吗。[妙啊][呲牙],2021-07-04 13:43:30,5,评论,漆器这种东西，怎么也不可能源自日本这种小地方，单从原料漆的发掘使用来说，得是多闲的蛋疼的人做了多少实验用了多少漆割了多少漆树试出来的。日本有这条件吗。,0.9999
传承往往比发明更困难,2017-11-17 17:53:54,5,评论,传承往比发明更困难,0.9791
最开始看到漆面还以为是种吃的,2017-11-11 22:06:04,4,评论,最开始看到漆面还以为是种吃的,0.9913
还纳闷这种面我怎么没听说过,2017-11-11 22:06:28,4,回复,还纳闷这种面我怎么没听说过,0.0034
是我们起源又怎么样，我们发扬光大了？,2017-11-11 22:03:36,6,评论,是我们起源又怎么样，我们发扬光大了？,0.9997
楚国漆器也是一绝！唉，可惜无人传承！,2017-11-11 21:58:53,6,评论,楚国漆器也是一绝！唉，可惜无人传承！,0.9999
悟已往之不谏，知来者之可追。我们无法改变过去，但我们可以把握现在和将来。我们该做的就是心无杂念的继承和发扬这些优秀的传统，与时俱进、推陈出新。,2017-11-11 17:08:52,5,评论,悟已往之不谏，知来者之可追。我们无法改变过去，但我们可以把握现在和将来。我们该做的就是心无杂念的继承和发扬这些优秀的传统，与时俱进、推陈出新。,0.0018
绝对暴力可以解决一切的那个。。。你是忘了秦始皇和项羽的结局了吗( ´_ゝ｀),2017-11-11 00:18:59,6,评论,绝对暴力可以解决一切的那个。你是忘了秦始皇和项羽的结局了吗( ´_ゝ｀),0.9999
揚州漆器挺出名的,2017-11-10 23:11:44,5,评论,揚州漆器挺出名的,0.9999
老实说我连“瓷国”这个称呼都觉得不那么满意，听说日本叫“漆国”只觉得喜闻乐见。明明两个国家的国名其实很是牛X哄哄的→_→,2017-11-10 22:19:16,5,评论,老实说我连“瓷国”这个称呼都觉得不那么满意，听说日本叫“漆国”只觉得喜闻乐见。明两个国家的国名其实很是牛X哄的→_→,0.0011
把封面看出屎皮漆器2333,2017-11-10 20:24:00,6,评论,把封面看出屎皮漆器23,0.0143
仨字，美！,2017-11-10 19:07:08,6,评论,仨字，美！,0.9888
易梓嘉卫队别以为我看不懂日英混合ID,2017-11-11 12:05:07,3,回复,易梓嘉卫队别以为我看不懂日英混合ID,0.0016
就像百鬼夜行一样吧，起源于中国，却盛行于日本,2017-11-10 18:14:01,5,评论,就像百鬼夜行一样吧，起源于中国，却盛行于日本,0.0016
这只是因为日本动漫。。。如果几十年前盛行的是聊斋这种神鬼系列，那这种作品层出不穷，但我们盛行的是金庸，中国鬼故事里也有百鬼这样的，不过我们其他叫法，比如罗生门开，而且日本整个文化特点有利于神鬼文化，因为他们文化一个很大特点是“幽玄”，相信领教过日本恐怖片的会深有体会，吓死劳资了随着中国软实力增强，将来你会见到很多不一样的东西，毕竟底蕴摆在那,2017-11-10 19:51:15,5,回复,这只是因为日本动漫。如果几十年前盛行的是聊斋这种神鬼系列，那这种作品层出不穷，但我们盛行的是金庸，中国鬼故事里也有百鬼这样的，不过我们其他叫法，比如罗生门开，而且日本整个文化特点有利于神鬼文化，因为他们文化一个很大特点是“幽玄”，相信领教过日本恐怖片的会深有体会，吓死劳资了随着中国软实力增强，将来你会见到很多不一样的东西，毕竟底蕴摆在那,0.9999
其实两国的百鬼夜行并不一样，只是没人去了解去区别，去了解的话会发现差的蛮多的┐(´-｀)┌,2017-11-11 05:42:25,6,回复,其实两国的百鬼夜行并不一样，只是没人去了解去区别，去了解的话会发现差的蛮多的┐(´-｀)┌,0.9997
理论自信 制度自信 道路自信 文化自信！,2017-11-10 17:35:18,6,评论,理论自信 制度自信 道路自信 文化自信！,0.0227
我觉得没什么啊，无论是韩国还是日本，大家都长的那么像，肯定都是一个祖宗，大家都穿同一条内裤。只要没有战争，这样多好。,2017-11-10 13:16:12,5,评论,我觉得没什么啊，无论是韩国还是日本，大家都长的那么像，肯定都是一个祖宗，大家都穿同一条内裤。只要没有战争，这样多好。,0.9993
如果政治家们都能这么想当然再好不过了,2017-11-10 14:08:25,5,回复,如果政治家们都能这么想当然再好不过了,0.0013
理想很美好，然而这是不可能的，没错，不是疑问句，是肯定句，就是不可能的。错误与伤害不会因为道歉和补偿而消失，即便是同族，也会因为生存而争斗，就算你说全人类都是同一个祖先，差别还在那里，血缘也在那里，高低胖瘦，美丑穷富，有差别就会有争斗，因为我们是智慧生物，思想不同，所看重的东西不同，信任的不同，毕竟我们都不是圣人。,2017-11-11 03:20:34,5,回复,理想很美好，然而这是不可能的，没错，不是疑问句，是肯定句，就是不可能的。错误与伤害不会因为道歉和补偿而消失，即便是同族，也会因为生存而争斗，就算你说全人类都是同一个祖先，差别还在那里，血缘也在那里，高低胖瘦，美丑穷富，有差别就会有争斗，因为我们是智慧生物，思想不同，所看重的东西不同，信任的不同，毕竟我们都不是圣人。,0.9999
感谢推荐让我又找到一个这样的up主，b站有up主叫非遗小当家大家也可以关注下，非遗传承你我做起，有时候看韩国申遗很多人说不要脸，别国文化保护得好大家说要学习，这些都没错，其实平时花几分钟知道一下自己国家的文化就是最简单的传承。,2017-11-10 13:02:37,6,评论,感谢推荐让我又找到一个这样的up主，b站有up主叫非遗小当家大家也可以关注下，非遗传承你我做起，有时候看韩国申遗很多人说不要脸，别国文化保护得好大家说要学习，这些都没错，其实平时花几分钟知道一下自己国家的文化就是最简单的传承。,0.9998
很多东西我们自己看不起，别人觉得很神奇。每次看到一些古老的东西或者活动时，总有些杂货满脸鄙夷…我特么真想出现在他面前，指着他脑袋说:这是你老祖宗留给你的!!!!,2017-11-10 12:43:46,5,评论,很多东西我们自己看不起，别人觉得很神奇。每次看到一些古老的东西或者活动时，总有些杂货满脸鄙夷…我特么真想出现在他面前，指着他脑袋说:这是你老祖宗留给你的!,0.9999
我们国家依然有人学习漆器好吗……没有丢，会传承下去的。我们都在努力。,2017-11-10 12:27:42,6,评论,我们国家依然有人学习漆器好吗…没有丢，会传承下去的。我们都在努力。,0.9999
这个  具体丢没丢查查就知道了呗 不要一说起这些就是我们都丢了 都丢了，很多没有丢 只是你没接触 很多好的东西都属于奢侈品 丢了的那些很多都是不符合后面发展被淘汰，或者是经过改良，不多说  就像这个漆器 说实在  我到现在也只听过而没见过 一般的人家会花大价钱去买这类的装饰品吗 有底蕴的家族会买这类物品 以前很多工艺品为什么不一直延续到现在 不就是现代工艺冲击下 做出来的物品 更便宜 更耐用 社会的发展 人类的进步本身就会失去原有东西  真正能传下来的都是大浪淘金 已经是瑰宝级别 没传下来的除了个别原因大部分都是不能适合后面社会或者被新生事物取代 但是我很喜欢这样的进步 何必被以前的东西所束缚 以前的东西使我们骄傲 但更多的应该是前进 前人的精神和智慧让我们前进 但这不是让我们驻足不前 就像我曾经看过某些少数民族传承的歌曲 史诗 现在基本知道和会的人很少 在现代科技的冲击下 以后估计只能在纪录片里面看见了,2017-11-10 13:22:07,5,回复,这个 具体丢没丢查就知道了呗 不要一说起这些就是我们都丢了 都丢了，很多没有丢 只是你没接触 很多好的东西都属于奢侈品 丢了的那些很多都是不符合后面发展被淘汰，或者是经过改良，不多说 就像这个漆器 说实在 我到现在也只听过而没见过 一般的人家会花大价钱去买这类的装饰品吗 有底蕴的家族会买这类物品 以前很多工艺品为什么不一直延续到现在 不就是现代工艺冲击下 做出来的物品 更便宜 更耐用 社会的发展 人类的进步本身就会失去原有东西 真正能传下来的都是大浪淘金 已经是瑰宝级别 没传下来的除了个别原因大部分都是不能适合后面社会或者被新生事物取代 但是我很喜欢这样的进步 何必被以前的东西所束缚 以前的东西使我们骄傲 但更多的应该是前进 前人的精神和智慧让我们前进 但这不是让我们驻足不前 就像我曾经看过某些少数民族传承的歌曲 史诗 现在基本知道和会的人很少 在现代科技的冲击下 以后估计只能在纪录片里面看见了,0.0019
回复 @贪食的巨熊 :不会的啦~~优秀的会传承，传承的人会改变。不会只在纪录片里的~,2017-11-10 16:44:29,6,回复,回复 @贪食的巨熊 :不会的啦~优秀的会传承，传承的人会改变。不会只在纪录片里的~,0.0018
很多都丢了，，，有也只有那么几个吧，或许几个都没有,2017-11-10 12:37:31,6,回复,很多都丢了，有也只有那么几个吧，或许几个都没有,0.9996
什么国家不重视？！！！你重视了吗？什么叫做做的人多了就便宜了这玩意做个木胎都可能要花个1年多！现在的漆树不多了不是春秋战国了！而且每个漆匠都会生漆藓！成为一名合格的漆匠很难受的苦很多的！他喵的几个弹幕就把一个商代出现的工艺说的一分不值[小电视_好怒啊],2017-11-10 11:53:47,6,评论,什么国家不重视？！你重视了吗？什么叫做的人多了就便宜了这玩意做个木胎都可能要花个1年多！现在的漆树不多了不是春秋战国了！而且每个漆匠都会生漆藓！成为一名合格的漆匠很难受的苦很多的！他喵的几个弹幕就把一个商代出现的工艺说的一分不值,0.0026
回复 @抖动的大腿肉:矛盾？并不矛盾啊？你怎么看出矛盾的？授之于鱼还是授之于渔？这个矛盾嘛？按你的逻辑漆器可以买很多房子，那些有技术的人是傻子？就像前些年的文玩市场。而且现代流水线工艺完全可以量产！就像深圳的黄冈村！一年复制的世界名画多达20万副！现在一副也就300块！呵呵！这类型的东西什么有价值？只要可以复制，量产的。价格就底！你不在这个市场，你就别上升所谓的高度去看待这东西！不但外行，还没有任何帮助！,2017-11-10 17:00:03,4,回复,回复 @抖动的大腿肉:矛盾？并不矛盾啊？你怎么看出矛盾的？授之于鱼还是授之于渔？这个矛盾嘛？按你的逻辑漆器可以买很多房子，那些有技术的人是傻子？就像前些年的文玩市场。而且现代流水线工艺完全可以量产！就像深圳的黄冈村！一年复制的世界名画多达20万副！现在一副也就30块！呵！这类型的东西什么有价值？只要可以复制，量产的。价格就底！你不在这个市场，你就别上升所谓的高度去看待这东西！不但外行，还没有任何帮助！,0.0016
回复 @抖动的大腿肉:别强行一件漆器三套房子了！谁不知道这东西多少钱。看看市场就知道这东西没什么价值了！,2017-11-10 13:13:32,4,回复,回复 @抖动的大腿肉:别强行一件漆器三套房子了！谁不知道这东西多少钱。看市场就知道这东西没什么价值了！,0.002
回复 @热心市民柯先生:那就希望您以后能让漆器量产了把那名声从日本人手里多过来了,2017-11-10 17:28:37,6,回复,回复 @热心市民柯先生:那就希望您以后能让漆器量产了把那名声从日本人手里多过来了,0.9999
自己的东西永远自己不保护让别人发扬光大，到底是什么让我们这么大方的？？？上层不提倡，下层怎么办？而且社会的风气就要毁灭祖先留下的一切，然后再在亲手毁灭的文化遗产废墟上大家虚情假意的说可惜可惜。,2017-11-10 11:30:13,5,评论,自己的东西永远自己不保护让别人发扬光大，到底是什么让我们这么大方的？上层不提倡，下层怎么办？而且社会的风气就要毁灭祖先留下的一切，然后再在亲手毁灭的文化遗产废墟上大家虚情假意的说可惜。,0.9999
