评论内容,评论时间,评论人等级,评论类型,评论内容-新,情感分值
关注了这个up知道了我们中国人很多传统的手艺，真是长见识了,2017-11-02 21:31:24,5,评论,关注了这个up知道了我们中国人很多传统的手艺，真是长见识了,0.9999
当了这个UP主认识了你们这些可爱的粉丝，我也是长见识了,2017-11-02 21:49:34,6,回复,当了这个UP主认识了你们这些可爱的粉丝，我也是长见识了,0.0014
回复 @匠仓TV :噫 会撩粉丝的up  关注了关注了,2017-11-02 22:25:16,6,回复,回复 @匠仓TV :噫 会撩粉丝的up 关注了,0.9316
真的真的突然眼眶就湿了,2018-11-03 23:43:04,5,回复,真的突然眼眶就湿了,0.0636
好...还能说什么...失望？失落？还是心凉？,2017-11-02 21:29:26,6,评论,好.还能说什么.失望？失落？还是心凉？,0.9995
不用这样。。。想想蹴鞠是咱们先搞的。。。男足不也。。。保持耐心，信心，祝福，一起加油！,2017-11-02 21:33:42,6,回复,不用这样。想蹴鞠是咱们先搞的。男足不也。保持耐心，信心，祝福，一起加油！,0.9997
回复 @匠仓TV:qwq好,2017-11-02 21:38:58,6,回复,回复 @匠仓TV:qwq好,0.9755
我？？？读着秒抢沙发，每次点进来发现地板都没了？？？,2017-11-02 21:28:42,6,评论,我？读着秒抢沙发，每次点进来发现地板都没了？,0.0033
一个毫无尊严的UP主,2017-11-02 21:28:52,6,回复,一个毫无尊严的UP主,0.0162
回复 @匠仓TV :PS:本期视频有福利~关注微信公众号 匠仓TV  微博@匠仓  ，有机会获得大漆玲珑小葫芦哦~没人来小编自己偷偷抱走了╮(￣▽￣)╭,2017-11-02 21:40:48,6,回复,回复 @匠仓TV :PS:本期视频有福利~关注微信公众号 匠仓TV 微博@匠仓 ，有机会获得大漆玲珑小葫芦哦~没人来小编自己偷抱走了╮(￣▽￣)╭,0.9986
up主的视频里的匠人好像大部分都是闽南人唉，感觉好亲切(｡･ω･｡)然而我是夹杂闽南地区里的客家人，虽然会讲闽南话,2017-11-02 21:41:18,6,回复,up主的视频里的匠人好像大部分都是闽南人唉，感觉好亲切(｡･ω･｡)然而我是夹杂闽南地区里的客家人，虽然会讲闽南话,0.0018
emmmmm，基本上的人都对生漆过敏。有些东西固然有人继承很好，但别总是说没人继承很难受……一面说着没有人继承发扬很苦恼，那你怎么自己不去做这件事？看到别人胳膊上一堆红点，半夜采漆树的采漆人很危险，冷藏猪血和漆的时候很臭，做漆器很难又很苦的时候刷句“心疼qwq”……(;¬_¬)那还真是很棒棒哦。,2017-11-03 07:51:37,6,评论,em，基本上的人都对生漆过敏。有些东西固然有人继承很好，但别总是说没人继承很难受…一面说着没有人继承发扬很苦恼，那你怎么自己不去做这件事？看到别人胳膊上一堆红点，半夜采漆树的采漆人很危险，冷藏猪血和漆的时候很臭，做漆器很难又很苦的时候刷句“心疼qwq”…(;¬_¬)那还真是很棒哦。,0.0015
反正我这种闻过几万只鸭的鸭屎的人都嫌弃猪血+漆的味道(;¬_¬)真是臭到窒息。,2017-11-03 08:01:10,6,回复,反正我这种闻过几万只鸭的鸭屎的人都嫌弃猪血+漆的味道(;¬_¬)真是臭到窒息。,0.0024
但是，真的狠惊艳。太美了。,2017-11-03 17:21:56,6,回复,但是，真的狠惊艳。太美了。,0.8863
回复 @一代赌神-李清照:精雕出细活嘛。但是确实做起来难也累。,2017-11-03 21:18:42,6,回复,回复 @一代赌神-李清照:精雕出细活嘛。但是确实做起来难也累。,0.0048
专业就是关于这方面的，最近的课程就是在做漆器，想说做漆艺的真的不容易，尤其是还会大漆过敏，得漆疮，现在手臂和脸全肿着的，又疼又麻又痒（100只蚊子在咬你还不能挠的感觉），但是漆器是真好看啊，每一个步骤又让我那么沉迷，看着器皿一点点从手中脱胎而出，用水磨的功夫一点点放出光彩，心中也很自豪，我国的传统漆艺那么美，那么好，可惜知道的人那么少，和别人说大漆，别人都不知道是什么东西。唉，要不是过敏反应太严重，以后都想没事做一点漆器。,2017-11-03 02:24:56,5,评论,专业就是关于这方面的，最近的课程就是在做漆器，想说做漆艺的真的不容易，尤其是还会大漆过敏，得漆疮，现在手臂和脸全肿着的，又疼又麻又痒（10只蚊子在咬你还不能挠的感觉），但是漆器是真好看啊，每一个步骤又让我那么沉迷，看着器皿一点从手中脱胎而出，用水磨的功夫一点放出光彩，心中也很自豪，我国的传统漆艺那么美，那么好，可惜知道的人那么少，和别人说大漆，别人都不知道是什么东西。唉，要不是过敏反应太严重，以后都想没事做一点漆器。,0.9999
没什么好说的，加油吧兄弟。,2017-11-03 07:12:44,5,回复,没什么好说的，加油吧兄弟。,0.0035
我想问一下，做漆器不能用合成染料来做吗？用合成染料来替代会过敏的大漆，不是好多了吗？,2020-04-21 16:16:28,5,回复,我想问一下，做漆器不能用合成染料来做吗？用合成染料来替代会过敏的大漆，不是好多了吗？,0.9998
回复 @在路上Tu :可以是可以，但是用大漆制作的物品上百年都不会腐坏，是可以当传家宝的，并且大漆本身是无毒的，现代的工业材料并没有办法替代大漆的特性，就像工艺品和艺术品的区别一样,2020-04-21 21:41:42,5,回复,回复 @在路上Tu :可以是可以，但是用大漆制作的物品上百年都不会腐坏，是可以当传家宝的，并且大漆本身是无毒的，现代的工业材料并没有办法替代大漆的特性，就像工艺品和艺术品的区别一样,0.0028
ummmmm做漆器什么的，大多数的人对生漆是过敏的，就算后来经常碰该过敏还是过敏，所以做的人不多，话说能不能不要啥事都怪国家？前阵子袁隆平老先生的事情明明有发表，你们自己不关注跑去看明星，过几天发现了就怪国家不关注，看见些什么非物质文化遗产，知道的人或者做的人不多，又跑来怪国家，说国家这怎么了那怎么了，你要国家咋整哦，天天啥事不干就在那告诉你，哎今天发生了什么，哎这儿有什么非物质文化遗产要人继承你快去，电视天天啥都不放就放纪录片新闻好了，可就算是这样，二十四个字还有人不记得，就算记得了也只是会背，有的事靠自觉，别啥事都说：还不是因为国家不关注不宣传。你自己不在意不做国家说再多也很没辙谢谢了有的事情是国家做的不好，但什么事都怪国家就是你有毛病了吧【无奈脸,2017-11-03 08:35:21,6,评论,um做漆器什么的，大多数的人对生漆是过敏的，就算后来经常碰该过敏还是过敏，所以做的人不多，话说能不要啥事都怪国家？前阵子袁隆平老先生的事情明有发表，你们自己不关注跑去看明星，过几天发现了就怪国家不关注，看见些什么非物质文化遗产，知道的人或者做的人不多，又跑来怪国家，说国家这怎么了那怎么了，你要国家咋整哦，天啥事不干就在那告诉你，哎今天发生了什么，哎这儿有什么非物质文化遗产要人继承你快去，电视天啥都不放就放纪录片新闻好了，可就算是这样，二十四个字还有人不记得，就算记得了也只是会背，有的事靠自觉，别啥事都说：还不是因为国家不关注不宣传。你自己不在意不做国家说再多也很没辙谢了有的事情是国家做的不好，但什么事都怪国家就是你有毛病了吧【无奈脸,0.9998
←_←然而袁老的事早了多久 那时候早就关注过了…………只不过前段时间营销号又故意拿出来编了个新闻想搞事趁热度,2017-11-03 09:23:03,6,回复,←_←然而袁老的事早了多久 那时候早就关注过了…只不过前段时间营销号又故意拿出来编了个新闻想搞事趁热度,0.0013
回复 @星辰stars:不是呀，袁老那件事是九月底的事情，然后过了几天鹿晗的事情出来了，大概再过了一个星期，一堆营销号出来了，就冒出一堆人在那儿balabalabala（ ’ - ’ * ),2017-11-03 11:07:32,6,回复,回复 @星辰stars:不是呀，袁老那件事是九月底的事情，然后过了几天鹿晗的事情出来了，大概再过了一个星期，一堆营销号出来了，就冒出一堆人在那儿bala（ ’ - ’ * ),0.0019
就像抹茶一样，是源自中国的，传到日本去了，现在又传回来了。并不是因为中国人不重视传统，是因为古代抹茶做起来太麻烦，费时费力，只能供达官显贵享用，影响农业税收，所以被朱元璋禁止了。现在科技发展了，抹茶才又重新回归。很多非遗也是这样，生产工艺繁琐，不适应现代化的生产方式，价格也不是平常人能接受的，以前大家连饭都吃不饱，更何况这种费时费力偏物质享受的东西呢？不是因为**消亡，而是因为不能适应工业化批量的生产方式才会逐渐消亡的。现在物质条件好了，大家才能在b站上说这说那的，才有条件欣赏这些艺术不是吗？,2017-11-12 00:31:52,3,评论,就像抹茶一样，是源自中国的，传到日本去了，现在又传回来了。并不是因为中国人不重视传统，是因为古代抹茶做起来太麻烦，费时费力，只能供达官显贵享用，影响农业税收，所以被朱元璋禁止了。现在科技发展了，抹茶才又重新回归。很多非遗也是这样，生产工艺繁琐，不适应现代化的生产方式，价格也不是平常人能接受的，以前大家连饭都吃不饱，更何况这种费时费力偏物质享受的东西呢？不是因为*消亡，而是因为不能适应工业化批量的生产方式才会逐渐消亡的。现在物质条件好了，大家才能在b站上说这说那的，才有条件欣赏这些艺术不是吗？,0.003
感觉抹茶和中国古代的点茶，分茶还是有区别的，中国好像不会把茶叶磨那么细，而且讲究茶汤的颜色，和茶叶的品类。,2020-07-02 11:52:00,5,回复,感觉抹茶和中国古代的点茶，分茶还是有区别的，中国好像不会把茶叶磨那么细，而且讲究茶汤的颜色，和茶叶的品类。,0.9999
中国的在北宋是最盛，叫点茶，做好了是雪白色还可以在上面写字画画，特别好看，，，我学过[微笑][微笑],2020-10-02 15:26:06,4,回复,中国的在北宋是最盛，叫点茶，做好了是雪白色还可以在上面写字画，特别好看，我学过,0.9998
回复 @一颗水龙果 :哇塞，好浪漫呀,2021-01-25 00:13:45,5,回复,回复 @一颗水龙果 :哇塞，好浪漫呀,0.0035
japan啥意思跟我们有啥关系？上下五千年的历史需要欧美国家去定义？？欧美觉得是日本的就是日本的了？文化自信呢？我们可是四大文明古国来着！而且是传承保护最完好的，说实话欧美一些国家的历史还没中国历史的零头多,2017-11-10 09:43:58,6,评论,japan啥意思跟我们有啥关系？上下五千年的历史需要欧美国家去定义？欧美觉得是日本的就是日本的了？文化自信呢？我们可是四大文明古国来着！而且是传承保护最完好的，说实话欧美一些国家的历史还没中国历史的零头多,0.0016
我们中国在这个世界的棋盘上下了几千年了。其中对手换了几个，然而我们可是都没下场那。,2017-11-10 12:58:33,6,回复,我们中国在这个世界的棋盘上下了几千年了。其中对手换了几个，然而我们可是都没下场那。,0.9999
被世界称为Japan，世界是谁？欧美国家算什么？他们说是日本就是日本了？我们说是中国的就是中国的，它本来也就是中国的,2019-10-25 12:07:39,5,回复,被世界称为Japan，世界是谁？欧美国家算什么？他们说是日本就是日本了？我们说是中国的就是中国的，它本来也就是中国的,0.9999
回复 @蕾姆亲亲拉姆 :给你加个狗头[doge][doge],2020-02-18 14:48:19,5,回复,回复 @蕾姆亲拉姆 :给你加个狗头,0.0025
我还不会写字的时候就知道漆器起源中国而且只有贵族用得起，真照标题说的被世界命名为日本工艺，那肯定是传承与宣传力度不足，才让“世界”如此无知。自然不赞同漆器被认为是日本创造，但同样反感见到被日本传承与发扬的工艺或文化就跳脚的行为。最简单的，漆器起源中国但可以说日本漆器与中国漆器技与魂完全相同吗；和服起源吴服，但和服与吴服一样吗；尺八源自中国，但日本音乐家的尺八因中国而吹奏的吗。根源不能否认，可凭根源概括否定流传否定结果太过自大。文化是世界的工艺是世界的，起源决定不了什么，传承才是根本，只有起源没有传承不算工艺。我从来不会因为“尺八明明是中国乐器将它发扬光大的却是日本”一类觉得惆怅或者不甘，有传承者我便高兴，传承者是中国人还是日本人我都不在乎。工艺没有那么单纯，非要用国界定义不过是虚荣不过是狭隘。在起源地传承也好在起源地失传也好，原由众多，然而归根结底不过是其在起源地是否被需要而已。某个时代将它抛弃了，也可能某个时代又将它捡起，要是捡不起来了的同时发现还有一直没抛弃它的人，不应该感到高兴吗，为什么首先就要揪着国界不放呢。与其跳脚与其伤春悲秋，不如踏踏实实选一种学习。即将失传又无人传承的工艺，比被他国传承的工艺，更多得多啊。本国人无人眷顾他国也未得传承的那些，才是真正该为之悲伤的。,2017-11-03 21:25:46,6,评论,我还不会写字的时候就知道漆器起源中国而且只有贵族用得起，真照标题说的被世界命名为日本工艺，那肯定是传承与宣传力度不足，才让“世界”如此无知。自然不赞同漆器被认为是日本创造，但同样反感见到被日本传承与发扬的工艺或文化就跳脚的行为。最简单的，漆器起源中国但可以说日本漆器与中国漆器技与魂完全相同吗；和服起源吴服，但和服与吴服一样吗；尺八源自中国，但日本音乐家的尺八因中国而吹奏的吗。根源不能否认，可凭根源概括否定流传否定结果太过自大。文化是世界的工艺是世界的，起源决定不了什么，传承才是根本，只有起源没有传承不算工艺。我从来不会因为“尺八明是中国乐器将它发扬光大的却是日本”一类觉得惆怅或者不甘，有传承者我便高兴，传承者是中国人还是日本人我都不在乎。工艺没有那么单纯，非要用国界定义不过是虚荣不过是狭隘。在起源地传承也好在起源地失传也好，原由众多，然而归根结底不过是其在起源地是否被需要而已。某个时代将它抛弃了，也可能某个时代又将它捡起，要是捡不起来了的同时发现还有一直没抛弃它的人，不应该感到高兴吗，为什么首先就要揪着国界不放呢。与其跳脚与其伤春悲秋，不如踏实选一种学习。即将失传又无人传承的工艺，比被他国传承的工艺，更多得多啊。本国人无人眷顾他国也未得传承的那些，才是真正该为之悲伤的。,0.9999
那是，，，英国佬如果这样念念不忘，那看见乒乓球还不要哭死╮(￣▽￣)╭,2017-11-20 07:34:57,6,回复,那是，英国佬如果这样念不忘，那看见乒乓球还不要哭死╮(￣▽￣)╭,0.9998
之所以觉得可惜 是因为他是我们璀璨文化里的一部分 一个不可或缺的部分 代表了我们曾经的繁荣 就算现在不需要了 那也是祖先们智慧的结晶 调漆选料都是他们一次一次试出来的 被人学去了就归到他们身上 后辈们有啥资格说不在意 艺术无国界？？？正如你所说 这门手艺能走多远全靠传承与宣传力度 因为当初创造的那位人 放心的把手艺交给了后辈 如今他国学去了就要归到他们 你觉得人家会开心？？？ 你没资格 他们更没资格 这要靠我们国家去争取  难道我们有一天在油画的水平上登峰造极 就能把油画用china命名？？？,2018-09-23 15:15:47,4,回复,之所以觉得可惜 是因为他是我们璀璨文化里的一部分 一个不可或缺的部分 代表了我们曾经的繁荣 就算现在不需要了 那也是祖先们智慧的结晶 调漆选料都是他们一次试出来的 被人学去了就归到他们身上 后辈们有啥资格说不在意 艺术无国界？正如你所说 这门手艺能走多远全靠传承与宣传力度 因为当初创造的那位人 放心的把手艺交给了后辈 如今他国学去了就要归到他们 你觉得人家会开心？ 你没资格 他们更没资格 这要靠我们国家去争取 难道我们有一天在油画的水平上登峰造极 就能把油画用china命名？,0.9999
回复 @第八个受害者 :问题在于乒乓球是实力差距，中国的很多东西失传都是不重视，不珍惜。到失去了或着被别的国家传承了的时候才后悔,2019-12-10 12:50:28,6,回复,回复 @第八个受害者 :问题在于乒乓球是实力差距，中国的很多东西失传都是不重视，不珍惜。到失去了或着被别的国家传承了的时候才后悔,0.0014
看了评论区你们就会知道，最让人心痛的不是文化的流逝，不是技艺的失传，而是我们称之为同胞的国人，凡见到此类报道，首先想到的不是如何去传承发扬，而且先批评指责，不去认识，不去欣赏，把所有古老的技艺都当做糟粕，连去看一眼的兴趣都没有，等到别的国家提起了，又跑过来夸这技术多么的好，顺便指责国人不重视，没人传承，丢人现眼。漆雕是，昆曲是，针灸是，各种节庆也是，但凡挂个国字，在某类人眼中就是差的代表，不求你们去了解发扬，至少看到宣传自己国家的东西的视频时，别光顾着骂人，说个好字不行嘛？自己老祖宗传下的东西，就这么让你们觉得丢人？,2017-11-11 03:33:40,5,评论,看了评论区你们就会知道，最让人心痛的不是文化的流逝，不是技艺的失传，而是我们称之为同胞的国人，凡见到此类报道，首先想到的不是如何去传承发扬，而且先批评指责，不去认识，不去欣赏，把所有古老的技艺都当做糟粕，连去看一眼的兴趣都没有，等到别的国家提起了，又跑过来夸这技术多么的好，顺便指责国人不重视，没人传承，丢人现眼。漆雕是，昆曲是，针灸是，各种节庆也是，但凡挂个国字，在某类人眼中就是差的代表，不求你们去了解发扬，至少看到宣传自己国家的东西的视频时，别光顾着骂人，说个好字不行嘛？自己老祖宗传下的东西，就这么让你们觉得丢人？,0.002
说得好 视频的弹幕也糟心啊 第一时间是撕逼视频标题的时候有没有七千年,2017-11-11 10:05:15,6,回复,说得好 视频的弹幕也糟心啊 第一时间是撕逼视频标题的时候有没有七千年,0.9998
没毛病就是这样，去保护传承和心痛的是一类人，去嘲讽马后炮跪舔的是一类人，第二类人真是当**还要立牌坊，恶心的想吐,2017-11-12 00:23:21,5,回复,没毛病就是这样，去保护传承和心痛的是一类人，去嘲讽马后炮跪舔的是一类人，第二类人真是当*还要立牌坊，恶心的想吐,0.0017
说得好，在指责的时候估计把他自己也是个中国人也忘了,2020-01-10 19:22:58,5,回复,说得好，在指责的时候估计把他自己也是个中国人也忘了,0.0019
这个标题还真是。。。。(~_~;)上次学校讲座正好有讲。其实完全不是被抢什么的。。就跟中国被命名为china陶瓷一样。漆器是当时日本最热销的工艺品。而当时中国的漆器虽然也有出口。但风头远不及陶瓷。所以不是漆器被命名为japan。而是日本被命名为漆器。。而且事实是漆器工艺在中国断层巨大。很多都是建国后重新从日本韩国越南学回来的。没错原本是我们自己的东西。但自己弄丢了。就要认。邻国有的备份也是一件好事啊。弄得那么对立干啥。。现在是人家领先了。那就跟人家学习嘛。这种浮躁好胜也是自信不足没有底气的表现吧。。然后不仅漆器。传统工艺要复兴靠的不是鼓励大家去学。是要鼓励大家去买吖。。工匠也要吃饭要养家也想双十一剁个手。结婚也要买房父母也会生病。结果赚的钱还不够买材料工具怎么可能坚持下去呢。。,2018-11-05 12:23:09,6,评论,这个标题还真是。(~_~;)上次学校讲座正好有讲。其实完全不是被抢什么的。就跟中国被命名为china陶瓷一样。漆器是当时日本最热销的工艺品。而当时中国的漆器虽然也有出口。但风头远不及陶瓷。所以不是漆器被命名为japan。而是日本被命名为漆器。而且事实是漆器工艺在中国断层巨大。很多都是建国后重新从日本韩国越南学回来的。没错原本是我们自己的东西。但自己弄丢了。就要认。邻国有的备份也是一件好事啊。弄得那么对立干啥。现在是人家领先了。那就跟人家学习嘛。这种浮躁好胜也是自信不足没有底气的表现吧。然后不仅漆器。传统工艺要复兴靠的不是鼓励大家去学。是要鼓励大家去买吖。工匠也要吃饭要养家也想双十一剁个手。结婚也要买房父母也会生病。结果赚的钱还不够买材料工具怎么可能坚持下去呢。,0.0019
是呀，但说这是日本的，就是错误的。,2019-11-02 17:44:11,4,回复,是呀，但说这是日本的，就是错误的。,0.9978
……不是，有些漆器制作工艺，日本都没有的，去学什么昂，中国就算一匹瘦骆驼，那也有制漆的大家昂,2021-08-07 03:22:39,6,回复,…不是，有些漆器制作工艺，日本都没有的，去学什么昂，中国就算一匹瘦骆驼，那也有制漆的大家昂,0.0015
中国漆器水平高于日本，并没有断掉,2021-08-21 19:03:21,5,回复,中国漆器水平高于日本，并没有断掉,0.423
漆器叫Japan只不过是单纯历史上欧亚贸易的货源地问题。不是中国技术不好也不是日本的精良，更加没有什么在哪辉煌这种狗屁一样的事情。单纯仅仅只是欧洲人买漆器的货源地是日本，就这么简单。跟中国的荷兰豆荷兰的中国豆一个意思，货源地问题。难道因为名字就叫荷兰豆就是荷兰诞生的?在荷兰叫中国豆就是中国的骄傲?mdzz吧很多疾病命名也只是用地名或者人名。用地名难道疾病就是那里诞生或者最多?用人名难道就是他第一个发现或者他发现的最多?都不见得，也许只是恰好起了这么个名然后传开了就像我们都知道小明一样难道小明他爸就要在这瞎逼逼自己不出名?mdzz[芮小凸小凹_无聊],2017-11-06 12:55:52,6,评论,漆器叫Japan只不过是单纯历史上欧亚贸易的货源地问题。不是中国技术不好也不是日本的精良，更加没有什么在哪辉煌这种狗屁一样的事情。单纯仅只是欧洲人买漆器的货源地是日本，就这么简单。跟中国的荷兰豆荷兰的中国豆一个意思，货源地问题。难道因为名字就叫荷兰豆就是荷兰诞生的,0.9999
不愧5级大佬，现在低龄化严重啊,2017-11-10 08:58:51,5,回复,不愧5级大佬，现在低龄化严重啊,0.8841
比如阿拉伯数字不是阿拉伯人发明的，而是印度发明的,2019-10-12 21:35:44,5,回复,比如阿拉伯数字不是阿拉伯人发明的，而是印度发明的,0.3403
回复 @殿春簃 :对……刚想发个评论……,2019-10-16 12:24:42,6,回复,回复 @殿春簃 :对…刚想发个评论…,0.0015
