内容,时间
北京环球影城还是挺好玩的，每一个项目都非常享受，但好像没迪士尼给人那么想二刷的感觉，可能是所有项目都是观看性质，体验过再做一次就没感觉了，而迪士尼体感类项目比较多。所有的排队路线很绕，难道是怕有蛇嘛。我刷完了所有项目，按照官方APP上排队时间走的路线，效率挺高。哈利波特园区从早上到晚上都是人，三把扫帚餐厅要排一个半小时。关于二次消费，我感觉全园理性的消费就黄油啤酒和冰淇淋雪糕值得买，一共90元；看到小孩子人手一根魔杖，想玩那个可以问别人借下，因为不是经常来环球影城买它出园就没用了，不太值得，其它的周边我都看过了，没有什么特别吸引人的地方，都不是太值得买，家里基本上都有的，除非情侣一起来或者有小孩子。关于餐厅，人均消费100，在游乐园算低了，而且我是点的牛排，在落霞餐厅。北京环球的代入感不如迪士尼强，我问这个项目大概排多久，员工说您扫下健康宝；在哈利波特商店，想试戴分院帽，商店员工说上午试戴的人太多了，可能没电了，魔法世界怎么会需要电呢就感觉很出戏。环球影城的装修和设计感觉没有迪士尼给人一种高档的感觉，环球有一种土的感觉。花车巡游比迪士尼长太多了，环球是17分钟，迪士尼是2分半，长度长很棒，但环球的花车巡游真的很土，很俗气，相比较于迪士尼而言的。总得来说，环球影城很值得去，第一次感觉非常不错。,2021-10-07 发布点评
北京环球度假区包含七大主题景区、37处骑乘娱乐设施及地标景点、24场娱乐演出、80家餐饮及30家零售门店，计划建设包含中国元素的主题公园，引入中国文化和孙悟空等，三期计划建设水上乐园。,2021-11-06 发布点评
周一日的，那天有风，景区里人不多。平均每个项目排队不到20分钟。运动类F3体感项目都挺好玩，还不受天气影响是室内的。基本上11点到的玩到下班玩了绝大多数，每个主题也有相通之处不用都玩，侏罗纪，哈利波特，变形记刚体感类F3好玩，其他的表演类好，哈利波特的那个表演一定不要去看，费时间还超级无聊。,2021-11-30 发布点评
人多到不行，热门项目排队一个半小时起。估计大家都以为进京受限人会少点，结果是人山人海。感觉最不值得的是鹰马飞行，排队两小时体验半分钟。哈利波特禁忌之旅排队时间180分钟。简直可怕。这还是相对淡季的冬天，这要是到了暑假还得了。一天下来腿肚子转筋。要想玩的轻松点还是工作日来吧。吃饭的地方很多，价格贵，但是景区不都这样嘛。至于很多人吐槽的迷宫式排队，我看是因为人太多了，不这样排队，那么多人怎么能按顺序守秩序的排队两小时呢。,2021-11-21 发布点评
🌍环球影城真的好看又好拍&#x20;找了一个旅拍&#x20;性价比超高。霍格沃茨魔法世界真的爱了&#x20;哈迷们一定要去！建议一定要穿一双好走路的鞋这点太重要了！！！我就是因为鞋没带好差点儿腿就没了😭&#x0A;其实不需要太早去，10:30到大球那里拍照，然后进园区直奔哈利波特的三把扫帚餐厅吃饭就不需要排队，黄油啤酒也可以在这里喝到，酒足饭饱之后再去刷禁忌之旅，绝对值得2刷的项目。然后我们接下来就是拍照了。拍完去了小黄人和变形金刚，变形金刚的过山车三刷真的绝好玩。其他时间去看了看别的园区,2021-11-12 发布点评
还没进门就体会到设计者的爱心啦！把车停在小黄人区，不会记错哟！除了有趣的游玩项目，细心的我还看到了新款的真车和老款的咪表，仿佛在加州！我们通利佛尼亚州的天儿也蓝天白云太好看了！买到了喜欢的小恐龙：Blue，还蹲到了“恐龙饲养员”小哥哥🧍‍♂️一个小Tip：刚入园的时间段很多人去排大项目，熊猫大侠之旅没啥人，包场玩儿爽。。。,2021-09-09 发布点评
北京环球度假区（Universal&#x20;Beijing&#x20;Resort），位于北京市通州区，毗邻东六环和京哈高速公路，是亚洲的第三座，全球的第五座环球影城主题乐园。,2021-11-04 发布点评
环球影城介绍就不赘述了，大家网上都可以收到，直接进入正题。&#x0A;提前准备，下载环球影城APP或者环球影城微信小程序，个人认为小程序比APP好用，因为小程序好多选项APP没有。在小程序预约入园时间。注册完之后，上传入园人员的人脸信息。不录入人脸进门要查身份证，录入人脸之后入园刷脸即可，之后园区很多地方都可以刷脸。APP可以查地图、每个项目排队时间、演出时间等信息。&#x0A;建议多带几瓶矿泉水，一方面虽然园区有直饮水，但是好多人直接把嘴放在出水贴着喝水，很不卫生。另一方面玩一天真的会很渴总想水。当然也可以买水，但是很贵。可以自己带小吃，安检不查。&#x0A;内侧试运行阶段，热门项目排队1个小时，其他项目10到20分钟不等，估计等正式开园热门项目要2小时起步。可以购买环球优速通，价格400-500元，减少排队时间。&#x0A;早上出发开车一小时到达，9点准时入园，没有排队，据说如果正式开园应该起码需要7点到，才能保证早些入园，早些入园就可以争取多玩的时间。&#x0A;到了环球影城会先看到这种类似ETC的入口，会有工作人员问你需要去100停车还是150停车，150会离安检口稍微近些，都不限时，给工作人员交完停车费，车需要再往前开打开1、200米到停车楼里停车。&#x0A;停好车后跟着指示牌进入景区，穿过环球大道（可以购物、吃饭，比景区营业时间长，不需要门票）-到达环球影城酒店--穿过酒店进入景区&#x0A;提前攻略了一下，环球影城分七个园区，分别是好莱坞、小黄人、哈利波特、侏罗纪、变形金刚、功夫熊猫、水世界。&#x0A;必玩项目&#x0A;哈利波特区域&#x20;&#x20;&#x20;&#x20;&#x20;&#x20;哈利波特与禁忌之旅、鹰马飞车&#x0A;侏罗纪区域&#x20;&#x20;&#x20;&#x20;&#x20;&#x20;&#x20;&#x20;飞跃侏罗纪、侏罗纪世界大冒险&#x0A;变形金刚区域&#x20;&#x20;&#x20;&#x20;&#x20;&#x20;霸天虎过山车、变形金刚火种源争夺战&#x0A;功夫熊猫区域&#x20;&#x20;&#x20;&#x20;&#x20;&#x20;神龙大侠之旅&#x0A;小黄人&#x20;&#x20;&#x20;&#x20;&#x20;&#x20;&#x20;&#x20;&#x20;&#x20;&#x20;&#x20;神偷奶爸小黄人闹翻天&#x0A;必看演出&#x0A;未来水世界&#x20;&#x20;&#x20;&#x20;&#x20;&#x20;&#x20;&#x20;表演&#x0A;好莱坞&#x20;&#x20;&#x20;&#x20;&#x20;&#x20;&#x20;&#x20;&#x20;&#x20;&#x20;&#x20;不可驯服（表演）&#x0A;花车大巡游&#x0A;城堡灯光秀&#x0A;&#x0A;上述项目除了飞跃侏罗纪内测阶段没有开发、霸天虎实在不敢玩，其他的全都刷到了，还玩了各个园区的其他项目。一天节奏很紧凑、但不累。而且还特别幸运，好多项目时时间点刚好赶上，最后全天项目加表演大概共刷15项，超棒。,2021-09-06 发布点评
去过美国奥兰多、洛杉矶和新加坡的环球影城，现在北京家门口就有了。9月2日环球影城试运营的第二天，和朋友们来这里先玩为快。有几点有用的经验跟想来这里游玩的朋友们分享。1、停车费可以在环球影城小程序上预付，¥95比现场付便宜一点点，但是可以直接识别，无需停留即可进入停车场。¥150&#x20;VIP停车意义不大，没近便多少。2、如果订票的时候可以买优速通，一定要买，可以大大减少排队的时间，多玩些项目。3、比较惊险刺激的玩乐项目有霸天虎过山车、哈利·波特与禁忌之旅、飞越侏罗纪等，这些项目排队的时间较长，可以在乐园大屏幕及游乐项目入口处，看到等候的时长。我们在试运营期间玩时，上午越早排队的人越多，下午这些项目基本就没什么人排队了。4、北京环球度假区App有一些有用的资讯和地图，建议下载使用。5、园区里的落霞餐厅档次高，环境和菜品都很好。冰镇可乐可以无限量续杯。6、家里如有小孩儿，小黄人爆米花玩具车是个很不错的纪念品，焦糖爆米花也挺好吃。7、霸天虎过山车排队前须寄存，不让带任何东西进入，入口处有金属探测器，手机是带不进去的，帽子墨镜也不让带。8、哈利·波特板块的小村庄很有意思，里面卖的¥50一杯的黄油啤酒，其实是饮料，两个买了人都评价太甜、类似奶盖茶，就省省银子，不用排队买了。9、有人中途出大门，去环球影城标志的大圆球处拍照，再返回乐园就不让进了，所以出来前要问清楚。10、城市大道也值得一逛，特别是餐饮。巧克力餐厅是一家美国奥兰多的餐厅，在亚洲区只有这一家店。它的巧克力慕斯蛋糕挺好吃，就是太甜了，超出了中国人对甜度的承受能力。,2021-09-03 发布点评
9月1号，我和爱人到北京环球度假区景区进行了参观游览。说真的，在影城第一天试营业就能亲临其境，非常荣幸。&#x0A;&#x0A;一天下来，在园区花费的大概费用是：门票免费，优享停车费150元，在景区里吃了两份快餐，买了几瓶水，外加给小外孙买了三件小黄人纪念品，总共花了1000多块钱。&#x0A;&#x0A;虽是试运行第一天，景区里游客还是挺多的，多个项目都要短暂排队。不过，景区管理挺规范，可参与的项目我们大都体验了。&#x0A;&#x0A;对比2012年去过的好莱坞环球影城，个人感觉在项目安排上有些差异，服务上，北京环球影城更中国化。总体还是挺不错的。,2021-09-03 发布点评
8月26号去的，内测票，早晨8点就到了，停车在三楼收费100元一天，2楼150离安检口最近，里面玩的项目很多，由于不知道票价，不知道性价比如何，但是里面的项目绝对是全新的感受，非常棒。里面吃的东西还可以。正常的景区价格，矿泉水10元一瓶，但是景区里有免费的直饮水，我拍了熊猫馆里面餐厅的价格表。大家可以参考。我们点了一份鸡腿饭，里面有两个烤鸡腿，还有一点青菜，米饭，半个酸柠檬，味道还不错！大家觉得贵，可以自带食物进园区，没人管，带孩子的朋友，里面也有租车的，一个坐的小推车一天100元，两个人坐的小推车一天150，大家参考一下。各个主题乐园设计的非常好，但是飞跃侏罗纪这个项目排队的走廊非常非常的绕，绕到你怀疑人生，不夸张，大家进去玩，就知道了，从门口进去到游玩的项目，起码要走30分钟，这还是人不多的情况下，如果人多起码两个小时玩一个项目，太可怕了。园区里有各种表演，大家提前一定要做好功课，记一下里面演出的时间，演出很精彩，大家别错过。未来水世界的演出很棒，到晚上最后6点多，还有一个花车巡游，很棒，大家玩完项目以后不要着急走，看完花车巡游再走！走的时候别忘了，去游客服务中心领取一个免费的纪念章！,2021-08-31 发布点评
8月份内测去的，人没迪斯尼试运营时多，坐了五遍过山车……最好玩的应该是哈利波特的魔法世界和侏罗纪世界，还有各种表演一定不要错过。北京环球超千亿打造，中国主题乐园的王者。,2021-09-14 发布点评
怎么说呢，这次体验是非常棒的，确实很好玩，而且和自己非常喜欢的人在一起去游乐园更有意思。&#x0A;只不过呢，当你喜欢人家，人家不喜欢你的时候，这种地方就变成了去一次难受一次的地方，因为每次去都会想起和那个人一起的样子。&#x0A;总之人生中所有的灿烂辉煌都需要用寂寞去偿还…,2021-11-22 发布点评
北京环球影城|霍格沃兹新生报到|哈利波特&#x0A;&#x0A;霍格沃兹新生报到&#x0D;&#x0A;有没有狮院的校友呀~&#x0D;&#x0A;哈哈哈哈&#x20;从小到大最爱看的就是哈利波特&#x20;每一集也没落下过👀&#x0D;&#x0A;环球影城最大的亮点就是哈利波特园区了&#x20;所有的人感觉都集中在了这里&#x0D;&#x0A;拍照有几个地方真的超级出片!&#x0D;&#x0A;图一：三把扫帚餐厅&#x20;下午2点排队不到一个小时就进去了&#x20;户外位置拍照真的是绝美&#x0D;&#x0A;图二：进去的时候正好碰到了列车长&#x20;太幸运啦~&#x0A;图三：进园区右手边就能看到&#x20;全都是拍照的小姐姐&#x20;小巷里分分钟出片!,2021-10-14 发布点评
明天环球影城就要对外营业了，写一点小TIPS：&#x0A;&#x0A;🌐1、影城内大门&#x20;&amp;&#x20;影城外大门&#x20;都有存包处🛅，影城内是箱柜存取，影城外是人工存取。&#x0A;晚上10点左右如果还没取走，工作人员会打电话来提醒，不用担心太晚了拿不到包。&#x0A;&#x0A;🌐2、下载“北京环球度假区”APP能实时查看排队情况。哈利波特区是人气也是最高的，变形金刚区不相上下，建议先去这两个地方。&#x0A;&#x0A;🌐3、“花车巡游”在5点半左右，道路会被提前清场，所以不用担心错过。&#x0A;&#x0A;🌐4、有随身物品的朋友一定要带足够装的随身包！里面很多设施（包括哈利波特小火车）以及变形金刚、侏罗纪4D冒险…内场没有放东西的地方，全都是放在脚下，没包的话拿手上很容易滑落，也不安全。&#x0A;&#x0A;🌐5、哈利波特城堡灯光秀在19:20-20:00，每场间隔20分钟左右。&#x0A;&#x0A;🌐6、和动漫角色合照128一张纸质纪念，挺贵的而且容易拍翻车！强烈建议让同行者帮着拍。&#x0A;&#x0A;🌐7、影城内存包处有借充电宝的，其余能租借的地方并不多，功夫熊猫里的餐馆也有一处，带好充电宝！&#x0A;&#x0A;🌐9:侏罗纪的4D项目不如变形金刚的，时间来不及的话优先选后者（火种源争夺战）。&#x0A;&#x0A;‼️绝对不能错过的项目：‼️&#x0A;&#x0A;🌀1、哈利波特区内是对角巷，不用等雪天，因为自带雪落屋檐效果，是整个环球影城人气最高的地方之一。&#x0A;&#x0A;（1）商店里买的魔杖🪄可以操控很多橱窗里的灯，对角巷里到处都是穿着袍子挥舞魔杖的人，代入感十足！&#x0A;&#x0A;（2）里面服装卖的很贵，单袍子800+，魔杖348还是可以买的，因为不确定外面买的能不能操控这里灯光😂，服装建议大家先在网上买好，反正穿进去都一样有代入🧙‍♀️（里面有点小贵）&#x0A;&#x0A;（3）黄油啤酒50一杯，不太好喝，但是个不错的拍照道具😜&#x0A;&#x0A;🌀2、变形金刚区。&#x0A;&#x0A;（1）与变形金刚合照是绝对不可以错过的！他会和每个上台的玩家聊天，特别搞笑，我前面一单独的小姐姐上去了，变形金刚用机械又有男人味的语气问：“你的男朋友呢，怎么没人给你拍照。”，哈哈哈哈哈哈哈！&#x0A;&#x0A;（2）霸天虎过山车🎢是我亲眼见过最恐怖的过山车之一，全程不减速，五个360度大圆圈⭕️，全程大约30多秒，来环球影城如果不坐一次会抱憾！&#x0A;&#x0A;（3）有一个1:1的变形金刚在4D项目门口。绝对满足影迷❤️‍🔥&#x0A;&#x0A;（4）变形金刚的4D项目“火种源争夺战”超级棒，不恐怖也没强烈失重感，但不影响代入感而且刺激，适合胆小的。,2021-09-19 发布点评
万众期待的北京环球影城、终于要在9月20日正式开业啦！试营业期间去感受了下～实在是太好玩啦！&#x0A;一天时间优速通刷了所有大项目～虽然时间有些紧张，但收获满满快乐哈哈，如果预算充足要住一晚啊，两天时间妥妥的！哈利波特区晚上更有feel，YYDS！还想再去！最棒主题乐园没错啦～,2021-09-08 发布点评
别在节假日去！请一天假去，基本等于买了快速票，所有大项目可以在一天内玩完。别在园区买吃的！贵，难吃，还要排队，自己带点吃的，凑合一下。,2021-11-21 发布点评
环球影城真的太好玩了，可能是我本人比较喜欢看电影吧，个人认为北京环球影城比大阪环球影城要好玩，主要是面积大，而且项目也比较新颖，最好玩的是哈利波特，而且餐厅的饭也非常好吃啊！,2021-11-11 发布点评
度假区规模很大，可以提前一天入住酒店，转天可以提前一小时入院游玩，各种游乐设施很好玩，值得去看看，花车巡游很好看，非常适合情侣出游。,2021-11-17 发布点评
现在刚开放时的喧嚣已经慢慢过去了，园区渐渐进入了正常运营，只是疫情随时在波动，有点影响我们的安排，希望下次安排没这么费劲。,2021-11-17 发布点评
去了内测，可惜只开放了景观大道，里面的游艺项目不让进，去购物了下，虽然纪念品看似简单，但是真的处处有惊喜，这个要自己研究，顺便推荐下，那个猫头鹰玩偶真棒，值得拥有,2021-08-28 发布点评
太好玩了！期待二刷！&#x0A;订的环球影城主题酒店🏨享提前一小时入园，进门就冲向哈利波特，赶上第一波***，然后又飞速冲向变形金刚，头排包车“霸天虎”简直不要太爽！由于没人，进行了二刷！后面就是随心所欲的逛吃玩儿了！,2021-11-28 发布点评
房间还是非常不错的，从房间里面看外景，视野很好，可以看到整个园区，花车也可以尽收眼底，感谢尽职尽责的的工作人员张丹，在这里特别表扬一下楼层经理陈环，服务很贴心，可以预知我们的需求，我妈妈特别满意。房间还特别做了圣诞装饰，氛围感十足，如果下次来的话还会选择这里入住，值得推荐,2021-11-28 发布点评
主题鲜明，各有特色，丰富的体验，值得一去。&#x0A;霸天虎过山车最火爆，哈喽波特***排队时间最长，飞跃侏罗纪感觉一般。水世界要夏天来看过来更好玩，这冷天雨衣都不用准备了，没有湿身机会了。大风天户外过山车都暂停了，要选好天气来玩。玩一天走了25000多步，堪比跑个半马,2021-11-22 发布点评
很开心的一次游玩，随着来了北京环球，我也完成了打满亚环🌎USS-USJ-UBR。&#x0A;周三去的，因为人不是很多，园区体验挺好的，项目基本三刷，虽然有一些不足和遗憾，比如全球最大园区哈利波特都没还原对角巷和精灵银行、3&#x2F;4站台；整体娱乐设施就是过山车+小火车+5D电影；期待后面更多期开放吧～&#x0A;感谢携程的出票，很方便，特别提醒：出票后使用小程序或官网预约，携带身份证即可；坐地铁入园比停车场要近。,2021-11-21 发布点评
跟朋友一起去的，约的九点入园，八点四十五就开门了，人不是很多。入园后直奔哈利，要先途径小黄人，小黄人一早还没开门。我们从哈利玩完出来才九点一刻基本没排队，以后去了侏罗纪，飞跃地平线排的人比较多将近一个小时，剩下的除了霸天虎实在是不敢玩，能玩的基本都没排队，我们走的时候是四点多很多项目都没玩完，果然是暴走了两万多步。要注意的一点是比如你没有按着地图顺序玩，可能要多有很多路。,2021-11-15 发布点评
肯定是北京市乃至全国都非常值得一去的乐园类景点，综合下来设施和表演的体验还是不错的，最值得推荐的区域依次是哈利波特、变形金刚、侏罗纪、未来水世界、小黄人、功夫熊猫。最推荐的项目是哈利波特与魔法禁忌、霸天虎过山车、火种源争夺战、飞跃侏罗纪、侏罗纪大冒险，飞跃侏罗纪可能是园内排队最长的项目，能早去就先去。园区里的几个表演也各具特色，第一次去的话应该看一下。园区周末才七点就闭园了，时间有点早；哈利波特城堡的灯光秀6分钟左右，说实话震撼程度和可观赏性不如迪士尼。乐园里吃饭大多是快餐类，功夫熊猫区域的面馆和中餐人还不算多，可以供选择。小黄人区域的爆米花厅可以买到纪念的小汽车款，但价格不低，除了单份的食物，各种周边产品很少有在100块钱以下的，再加上门票，花销着实不低。买魔杖得赶早，不然排队，要么就快闭园再去买。全园吃饭排队最长的区域就是哈利波特的三把扫帚，个人认为周末没必要。,2021-11-14 发布点评
肯定是北京市乃至全国都非常值得一去的乐园类景点，综合下来设施和表演的体验还是不错的，最值得推荐的区域依次是哈利波特、变形金刚、侏罗纪、未来水世界、小黄人、功夫熊猫。最推荐的项目是哈利波特与魔法禁忌、霸天虎过山车、火种源争夺战、飞跃侏罗纪、侏罗纪大冒险，飞跃侏罗纪可能是园内排队最长的项目，能早去就先去。园区里的几个表演也各具特色，第一次去的话应该看一下。园区周末才七点就闭园了，时间有点早；哈利波特城堡的灯光秀6分钟左右，说实话震撼程度和可观赏性不如迪士尼。乐园里吃饭大多是快餐类，功夫熊猫区域的面馆和中餐人还不算多，可以供选择。小黄人区域的爆米花厅可以买到纪念的小汽车款，但价格不低，除了单份的食物，各种周边产品很少有在100块钱以下的，再加上门票，花销着实不低。买魔杖得赶早，不然排队，要么就快闭园再去买。全园吃饭排队最长的区域就是哈利波特的三把扫帚，个人认为周末没必要。,2021-11-14 发布点评
肯定是北京市乃至全国都非常值得一去的乐园类景点，综合下来设施和表演的体验还是不错的，最值得推荐的区域依次是哈利波特、变形金刚、侏罗纪、未来水世界、小黄人、功夫熊猫。最推荐的项目是哈利波特与魔法禁忌、霸天虎过山车、火种源争夺战、飞跃侏罗纪、侏罗纪大冒险，飞跃侏罗纪可能是园内排队最长的项目，能早去就先去。园区里的几个表演也各具特色，第一次去的话应该看一下。园区周末才七点就闭园了，时间有点早；哈利波特城堡的灯光秀6分钟左右，说实话震撼程度和可观赏性不如迪士尼。乐园里吃饭大多是快餐类，功夫熊猫区域的面馆和中餐人还不算多，可以供选择。小黄人区域的爆米花厅可以买到纪念的小汽车款，但价格不低，除了单份的食物，各种周边产品很少有在100块钱以下的，再加上门票，花销着实不低。买魔杖得赶早，不然排队，要么就快闭园再去买。全园吃饭排队最长的区域就是哈利波特的三把扫帚，个人认为周末没必要。,2021-11-14 发布点评
#周六的环球攻略&#x20;没有优速通、没有vip、没有提前入园，基本刷完所有想玩的。&#x0A;[太阳]9:00开园，8点到，停车有100和200两种，200的离门进。不要犹豫，选200的，因为出园时多一步都不想走！&#x0A;[太阳]下个app看各项目排队时间，哪个少去哪个，别看网上各种顺时针逆时针的攻略。&#x0A;[烟花]飞跃侏罗纪值得二刷，全天排队没有低于40分钟的，所以我们早上入园就冲进去了，第一遍没有排队，第二遍排了30分钟。&#x0A;[烟花]侏罗纪大冒险、小黄人闹翻天、变形金刚争夺火种都是3d的，晕3d的建议慎坐，反正我老公晕的不行，基本全程闭眼[叹气]&#x0A;[烟花]一定要穿轻便的鞋子，一定要带充电宝。,2021-11-13 发布点评
整体环境很不错，蛮沉浸的。和朋友去玩的，除了霸天虎过山车，我胆子还蛮小的都做了一遍。景区管理还是要加强一点，有的节目是我们去的时候显示今天不演出，但是离开的时候路过了演出场地，却发现今天仍旧可以提供演出的😅不是什么大事，但还是心里不太舒服。,2021-11-10 发布点评
