内容,时间
哈迷必去&#x20;优速通必须有&#x20;完全不排队&#x20;孩子开心到爆&#x20;必玩儿***&#x20;飞越侏罗纪&#x20;霸天虎过山车&#x20;奥利凡德魔杖店那个不推荐&#x20;排了半天&#x20;就选一个人聊聊魔杖的事儿&#x20;功夫熊猫有些鸡肋&#x20;但支持咱国宝可以去转转😜,2021-10-25 发布点评
优速通真香，11月27和28两天优速通卡，人间值得，每天可以刷十几个项目，其实有优速通走的也很累，但是确实不用等待，允许的话还是买吧。,2021-12-02 发布点评
优速通真香，11月27和28两天优速通卡，人间值得，每天可以刷十几个项目，其实有优速通走的也很累，但是确实不用等待，允许的话还是买吧。,2021-12-02 发布点评
优速通真香，11月27和28两天优速通卡，人间值得，每天可以刷十几个项目，其实有优速通走的也很累，但是确实不用等待，允许的话还是买吧。,2021-12-02 发布点评
优速通真香，11月27和28两天优速通卡，人间值得，每天可以刷十几个项目，其实有优速通走的也很累，但是确实不用等待，允许的话还是买吧。,2021-12-02 发布点评
挺好玩的，就是容易晕，太多转圈的项目了，周末人没有很多，3D效果很好，一种身临其境的感觉，跟欢乐谷不是一个档次的，以后再也不去欢乐谷了,2021-11-22 发布点评
很好玩，真的挺好的感觉，很酷很酷的感觉，孩子很喜欢，下次还要去的，从早上出门一直玩到晚上10掉到家。未来水世界很好玩，奴布拉岛也很好玩,2021-11-06 发布点评
大北京的荣幸，除了变形金刚火种源之战和哈利波特城堡灯光秀没来得及玩上，其他想玩的都玩到了，非常好玩！特别喜欢功夫熊猫文创周边。哈利波特区域最吸引人，女孩穿着制服裙拍照非常美！,2021-10-05 发布点评
生活敷衍你，是从你敷衍你自己开始的。&#x0A;&#x0A;你不辜负生活，生活才不会辜负你。&#x20;&#x0A;&#x0A;一日三餐，人间烟火里吃出品质和健康，周末愉快！,2021-09-12 发布点评
最开始试营业的时候去的，人还没有那么多，所以进去排队的时间非常少，差不多15-20分钟就解决战斗了。最喜欢的是霸天虎过山车和哈利珀特大冒险，新颖，刺激。,2021-10-25 发布点评
感谢小仙女的内测邀约🥳🥳🥳去的比较晚了，体验感觉不错，很舒适，期待正式开园😍😍😍,2021-08-23 发布点评
大雪中体验了环球影城，人不多、排短队，简单的快乐。,2021-11-10 发布点评
去过了大阪的环球影城，一直非常期盼北京的环球影城。好不容易盼到开幕，第一时间跑去北京感受一下。总体来说还是不错的，只是这次是带父母去感受一下，下次肯定还会去，再疯狂刷项目,2021-09-26 发布点评
9月6日内测去的，除了东西贵点还是很好玩滴，强力推荐哈利波特跟侏罗纪！,2021-09-14 发布点评
平时去，人不是很多，排队最长35分钟。但是希望人不多时，可以安排比较短的路线到达游戏开始地点，没有人还要各种绕路，实在太麻烦了,2021-11-15 发布点评
大大提升了游玩体验，一天内完成了景区所有游玩项目，大项目也没有排队，节省了许多体力，价格也还可以接受，美中不足是票比较难抢。,2021-11-09 发布点评
门票价和想象中的期待值不太一样。因为门票高，期待也高。黄牛问题管理不到位，导致后来的顾客买不到优速通，排队时真的有人经过时小声暗示有优速通出售。,2021-10-03 发布点评
用了优速通，一天刷完了所有的项目，太开心啦！,2021-09-27 发布点评
挺好玩的，就是携程不太地道，优速通买几个就得一起退，不能单退一个，问环球客服人家说可以单退，携程死活不给退，要退得一起退。,2021-11-10 发布点评
出地铁口就是环球大道入口，交通便利，景区餐饮种类齐全、价格可以接受，提前两个月抢到的优速通，大大提升了每个项目的游玩体验。,2021-11-09 发布点评
没抢到优速通，就买两天门票玩，第一天来很幸运，没什么人玩任何项目都不需排队，想刷几遍刷几遍，刷到腻为止，第二天人就多了些，3点后大家都玩累了，这时想刷几次刷几次。,2021-10-01 发布点评
没抢到优速通，就买两天门票玩，第一天来很幸运，没什么人玩任何项目都不需排队，想刷几遍刷几遍，刷到腻为止，第二天人就多了些，3点后大家都玩累了，这时想刷几次刷几次。,2021-10-01 发布点评
环球是要比迪士尼更适合成年人的，变形金刚，哈利波特必打卡，哈哈,2021-09-08 发布点评
北京环球影城，值得一玩，目前淡季，票价能接受。开车自驾或坐地铁，都方便的。推荐！,2021-11-28 发布点评
去北京环球度假区乘地铁最便利，吃喝玩乐均有，餐饮种类很多。景观大道营业时间7:00-22:00，早点儿入园，安检也需要一些时间。园区内有很多游玩项目，可适合各类大、小朋友，最好提前做攻略，合理安排游玩时间。非常感谢携程给予老客户的赠票！,2021-11-25 发布点评
非常值得。办理入住的时候被通知升级了房型，太开心。&#x0A;1.&#x20;早入园一小时，可以迅速刷完三个主要项目，就是走着累点儿，大冬天竟然走了一身汗。&#x0A;2.&#x20;提前入园最好是可选服务，不要捆绑搭售。这样可以住两晚，要不晚上出来的时候真是累死！&#x0A;3.&#x20;要是能给房客提供法师法袍租赁服务就更好了。&#x0A;4.&#x20;强烈推荐园区里的照相服务。,2021-11-14 发布点评
选的工作日去的，人依然如预想的一样多…强烈建议下环球影城的APP，可以提示等待时间和自己的位置，这个是超级有用的。然后手机充电宝必备，所有项目全需要刷二维码，手机没电就废了。霸天虎过山车身体条件允许的情况下必刷一把，排队时间也不是很长，全天40-50分钟这样，但是需要把手机等全部寄存，所以排队时有些无聊。飞越侏罗纪是排队性价比最低的，全部项目里属它排队时间最长，但是玩一把感觉一般般。功夫熊猫那里就是个黑暗版庙会，人不多，但是真的很黑，想拍照的就算了。哈利波特城堡和过山车推荐玩一下，还不错，小黄人适合带孩子去玩，也有过山车，排队人少不刺激。,2021-10-20 发布点评
里面场景设计用心，非常注重细节。三把扫帚餐厅餐饮不错，功夫熊猫面馆味道尚可。但是缺少迪士尼小镇引进的国际型餐饮，特色美食少，许多餐厅装修不错，进去后没什么吃的，好像食堂快餐店。各种节目不错，就是时间短，内容少了一些，未来水世界演出不错！感觉园区游玩内容还需完善丰富！,2021-10-19 发布点评
#北京环球影城&#x0A;各个国家的环影都去过了，所以特别期待咱们中国的。先说一下，整体感觉就是，大气，完整，经典的主题都有了，尤其是哈利波特主题。这次我是邀请票试运营期间去的，一天一万人，全程没有看任何剧场和表演，只是玩每个主题的VR和过山车项目，排队时长30-60分钟。没有任何停歇，中途坐了半小时吃了个鸡腿，走了2万8千步。其中等朋友上个厕所的功夫，眼看着要玩的项目排队时间从30分钟变成了60分钟[吐]所以正式开园以后，每天三万人，大家自己感受吧。所以整体来说，一天想看剧场，看表演，玩项目，就算买了优速通，也不可能，因为太大了。&#x0A;⛰️景点玩法&#x0A;因为园区太大，所以如果第一次去，只能玩一天的，那建议开圆前一小时就去早排队入园，进去以后奔跑穿过环球大道，直奔园区！玩项目为主，别看剧场表演啥的，要不然玩不完。如果想减少排队时长，可以单独购买优速通票。&#x0A;哈利波特可以留在最后，天暗了，玩完了直接看城堡灯光秀。出园后再逛吃环球大道！营业到11点！&#x0A;🚗交通住宿&#x0A;里面有环球自己的酒店和诺金可以住，住酒店有不同福利，具体可以咨询酒店。&#x0A;🍜美食推荐&#x0A;每个主题园区里面都有美食，以汉堡薯条快餐为主，都是半成品加热。如果可以，就等关门了出来在门口环球大道上吃，吃饭购物看电影，一条龙，选择很多。&#x0A;📌贴心TIPS&#x0A;带好大容量充电宝！！！！&#x0A;环球大道离园区很远，请奔跑，不要停留，晚上出来以后再逛吃！！！！&#x0A;不要沉迷于拍照耽误时间！！！！&#x0A;别遛弯，腿倒快点！！！&#x0A;环球影城重点是体验裸眼RR项目，排队之前问清楚，别被各种演出剧场耽误了时间！！！&#x0A;哈利波特全套学院服和披风，可以提前在淘宝买，里面很贵！！！！,2021-10-11 发布点评
这是北方人民的福利，不必去上海了。比较迪士尼，环球影城更吸引年轻人来玩。一天时间刚好玩遍所有项目，各个IP距离都不远。刚开园不久感觉人还不是很多，热门项目排队在90分钟左右。目前是一期，这个价的门票还是有点贵！建议报名首旅的直通车，价格比自己买便宜些，而且往返直通大巴直接到安检口，省时省力不说还有导游姐姐的游玩攻略参考，很棒！,2021-10-07 发布点评
携程服务超级棒！预订完实时出票点赞！影城里面游玩项目很多，适合大中小朋友，推荐***，火种源，侏罗纪大冒险，黄油啤酒，小黄人冰棍，烤鸡套餐都是必选。北京环影内服务人员超级和善，服务周到。十.一出游人比较多，游客门素质很高，尊老爱幼，互相谦让。晚上到哈利波特看灯光秀人太多可以外面观看，大项目排队时间长，可以提前规划一下，利用花车迅游和哈利波特灯光秀都是错峰刷其他项目的好机会，虽然绕栅栏时间长，但是大家心态都很平和，建议如没优速通还是错峰出游好。,2021-10-02 发布点评
非常棒，进门右手边有导游图册，这个一定要带，进门先去哈区，那个是人排队越来越多的地方，带一个水杯，饮用水***随处可见，卖的水是有点贵的，不用带零食里面吃的很多而且餐食的价格也不贵，和北京市区的消费没有太大的差别，一天下来园区里面2万+的步子，平时没有锻炼的人不建议单独带孩子入园游玩,2021-10-01 发布点评
一天把所有项目全部刷完了&#x20;真的非常值得去&#x20;霸天虎早上由于下雨关闭了&#x20;中午雨停了立马排队了&#x20;也太刺激了&#x20;哈利波特竞技之旅5d融入感也太强了吧&#x20;变形金刚火种源也很好玩&#x20;24号一早就去了&#x20;早上下了好大的雨&#x20;不过中午就停了&#x20;一直到晚上都没有下&#x20;老天也太给力了&#x20;值得去值得去！,2021-09-28 发布点评
二刷，有优速通就舒服多了，还想再去。,2021-11-27 发布点评
大项目都玩了一遍，变形金钢过山车🎢玩了两遍，早上一次，晚上一次，不同体验效果，感觉晚上加灯光效果更酷炫，体验感更好,2021-11-20 发布点评
非常不错非常不错的地方，整整一天，就是好累啊，每个地方都适合去打卡，雨中排队也特别好玩，就是人太多啦，最好不要节假日去啊。&#x0A;【景色】美&#x0A;【趣味】好&#x0A;【性价比】低,2021-10-04 发布点评
不错，值得二刷。各个年龄都能找到自己的乐子。丰俭由人，花钱少也能玩得不错。,2021-10-01 发布点评
去的那天人最少，每个项目只要排5到15分钟，但很多项目都类似于vr感觉都没必要二刷，霸天虎倒是刷了五次，另外里面并不是很大，每个项目排队要绕的圈子比较大,2021-10-29 发布点评
还是不错的。没有想象中的大。说是新加坡的五倍大。但项目各方面觉得还比国外的几家少一些。配套服务各方面也都还行。适合带孩子经常来。也希望以后能多扩充项目！,2021-09-26 发布点评
有幸邀请去了环球影城，里面还是值得一去的，5D效果很好，让你有种身临其境的感觉，部分景区开放，因为是内测所以有的景区没有开放，人是真的太多了，排队一个小时左右可以玩一个项目,2021-09-01 发布点评
国内首个环球影城开园啦！人山人海，即使买了快速票，也是要排队很久。趣味性还是很足的，七大主题都值得体验，门票不算便宜，尤其是加上快速票，门票消费不低。,2021-10-25 发布点评
在携程买票很方便，预定好票之后，当天是凭身份证进入的。其实很多途径都可以购票，我是携程有一些会员优惠买的，但有的途径不用会员也一样的价格，希望改进！,2021-11-05 发布点评
一天基本都是在排队了。项目游玩体验也是很一般。基本是排队差不多80分钟游玩一分钟。有些项目排了体验也不怎么样。除了主题性比较强，项目真的是很一般了。,2021-10-23 发布点评
值得一去的地方，之前预报有中雨还纠结是否要改期，还好坚持了，天气非常给力！喜欢的项目都刷了，喜欢的玩具也买了，小黄人冰棍儿黄油啤酒必须要入。期待年卡,2021-09-26 发布点评
安排好时间行程，体验感还是很好的。没有优速通的情况下带着孩子也能刷完五大主题项目并看了表演及灯光秀。里面的餐厅食物味道也不错。大人孩子都玩得很开心,2021-10-12 发布点评
还不错，不过还是比较适合年轻的朋友，哈哈😄…………………………………………………………………………………………………………………………………………………………………………………………,2021-11-07 发布点评
值得玩儿一天～配妈妈来的，老少皆宜～建议早起来先将所有项目玩儿一遍，坚持到晚上8点后，园内人少了，哈利波特和变形金刚这俩最好玩儿的，可以刷二轮～,2021-10-07 发布点评
已经去了三次了，都是内部压力测试。太棒了👏,2021-09-16 发布点评
吹爆北京环球影城&#x20;内部压力测试有些项目没玩尽兴&#x20;等正式开园了必须二刷,2021-08-23 发布点评
人是非常的多，建议时间允许的话还是平时进行游玩，体验感不是很好，大部分的时间都在排队了。里面的东西也不是很便宜。但是可能找人少的时间再去一次。,2021-11-25 发布点评
亚洲第三座环球影城，非常幸运抢到了门票以及优速通，这里是亚洲最大的，同时还有中国特有的功夫熊猫主题，特别适合带小朋友，总是，一定要来一次才行。,2021-10-10 发布点评
酒店房间干净，服务主动，只要看到客人的出现，马上询问是否需要帮助，对于疑问也是第一时间解答，针对去环球影城玩的朋友，环球影城酒店绝对是第一选择，酒店下楼就是入口，只需要花1分钟时间就可以到达环球影城乐园！在这里还需要特别感谢宾客关系Clair、大堂经理Archer和为您准备房间的客房经理Alice~，服务贴心满意，下次去一定还继续订这个酒店,2021-11-30 发布点评
10月29去的，比较空，过山车就排了5分钟，小黄人闹翻天排了20分钟，其他的没排队，基本上能带孩子的项目都会很多人排队。总共玩了12个项目，2个重复玩的，哈利波特***最好玩。&#x0A;哈利波特***：全息投影乘车，场景做的特别好，电影还原，一定要玩🌟🌟🌟🌟🌟&#x0A;鹰马飞行：低配版过山车，适合儿童。🌟🌟&#x0A;奥利凡德：魔杖店推销表演🌟🌟🌟&#x0A;小黄人闹翻天：亲子项目，5D电影🌟🌟🌟（小黄人的都是亲子项目，适合带孩子玩，排队也很长）&#x0A;未来水世界：海盗跳水开摩托艇等有剧情的特技表演🌟🌟🌟🌟&#x0A;霸天虎过山车：速度快，安全压杠比较紧，后背紧贴座位，全程没有失重感但是头晕。🌟🌟🌟🌟&#x0A;火种源争夺战：室内4D电影低配过山车，两块幕布，车子来回转圈有点头晕，亲子项目。🌟🌟🌟&#x0A;侏罗纪大冒险：和火种源争夺战有点像，也是室内4D电影，两块幕布来回转，头晕。&#x0A;,2021-11-03 发布点评
环球影城终于打卡完成，在没有任何优速通和VIP的前提下我在平日周四刷完了所有的项目，攻略就是住两晚环球酒店，第一天早上可以早点一小时进去，人少排热门项目，十点左右开始上人了，游客都去挤哈利波特园的时候我们可以去其他园玩，然后玩到中午就可以去酒店休息了，休息到一两点的时候再回来继续刷其他园区，到晚上八点到九点的时候所有项目几乎不用排队，即便排队也很少人，这样就可以把全园所有项目完成！不要小看中午这休息一两个小时，因为白天人实在是太多了，干什么都在排队，连魔法棒施展魔法都要排队，排队非常消耗体力，一早进去很难坚持到最后玩13个小时，所以白天人最多的时候回酒店休息，下午才有体力玩到最后,2021-10-26 发布点评
9月28号去的环球影城，人不多，玩了很多项目，体验了一下，感觉不错，玩的很尽兴，哈利波特片区最好玩，晚上的灯光秀也很美，值得一去，花车也很好,2021-10-11 发布点评
优速通着实给力，享受的项目很全，且全程0排队，以至于坐霸天虎过山车的时候心理建设还没做好就直接飞上去嗷嗷嗷……&#x0A;未来水世界依旧喜欢坐蓝色区域，这次选了第一排，以至于穿着雨衣依旧湿得透透地……&#x0A;黄油啤酒不如记忆中的好喝，可胃里仍然保留几年前对***的记忆，依然翻江倒海，以至于扶着墙出来，服务员各种帮忙……&#x0A;当日拍照服务还是可以选择的，不光解放了自己，还增加了乐趣，以至于可以自由选择各种惊恐下的照片留着哈哈哈……,2021-09-22 发布点评
内测期间入园，当天九点进场，11店离场。待了两个小时，就玩了一个熊猫漂流。感觉很一般，和国外的环球影城完全就是两个东西！热门项目，排队都是两个小时起！出来的时候，看到等候入园检票的人已经快排到景观大道了。。。正常营业后，不敢想象要排多久的对！现在不能出国，估计又是一轮割韭菜！,2021-09-16 发布点评
项目评价：总体来说是男孩子的天堂，变形金刚的火种起源、侏罗纪公园，哈利波特这三大项目的形式相似，差异化除了主题外区别不是太大，感官上还是很刺激、震撼的。霸天虎过山车刺激程度满分，而且不会很害怕。很好玩，刚结束后头会晕。变形金刚人互动，除了霸天虎外，其他的机器人都很正经，没那么好笑。小黄人区域适合儿童。&#x0A;&#x0A;园区餐厅：试运行中午1点半去三把扫帚要排队2小时。侏罗纪有个比较火的也等了一个小时。餐厅的味道还可以，不要指望有性价比。小吃的味道也还可以，黄油啤酒值得购买。&#x0A;&#x0A;演出：未来水世界的演出，女主真的很厉害，也有些设计很震撼。想跟演员互动，坐在舞台中间前排。驯龙高手的演出很不错，形式新颖，音乐也蛮好听。室内空调太冷，记得穿一件外套。&#x0A;&#x0A;吐槽点：环球影城的环境、细节设计真的很一般，绿植以北方的松树和一些常见树木为主，花材也特别普通。服务人员的精神面貌让我觉得来的不是乐园。花车表演，花车一般，花车的互动尴尬的抠脚，机械的摆手，无情绪的互动，别说不能感染观众，让观众都没有带入感。哈利波特的排队会让人绝望，好几个大项目排队的设计都让人头痛，不仅长，而且特别绕，仿佛跟走迷宫一般。灯光秀只有6分钟！整体跟迪士尼比还是差很多。&#x0A;⭐建议：有条件一定要买优速通，要不排队会让你怀疑人生。,2021-09-14 发布点评
必须给我的好朋友点赞，把仅有的一张票给了我。&#x0A;火箭都想给你刷起来！！！一万*N颗小心心送给你&#x0A;见山是山，开门见山&#x0A;这些天小红薯上个各种攻略超级多，环球影城迷的打卡地&#x0A;基于环球影城和迪士尼的经验&#x0A;攻略都是自己做&#x0A;参考内容就是北京环球影城官网&#x0A;针对七大主题景区&#x0A;私人订制自己的游玩路线&#x0A;第一个项目，变形金刚基地--火种源争夺战&#x0A;推荐指数🌟🌟🌟🌟🌟，与新加坡的黑暗乘骑类似&#x0A;第二个项目，侏罗纪世界大冒险&#x0A;推荐指数🌟🌟🌟🌟🌟，这个好像新加坡和大阪环球影城都有~~~略有不同而已&#x0A;第三个项目，必须是哈利波特的魔法世界—哈利波特的魔法之旅了&#x0A;强烈推荐🌟🌟🌟🌟🌟，这个项目大阪也有的&#x20;内容差不多&#x0A;或者玩过迪士尼飞跃地平线的都可以选择&#x0A;满足身高的小朋友们可以选择，不会很刺激~~~&#x0A;第四个项目，哈利波特的魔法世界--鹰马飞行&#x0A;推荐指数🌟🌟🌟&#x0A;这个就是一个非常非常小的过山车&#x0A;第五个项目，变形金刚基地--霸天虎过山车&#x0A;推荐指数🌟🌟🌟🌟颗星，胆子大的不要犹豫了&#x0A;时间关系，更想留给经典项目和表演项目&#x0A;一路玩下来&#x0A;首先看了未来水世界—现场真人表演&#x0A;🌟🌟🌟🌟🌟推荐&#x0A;真人互动&#x20;表扬前现场人员会将气氛带起来&#x0A;表演也真的精彩&#x0A;第二个表演看的是好莱坞区域的不可驯服&#x0A;🌟🌟🌟🌟推荐&#x0A;如果时间允许，建议流浪节拍，青蛙合唱团，三强争霸运动会，&#x0A;未来水世界特技表演（之前一直没有看所以这次特意安排上了）&#x0A;灯光，摄像，开拍！（北京环球影城特有的，有兴趣可以看）&#x0A;最后就是环球大游行&#x0A;这三个都是🌟🌟🌟🌟🌟推荐&#x0A;另外啊必须讲一下&#x0A;环球影城里面的每一个主题乐园的卫生间都有自己的独特风格&#x0A;给整个影城多了更多乐趣&#x0A;大概就是这些吧&#x0A;北京环球影城，已经是我不准备去的了&#x0A;原本一个好朋友答应我要陪我去~~&#x0A;我认真的觉得就是好朋友，就是有机会一起玩耍&#x0A;但就因为一条信息没有回复他，变脸了。。。&#x0A;如果不是千载难逢的机会，恐怕，这一次的北京环球影城我也不会去的&#x0A;说过的话一定要算，答应过的事儿一定要做&#x0A;不破局，就不会再选择来北京环球影城啦[失望R][失望R][失望R]&#x0A;这是我觉得该有的态度&#x0A;over！&#x0A;所以，恩，那么&#x0A;伙伴们，祝你们北京环球影城玩的开心&#x0A;北京环球影城试营业打卡成功！！开熏。&#x0A;亚洲三座环球影城打卡完毕！！&#x0A;🌈🌸✨#北京环球影城[话题]#,2021-09-03 发布点评
哈利波特禁忌之旅强烈推荐，公认的最好玩的，裸3D效果结合真实场景还原，无论上下左右都让你觉得身临其境。&#x0A;其次未来水世界也超级有意思，尤其是前排湿透区，被水花溅到浑身湿透的同时，仿佛真实的经历过一场战争。&#x0A;比起透不过气的霸天虎过山车，我觉得火种源争夺战的4D更加刺激，尤其是导弹爆炸后浑身的灼热感，以及高空坠落后被大黄蜂接住的那瞬间，让人热血沸腾。&#x0A;功夫熊猫以及小黄人大多是孩子们的项目，所以没去看，不过排队倒是挺短的。&#x0A;侏罗纪公园和遇见迅猛龙由于排队时间太长所以没去成，只能开园后再去体验。&#x0A;最后临走的时候可以体验一下灯光开始好莱坞，不仅仅是视觉上的冲击，更会有真实的船只和绚丽的火焰，没有经历过暴风雨的人都能在不湿身的情况下体验一把。,2021-09-02 发布点评
目前景区景点一天足以，不怎么排队的情况下，一天行程2万多步，餐食人均建议200元&#x2F;人左右，建议先去骑乘类热门，花车、水世界、舞台剧也要看。,2021-10-30 发布点评
环球更适合成人，儿童更适合迪士尼，晚上游客较少，可以免排长队，威震天排了好几轮，原来是三位机器人每人20分钟轮流合影，所以，合影概率靠运气,2021-10-21 发布点评
环球影城绝对值得去玩，个人认为比迪士尼好玩多了，住酒店可以提前1小时入园，很方便，价格相对来说还可以，1天玩遍值回票价，大家有空就去打卡吧,2021-10-08 发布点评
玩了一天，很棒，没抢到优速通，工作日最多的排1小时，大概能玩10个项目。&#x0A;推荐霸天虎过山车，火种源争夺战，哈利波特***，鹰马飞行。,2021-09-23 发布点评
游玩体验非常不错,2021-11-03 发布点评
非常非常开心，可以忘却烦恼的地方，一天十一个小时，虽然腿很酸，但是真的很开心很开心！原本不敢坐的霸天虎过山车，也体验了，真的是太刺激了！,2021-10-22 发布点评
