内容,时间
北京环球影城&#x0A;💙我买的普通票，不知道大家是想十一来玩，还是怕排队，工作日当天的人异常的少。9点开园，我们刚好整点进入，进园后直走就看到图一大球，如果想拍白天的大球就还是在这多拍拍照吧，不然等玩项目的时候根本没法出来，只能等到晚上出园…&#x0A;💙走了好久终于到达禁忌之旅，这会排队人有一些，以为怎么也得排四十分钟，结果竟然十五分钟就进去了！工作人员在门口会给存包小票，记住不要把小票存进去，那是取包凭证…手机如果你不怕玩掉就不要存！因为里面有很多值得拍照之处。&#x0A;💙玩完后我就去买黄油啤酒了，不要买小推车的Butter&#x20;Beer，人多又晒，去同在哈利波特区的猪头酒吧里买，人少又快，冰沙的最好喝！价格💰50&#x0A;💙第二个项目是霸天虎，这里我走冤枉路了！因为霸天虎和禁忌之旅离好远…要穿过侏罗纪和功夫熊猫，感觉走了2公里md…刷完禁忌应该先刷侏罗纪，那样省腿…到达霸天虎是上午十点半，人少，跟着人流走十分钟就玩上了。体验感：速度之快超乎我想象，一圈下来想吐…&#x0A;💙玩完两个大项已经十一点多了，我又“跋山涉水”原路返回到哈利波特区的三把扫苕餐厅排午饭了，排队较久，大概半小时多，我点的排骨鸡腿拼盘，排骨味道绝了！价格💰118&#x0A;💙第三个项目就是侏罗纪世界大冒险，也是仅排队15分钟，胆大的可以坐前排，感受霸王龙就在你眼前…小孩玩估计会吓哭留阴影…飞跃侏罗纪还未开放，有点可惜…&#x0A;💙第四个项目是小黄人闹翻天，几乎无排队，玩到最后有感人的点…小孩子爱玩。玩完后可在小黄人乐园区域拍照，很出片。&#x0A;💙第五个项目是必玩的火种源争夺战，整场排队最久，大概40分钟。不恐怖但超逼真，有种身临其境的感觉！大人小孩都适合！遗憾没有和威震天合影，人巨多，要排一小时…&#x0A;💙第六个项目，大黄蜂回旋机。不在我的必玩清单，没啥人排队就去了，摇晃那一刻很放空，所有烦恼都忘却了…玩完后大概六点多，赶到花车巡游那里已经快结束，错过精彩阵容…&#x0A;💙最后就是全场最经典的灯光秀啦，在哈利波特区，18：40开场，大概七八分钟就结束，人很多，要提前半小时过去占据最佳观看位置…&#x0A;💙一天下来走了2.5w步…游玩顺序建议：一、禁忌之旅。二、侏罗纪世界大冒险。三、霸天虎过山车。四、火种源争夺战。五、小黄人闹翻天。以上是必打卡系列，其它就看排队时间随缘玩吧，最好按这顺序，不然会走冤枉路！字数限制只能分享到这里，有疑问可以在评论区留言！,2021-10-13 发布点评
如果想买优速通的话一定要在七点前到检票口。早晨6点半起床，带上水壶充电宝纸巾自拍杆，七点出发七点半下地铁到达环球大道开始安检。通过安检以后往里走，遇到大球简单拍个照然后继续往里走，一直走到检票口。前方高能！检票口的左边有票务服务，如果运气好的话可以购买当天优速通，限时限量的，10月3日一人一张800元，可将身份证交给一个人排队，窗口凭身份证购买。买好后排队检票进场。进场后不用像其他攻略说的先去哈利波特，可根据app显示的等待时间自行游玩。因为我用的优速通不用排队，所以也就没有太在乎先玩哪个后玩哪个。排队时间从长到短分别是：哈利波特禁忌之旅，侏罗纪大冒险，飞越侏罗纪，火源争夺战。给准备去北京环球影城的筒子的建议：&#x0A;1，条件允许的话早点起买优速通，我是除了鹰马飞行没玩（累了）以外其他的项目都玩过了。当别人百无聊赖排两个小时以上的S型队伍的时候，你使用优速通从人群中另辟蹊径直接进入，这种被行注目礼的感觉只能意会不能言传。&#x0A;2，穿一双舒服的鞋&#x0A;3，带水杯&#x0A;4，带雨衣（水世界湿身）&#x0A;在北京环球影城两个人门票1500，优速通1600，吃东西300。总的来说用优速通玩北京环球的体验感还是不错的。国庆节快结束了，提前两天回到工作岗位，努力搬砖，通过自己努力得到的都很踏实，2021还有80多天就结束了，一起撸起袖子加油干💪💪💪,2021-10-05 发布点评
非周末和节假日去的朋友不需要买优速通或者VIP也可以刷完全部项目，今天刚刚打卡了开园没多久的环球影城，以后自己家门口也有环球影城不用去国外玩了。人确实很多，但一天打卡了所有的项目都做过了，并且还有充足时间二刷某些项目，只要是在非周末节假日去你也可以。整体感受很好，项目有很多是从其它环球影城照搬建设，也有不少是原创非常有意思，玩完到家感觉整个人都在晃的感觉。想分享些基本攻略，在去之前，需要准备一双舒适的运动鞋，走路轻快，我一天走了27000步，所以还是比较大的步数和运动量，脚得先保护好；还需要带一个10000毫安以上的充电宝，园区内没有租充电宝，不像迪士尼每个餐厅都有，作为去过的人想告诉你手机在拍照刷朋友圈耗电量比你预想的大，确保手机和充电宝出门前是满电。园区一般8：30就会放游客进去，不是官方时间9点，所以9点我就已经刷完火种源了，有的人霸天虎和火种源都玩过了，所以别理解9点才让你进园，千万别。要想一天刷完全部项目不能9点到，要不然进去没有可以很快到你的项目就比较吃亏，对于周末和节假日的朋友更要早去，不可能全刷完也至少玩掉几个经典的大项。我看到很多攻略，和有很多人都说开园跑到霸天虎或者禁忌之旅，其实像我一样在地铁上就发现禁忌之旅排60分钟了，但是不管我开园冲谁，都能保证一天刷完所有项目，所以不要纠结先玩谁，跑得不累嘛又不是玩不到。先下载“北京环球度假区”APP查看排队时间，包括演出时间，也得知道什么时候赶去看演出，只要哪里人少去玩哪里，走的每一步都根据排队时间的情况来指引你，下午4点以后，各项目排队时间会开始缩短，到了晚上7点以后，所有项目排队时间不超过10分钟，包括禁忌之旅。错峰排队，暂时自己喜爱的项目排队长，超过60分钟，或者小项目超过半小时，可以先玩其它因为一天什么时候玩效果都一样的，真的没必要排长队不去排短队，要灵活。,2021-09-28 发布点评
终于打卡了，真是太愉快的一天了😬而且天气预报说25号局地暴雨，结果一滴雨也没下，简直太幸运啦💫&#x0A;💌购票：14号零点，在携程上很幸运地抢到了两张25号的门票和优速通。想到了官方app会卡到让人窒息[捂脸R]提前在携程定好提醒，很快就抢到了。&#x0A;📱第三方买好票后一定要在官方小程序或者app预约入园时间，因为是第三方不支持提前录脸，所以当天务必带好身份证&#x0A;✨可以提前在“北京环球度假区”微信公众号提前预约停车，可享受95折优惠哦&#x0A;💫从停车楼进入城市大道需要安检1次，到了乐园门口需要排两次队：第一次扫预约二维码.第二次扫身份证录脸（官方购票渠道可提前录脸，直接刷脸进入园区）。在这里我还出了个小插曲😂我居然使用了护照号订票，导致我刷身份证显示无票，吓得我赶紧联系携程客服解决，最后去了游客服务中心更改了信息这才进去。环球工作人员很耐心帮我解决，而且可以不用排扫预约二维码那个队了。直接去到扫身份证那里就好啦。&#x0A;💞路线：将近10点入园—小黄人—哈利波特—侏罗纪世界（在这里还看了花车巡演，吃了午饭）—变形金刚—功夫熊猫—未来水世界—好莱坞（在这里又看了花车巡游）—小黄人（照相&amp;买冰箱贴）—哈利波特灯光秀—辉煌大剧院不可驯服表演—小黄人—8：40回家&#x0A;💞看出来我有多喜欢小黄人和哈利波特了吧😄去了好几次这两个区域。&#x0A;💞使用优速通，每个项目要刷两次脸😃而且没有排队可言😎😎😎&#x0A;❤️优速通简直太香了，除了霸天虎过山车我不敢坐，其他项目我们都刷了一遍，还看了青蛙合唱团、未来水世界表演、不可驯服、小黄人沙滩见面会，传奇现场（碎嘴皮子威震天、擎天柱、风刃都看到了😎），还与美美、史瑞克、小黄人合影。真的太值了😜&#x0A;✨环球的工作人员和演员们真的很认真，如果游客真的沉浸其中一起互动，体验绝对完美。花车巡游喊了格鲁和艾格尼丝，他们还对我比心，简直太开心了🤗&#x0A;在环球度过了完美的一天～,2021-09-27 发布点评
"【交通篇】e&#x0A;建议自驾：停在代客泊车一天100-150-200三个档&#x0A;&#x0A;【小食篇】e&#x0A;园内有四种餐厅类型:&#x0A;1,快餐服务餐厅(汉堡、奶昔、三明治、热狗、&#x0A;披萨、意面、炸鸡....)&#x0A;2.餐桌服务餐厅(中西融合菜、西式料理.)&#x0A;3小食亭服务(饮料、小食、黄油啤酒、有鸡腿）&#x0A;4咖啡厅(咖啡、烘焙面包、甜品)&#x0A;&#x0A;【必玩篇】e&#x0A;1哈利波特区(禁忌之旅)&#x0A;2变形金刚区(霸天虎过山车、火种源争夺战)&#x0A;3.未来水世界(很燃,演员动作都超高难度)&#x0A;4.侏罗纪区（世界大冒险)&#x0A;5．花车巡游(很欢乐）&#x0A;&#x0A;【拍照篇】&#x20;e&#x0A;穿搭:最经典的袍子一定要有拍照很出片，可以淘宝可以闲租园区也有，比起学院风辣妹风更吸睛(我这一身撞衫率太高了)。&#x0A;拍照区域:&#x20;1.橱窗前2.哈利波特城堡3.对角巷4.街景5.梅尔斯餐厅门口的车车",2021-09-25 发布点评
"️&#x0A;推荐指数：此处🌟🌟🌟🌟🌟🌟🌟🌟🌟🌟&#x0A; &#x0A;地址：北京市通州区环球影城度假区&#x0A; &#x0A;🚙出行攻略：&#x0A; &#x0A;🚅1公共交通：选择公共交通的小伙伴可以乘坐地铁1号线八通线或者7号线，在环球度假区下车，B口出右转步行穿过环球城市大道到达验票区，步行大约200米。优点：整体公共交通很方便，不用考虑停车问题。&#x20;劣势：游玩一天很累，买了东西在坐地铁不太方便，so，各有利弊，因人而异。&#x0A; &#x0A;2🚗私家车：如果可以开车建议开车前往，我们当天是开车去的，下面详细说下开车停车攻略。首先，车位费分为三个价格，1、100元&#x2F;天（停放区域停车楼3-5层），150元&#x2F;天（1-2层），代客泊车200元&#x2F;天。其次我们选择的事100元的停车位，车位费可以提前一天在环球影城公众号上缴纳（可以便宜5元），我们当天的入园时间选择的是：8:30-8:50,我们到达环球停车场的时间是7:30，进入停车场非常顺利并且停在三层距离入口很近的停车位，所以早来是可以又省钱还可以少走很多路的~&#x0A;3🚕打车：打车也是需要打到环球影城停车楼，有专门的落客区域，出租车司机可以临停送客，也很方便。&#x0A; &#x0A;🎫验票刷卡：提前一天官方会给游客发送短信，一定要按照短信内容操作，点开网址将自己的近照上传网站，上传成功后入园即可刷脸进入，第二种方法就是刷身份证，内测亲测刷身份证会比刷脸更快些。&#x0A; &#x0A;🎢项目打卡：我们带着小朋友一起去的，所以选择的路线是亲子路线从主题公园入口进入，游玩路线是小黄人乐园---侏罗纪世界努布拉岛---功夫熊猫---变形金刚基地---未来水世界---哈利波特魔的魔法世界---小黄人乐园，环球度假村app或者小程序都可以查到排队时长，优先选择不浪费时间才是硬道理~！&#x0A; &#x0A;🎡小黄人乐园：&#x0A;57萌转过山车&#x20;身高限制：92cm-190cm&#x20;萌转过山车适合全家体验，共享无穷乐趣。这个项目我家小朋友刷了三次~推荐指数：🌟🌟🌟🌟&#x0A;58超萌漩旋涡&#x20;升降小飞机，带小朋友建议刷&#x20;推荐：🌟🌟🌟&#x0A; 59神偷奶爸小黄人闹翻天&#x20;身高限制：102cm&#x20;低于意外缩成小黄人，开启神奇之旅。非常好玩的项目，是4D电影项目，低于102的小朋友也可以坐不动的座椅玩，小黄人乐园强烈推荐玩这个项目，主要是排队时间短有格鲁和小黄人们的动画人物互动，游戏时间长，推荐：🌟🌟🌟🌟🌟&#x0A;            ",2021-09-16 发布点评
内测9月12日打卡北京环球影城&#x0A;&#x0A;接收到内测短信后，用微信的环球影城官方小程序提前兑换、人脸识别。7点15分抵达，停到了150元的区域，穿过环球大道大约10分钟到达检票口，早上沿途早点有卖热狗的，基本款五十元一个。各排队通道已经有很多人了。住酒店的客人有个快速通道8点就开放了，我们当天抵达的8点半开始入场。用环球度假区官方小程序可以随时查看各项目排队情况及演出时间（每天都在变化）。出园区后，城市大道有很多的商业：餐厅、蒙牛冰激凌、商店等。我们选择了珍宝海鲜，口味还是相当不错的。&#x0A;了&#x0A;&#x0A;&#x0A;一、哈里波特魔法世界：&#x0A;｛哈里波特与禁忌之旅｝、｛鹰马飞行｝；&#x0A;&#x0A;二、侏罗纪努不拉岛：&#x0A;｛飞跃侏罗纪｝、｛侏罗纪大冒险｝、奇遇迅猛龙；&#x0A;&#x0A;三、变形金刚基地：&#x0A;｛霸天虎过山车｝、｛火种源争夺战｝、&#x0A;｛与1:1变形金刚互动｝；大黄蜂回旋机；&#x0A;&#x0A;四、功夫熊猫：&#x0A;｛灯影传奇｝、｛神龙大侠之旅｝；&#x0A;&#x0A;五、未来水世界：&#x0A;&#x0A;六、好莱坞：现场特技表演&#x0A;&#x20;&#x20;&#x20;&#x20;&#x20;&#x20;&#x20;&#x20;不可驯服&#x20;&#x0A;&#x0A;七、小黄人：&#x0A;｛萌转过山车｝、｛小黄人闹翻天｝；&#x0A;&#x20;&#x20;｛超萌漩漩涡｝；&#x0A;&#x0A;八、晚上灯光秀；,2021-09-12 发布点评
开在家门口的环球影城当然值得一去啊！九月五号的邀请票带着儿子玩了一天，体验感很棒主题感十足，带上你的热情和耐心嗨起来吧！导航到达北京环球影城车辆入口处，地面停车场100，停车楼150，差别是停车场要比停车楼多走两百米！我们九点到达停车楼已满！也可以乘坐地铁非常方便！但也要考虑到玩一天下来是否还想坐地铁回家哦！安检后来到城市大道，因这里是全天免费游览的，所以不要被两边琳琅满目的店铺吸引，最后出来依然可以游览拍照哦，时间宝贵，在“标志球”处留影就可以到环球影城大酒店处排队刷脸入园了！&#x0A;&#x20;&#x20;&#x20;&#x20;&#x20;&#x20;&#x20;&#x20;入园后领一份公园指南，你要在小程序上实时关注各个项目的实时排队信息及时间，合理安排！当然最好是早些到达赶第一波入园直奔最想去的地方，否则十点至下午一点是排队时间最长的时候，午饭后就会好很多了，所以你也可以上午走走逛逛拍拍，玩儿一些简短的不用排太久的项目，下午开始紧凑的游玩之旅！傍晚花车巡游时是游乐项目排队时间最短的时候，可以自己取舍哦！最热门的霸天虎过山车、侏罗纪大冒险和哈利波特禁忌之旅排队最多也不过一小时，下午时间会短很多，其它项目排队都在半小时之内搞定！所以千万不要看到时间就开始焦虑烦躁哦！而且国内的热门景点不就是这样吗，没办法咱们人口多啊！所以要提前做好心理准备，保持好的心态才能不让游玩的心情打折扣哦！总之每一个主题项目都有自己的特色和惊喜之处，这个自己体验因人而异[调皮][调皮]！不得不说虽然试运行阶段已经人满为患了，但整个园区竟然井然有序，到处都透着便捷。有很多婴儿车轮椅租赁方便老人孩子，每个项目都有专门的婴儿车停放处！存包处刷脸存取十分快捷！就是过山车和禁忌之旅需要存包！山路十八弯的排队设计也很好，让人们一直在慢悠悠地蛇形走，还能欣赏一些彩蛋免得无聊，至少比直接站在队尾望眼欲穿地满满挪腾要强得多！不得不提的是，园区里到处都是卫生间，竟然没有人排队个个干净整洁，这在我们国家热门景区应该是非常少见的了吧！每一个园区都有自己的特色餐厅和纪念品商店，并没有网上说的贵的离谱！价格适中！纪念品商店都提供打包登记然后五点半后园区出口店铺自取服务，还是很周到的！试运行阶段晚上到八点结束，所以我们以玩儿为主，晚餐八点后在园区外的城市大道解决！我推荐萌萌牛鱼个人挺喜欢的！&#x0A;&#x20;&#x20;&#x20;&#x20;&#x20;&#x20;&#x20;&#x20;一天下来真的累，但心是快乐的啊，那就足够了！准备好行装调整好心态，带上你的荷包和好心情出发吧！,2021-09-12 发布点评
期待已久的环影终于向我发出了邀请，度过了愉快的一天体验之旅。整理一下自己的行程体验，有些凌乱，多多谅解啦！&#x0A;出发：自驾到环影门庭的时候会有问需要什么样的停车服务，在这之前做了一下简单攻略，我选择了代客泊车，这也是个人觉得很方便的一项服务，在最后疲惫的走不动的时候可以直接上车。&#x0A;入园：建议早点出门，进入园区前会安检，大概在八点半的时候就会开始扫脸入园了，由于是内测没有体验vip，入园后拿到园区指引，项目看的更清晰一点，不过还是提前要先关注微信小程序哦，这样各个游玩的时间都在上面体现，能让你更好的掌握时间。&#x0A;游玩：进入园区我们选择了先去变形金刚基地，先去刷霸天虎过山车，连跑带颠的竟然快速排上了第一排，一定要体验第一排的视角，太赞了；这个过山车需要提前存包，到了位置先往左手去存包，然后快速奔跑去上面，会有一个人员分流的通道，选择去第一排的会排左边。&#x0A;&#x20;&#x20;&#x20;&#x20;&#x20;过山车出来取了包不要犹豫直接去火种源争斗战，就不在剧透里面的情况，自己体验吧；再出来先看下时间，显示的周边时间排队都不长的话赶快扫了这个园区其他项目。&#x0A;&#x20;&#x20;&#x20;&#x20;&#x20;&#x20;变形金刚基地结束看了下时间就直奔侏罗纪世界的世界大冒险，排队的人刚好不多，很多人都是直奔哈利波特区去的，（当天飞跃侏罗纪没有开）快速排队扫侏罗纪的游乐项目，看着点时间。可以早点去排队等待未来水世界。&#x0A;&#x20;&#x20;&#x20;&#x20;&#x20;&#x20;&#x20;未来水世界是个露天的大场地，容纳的人很多，早点去可以选择好一点的位置，越靠下的蓝色和绿色位置很容易被湿身，准备好雨衣哦，红色区域是属于安全区域。看完了表演提前点往外走，这样能争取到一点时间。&#x0A;&#x20;&#x20;&#x20;&#x20;&#x20;&#x20;&#x20;&#x20;看完表演直奔哈利波特的魔法世界，禁忌之旅的时间基本没有低于过120分钟，也就是说只能靠排队了，中午的时候人相对于比较少，排队一点点挪进去吧！不建议在三把扫帚餐厅吃饭，排队时间超级长。在去排禁忌之旅的时候可以先买杯黄油啤酒，一边排队一边喝。扫了哈利波特的游玩后先去补给。&#x0A;&#x20;&#x20;&#x20;&#x20;&#x20;我们选择在侏罗纪的哈蒙特餐厅用的餐，休息调整后，转了转小黄人，我们是奔着大项目来的，所以后面的小小项目溜溜哒哒的能玩啥就玩啥了。&#x0A;&#x20;&#x20;&#x20;&#x20;&#x20;&#x20;五点半花车巡游，我们选择离变形金刚基地很近的附近看的表演，表演结束直接二刷霸天虎过山车，坐在最后一排体验了一次甩尾的快感，出来后刚好能赶上传奇现场的表演。&#x0A;&#x20;&#x20;&#x20;&#x20;&#x20;&#x20;这个时候就开始溜达功夫熊猫，一边玩一边拍照准备去看灯光秀,2021-09-10 发布点评
北京环球影城游览攻略&#x20;｜男孩向左、女孩向右&#x20;&#x0A;前两天去北京环球影城玩，讲真还是很不错的，&#x0A;回来后几个朋友不约而同觉得秒回18岁，全程各种欢乐。那么，去开心之前，一定要做攻略啊，朋友们明确喜好、减少波折、少走冤枉路，顺畅的体验很重要。&#x0A;下面就为大家整理一份详细的攻略，欢迎参考。&#x0A;[打call]入园准备：&#x0A;1.&#x20;通过“北京环球度假区官方”小程序进行预约。&#x0A;这一步会详细到“入园时间”，几个朋友同去的话，最好一起预约。我和朋友分别预约的，我那个时间段她就没有预约到。内测期间还是可以一起入园的，为避免麻烦，同时预约较好。&#x0A;2.&#x20;务必携带：身份证、充电宝（功夫熊猫区域看到租赁处，不过都借出去了）&#x0A;3.&#x20;最好背双肩包、或者有拉链的大容量包包，省力且可避免物品掉落。&#x0A;&#x0A;[打call]关于交通：&#x0A;1.&#x20;7号线、八通线终点站“环球度假区站”可直达，很方便。&#x0A;2.&#x20;开车前往也很顺畅，可停在停车楼或地面停车场，都很便利；网约车也有专用的落客区。&#x0A;&#x0A;[打call]重要的杂七杂八：&#x0A;1.&#x20;选好入园时段的小伙伴可以提前一些抵达主题公园，有序入园。&#x0A;2.&#x20;刚进入环球主题公园先来到的是好莱坞大道，这里的环球影城商店纪念品非常全，个人的建议是，在园区的各个主题景区内不必浪费时间逛纪念品店，因为这里都有，离开的时候一并购买最为方便。&#x0A;3.&#x20;值得一提的：可以在先买一两件打造氛围感的单品，在整个景区拍照都用得到哦～比如发箍或者哈利波特的魔法棒和袍子。,2021-09-08 发布点评
"早入园是起点，话不多说直奔项目排队走起啊～七大主题景区一天真的是有点赶时间；&#x0D;&#x0A;•&#x09;环球城市大道&#x20;（已对外开放），去公园玩的小伙伴可以等晚上出来后再溜达，夜景更好看，商店、餐厅、电影院（IMAX值得体验）还可以再high到午夜时分！城市大道最具特色的还是巧克力工厂，最出名的就是choclatex5的奶昔，非常受欢迎，但也超级甜；&#x0D;&#x0A;&#x0D;&#x0A;•&#x09;好莱坞：&#x0D;&#x0A;带好手机扫码扫脸穿过环球影城检票口后好莱坞大道了，左右建筑非常有特册，地面细看是BlingBling的星光大道🌟；&#x0D;&#x0A;&#x0D;&#x0A;【灯光、摄影、开拍show&#x20;】体验特效电影幕后的过程，火光四溅，热气扑面；&#x0D;&#x0A;&#x0D;&#x0A;【环球辉煌剧院】剧院外观很有中国特色，表演项目驯龙高手；有二层观影台当看到无牙仔在剧院上空飞翔时，相当惊艳！&#x0D;&#x0A;&#x0D;&#x0A;好莱坞大道两侧有室外小舞台，定时有唱跳俱佳的小表演；道路一侧还有两台从美国运过来的《速度与激情》中的原型车，驻足拍照也是霸气十足！&#x0D;&#x0A;&#x0D;&#x0A;【Mel’s餐厅】是好莱坞街道上极具80年代美国汽车餐厅的风格的餐厅，门口的几辆老爷车也是从美国运过来的原装车，喜欢古董车的可以近距离观赏合影了！&#x0A;•&#x09;变形金刚基地&#x0D;&#x0A;【能量晶体补充站&#x20;】（霸天虎过山车）-&#x20;五星推荐，弹射出去的一瞬间相当精彩，属于排队一小时，上机三分钟，下来还想再来一次的项目！注意：排队前所有的东西都要先寄存，包括手机！&#x0D;&#x0A;&#x0D;&#x0A;&#x20;【火种源争夺战】：3D骑乘项目；跟着Transformers&#x20;进入他们的世界来一场大战吧！&#x0D;&#x0A;【大黄蜂回旋机】：&#x20;适合大小朋友的旋转杯，应该更适合小孩子吧；&#x0D;&#x0A;【传奇现场】：&#x20;与幽默爱聊天的汽车人合影的舞台。霸天虎简直太幽默了，小朋友被糊的一愣一愣的～&#x0A;•&#x09;侏罗纪公园&#x0D;&#x0A;【飞跃侏罗纪】：据说是可以感受倒挂穿越山洞的刺激，可惜内测时还在做压力测试；推荐指数必须是5星&#x0D;&#x0A;【&#x20;侏罗纪世界大冒险&#x20;】（乘坐全地形豪华自动系统（ATLAS）,与恐龙近距离接触，接受来自恐龙的怒吼和追赶吧！&#x0D;&#x0A;【奇遇迅猛龙】&#x20;–&#x20;人龙互动，看驯养员如何收服迅猛龙；不过简短的介绍后就是拍照环节，比较费时间，推荐指数：2星；&#x0A;【哈利波特与禁忌之旅&#x20;】:&#x20;在霍格沃茨魔法学校的走廊与教室之间穿梭，在城堡的空中上下翻飞，推荐指数5星的骑乘项目；还可以参观城堡内部，比较还原电影场景；开园后城堡会有夜间灯光庆典；&#x0D;&#x0A;【&#x20;鹰马飞行】小型过山车，适合小点的孩子；",2021-09-04 发布点评
