内容,时间
环球影城真的很不错，进去之后先去排了哈利波特***，排了40分钟就进去了，虽然队形崎岖弯道，但是走动很快，而且氛围感很强，很想二刷，但是不想排了😂，其次还有欢乐水世界的表演，是真的完美，演绎效果很逼真，很喜欢，还完了飞越侏罗纪，推荐指数五颗星，非常好玩儿，还有侏罗纪大冒险，很有意思，跟恐龙近距离接触，nice，小黄人闹翻天也去了，功夫熊猫、萌转过山车、擎天柱、大黄蜂，非常Nice，玩的项目挺多，中午吃饭也不挤，没有网上说的那么恐怖，错开高峰期就可以了，合理规划时间，guan官方app上面就可以随时查看等候时间，很方便，总体来说体验感还是很棒的，有机会还会再来！强烈推荐大家，一定要去玩哈利波特和侏罗纪！！,2021-10-08 发布点评
很开心第一次去刷环球影城，虽然没有抢到VIP也没有抢到优速通，但22号普通票也刷了很多项目，除了哈利波特***排了70分钟，鹰马飞行排了25分钟，小黄人也全部都刷了，功夫熊猫骑乘项目基本没有排队，旋转木马连轴坐了两次坐出了VIP即视感，漂流坐的第一排，大满足～我们一家人都怵霸天虎过山车，仰着头看别人在天上尖叫，不想被威震天怼，所以哄着小妞儿绕道了😄小妞儿第二天要回麻瓜学校，所以放弃了灯光秀，总之，不后悔。值得二刷三刷四刷…专治小少女日常生活中的各种矫情，因为我们根本跟不上娃的体力,2021-10-07 发布点评
有人说迪士尼好，有人说环球影城好。其实是看去的人的心情和感受。作为主题乐园，有你喜欢的内容就好！迪士尼到疫情前大概去过五六次，一次两三天不等。环球影城疫情前去了新加坡的。这次北京环球影城开业，买了10月2日的票，没有抢到优速通，所以排队比较多。好在孩子大了，也没什么不适应。整体体验下来，个人感受：&#x0A;1.变形金刚主题特别成熟，体验下来非常好。商店里有很多变形金刚，比较全。孩子买了一个擎天柱，1480元。在园区的商品中，性价比是很高的。&#x0A;2.侏罗纪主题喜欢恐龙的孩子会比较喜欢，大人可能会觉得没那么好玩。&#x0A;3.哈利波特主题，之前我和孩子期待最大，逛下来，也算不错，但没有惊喜。几个原因：第一，按承担的项目数量来说，面积过小。对哈迷人群数量估计不足，人多时满眼望去，哪哪都是人。从早上到晚上，全天入口就排队，谈不上舒适体验。第二，迪士尼城堡你可以360度无死角欣赏，但哈利不行，城堡后面看，像简易房的赶脚。&#x0A;4.小黄人主题，倒是很让人惊喜，精致漂亮&#x0A;5.功夫熊猫，整体看看挺漂亮，尤其那棵树。项目适合小小朋友。&#x0A;其他，夜景挺美，不可驯服挺好看，水世界也还行。但和迪士尼的三个剧比起来，还是有差距。花车巡游的氛围营造的不如迪士尼。&#x0A;另，全园没有热水，餐厅都没有。&#x0A;据说只是一期，期待后面会更好，让我有二刷的动力。毕竟是开在北京家门口的，比去上海要方便的多！,2021-10-04 发布点评
团建不二选择，北京环球影城，我们来啦，虽然人多多，但是为了能和变形金刚哈利波特一起，都是值得的哦&#x0A;记得门口的变形金刚必须合影互动哦，每天轮换不知道你会碰到那一派了&#x0A;晚上华灯初上，景区更是美轮美奂哦。在湖边边看美景边享受美食，快哉快买,2021-09-28 发布点评
很多沉浸式体验的项目特效很棒，但是人太多了，排队一小时体验三分钟吧。天气热的时候去的，排队差点热死，好在室外排队区域有很多喷水的大电扇。另外全区里面很多地方可以接水，所以建议带一个杯子去。&#x0A;最后有条件的买优速通吧，不然真的逛不完。😂,2021-09-14 发布点评
景区主要包括功夫熊猫盖世之地、变形金刚基地、小黄人乐园、哈利波特的魔法世界、侏罗纪世界努布拉岛、好莱坞和未来水世界七大主题景区。&#x0A;&#x0A;1、哈利波特的魔法世界&#x0A;从积雪覆盖的屋顶到布满鹅卵石的街道，景区处处细节重现了一个魔法世界，带领观众来到他们曾经在小说或电影中体验的神奇世界。&#x0A;&#x0A;2、小黄人乐园&#x0A;大人和小孩都将欣赏到精彩纷呈的演出，邂逅他们最喜欢的人物，与调皮可爱的小黄人到处开心嬉闹。&#x0A;&#x0A;3、变形金刚基地&#x0A;在这里，“梅特罗贝斯”&#x20;与优秀的中国科学家们协力联手，在北京近郊选定一处富含能量晶体的场地，作为巢穴部队N.E.S.T.的北京总部。在这个绝密的超高能科技区，人类与汽车人结成联盟，共同保护地球。&#x0A;&#x0A;4、侏罗纪世界努布拉岛&#x0A;观众可亲身面对威猛强大的霸王龙、迅猛龙、甲龙以及令人望而生畏的暴虐霸王龙。喜欢恐龙的小朋友，大朋友们可是一饱眼福了~&#x0A;&#x0A;5、功夫熊猫盖世之地&#x0A;将功夫熊猫的世界展现给宾客，观众将同阿宝一起，踏上成为一代武术大师的追梦之旅。是全球首个以“功夫熊猫”为主题的景区。“功夫熊猫”影迷们大饱眼福，可以看到喜爱的翡翠宫、熊猫村和智慧仙桃树。&#x0A;&#x0A;6、好莱坞&#x0A;将东西方文化融会贯通，带领人们进入波澜壮阔的电影特效世界之中，领略电影幕后魅力。张艺谋x斯皮尔伯格视觉震撼&#x0A;&#x0A;十面埋伏x大白鲨&#x0A;火灾、风暴等5d体验&#x0A;&#x0A;7、未来水世界&#x0A;未来水世界特技表演通过逼真的演出和惊险的特技，让人置身于精彩的“水上战斗”之中。&#x0A;&#x0A;还有一个不能忽视的景点城市大道：城市大道位于北京环球影城主题公园的主入口，连接主题公园、停车楼、公共停车场与地铁等设施，游客在入园前即可轻松访问，畅享欢乐时光。这里好多好吃的，吃货们必打卡,2021-09-08 发布点评
成人的梦幻乐园，我相信光，也相信魔法,2021-11-09 发布点评
好玩哦，就是有点废腿，一天三万多步。三把扫帚的烤鸡别点，非常干。&#x0A;花车巡游，观看位置远在霸天虎过山车那里，完了可以直接排队去坐过山车。,2021-09-14 发布点评
去的时候大风天&#x20;晴朗&#x20;疫情期人也少&#x20;基本都不用排队&#x20;下午两点进场&#x20;快走两步也都刷差不多了&#x20;值得一去&#x20;总要去一次😁😁😁,2021-11-10 发布点评
说实话最大的期待就是希望服务比上海迪士尼强就行。大阪的环球影城还是不错的，等北京的开业了，希望从各方面超越。,2021-08-02 发布点评
把那些所谓的攻略都扔了吧，因为，人少到你闭着眼无脑就能把项目全部刷完，甚至可以二刷三刷N刷，我一天把所有项目都玩遍了，还看了N场演出，这几天买了优速通的一定非常郁闷，优速通仅剩的唯一一点优势就是玩每个项目可以少绕几个圈，少走几步路。当然，最好还是工作日来，周末帝都的家长都会领着神兽来溜娃，人还是比较多的。为什么会那么少人，因为都不让进京了，微博小红书上退票的一大沓，非必要不出X，大家都懂，总之，错过这波，下波再见,2021-10-29 发布点评
终于去玩完啦&#x20;去的那天有点降温不过还好&#x20;我全程都是短袖外面套个外套&#x20;一点都不冷&#x20;排队时间基本上都是50多分钟&#x20;飞越侏罗纪人最多啊&#x20;最多的时候等70分钟&#x20;有优速通基本上就是帝王的待遇&#x20;真的！&#x20;没有优速通的排队就很烦&#x20;但一天基本上大项目也都能玩了&#x20;最爱火种源和霸天虎过山车&#x20;哈哈哈,2021-10-28 发布点评
「北京环球度假区」&#x0A;犯规了吧！怎么这么可爱吖！看花眼咯&#x0A;环球影城开了家泡泡马特&#x20;特好&#x20;品牌联动&#x0A;喜欢看到优秀的品牌联动模式&#x0A;双向奔赴,2021-10-18 发布点评
强烈推荐，很值得一去，比以前去的很多乐园都好玩，用了12个小时，打卡必去的所有项目，玩的非常尽兴，有很多实用攻略，从上午到天黑，还想再去一次,2021-10-02 发布点评
22号去的，比较惨，赶上了不可驯服演到一半故障了，小黄人闹翻天快开始时故障了，哈利波特***暂停了一个小时。建议还是晚些时候再去玩吧。所有演出一定要坐前面，后面完全没有体验感！灯光秀没必要看，真的！一定要买优速通，所有游戏5分钟就能玩上。,2021-09-23 发布点评
开园日第一刷，一家三口携程正价票购入进园，原定12:00开园，今天11:15提前开园，我们比预约时间提前了1小时，12点准时入园，除了要走很多弯路意外还算井然有序额，因为限流1万多人，每一个项目至多排队1小时。陪孩子二刷了小黄人闹翻天，鹰马，功夫熊猫这几个排队10分钟以内的项目。&#x0A;每一个IP几乎都会有沉浸式体验，技术达到了，氛围感还是差了点，最明显感觉花车巡游相比迪士尼乐园差的太多了，周边产品也没有迪士尼吸引人，但是总体感觉还是不错的，不负众望。&#x0A;另外：&#x0A;本以为开园的游客都是资深人士，没想到还真有啥也不知道抱着几个月的孩子排队沉浸式体验的……还有只要是有队就跟这排不知道干嘛的……&#x0A;少数游客素质还是很低的，被人把手机屏幕撞碎了，那人头也不回马上就溜了。&#x0A;对园区里的植物景观很失望啊，植物的表现不好，入口的银杏树要死了的感觉，希望明年能缓苗，大致上养护不够精细，有长得没型的感受，配置没有什么亮点可言，好好养护吧，要不还不如现在，看着养护运营压力挺大的。&#x0A;环球影城度假区总归不会只去一次，留点遗憾下次再慢慢走。,2021-09-21 发布点评
"💃🏻有幸参加试营业压力测试，虽然是一个雨天，但还是把所有园区的主项目都玩了个遍&#x0A;‼️当天下雨，排队人不多，如果天气好一定要早去，不然进门就排到怀疑人生😂&#x0A;🦕侏罗纪世界&#x0A;我们首先选择了排队时间相对较短的[侏罗纪大冒险]，显示排队时间60分钟，里面的排队通道虽然绕来绕去，但是一直在走就感觉没有排很久，里面还原了侏罗纪世纪的各个恐龙，很有带入感;[奇遇迅猛龙]在排队的时候工作人员就会提醒你这是一个拍照互动的项目，带小朋友想拍照的可以考虑;[飞跃侏罗纪]现在还没有开放，期待它开放以后的表现&#x0A;🪄哈利•波特的魔法世界&#x0A;哈利波特真的是人很多，一进到园区里就立马有了代入感，感觉自己身处魔法世界，工作人员也非常敬业，让我们拿出麻瓜科技扫麻瓜健康宝😂;[禁忌之旅]非常🉑️，排队过程有一半在室外，大家一定要做好防晒，在室内的过程中哈迷会发现非常多的小彩蛋，排队过程不会很无聊‼️如果有眩晕症的朋友不建议此项目，我都一度觉得有点呼吸困难。[鹰马飞行]游玩过程比较短，有点像丛林飞鼠，绕来绕去的，小朋友可以玩，但是大朋友们如果时间比较紧就建议选择放弃。&#x0A;🎢变形金刚基地&#x0A;一进到主题就感觉到科技感十足，听着霸山虎过山车上的喊叫声就觉得热血沸腾，[霸山虎过山车]上不可以带任何物品，包括手机，眼镜要拿在手上(有条件的朋友请选择隐形眼镜，比较方便一点)，整个过程非常刺激，特别爽，没有很强的失重感，大家放心冲;[火种源争夺战]体验超级好，3D特效，视觉上很有冲击力，但是排队的时间也比较久，可以及时看小程序上的时间提醒，如果时间短别犹豫直接冲！&#x0A;🌊未来水世界&#x0A;水上特技表演，提前20分钟过去就可以，带雨衣的朋友可以选择蓝色座位&#x0A;🦄小黄人乐园&#x0A;比较适合小朋友，都是室内项目，[神偷奶爸闹翻天]前期讲解的时间比较长，像是看了一场动画电影;[萌转过山车]是小型过山车，有小朋友有老人可以体验一下&#x0A;🐼功夫熊猫盖世之地&#x0A;整个主题游乐都在室内，里面像是灯光秀一样很美，[神龙大侠之旅]是水上坐船项目，也是比较适合小朋友和老人;[阿宝功夫训练营]是小朋友的游乐园,看起来很好玩&#x0A;🎬好莱坞&#x0A;[灯光，摄像，开拍]带你了解特效是怎样制作的，排队时间较短，路过有时间可以去看一看;[不可驯服]是训龙高手表演，看好时间提前一点去排队，可以选一个好位置",2021-09-11 发布点评
携程买环球的票价格还是挺有优势的，出票也快。门口扫预约码、身份证直接进园。工作日人不多，排队基本都在20分钟以内。园区不大，比迪士尼小，基本上半天可以刷完。里面喝水吃饭都挺方便。,2021-11-19 发布点评
非常值得去，去过日本大阪的环球度假村，北京的更好玩。园区布置的很漂亮的，最值得去玩的是哈理波特园区，还有花车巡演也很好看，晚上的夜景更美,2021-09-30 发布点评
乘坐地铁直达游乐游安全处非常方便。整个乐游干净整洁，每位员工都很有礼貌，微笑服务，让人倍感亲切。游乐大酒店房间宽敞舒适，被褥干净，早餐非常丰盛好吃，还有萌萌的小黄人陪伴，一家人渡过了快乐的一天。,2021-10-08 发布点评
环境真不错，园内基本都是直饮水，拿杯子接了就喝，排队也没排很久，开园第一天出园还发了纪念品，工作人员态度真的很不错，该玩的也都玩了,2021-09-20 发布点评
很不错，一定要有优速通，没有你会在玩项目前，累死！每个项目都会送你迷宫，让你走的怀疑人生。,2021-09-14 发布点评
挺好&#x0A;【景色】&#x0A;【景色】&#x0A;【景色】&#x0A;【景色】&#x0A;【景色】&#x0A;【景色】&#x0A;【景色】&#x0A;【景色】&#x0A;【景色】&#x0A;【景色】&#x0A;【景色】&#x0A;【景色】&#x0A;先排霸天虎,2021-09-07 发布点评
周边和餐饮真心比国内系的游乐园强很多。就是这边的员工幸福感没境外的高似的，笑的好勉强。&#x0A;全程严肃的居多。&#x0A;为啥没有木乃伊呢？好喜欢木乃伊&#x0A;另外优速通现在到底怎么买？很神秘啊,2021-11-16 发布点评
带老妈过来溜达溜达……因为去过日本的…所以本来没有太多期待……不过演出都是中文了…就对我很有好了……水世界之前就觉得很精彩……这回中文表演之后能明白意思就很完美了……,2021-11-15 发布点评
11.4工作日➕天气冷➕疫情防控收紧多重buff，排队时间很短，最长也就30分钟，90%的项目和70%表演都体验了。大雾天气，还冷，如果排队时间再长的话可能有点难过了,2021-11-05 发布点评
整体感觉还是不错的，游乐设施和环境都对得起大乐园的称号，也有适合小孩子玩儿的，就是门票和里面的东西定价略贵，性价比还是欠缺！,2021-11-12 发布点评
大项目排队一个半小时左右，不过侏罗纪大世界和哈利波特的大项目是值得的，布景和道具带给你非常沉浸式的感受。三把扫帚的饭有些油腻，功夫熊猫的饭刚刚好，非常好吃，汤好喝。,2021-11-06 发布点评
今天头一次入园，算上北京这次环球已经游玩了全世界四个环球主题乐园了，一次好莱坞，一次新加坡一次大阪环球真的是没去一个国家都能感受不一样的环球影城.有的里边和大板挺像哈利波特还有汽车餐厅,2021-09-27 发布点评
很值得去内测所有项目全玩le，没什么人排队。,2021-08-21 发布点评
人不少，但是该玩的都玩完了。大人孩子都很喜欢。推荐哈利波特***、火种源争夺记。,2021-11-29 发布点评
「环球影城」大酒店•功夫熊猫主题套房&#x0A;9.11内测去的，房间很大，没有异味，并不像网上说的那么诡异，还挺好看的，孩子很喜欢。,2021-09-17 发布点评
周六早9点到晚9点玩了一整天下来，感觉还是工作日请假来最合适，会更便宜也更少排队。&#x0A;周末人真的太多了，每个项目都设计的很用心，园区景色也超棒，代入感很强，但排队的过程太消磨乐趣了，每个项目平均30到50分钟全程站立排队，正式体验也就两三分钟。&#x0A;听说还会继续扩展区域和ip，下次会挑个工作日再来玩一下的！,2021-11-27 发布点评
这次来环球玩儿，选择了最近的环球影城大酒店。非常不错，位置很好，下楼就是园区。不论去城市大道还是去乐园搜非常近。宾客关系主任提前一天打来电话，询问入住习惯，还升级了房间。服务非常好。前台陈敬威入住也非常热情，这次玩儿的住的都很不出错。值得推荐。,2021-11-23 发布点评
之前就听说过环球影城大酒店距离园区比较近，但是不清楚具体情况，与朋友及家人带着好奇跟疑惑，周末时去逛了一下。入住时间大概在下午16点左右，住的是好莱坞大道景观房，透过窗户可以欣赏不一样的环球。下午的时候，夕阳透过窗户照在床上，很是温馨。客户经理陈环看我人比较多，上有老下有小的，提前布置好了房间，干净整洁，尽职尽责，进一步提升了入住体验。晚上在房间里，环球的夜景很漂亮，很有城市的现代感，但在房间里又很静谧。入住体验很好。进了园区最推荐的就是***➕霸天虎过山车，不错。玩累了，我是去看了不可驯服的演出，睡了一个踏实。总之，还是很推荐入住环球影城大酒店的，服务得体有礼貌，家人朋友出行很推荐。,2021-11-16 发布点评
非常好的体验。入园相当方便。少走很多路。服务也超赞滴，尤其是人偶们太热情太配合了。房间干净整洁。早餐味道赞赞的。现在去人又少太合适了。感谢客房关系主管张昕卓和前台Devin。特别感谢因为有朋友在同一楼层，还帮我们升级了房间。,2021-11-03 发布点评
把那些所谓的攻略都扔了吧，因为，人少到你闭着眼无脑就能把项目全部刷完，甚至可以二刷三刷N刷，我一天把所有项目都玩遍了，还看了N场演出，这几天买了优速通的一定非常郁闷，优速通仅剩的唯一一点优势就是玩每个项目可以少绕几个圈，少走几步路。当然，最好还是工作日来，周末帝都的家长都会领着神兽来溜娃，人还是比较多的。为什么会那么少人，因为都不让进京了，微博小红书上退票的一大沓，非必要不出X，大家都懂，总之，错过这波，下波再见,2021-10-29 发布点评
来说个攻略:一定要早去，一早人少我们哈利波特直接刷了2遍非常省时间；下个app，去哪里看排队时间，离得近的区可以直接去，要是顺着景区游览顺序玩会赶上聚集人多；表演看好app时间，很有意思，水世界爆破的热浪很强，天冷就别坐前面了；晚上去三条扫帚酒吧吃饭坐外面顺便看灯光秀不排队，但是想看正面就排队去吧，不过能排到你怀疑人生，黄油啤酒我买的纪念杯版，喝完杯子能带回家的；星光大道没啥意思，晚上亮灯很好看，所以白天不要逗留，晚上去拍照合适；一定多带移动电源，我们的用到后面真的是一点点都没有了，园区里想找简直天人说梦。奥对了，如果你穿了巫师袍，园区里的工作人员都会跟你打招呼问好。总之项目都能玩上还能二刷，就看你的时间一定要安排好了，反正我走了3万多步看你们了,2021-10-28 发布点评
工作日，人不多，天气还特别好，所有大项目都刷了一遍，***刷了两次，很愉快的经历。&#x0A;吃饭的话，功夫熊猫里面的私房菜，柠檬鸡腿饭最好吃，晚饭在小黄人的餐厅吃的，味道一般吧，但是能吃饱，大道上也有很多吃晚饭的。&#x0A;从8点半入园，9点才出去，一天走了31000步~不虚此行,2021-10-25 发布点评
周一去的，走了2万9千步。早上8.45到，晚上6.30离开，除了我不能玩的过山车和幼儿向的游艺设备，外加要等80分钟的哈利波特，母亲大人不愿意等之外，其他全都玩了！演出也看了！没有买优速通，全靠硬排！地铁1号线到12月中旬的运营时间有改变，最后一班从环球影城出发的是8点多。&#x0A;全园过山车都是排队大户，最刺激的是霸天虎过山车，不能带包，不能带手机。我进园是app显示排队40分钟。app的排队时间基本比实际排队时间要多15分钟左右，适用于所有游玩项目！&#x0A;演出最好看是不可驯服和未来水世界。&#x0A;霸天虎人气超高，没有固定出现的时间，我那天是11点出来的，听了20分钟单口相声，特搞笑。&#x0A;本来想买小黄人汽车爆米花的，结果那天没出摊，购买地点在欢乐好声音门口。最后买了一个自拍小黄人的爆米花桶，159，爆米花需要另外花钱购买。&#x0A;即使去过新加坡和大阪的环球影城，我依然觉得北京环球值得来！演出都很精彩！花车巡游有点土，比迪斯尼差多了，没时间可以不看！,2021-10-19 发布点评
里面场景设计用心，非常注重细节。三把扫帚餐厅餐饮不错，功夫熊猫面馆味道尚可。但是缺少迪士尼小镇引进的国际型餐饮，特色美食少，许多餐厅装修不错，进去后没什么吃的，好像食堂快餐店。各种节目不错，就是时间短，内容少了一些，未来水世界演出不错！感觉园区游玩内容还需完善丰富！,2021-10-19 发布点评
里面场景设计用心，非常注重细节。三把扫帚餐厅餐饮不错，功夫熊猫面馆味道尚可。但是缺少迪士尼小镇引进的国际型餐饮，特色美食少，许多餐厅装修不错，进去后没什么吃的，好像食堂快餐店。各种节目不错，就是时间短，内容少了一些，未来水世界演出不错！感觉园区游玩内容还需完善丰富！,2021-10-19 发布点评
里面场景设计用心，非常注重细节。三把扫帚餐厅餐饮不错，功夫熊猫面馆味道尚可。但是缺少迪士尼小镇引进的国际型餐饮，特色美食少，许多餐厅装修不错，进去后没什么吃的，好像食堂快餐店。各种节目不错，就是时间短，内容少了一些，未来水世界演出不错！感觉园区游玩内容还需完善丰富！,2021-10-19 发布点评
溜达过来发现人不多就干脆买票进来，周日客流明显不如周六，变形金刚火种源、哈利波特禁忌之旅和侏罗纪的大冒险项目都排到了，个人感觉视觉观感上来说这三个都不可错过。功夫熊猫区的氛围很好，很适合吃个晚饭。哈利波特区域适合晚上压轴区。景区餐饮门票都是那种“常规的贵”。总体来说很值得来体验，特别是对其中的电影有所阅历的朋友，调整好预期前来绝对不虚此行。,2021-10-18 发布点评
三个演出&#x0A;【未来水世界】五星推荐&#x0A;【不可驯服（驯龙高手）】四星推荐&#x0A;【欢乐好声音】四星推荐&#x0A;项目&#x0A;好莱坞：【灯光摄像开拍】四星推荐，排队人最少&#x0A;小黄人乐园：【神偷奶爸小黄人闹翻天】四星推荐&#x0A;侏罗纪：【侏罗纪世界大冒险】四星推荐【飞跃侏罗纪】四星推荐&#x0A;哈利波特：【哈利波特与禁忌之旅】五星推荐&#x0A;变形金刚：【霸天虎过山车】五星推荐&#x0A;【变形金刚火种源争夺战】四星推荐&#x0A;&#x0A;骑乘类项目：哈利波特》变形金刚火种源争夺战》侏罗纪大冒险》神偷奶爸小黄人闹翻天&#x0A;&#x0A;19点-21点的【霍格沃茨&#x20;夜间灯光庆典】，循环播放。&#x0A;花车游行今天是下午一点，每天时间不固定，没看错过app,2021-10-18 发布点评
这环球影城的哈利·波特隐秘之旅，排队排得天昏地暗、天荒地老，看着面前的人潮，曲曲折折、一望无边，几个小时，就是为了看那只爱除你武器的救世之星凛然正气、上蹿下跳。你说，很多人连书都没读熟，却跟风来玩儿这室内项目，最后头昏目眩、眼花缭乱，还要到隔壁小屋中静坐良久，这又是何苦呢？,2021-10-18 发布点评
