内容,时间
 从洛杉矶到日本，环球影城重度爱好者来到新加坡啦！奉上一些小小的经验😆首先是买票问题。我们买了单次快捷票，即可以在玩每个项目可以走一次快速通道（快捷票并非包括所有项目，但涵盖了园区最受欢迎的那些）。如果是在旅游高峰期，比如我们是在12月30日这样的日子，那么快捷票很有用。热门项目的排队时间都在90分钟到120分钟，使用快捷票排队是10到25分钟。还有另一种多次快捷票，即每个项目可以多次优先游玩，我认为没有必要。因为使用快捷票也会耗费排队时间，加上存包、吃饭、拍照的时间，玩完一遍所有热门项目也要到傍晚（按照11点入园来算）。其次必玩项目！变形金刚 ⭐️⭐️⭐️⭐️⭐️ 环球影城经典项目！视觉效果与游玩性完美结合！不会有过刺激不适的感觉。太空堡垒机械战队（灰色轨道）⭐️⭐️⭐️⭐️⭐️园区内一共两个过山车，一个是灰色轨道，一个是红色轨道。相比较而言，灰色轨道更好玩，它是悬挂式的，会有翻转，轨道变化比较多。两个过山车其实都不是很高，也不是很快，不会有强烈失重，算是比较温和的过山车，跟北京欢乐谷的极速飞车相比是小case🤪木乃伊复仇记 ⭐️⭐️⭐️⭐️⭐️室内过山车，很黑，所以看不见什么时候上什么时候下😆属于那种好玩也不会特别惊险的过山车，有一丢丢失重感。侏罗纪河流探险 ⭐️⭐️⭐️⭐️漂流项目，后段比较精彩！不会有不适感。肯定会淋到水！可以提前准备雨衣，排队时有自动售卖机，10新币，推荐提前准备，在普通超市2新币搞定。太空堡垒人类战队 ⭐️⭐️⭐️⭐️红色轨道过山车，真的是不算刺激不会难受的类型。鞋猫剑客历险记 ⭐️⭐️⭐️全球首个《鞋猫剑客历险记》主题悬吊飞车，老少咸宜，也有一定速度与俯冲，不算无聊！芝麻街之意大利面太空战⭐️⭐️⭐️可爱！平缓！史瑞克4D电影之前在洛杉矶玩过，印象中好玩程度是普通水平，大概是三到四星。马达加斯加园区的木箱漂流记实在没时间去了😭因为晚上约了朋友吃饭。接下来是游玩顺序！热门项目都在进园后逆时针方向，所以如果想要避开人群，顺时针或许是不错的选择。我们没有特别关注真人玩偶合影时间，但很幸运的是，恰巧碰上了Gru以及小黄人的时间。都在好莱坞街道，Gru是五点半，小黄人是六点😆,2018-12-31 09:14:24
 早上9：30的环球影城门口已经有很长的队伍了，这很正常。之所以选择在今天来这里，就是想避开周末两天，事实证明这个想法很明智，所以建议大家，不要安排在周末去玩环球影城。在马蜂窝上购买了门票，很优惠，比现场买可便宜不少哦。商家会发送电子邮件给你，打开里面的附件文档，在入口处直接出示给工作人员，扫码就可以进去了。 来到这里，就放下所有的烦恼和心事，尽情去享受此刻的欢乐吧。玩了“木乃伊”和“侏罗纪公园”。也观看了“未来水世界”的真人Show。影城不大，而且有几个小馆还没有开放，即便这样，也足以在里面玩一天了。给大家的建议就是：除非你的行程安排得非常紧张，又或者你觉得都不好玩，那么，请预留至少6个小时(每次排队不超过20分钟的情况下)在这里吧。18：30，心满意足的离开。,2018-12-30 15:30:28
 提前买好电子票，存成二维码截图可以直接扫码进园， 圣淘沙专线需单独购票，EZLINK卡可以直接进站，充值机器只有负2楼地铁出站口有。 进园后不要忘记一定要在入口左侧游客信息栏拿：     ① 导览地图：了解园区整体情况，游玩项目所在位置②时间安排表：注意看好“未来水世界”等的表演时间，方便安排游玩时间。“与角色会面”是影视人物出场合照的时间。以前赶早不赶晚提前去，热门的要排队以免错失合照机会 玩漂流最好自备一次性雨衣，塑料袋装鞋子。现场买5新币。 环球影城绝大多数游览资料和指示都有中文，但是所有项目和演出都是英文演出 新加坡环球影城不大，不知道想玩什么就绕一圈看看。 单人有SINGLE快速通道，除了木乃伊基本都不用排队，不需要买快速卡。 玩木乃伊要存包，免费存放用指纹验证。木桶漂流为怕湿身也会要求存包，但是要收费5新币，所以其实可以都在木乃伊处存包,2018-12-29 20:05:28
 提前在马蜂窝预订的环球影城门票，抱着周一人不多的态度没有买快速票，去了才发现环球影城真的不分周几 永远那么多人！！！奉劝各位小伙伴，还是买快速票吧，那排队的人根本等不起 一个过山车要排队四个小时，这都是后话了。环球影城十点钟开门，建议九点半就去排队。之前简单做了一下攻略，可以逆时针游玩，我们并没有上来直奔变形金刚，我们真的是走一路拍一路，走到哪里都要拍一拍 。先走上了好莱坞大道，有我最喜欢的小黄人商店，每一样都喜欢得不得了，还可以跟小黄人合照，有时间的哈，我们没有特意赶回来，但我们看到了芝麻街的绿色垃圾桶人偶，好喜欢阿。先去玩了芝麻街什么大战意大利面小火车，貌似是小孩子玩的，站排时间一个小时，有点失望 。,2018-12-28 15:24:17
 之前研究半天是否需要优先票，网上说法不一，优先票是可以现场购买的，根据入园情况价格浮动。考虑是淡季，决定入园再看情况购买。过山车，同行的朋友去乘坐了，即便看起来排队的人不多，还是排了一会儿才坐上。环球很多项目除了优先通道，还有专门给单人游客的专门通道，这时候凸显一个人的优势了...木乃伊这个区域，我们完全没有进去...买了环球的摄影券，但是基本没照，很多可以照相的地方都没有提示，最后去取相处时照了的很多照片也都找不到了，感受很不好。对了，自备雨衣很重要，大淘宝几块钱的雨衣比现场的好很多。新加坡的雨总是说来就来，木有任何预兆....我个人很喜欢这个不太惊险又有点儿小心跳的项目，好吧，老母亲的小胆量，确实还不如小朋友....新加坡的环球并不大，然而一天下来，我们竟没有逛完，中间的雷雨耽误了一小会儿，其他时间马不停蹄...总结下来，要想一天逛完，还是得有优先票啊...环球最好玩的是过山车，我们没有体验，环球的餐厅挺多的，但是跟所有乐园一样，就别讲解口感了吧。,2018-12-27 00:59:47
 门票是在网上预订的，凭二维码直接扫码入园，很方便。环球影城的门票是一日票，可以自由进出，如吃完饭再回去也可，出去时工作人员在手背盖个章即可。进园无需验包，可以带食物进园，这里忍不住吐槽上海迪士尼，不能带食物进园这个规定，真的好奇怪。,2018-12-25 17:50:49
" 环球影城当然是必须要去的啦
乐园里的食物肯定是比外面贵的，影城外面有好些吃东西的店铺，有鼎泰丰，价格跟市区的一样，推荐在这里吃。
入园后记得先拿一份园区地图和活动时间表，英文不好的建议拿两份地图，一份中文，一份英文，能更快的就行地图对照，不然你在园区里看到英文地标也弄不明白到底写的是啥
大致规划一下，挑选自己喜欢的项目，还有角色见面时间， 比如 变形金刚见面会、小黄人见面会。
详情参考攻略：http://www.mafengwo.cn/i/8267578.html",2018-12-20 15:56:31
 九点四十五有开园表演，气氛一下子就被烘托起来了。门口排队的人已经不少，但经历过上海迪士尼那种大场面，这点程度的排队那都不叫排队！大家都是慢慢走慢慢看，摆摆POSE拍拍照，逛到哪个玩哪个。不像大阪环球影城和上海迪士尼，一开门一群人往里面狂奔，太恐怖了！,2018-12-20 00:40:49
 进去后大概是逆时针的路线，正巧碰上魔发精灵的主题展，进去前也没做什么攻略，看到什么就玩什么，总体来看，里面的景点还是很家庭的。可以买快速通行，排队久的项目看到用express的还是很幸福的，而且是把整个园区都玩一遍的重要前提。,2018-12-08 15:03:56
" 【环球影城】
下午去环球影城，公交车到圣淘沙站，然后搭一站跨海的轻轨过去，也可以走过去。
这个环球影城不大，但比LA的干净整洁一些，就是逆时针走一圈就玩完了。
过山车不错，LA的环球影城是没有过山车的。变形金刚很震撼，坐了三次，乐园里的声光效果真不一样。有一个攀岩的不错，但是没有带护照，遗憾。还有一个模拟纽约的飓风场景的，也很逼真。
马上春节了，很有过年的气氛。
晚饭在出环球影城右手边的马来西亚美食城解决，吃了肉骨茶和石锅饭，出来漫步圣淘沙和vivo city。",2018-12-05 13:41:08
 我定了电子票和一次的快速票，所以心里想着势必能玩到爽……然而……坐小火车的第一站就是环球影城啦，还在小火车上就能看到许多游客在排队入园，激动的我恨不得下了车拉着老公狂跑……还记得我定的是电子票吗，根据指示先去地下车库的K9位置取了票，然后再回到门口入院。以上是在环球影城的一些照片……总结一下：1.不要跟胆小鬼一起去玩惊险的项目。由于我们买的是单次快捷票，考虑到我老公这个过山车无能的人，即使在工作人员提示我们普通通道也很空的时候，我也义无反顾的选择了把快捷次数用掉。事实证明……太正确了，我老公这个弱鸡坐木乃伊项目的时候鬼喊鬼叫的……以至于我自己心里压力也很大，做完之后人也难受的要死。后来太空堡垒两条线路我都是自己上的，刚好把两个人的快捷次数用完……2.在新加坡那几天都有突发降雨的情况，虽然当时内心有点压抑，不过要及时调整。我们就在下雨的时候去看了斯皮尔伯格的摄影棚（用快捷票还排了20分钟），出来之后就是晴天啦~所以要及时调整路线哦。不过下雨的话汽车人合影会取消，不要傻傻的等哦……3.一定要去看未来水世界……坐在微湿区最后一排很安全的哈哈。4.变形金刚我们2刷了，好看的，好看的。5.侏罗纪河流探险不怎么刺激的，记得带雨披，但是穿了也不能保证百分之百的不会淋湿……比如我，选了位置依然被泼个正着……,2018-12-05 01:05:39
 提到新加坡首先会想到要去的必是环球影城吧……毕竟这里有全亚洲唯一的变形金刚！毕竟这里有人气超高的小黄人！大黄蜂和小黄人都是我的爱。新加坡的环球影城真的超级超级超级小！如果你什么都不玩单纯逛一下的话走一圈最多四十分钟！但若真要把每个项目玩遍不买快速通行券的话也得准备一天的时间。游玩线路推荐:如果你没有买任何快速通行券那么是要准备多一些时间多一些体力来玩的！我建议一进门别管三七二十一、别管什么顺时针游玩逆时针游玩。全力冲刺到科幻城市！你可以先玩两个过山车，因为下午很有可能遇到维修，其次再玩变形金刚，接着木乃伊！总之上午先把这些热门项目玩完，下午主要看看表演玩玩小项目、和影城明星们合照等等！,2018-11-29 15:46:23
 不管是大朋友还是小朋友都能玩得尽兴，有的过山车我都不敢玩，但是好多小朋友都玩得很开心。建议预留一天时间在环球影城，有些项目排队时间比较久，可以买单次快速票，价格是50新币，也有多次快速票，可以找园内工作人员咨询。小贴士：入口处的单人通道比较快，小伙伴们也可以分开玩，节省时间。从蓝色地球正门进来，直接扫描订单上的二维码进场，在入口处先拿中文地图和当天特殊节目表。下午还有跟小黄人见面拍照的时刻，具体时间看当天节目表。正确顺序应该是进门往右走，去科幻城市玩变形金刚。大家一定记得，进门往右走！！往右先！！建议入场后，按主次顺序安排好游玩项目，不要顾此失彼。,2018-11-28 18:06:17
 影城进门后别忘了拿一些说明手册，里面写了什么时间段、哪些区有各种影视人物出来巡游，以及表演项目的时间表，好安排时间和项目。玩了木箱漂流、旋转木马、空中飞车、洛克男孩、好莱坞歌舞、芝麻街的人物、马达加斯加的动物们等等。。。。影城的游戏项目看来是经过精心挑选的，跟经典电影挂钩，又具有自己的特色，很不错。,2018-11-25 18:41:14
 去年在大阪玩了USJ，回味无穷，萌生了想要玩遍全世界环球影城的愿望，所以今年来打卡了USS，不过和USJ对比，USS真的领人失望了····主要原因在于USS实在太小了·····没走两步就到另一个主题园区了，不同主题的园区之间也没有任何过渡和衔接，就是硬生生的拼在一起，甚至在一个主题园区就可以直接望到下两个园区了。去之前在纠结要不要在网上提前买快票，去年USJ很庆幸买了快票，剩了不少排队时间，多玩了很多精彩的项目。看了很多攻略，都说不需要快票，USS比较小，人也不会特别多，合理安排路线一天可以全部玩下来，所以我们决定先不买快票，入园后看看人流量和排队情况再决定。我们担心周末人多，特地选了周一去，没想到周一人也意外的有点多····在想要不要临时买快票，但是那天的现场快票已经涨到150新币了，网上说快票定价会根据人流量临时调整，看了下这么小的园区，还有比门票都贵的快票，果断放弃了····继续排队吧~~在USJ，小黄人有一整个园区，USS只有一家商店和几个玩偶·····温馨提示：1.尽量不要公共假期去，如果不想买快捷票也不想排队的话也尽量避开周末！2.如果合理安排游玩时间和项目顺序，快票是不需要买的！如果真的需要买快票，在某宝提前买比现场买便宜很多！3.门票可以在某宝提前买好，入园刷电子票二维码方便很多！4.建议穿短裤，女生不要穿裙子不要穿裙子不要穿裙子！5.中长发、长发的女生朋友，请准备好皮筋绑头发，尤其是在玩过山车的时候！6.怕晒黑的提前涂好防晒！7.穿舒适的不怕水的鞋，不要穿拖鞋或者高跟鞋！8.带眼镜的朋友请在玩侏罗纪河流探险时保管好！9.项目门口会显示排队时间，大家可以参照，以便安排行程！10.可以提前去新加坡的超市买个雨衣或者自己从国内带一次性雨衣！,2018-11-22 19:29:06
 新加坡 环球影城万圣节惊魂夜（Halloween Horror Nights）今年迈入第八年，2018年的Halloween Horror Nights举办在9月27日至10月31日。曾经犹豫要不要去，想想刚好都碰上我去 新加坡 的日期了，今年不去更待何时，便决定去了吧。我是一个月前买的的早鸟票，一人50新币，凭票可领取一杯可乐。晚上7点半入场，现场有5个鬼屋，3个杀手表演，还有白天环球影城的热门游戏晚上都有开放。我买了星期四的票，不是高峰期，票价便宜些，人潮应该也比较少（其实还是超多人的）。,2018-11-20 20:21:21
" 非常推荐！！新加坡环球影城（Universal Studios Singapore）是耗资43亿2000万美元兴建的圣淘沙名胜世界的重点项目之一，于2010年3月18日正式开放，它是东南亚首个和唯一的环球影城主题公园。新加坡环球影城总共将设有24个游乐设施和景点，其中18个是专为新加坡设计或改造。
关于地点：圣淘沙岛内，我们是坐地铁抵达圣淘沙站，然后换成岛内小火车直接抵达的~
关于门票：某宝购买，电子码直接发送到你邮箱，进门的时候直接手机扫码，非常方便
关于游览：下载环球影城APP，随时观测排队状态，建议逆时针游玩。
关于拍照：可以参考我的游记，很多打卡位都标注了~",2020-02-15 11:38:22
 这次和爸妈一起来旅行的，所以 新加坡 环球影城并没有在我计划安排中，那么路过就拍照留念一下，下次有机会就再来一次吧。,2020-02-09 21:13:07
" 《新加坡@小假期》——
变形金刚3D对决之终极战斗：移动的3D电影？排队约45分钟。是热门又好玩的项目，建议早入园直奔这里
木乃伊复仇记：室内过山车，一片漆黑，会突然往前往后坠落。排队约10分钟。好玩但稍微刺激
芝麻街之 意大利 面太空战、 马达加斯加 木箱漂流记、史瑞克4D影院：适合小小朋友们",2019-11-30 18:12:51
 中午的时候，我们没有选择在环球影城里用餐，而是在环球影城外的美食广场解决的。因为环球影城只是作为圣淘沙旅游岛中的一个娱乐点，所以在环球影城里游玩的旅客当天可以多次出入环球影城（其他圣淘沙景点也是类似的规定）。从环球影城出来的时候，工作人员会在你手臂上盖上一种肉眼看不见的印章，当你重新回来的时候他们就会用紫外线灯照射一下你的手臂，就能看到手臂上的印章了。,2019-10-05 00:25:44
" 大名鼎鼎的环球影城，我倒觉得，门外的旋转地球，才是所有人打卡的目标吧，无数人围着那个球，摆各种造型。
至于里面的游乐设施，放一张表格吧，各位可以参考。
另外，快捷票的话，非寒暑假非节假日的周二周三周四，不需要买快捷票。",2019-09-22 21:06:55
 跟变形金刚拯救世界，过山车探险盗墓，和史莱克迷失在4D世界，漫步在好莱坞……虚拟又那么科技现实，玩一整天，整天的好心情！ 早上大约10点到达，我们买了门票+ Express，差不多700RMB。Express给你不用排队的超级优越感，还给予你整个园区逛2遍的充裕时间。如果时间充裕，建议变形金刚放在最后玩，不然再玩其他就索然无味了。还有过过山车可以分别扮演不同战队角色坐两次，看起来吓人但实际超好玩。埃及过山车会有惊喜和惊吓，同车一个10岁左右的印度女孩玩得哇哇哭。,2019-09-08 18:57:20
 【 新加坡环球影城】是东南亚首个且唯一的环球影城主题公园，七大主题区汇集24项游乐设施，其中18个是专为新加坡独一无二设计的，这让我们的探索欲望飚到了顶点。,2019-09-06 16:59:57
 没什么可说的，必玩的地方！主要纠结的点是根据自己的情况买快捷票，我们买的是一次的快捷票，除了太空堡垒没玩（不敢）以外，其他所有项目全部都玩了。个人觉得最好玩的：变形金刚，最好看的：未来水世界，这两个是唯一唰了两遍的。遥远王国、侏罗纪公园里的项目都还不错，比较失望的是埃及古文明，芝麻街和马达加斯加适合低龄儿童。,2019-09-02 17:18:24
 新加坡环球影城，拥有多项顶尖独特的游乐设施与景点，融汇电影主题的崭新项目及表演，其中包括：变形金刚3D对决之终极战斗、史瑞克4-D影院、 马达加斯加 、木箱漂流记、侏罗纪河流探险、太空堡垒双轨过山车等！这里真的是个浓缩的 好莱坞 世界，到处都是适合凹造型的道具场景。24个游乐设施和景点，包括古 埃及 、失落的世界和 好莱坞 大道等七个主题区，重现电影世界的神奇，掀开探险旅程的序幕。随着不同电影的剧情，从一个荧幕转移到另一个，沉浸在星光大道的耀眼光芒中。这个宽容度最 大化 的世界级别游乐场，可以满足各年龄段孩子的需求，汲取了欧、美、日环球影城的精华。强烈建议大家一开园就进来玩，如果热衷于玩项目，还是买快速 通道 卡比较好。环球影城的经典项目，当然是深具创意的变形金刚3D对决和世界最高的双轨过山车，这些精彩刺激的娱乐项目，瞬息变化的炫目转变，绝对会引发嘶喊尖叫。其实要在这里找到无人拍摄场景并不是很困难的事情， 好莱坞 街道分分钟出片。谁说来到这里一定要排队刷项目，做自己喜欢的样子本身就是令人雀跃的事情。在这里，每一个游客都是自己的主角，它的多元性承载的是文化和艺术的融合，还有悠久的历史，它们彼此和谐共存，互相尊重，也互相包容。,2019-09-01 19:02:07
 磨蹭到十点半入园，当天早上在酒店用手机在飞猪网购买的门票两大一小926，直接凭电子票入门，无需兑换纸质票，在入口处打开手机扫一下电子票的码即可。门口会有安检有没有外带食物，这个是不允许的。可以带个水瓶，园内都有直饮水。我们是按照逆时针顺序玩的，我们算是胆子比较小的，同样是胆子小的可以参考我家胖丫头情况。1、马达加斯加-木箱漂流记2、鞋猫历险记-悬吊飞车就是小型过山车，看起来不是很有坡度，但实际上对于胆小的孩子还是有难度，我家胖丫头小脸已吓白。3、失落世界-漂流。里面有个段落是从下面缓慢升起，门开之后，走过一段颠簸一下子冲下去水花四溅，胖丫头说这最害怕。提前在淘宝上买的雨衣，听说坐在边上会全部湿身，所以我们仨全副武装。4、未来水世界。老于坚持演出结束后会有彩蛋，果不其然我们的彩蛋是我们仨与演员们拍全家福。棒棒哒🎈🍾️🎉🎊🎉。ps：这个女主角貌似很喜欢小胖子，一直在向她发出邀请“一起拍照啊”，我家胖丫头还有点腼腆，不好意思过去。5、小汽车排了45分钟6、芝麻街,2019-06-22 13:31:28
 2016年10月，环球影城的票从淘宝搞定的，建议买极速通过的票，有些项目是无需排队的，变形金刚的那个真的刺激哦 哈哈,2019-06-17 14:19:55
 新加坡的环球影城和其他相比是最小的一个了，但如果要玩爽，也还是请赶早。九点半门口排队，9点50就放进去了，进门别管三七二十一先往逆时针方向冲，如攻略所说，变形金刚，木乃伊，双轨过山车，工作日基本可以包场，节假日双休日快捷票还是很需要的。木乃伊连着刷了两遍，位子随意挑。。。表演时间事先看好，不要错过。中午开始还有很多卡通人物出来拍照，也是有时间的。准备出门前过山车可以再去刷一遍，基本不需要排队了。,2019-06-11 17:40:16
" 位于圣淘沙度假区，
比起美国、日本的环球影城，新加坡的环影有点小呀。
虽然小，依然足够吸引人！必竟拥有变形金刚等电影资源。是个有故事的乐园。",2019-06-09 12:23:53
 比想像中小很多，但不乏吸引人的魅力。一大早在門口等待著開園，之後狂奔到雙過山車，沒有排隊還坐在第一排實在是刺激。美中不足下午下起了暴雨，有些外部的遊樂設施關閉，兩小時後才逐漸停止，彌補了其他的項目。還是很開心的一天。,2019-06-06 23:44:48
" 早上9点30之前到达了环球影城，在那个蓝色大地球前拍了几张照片就赶紧去排队了。去之前听说是10点开门，但那天实际是9:45就开门了。入园前有一个短短的秀，尖叫声最高的可以得到快递 通道 票。
整个游乐园最刺激的就是这个太空堡垒双轨过山车了，也就是俗称的“红灰过山车”，但是呢，我和小伙伴都是不敢玩的，只有看看的命。
一开门千万别去拍照啊，一路快走先去玩变形金刚3D对决，几乎没什么人，不用排队。这个项目其实不刺激的，但是因为戴着3D眼镜，坐第一排的小伙伴表示太有带入感了。
侏罗纪河流探险11点才开始，类似于一个圆形的橡皮艇，一船可容纳9个人。漂流一点不刺激，其实有点点无聊。怕弄湿，我们自己带了雨衣去，没有带的小伙伴也可以在自助贩卖机上买，5坡币一件。
我们买快速 通道 票了嘛？No、No、No……
但是，所有我们玩的项目排队没有超过10分钟，非节假日游客真的不多。比较遗憾的是没有看到大黄蜂出来互动。",2019-05-28 10:51:18
