标题,出发时间,逗留时间,费用,游玩人数,游玩方式,观看量,途径,行程
呼伦贝尔、阿尔山4日自由行在北方的北方，请签收这份秋日的温暖,2020-09-17 出发,共4天,人均2300元,闺蜜,深度游 购物 美食 自驾 摄影 赏秋 国庆,1.8万,途经：阿尔山Aershan 兴安盟 扎兰屯 ,行程：阿尔山 驼峰岭天池 阿尔山火车站 乌苏浪子湖 三潭峡 柴河月亮小镇 哈拉哈河 石塘...
赴一场阿里之约丨西藏的“西藏”我终于来了,2020-09-10 出发,共15天,人均13000元,三五好友,深度游 美食 自驾 摄影,3.2万,途经：那曲 阿里 山南 日喀则, 
皖南古村落,2020-10-26 出发,共1天, , ,美食 摄影,372,途经：黄山 ,行程：皖南古村落 太平湖 西溪南古村落 黄山风景区 黄山北站
稻城亚丁丨秋日里的香格里拉之魂,2020-10-14 出发,共11天,人均5600元,情侣,深度游 美食 自驾 摄影 赏秋 国庆,9809,途经：稻城 甘孜 康定 阿坝 泸定 ,行程：稻城亚丁 海螺沟晓拾客栈 派酒店(康定下桥店) 稻城四季莲花客栈 岷山行者牧心酒店(...
（下）桂林、阳朔、柳州、北海 11日游，太脏广西，遍地垃圾,2020-10-13 出发,共11天,人均2500元, ,骑行 赏秋,5.2万,途经：阳朔 桂林 北海 柳州 ,行程：阳朔站 兴坪汽车站 阳朔 十里画廊 月亮山 遇龙河步道 遇龙河 良宿空中观景旅拍餐...
（上）桂林、阳朔、柳州、北海 11日游，太脏广西，遍地垃圾,2020-10-13 出发,共11天,人均2500元, ,骑行 赏秋,1.4万,途经：阳朔 桂林 ,行程：十里画廊 漓江 东西巷 靖江王府(独秀峰) 日月双塔 象山景区 逍遥楼遗址 七星景区...
食光者∣2020年10月广府四城八日行记,2020-10-01 出发,共8天,人均4500元, ,美食 海滨海岛 中秋节 摄影 国庆,1.7万,途经：广州 佛山 珠海 ,行程：珠江 光孝寺 白云山 佛山祖庙 叶问堂 黄飞鸿纪念馆 民信老铺(华盖路店) 顺德鱼生...
【北境秋天的油画】2020年中秋国庆6日呼伦贝尔追赶深秋的草原和森林,2020-10-22 出发,共1天, , ,自驾 赏秋,3.4万,途经：呼伦贝尔 额尔古纳 ,行程：海拉尔 恩和 月亮泡子 临江屯 老鹰嘴 太平村 黑山头 七卡 室韦
KK红枫之邀，辽宁赏秋,2020-10-24 出发,共5天,人均3000元,三五好友,深度游 赏枫 徒步 赏秋,8326,途经：沈阳 ,行程：沈阳故宫 张氏帅府博物馆 沈阳金融博物馆 怪坡 沈阳世博园 “九•一八”历史博物馆...
四天三晚，在三亚体验舒适的度假慢生活~,2020-09-11 出发,共4天,人均2800元,三五好友,购物 美食 海滨海岛,2.7万,途经：三亚 ,行程：三亚湾假日度假酒店 阿浪海鲜 三亚国际免税城 稍微秀创意品味餐厅
厦门-云南(昆明-丽江-泸沽湖-香格里拉-大理)8日自驾游,2020-10-01 出发,共8天,人均2180元,三五好友,深度游 自驾 国庆,1831,途经：香格里拉Xianggelila 丽江 大理 泸沽湖 昆明 ,行程：虎跳峡 丽江古城 松赞林景区 纳帕海归青草原 独克宗古城 普达措国家公园 洱海...
走进无锡，太湖江畔好风光，爱上拈花湾、灵山圣境好壮美,2020-10-17 出发,共3天,人均1000元,三五好友,美食 古镇 摄影 赏秋 国庆,3.4万,途经：无锡 灵山 ,行程：无锡山居壹聚民宿 灵山大佛 灵山梵宫 九龙灌浴 灵山胜境 拈花湾 花筑·无锡梵舍客...
普吉清迈吃逛吃,2019-12-26 出发,共8天,人均3000元,情侣,美食 寒假 毕业游 冬季,1.6万,途经：泰国(普吉岛Phuket 皮皮岛Phi Phi Islands 清迈Chiang Mai) ,行程：潘基艾莉芬特布兰克度假屋(Ban Elephant Blanc) 卡塔海滩 拉崴海滩 班芝温泉渡假酒店...
周庄，西塘，乌镇7日游,2020-10-17 出发,共7天,人均7000元,情侣,古镇,4166,途经：嘉兴 周庄Zhouzhuang 乌镇Wuzhen 西塘Xitang ,行程：西塘御雅轩客栈 乌镇枕水度假酒店 乌镇水巷驿
【马玛丽旅行志】疫情之后，所有的度假感，都属于三亚（已更10家酒店攻略）,2020-10-19 出发,共30天,人均10000元,三五好友,深度游 美食 自驾 摄影,23.2万,途经：三亚 ,行程：三亚亚龙湾铂尔曼别墅度假酒店 海棠湾 三亚海棠湾阳光壹酒店 凤凰国际机场 蜈支洲岛...
深秋一人游北疆,2020-10-10 出发,共7天,人均6000元,独自一人,环游 自驾 赏秋 国庆 第一次,1.8万,途经：喀纳斯Kanasi 布尔津 乌鲁木齐 ,行程：禾木风景区 五彩滩 布尔津县 观鱼台 喀纳斯景区 贾登峪 月亮湾 禾木桥 喀纳斯图
极度闲散的天津3日游,2020-10-03 出发,共4天,人均3400元,闺蜜,中秋节 国庆 第一次,8001,途经：天津 ,行程：天津大学 世纪钟广场 津湾广场 全季酒店(天津津湾广场店) 五大道 西开教堂 静园...
漫步云南，梦一场秘境雨崩,2020-09-20 出发,共10天,人均6500元, ,漫游 古镇 摄影 徒步 赏秋,2.9万,途经：梅里雪山Meilixueshan 丽江 ,行程：雨崩村 丽江古城 蓝月谷 束河古镇 云南小粒咖啡 月亮湾 茶马古道 冰湖 下雨崩...
国庆中秋山西全家7日游——跨越1300多公里欣赏祖国大地上的别样风景,2020-10-14 出发,共8天,人均2500元,家庭,自驾 国庆 第一次,2243,途经：大同 五台 ,行程：云冈石窟 龙聚祥烧麦馆 大同城墙遗址 五台山
丽江游记,2020-10-13 出发,共7天, , , ,4107,途经：丽江 ,行程：丽江古城 丽江三义国际机场 玉龙雪山
关东情：阿尔山到长白山，满洲里到北极村，五大连池到鸭绿江，东宁要塞。,2020-07-20 出发,共20天,人均5500元,独自一人,环游 自驾 夏季 第一次,5760,途经：漠河 长白山Changbaishan 五大连池 阿尔山Aershan 霍林郭勒 满洲里 额尔古纳 哈... ,行程：北极村 长白山 五大连池风景区 阿尔山 可汗山 三潭峡 地池 天池 杜鹃湖 41号界...
秋日海滨，只想在此虚度时光【濑户内海】,2019-11-17 出发,共7天, ,闺蜜,美食 海滨海岛 赏秋,7.8万,途经：日本(高松Takamatsu) ,行程：直岛 金刀比罗宫
【河南】独行中原，惬意之旅,2020-09-18 出发,共7天, ,独自一人,漫游 古镇,4.1万,途经：登封 洛阳 ,行程：观星台 少林寺 嵩阳书院 洛阳博物馆 龙门石窟 洛邑古城 洛阳龙门站 关林庙 白马...
【北京】京郊水镇，后疫情生活中收获的意外惊喜,2020-09-02 出发,共2天,人均1000元,独自一人,古镇,19.2万,途经：北京 古北水镇Beijingwtown ,行程：古北口司马台村水镇 古北水镇
大理丽江：这里的空气有点稀薄，人们过着乌托邦的生活,2020-09-15 出发,共5天,人均3000元,三五好友,美食 古镇 自驾 摄影,3.8万,途经：丽江 大理 ,行程：拉市海 雪嵩村(玉湖村) 束河古镇 大理古城 泸沽湖 洱海 苍山 玉龙雪山 丽江古城...
飞越到北纬18度南国，做一次10月的候鸟，（三亚吃住游全攻略）,2020-10-10 出发,共1天, , ,漫游 美食,5万,途经：三亚 ,行程：大小洞天 亚龙湾 南山寺 崖州古城 海月广场 大东海 小东海 三亚河 第一市场...
这么炫的天下第一关见过吗？逛古城爬长城，山海关访古美食之旅,2020-09-26 出发,共2天,人均300元,三五好友,美食 古镇 中秋节 摄影 国庆,2.7万,途经：山海关 ,行程：天下第一关 山海关 老龙头 山海关古城景区 角山 王家大院 孟姜女庙
开封旅游，走进清明上河园，一朝步入画卷 一日梦回千年,2020-09-28 出发,共2天,人均2500元, , ,10.9万,途经：开封 ,行程：清明上河园 虹桥
特殊年份的西南（贵州 云南）游历记,2020-10-10 出发,共23天, ,家庭,自驾 赏秋,2891,途经：镇远 石阡 江口 黎平 荔波 昆明 兴义 贵阳 蒙自 建水 锦屏 从江 通海 印江 ,行程：大河关码头 青龙洞 镇远古城 祝圣桥 万寿宫 四方井巷 梵净山 老金顶 翘街 堂安...
完美错过疫情的三亚亲子假期超全攻略（四家丰俭由人的酒店及美食攻略）,2020-06-04 出发,共7天,人均4000元,亲子,美食 海滨海岛 摄影 夏季 探险 第一次,2.2万,途经：三亚 ,行程：亚龙湾 海棠湾 后海 香蕉船 三亚湾 大东海 情人桥 亚龙湾热带天堂森林公园 海南...
再遇丽江，彩云之南下，属于我的风花雪月,2020-10-01 出发,共4天,人均4000元,独自一人,深度游 美食 古镇 赏樱 国庆,1.3万,途经：丽江 ,行程：四方街 狮子山 大研花巷 丽江古城 大研古城 丽江粑粑 玉龙雪山 木府 樱花餐厅...
国庆中秋双节，食在广州,2020-10-05 出发,共4天,人均2700元,情侣,美食 中秋节 国庆 第一次,1.6万,途经：广州 ,行程：北京路步行街 珠江夜游天字码头 穗银肠粉店 黄埔军校旧址纪念馆 敏华冰厅(天河城店)...
皖美初见*水墨宏村诗画西递梦里徽州自驾六日游,2020-10-03 出发,共6天,人均2000元,情侣,深度游 美食 自驾 国庆,4067,途经：黟县 黄山 歙县 淮安 ,行程：宏村景区 太平湖 宏村徽风苑客栈 木坑竹海 塔川 南屏景区 汪氏宗祠 月沼 南湖...
疫情后国庆假期的广西之旅~~~,2020-10-03 出发,共5天,人均2700元,家庭,美食 国庆 第一次,1.6万,途经：阳朔 桂林 柳州 龙脊梯田The longji yao and zhuang ethnic terrace ,行程：十里画廊 两江四湖 金龙桥 遇龙河漂流 东西巷 兴坪古镇 日月双塔 象鼻山景区...
带着老妈去旅行4（庐山—西湖—乌镇—苏州）,2020-10-01 出发,共8天,人均2222元, ,穷游 中秋节 徒步 国庆 第一次,3247,途经：庐山市 苏州 ,行程：五老峰 芦林湖 如琴湖 三宝树 乌龙潭 悬索桥 美庐 花径 仙人洞 锦绣谷 大天池...
桂林5日游,2020-09-26 出发,共6天,人均4000元,独自一人,中秋节 国庆,18.7万,途经：阳朔 桂林 ,行程：兴坪古镇 相公山 西街 遇龙河 十里画廊 阳朔如意峰 阳朔 桂林香江大饭店 龙胜韶...
2020年国庆—— 《从你的全世界路过》之理塘、乡城行,2020-10-01 出发,共1天,人均1500元,家庭,自驾 中秋节 国庆,3.9万,途经：康定 理塘 乡城 ,行程：新都桥 卡子拉山 折多山 理塘县
郴州东江湖自由行,2020-10-07 出发,共2天,人均298元,三五好友,自驾 暑假 毕业游 摄影 国庆,9.7万,途经：郴州 ,行程：仰天湖大草原 雾漫小东江
初遇嵊泗—不负嵊夏好时光，泗乎太安逸,2020-10-06 出发,共5天,人均4000元,三五好友,美食 第一次,13.8万,途经：嵊泗 ,行程：无人村 后头湾村 基湖沙滩 东崖绝壁 小洋山 枸杞岛 东海渔村 花鸟岛 黄龙岛...
第一次西藏旅行的14天，探访高原9个藏族村落,2020-09-10 出发,共14天,人均6000元,三五好友,深度游 摄影 第一次,3.2万,, 
青海甘肃大环线——在荒芜中穿越惊喜,2020-09-19 出发,共8天,人均8000元,三五好友,深度游 环游 自驾,1330,途经：海西 敦煌 西宁 ,行程：俄博梁 莫高窟 茶卡盐湖 曹家堡机场 塔尔寺 沙力海 大柴旦翡翠湖旅游景区 伊布拉...
成都，撑肚！成都的旅途中，少不了美食的“浓墨重彩”,2020-09-21 出发,共4天,人均3000元,三五好友,美食 古镇 夏季 赏秋,2万,途经：成都 ,行程：火锅 大公园 作品
1日游,2020-09-30 出发,共1天,人均30元, , ,19.5万,途经：北京 ,行程：北京植物园
泡酒店、吃美食、沙滩玩耍，三亚亲子游的正确打开方式！,2020-09-17 出发,共5天,人均2500元,亲子,美食 海滨海岛 自驾 国庆,2.6万,途经：三亚 ,行程：凤凰国际机场 三亚湾 三亚亚特兰蒂斯失落的空间水族馆 三亚亚特兰蒂斯水世界 三亚亚...
带你吃遍大理的43种特色美食，这里可不只有“风花雪月”，附6日行程规划,2020-09-28 出发,共6天,人均3000元,情侣,深度游 美食 古镇 暑假 国庆,15.8万,途经：大理 ,行程：大理大学 洱海 大理学院 喜洲 苍山 漾濞海英卷粉(2店) 大理古城 喜洲粑粑 德宏...
济南、曲阜、泰安游   作者  黎明之光,2020-08-19 出发,共11天,人均3060元,家庭,深度游 夏季,3.6万,途经：济南 泰安 曲阜 ,行程：大明湖 趵突泉景区 大明湖景区 百花洲 关帝庙 泉城路 山东省科技馆 泉城广场...
说走就走去银川,2020-09-19 出发,共5天, ,独自一人,赏秋,6186,途经：银川 吴忠 ,行程：银川河东国际机场 中阿之轴 览山公园 镇北堡西部影城 西夏陵国家考古遗址公园 青铜...
西藏侣行.自驾&摄影拉萨及周边七天六夜这样玩,2020-09-11 出发,共7天,人均4000元,情侣,环游 自驾 摄影 赏秋,2.7万,途经：拉萨 定日Dingri 浪卡子 日喀则 ,行程：八廓街 珠穆朗玛峰 布达拉宫 珠峰大本营 羊卓雍措 珠穆朗玛国家公园 小布达拉...
九月9天 云南之旅（昆明、大理、丽江）,2020-09-13 出发,共9天,人均3000元, ,古镇 赏秋,1.4万,途经：昆明 大理 丽江 ,行程：滇池 公园1903 翠湖公园 近日楼 大理站 洱海 大理古城 喜洲 丽江火车站VIP服务...
端午去台湾，绕了个圈，吃得很饱,2018-06-13 出发,共12天, ,情侣,穷游 美食 摄影,1.1万,途经：桃园 台北Taipei City 台中 南投 台南Tainan 垦丁Kenting 恒春Hengchun 台东... ,行程：桃园机场 西门町 西门红楼 中正纪念堂 宁夏夜市 台北车站 宫原眼科 台中火车站...
西行漫记——鲁西南巡游,2020-09-10 出发,共4天, , ,古镇 自驾,2757,途经：枣庄 聊城 济宁 ,行程：台儿庄古城 山陕会馆 中华水上古城 东昌湖 光岳楼
走进精致开放的梦幻海滨小城——威海四日休闲游,2020-09-17 出发,共4天,人均2000元,独自一人,美食 海滨海岛 暑假 短途周末 徒步 国庆,20.5万,途经：威海 ,行程：猫头山 威海国际海水浴场 小石岛 威海公园 韩乐坊 火炬八街 海源公园 一战华工纪...
在云端,2020-09-12 出发,共8天,人均5000元,三五好友,深度游 自驾 赏秋,1.5万,途经：大理 丽江 香格里拉Xianggelila 大理市区 昆明 ,行程：洱海 丽江三义国际机场 丽江古城 玉龙雪山 丽江千古情 虎跳峡 普达措国家公园...
追赶夏季的尾巴--嵊泗列岛4日游,2020-09-14 出发,共4天,人均1600元, ,夏季 第一次,19.6万,途经：嵊泗 ,行程：东海渔村 赤膊山 六井潭 和尚套 沈家湾客运码头 嵊山岛
奔赴四川的未知旅行，享受慵懒惬意的慢生活,2020-09-17 出发,共1天, ,独自一人,赏秋 第一次,2.5万,途经：九寨沟 成都 ,行程：九寨沟风景区 浴室 火锅 九寨沟爱情海景区 武侯祠 作品 金沙遗址博物馆 宽窄巷子...
三亚吃货漫游记，无处不自在,2020-08-23 出发,共3天,人均2000元,情侣,购物 漫游 美食 海滨海岛 暑假,1.7万,途经：三亚 ,行程：三亚湾 海棠湾 摩托艇 蜈支洲岛 观海长廊 情人桥 观日岩 情人岛 海底漫步 香蕉...
吉林——沿长白山一路向东北到中国版图鸡嘴,2020-09-30 出发,共7天, ,家庭,深度游 自驾 中秋节 赏枫 国庆,1637,途经：秦皇岛 长白山池西Changbaishanchixi ,行程：山海关 长白山西坡景区
倔强、妩媚、多舛的生命，它就在秋日额济纳旗的胡杨林,2020-10-10 出发,共6天,人均3000元,三五好友,深度游 自驾 赏秋 第一次,1438,途经：额济纳旗Ejinaqi 银川 ,行程：巴丹吉林沙漠 居延海 策克口岸 东风航天城 大漠胡杨林景区
武夷山4日游,2020-09-09 出发,共4天,人均1300元,独自一人,徒步 赏秋,20万,途经：武夷山 南平 ,行程：武夷山 中华武夷茶博园 武夷山九曲溪 一线天 玉女峰 大红袍景区 天游峰 武夷山桃...
普陀山，东极岛3日游,2020-09-09 出发,共4天,人均2400元,独自一人, ,20.4万,途经：东极岛Dongjidao 普陀山Putuoshan, 
一年一次的旅游攻略,2020-09-03 出发,共8天,人均3200元,情侣,环游 美食 古镇 踏春 夏季,2万,途经：婺源 成都 重庆 ,行程：婺源篁岭 汪口 江湾景区 三清山 婺源站 宽窄巷子 锦里古街 冒椒火辣 武侯祠...
成都深度游｜旅行博主去了三次成都总结这篇游记带你游遍成都（满满干货奉上）,2020-09-12 出发,共1天, , ,深度游 美食,1.3万,途经：成都 ,行程：春熙路 大慈寺 子非 停车场 武侯祠 宽窄巷子 井巷子 西村大院 鹤鸣茶社 人民公...
三亚行摄录：「夏末·秋初」海岛浪行记（吃住行全攻略）,2020-09-11 出发,共1天, , ,漫游 美食 海滨海岛 摄影 夏季 第一次,1.4万,途经：三亚 陵水 ,行程：三亚湾 西岛 分界洲岛 大东海 小东海 椰梦长廊 夏日百货 海月广场 牛王岛 不仔...
魅力西北大环线，带上爱的人出发,2020-08-30 出发,共6天,人均5700元,三五好友,环游 赏秋 第一次,19.7万,途经：敦煌 祁连 青海湖qinghaihu 海西 嘉峪关 门源 西安 ,行程：莫高窟 祁连大草原 青海湖 小火车 茶卡盐湖 翡翠湖 鸣沙山月牙泉 月牙泉 鸣沙山...
【可可西里+絲绸之路】大西北“青、甘”环线之旅,2020-08-27 出发,共12天,人均8000元,情侣,深度游 环游 美食 赏秋,3721,途经：格尔木 海西 敦煌 兰州 ,行程：东台吉乃尔湖 艾肯泉 茶卡盐湖 昆仑山口 察尔汗盐湖 大柴旦翡翠湖旅游景区 雅丹魔...
突袭三亚！72小时倒计时，这次三亚旅行我拒绝平庸！,2020-08-17 出发,共3天,人均2000元,情侣,美食 夏季,1.4万,途经：三亚 ,行程：天涯海角 椰梦长廊 太阳湾 小海豚海鲜广场(三亚湾店) 萌哒哒椰子鸡 大东海 三亚湾...
每一个不曾起舞的日子，都是对生命的辜负--阳朔三日游,2020-09-18 出发,共3天,人均2000元,三五好友,短途周末 摄影 赏秋 第一次,5589,途经：阳朔 贵阳 桂林 ,行程：阳朔 十里画廊 贵阳北站 金龙桥码头 贵阳云尚小筑精品客栈 阳朔站 夕拾花舍(阳朔...
余夏金秋去三亚：6天5晚“玩在当地，吃在当季”的三亚纪忆·夏日食光,2020-08-27 出发,共6天,人均6000元,情侣,深度游 美食 海滨海岛 夏季 赏秋,1.6万,途经：三亚 ,行程：帆船 三亚湾 西岛 天涯海角 老爸茶 情人桥 海月广场 第一市场 三亚福朋喜来登酒...
想去人少的海边看这里——东山岛、潮州、厦门、鼓浪屿9天8晚自驾游，用心记录！,2020-08-15 出发,共9天,人均5300元,家庭,美食 自驾 夏季 第一次,4.2万,途经：东山 潮州 厦门Xiamen ,行程：东山岛 金銮湾沙滩 金銮渔家 广济桥 牌坊街 哆啦A梦好久不见鲜果饮 阿彬牛肉火锅(...
这些年你欠重庆的电影票应该补上啦！神雕侠旅带你重庆电影取景地巡礼。,2020-08-15 出发,共4天,人均2500元,情侣,美食 自驾 摄影 夏季,2.1万,途经：重庆 ,行程：解放碑步行街 中山四路 解放碑 皇冠大扶梯 海棠溪筒子楼 洪崖洞民俗风貌区 嘉陵江...
2020年8月，看大理风花雪月,2020-08-26 出发,共3天, , ,蜜月,7.8万,途经：大理 ,行程：苍山 大理古城南门 大理古城 大理站 寂照庵 洱海
在重庆˙归故里|2天走完重庆最复古的4个小众打卡点,2020-08-25 出发,共2天,人均300元,闺蜜,摄影,23.2万,途经：重庆 ,行程：洪崖洞重逢1980街区 两江国际影视城（民国街） 解放碑步行街 解放碑 龙兴古镇 黄葛...
蓝色土耳其,2018-10-06 出发,共8天,人均8000元,三五好友,跨年 国庆 第一次,2.7万,途经：土耳其(伊斯坦布尔Istanbul) ,行程：博斯普鲁斯海峡 蓝色清真寺 圣索菲亚大教堂 Istinye Park购物中心 贝勒贝伊宫 地下...
川进青出 圆梦拉萨,2020-08-25 出发,共14天,人均8000元,家庭,自驾 赏秋,304,途经：泸定 稻城 林芝 拉萨 ,行程：磨西古镇 海螺沟 贡嘎山 稻城亚丁 洛绒牛场 五色海 牛奶海 波密 鲁朗国际旅游小...
漫步济南，一个惊艳到我的城市，超乎我的想象！,2020-08-20 出发,共4天,人均1000元,家庭,漫游 自驾 暑假,8689,途经：济南 ,行程：大明湖 黑虎泉 山东博物馆 趵突泉景区 宽厚里 百花洲 大明湖景区 济南宽和居四合...
2020朵朵家一路向西之西行记,2020-08-13 出发,共9天,人均3000元,亲子,自驾 暑假,2.9万,途经：红原 ,行程：长江黄河分水岭
遇见别样三亚，只知这里风景美如画，殊不知历史也传奇（内附美食攻略）,2020-07-16 出发,共1天, ,闺蜜,深度游 美食 古镇 摄影,12.4万,途经：三亚 ,行程：椰梦长廊 太阳湾 海棠湾 南山寺 后海村 小东海 分界洲岛 三亚湾 亚龙湾 大东海...
相约稻城亚丁，人生不可缺少的毕业旅行，我们的夏日稻城亚丁之行,2020-06-09 出发,共9天,人均5000元,三五好友,深度游 自驾 暑假 毕业游 摄影 夏季,11.5万,途经：稻城 ,行程：稻城亚丁 兔儿山 仙乃日 洛绒牛场 冲古寺 扎灌崩 央迈勇 牛奶海 五色海
牵你的小手，我们去看夏季的呼伦贝尔大草原,2020-07-18 出发,共7天,人均5000元,亲子,自驾 摄影 夏季,9178,途经：呼伦贝尔 ,行程：海拉尔 冷极村 呼伦贝尔大草原 巴尔虎草原 巴尔虎蒙古部落民俗旅游度假景区 大兴安
【带着手绘去旅行】呼伦贝尔5天4晚自驾游，邂逅清新夏日——呼伦贝尔大旅游攻略,2019-06-16 出发,共5天,人均5000元,三五好友,美食 自驾 摄影 夏季 探险,9596,途经：呼伦贝尔 ,行程：呼伦贝尔大草原 海拉尔
轻舟已过万重山——桂林/阳朔/龙脊梯田行摄记【桂林旅游攻略】,2018-07-25 出发,共5天,人均3000元,家庭,深度游 摄影 夏季,15.7万,途经：桂林 ,行程：漓江 银子岩 象山景区 两江四湖 独秀峰 叠彩山 日月双塔 两江国际机场 崇善米粉...
9日游,2020-08-01 出发,共9天,人均5600元,三五好友,自驾,3.6万,, 
在三亚住了一个月，我发现这些酒店最值得带宝宝去！,2020-08-18 出发,共18天,人均25000元,家庭,深度游 暑假 摄影 夏季,5.7万,途经：三亚 ,行程：三亚海棠湾阳光壹酒店 三亚保利瑰丽酒店 三亚亚特兰蒂斯失落的空间水族馆 三亚半山半...
2020  一大家子 5大2小 青甘大环线走起！！（西宁出发-顺时针线路）,2020-08-09 出发,共8天,人均5000元,亲子,深度游 环游 自驾 暑假,25.5万,途经：西宁 兰州 敦煌 张掖 瓜州 ,行程：曹家堡机场 中川机场 鸣沙山月牙泉 莫高窟 敦煌影视古城 沙洲市场 鸣沙山 祁连山...
呼伦贝尔亲子游，原来你也可以很温情【呼伦贝尔大草原旅游攻略】,2019-06-05 出发,共5天,人均3500元,亲子,深度游 自驾 摄影 夏季,9959,途经：呼伦贝尔 ,行程：呼伦贝尔大草原 海拉尔 大兴安岭 贝尔湖
经转摇出了你的神秘,2020-07-28 出发,共14天,人均5000元,亲子,美食 自驾 暑假,1.5万,途经：黄果树Huangguoshu 西宁 德钦 当雄 安多 ,行程：黄果树瀑布 大佛寺 白马雪山 飞来寺 玛尼堆 唐古拉山 纳木措国家公园 纳木措...
呼伦贝尔大草原❀林深时见鹿，梦醒来见你❀呼伦贝尔大草原,2020-08-17 出发,共1天, ,家庭,环游 暑假 摄影 夏季,9632,途经：呼伦贝尔 ,行程：呼伦湖 海拉尔 呼伦贝尔大草原
避暑度假到云南，昆明玩不够的是古滇,2020-08-06 出发,共5天,人均3000元,三五好友,美食 温泉,12万,途经：昆明 ,行程：滇池 湿地公园 古滇艺海大码头 七彩云南欢乐世界 七彩云南欢乐世界-飞翔影院 古滇...
黔所未游，一路向“黔”看（未完待续）,2020-08-15 出发,共1天, , , ,1995,途经：贵阳 ,行程：甲秀楼 黔灵山公园 花果园湿地公园 花溪夜郎谷
我家开的界，所以张家界（一人7日自由行含详细路线：张家界凤凰长沙）,2020-08-14 出发,共1天, , , ,9.4万,途经：张家界 ,行程：大庸府城 百龙天梯 上天梯 大观台 砂刀沟 丁香榕村
平遥古城免费游~这些攻略必须有！,2020-08-13 出发,共3天,人均600元,家庭,深度游 购物 美食 古镇 自驾 暑假 赏秋,21.3万,途经：平遥 ,行程：平遥古城 娘家醋坊 洪武记饭店 梁先森·酸奶铺子 平遥古城墙 清虚观 城隍庙 双林...
一只爱玩的胖子！,2020-07-20 出发,共12天, ,家庭,深度游 夏季,12.9万,途经：乌兰布统草原Wulanbutong 昌黎, 
呼伦贝尔大草原——如果风知道，如果云知道【呼伦贝尔旅游攻略】,2020-08-11 出发,共5天,人均3000元,三五好友,深度游 美食 自驾 摄影 夏季,8884,途经：呼伦贝尔 ,行程：呼伦贝尔大草原 海拉尔 呼伦湖 贝尔湖
丝绸之路：千年敦煌&麦积山石窟&张掖丹霞&马蹄寺,2020-10-25 出发,共5天,人均5000元,三五好友,深度游 赏秋,2231,途经：敦煌 嘉峪关 兰州 张掖 ,行程：莫高窟 敦煌机场 鸣沙山月牙泉 玉门关 雅丹地质公园 敦煌夜市 西千佛洞 敦煌博物...
蓝色太平洋-一周暴走台湾,2016-06-25 出发,共7天,人均10000元,三五好友,自驾 暑假,1.9万,途经：高雄 屏东Pingtung 垦丁Kenting 台南Tainan 台北Taipei City ,行程：驳二艺术特区 吴宝春麦方店（高雄店） 桦达奶茶(新光三越) 瑞丰夜市 高雄市忠烈祠...
初见南沙，多多记录，多多回忆,2020-07-23 出发,共4天,人均3000元,三五好友,美食 第一次,4.8万,途经：广州, 
