标题,出发时间,逗留时间,费用,游玩人数,游玩方式,观看量,途径,行程
4月5月游河南,2021-08-04 出发,共10天, ,独自一人,深度游 穷游 踏春,8729,途经：洛阳 郑州 ,行程：洛阳博物馆 洛邑古城 河南博物院 隋唐城遗址植物园
大手牵小手，厦门走一走，你不知道的厦门亲子攻略,2021-06-25 出发,共1天, , ,深度游 美食 自驾 暑假 短途周末,1.5万,途经：厦门Xiamen ,行程：厦门大学 鼓浪屿 环岛路 厦门科技馆 科德航空研学基地 野好社区(天竺山店) 西坂菜...
人间净土，喀纳斯,2021-07-22 出发,共6天,人均8000元, , ,4943,途经：布尔津 喀纳斯Kanasi ,行程：五彩滩 禾木草原 卧龙湾 月亮湾 神仙湾 鸭泽湖 喀纳斯景区 禾木风景区
2021年之：7月 贵州--香格里拉--广州,2021-07-08 出发,共22天,人均6637元,独自一人,穷游 骑行 夏季,6718,途经：贵阳 江口 黄果树Huangguoshu 丽江 香格里拉Xianggelila 昆明 广州 西江千户苗寨... ,行程：贵阳北站 梵净山 蘑菇石 丝娃娃 黄果树石头寨景区 天河潭旅游度假区 贵州省博物馆...
这个夏天，我在呼伦贝尔等你,2021-07-08 出发,共5天,人均4000元,三五好友,美食 自驾 夏季,1.5万,途经：呼伦贝尔 ,行程：贝尔湖 呼伦湖 呼伦贝尔大草原 满洲里 海拉尔 才恩吉雅牛排锅 大兴安岭 呼伦贝尔...
清凉一夏，去刺激与梦幻并存的顺德欢乐海岸PLUS浪一下,2021-07-31 出发,共2天,人均500元,亲子,深度游,1.7万,途经：佛山 ,行程：顺德欢乐海岸PLUS 玛雅海滩水公园 顺峰山公园
国内就能看到的玻璃海——绝美西沙群岛 我国的神圣领土,2018-06-14 出发,共4天,人均5000元,独自一人,海滨海岛 游轮 暑假 夏季 冬季 第一次,2204,途经：三亚 ,行程：凤凰岛 凤凰国际机场 三亚湾
2021东莞出发贵州10天9晚暑期亲子自驾游,2021-07-17 出发,共10天,人均2500元,亲子,古镇 自驾 暑假,1.4万,途经：荔波 贺州 桂林 平塘 贵阳 遵义 铜仁 凤凰 清远 ,行程：荔波小七孔景区 贺州正菱大酒店 银子岩 中国天眼科普基地 洋芋粑 青岩古镇 贵州峰...
六月的周末（杭州）绿色生活 国美毕设 ~,2021-06-05 出发,共2天,人均500元,三五好友,短途周末 夏季,2112,途经：杭州 ,行程：桂语山房高级餐厅 浙江美术馆 西湖 太子湾公园 鱼宇·居酒屋(十五奎巷店) 西湖菁莲...
暴走魔都 | 请收下这份上海最新网红打卡攻略,2021-07-25 出发,共1天, , ,美食 夏季,1.2万,途经：上海 ,行程：田子坊石库门 东方明珠 上海千古情 武康路 田子坊 外滩 黄浦江 上海和平饭店...
中州行,2021-07-13 出发,共7天, , , ,2204,途经：郑州 登封 洛阳 开封 ,行程：郑州城隍庙 商城遗址 太室山 三皇寨 少林寺 好汉坡 三黄寨景区 塔林 龙门石窟...
舟山亲子研学之旅：以斯为媒，以史为师,2021-07-23 出发,共1天, , ,美食 海滨海岛,1265,途经：舟山 ,行程：定海古城 册子岛月亮湾景区
刷新苏北印象丨遇见了一座心仪的城市，美食与文化在此碰撞,2021-07-13 出发,共4天,人均2500元,三五好友,美食 古镇 自驾 夏季,3.7万,途经：新沂 ,行程：窑湾古镇 马陵山风景名胜区 钟吾公园 亚欧大酒店餐饮部 玉华楼 姜家辫子辣汤
一路向北去大草原，穿越呼伦贝尔梦幻之旅,2021-07-23 出发,共5天,人均3000元,三五好友,深度游 美食 自驾,1.3万,途经：呼伦贝尔 额尔古纳 满洲里 ,行程：呼伦贝尔大草原 额尔古纳湿地 海拉尔 北疆明珠观光塔 黑山头湿地 大兴安岭 额尔古...
【上海】这个夏天，带你打卡千面魔都,2021-07-17 出发,共2天,人均2000元,三五好友,购物 摄影 夏季 第一次,6.3万,途经：上海 ,行程：衡复历史文化风貌区 外滩 广富林文化遗址 陆家嘴
贵州自由行七天六晚,2021-07-09 出发,共7天,人均5600元,三五好友,深度游 古镇 夏季 第一次,2550,途经：贵阳 荔波 镇远 西江千户苗寨Xijiangmiaovillage ,行程：甲秀楼 68级跌水瀑布 贵州省博物馆 荔波小七孔景区 龙洞堡国际机场 镇远古镇-慧丰
2021的五一潮汕 逃回家,2021-04-30 出发,共4天,人均3840元,三五好友,美食 五一 短途周末,3087,途经：潮州 南澳 汕头 ,行程：潮州金信酒店 韩上楼大酒楼 开元寺 牌坊街 伟舅牛肉丸 溪口刘卜鹅肉店 古法甜品...
第一次去吃遍玩全长沙深度周末游4D4N,2021-07-15 出发,共4天,人均2000元,闺蜜,美食 暑假 短途周末 第一次,1.1万,途经：长沙 ,行程：橘子洲 黄兴路步行街 岳麓山 湖南省博物馆 李自健美术馆 岳麓书院 火宫殿 谢子龙...
南平·政和大岭古银杏·天台山银杏·石林·宝山大圣故里·和平古镇·天成奇峡,2021-07-20 出发,共1天, ,家庭,古镇 自驾 赏秋,676,途经：南平 顺昌 ,行程：天成奇峡
浓情盛夏，邂逅九江灵动风光,2021-07-08 出发,共5天,人均1000元,亲子,深度游 美食 自驾 暑假 摄影 夏季,2万,途经：九江 ,行程：浔阳楼 琵琶亭 锁江楼 庐山植物园 修水修江国际大酒店 中华贤母园 八里湖公园...
尽享天堂般的美丽自然风光--阿坝四天,2021-07-15 出发,共4天, , ,环游 摄影 夏季,1.3万,途经：阿坝 美国(天堂Paradise) ,行程：莲宝叶则 扎嘎瀑布 阿坝州
北疆之夏，关于可可托海和喀纳斯的那些故事,2021-07-07 出发,共6天,人均10000元,三五好友,深度游 古镇 夏季,1.5万,途经：富蕴 喀纳斯Kanasi ,行程：可可托海景区 可可苏里 可可苏里湖 神钟山 可可托海地质陈列馆 禾木风景区 卧龙湾...
初夏时节，邂逅安庆，感受山水之美,2021-07-10 出发,共2天,人均580元,三五好友,自驾 夏季,6628,途经：岳西 安庆 ,行程：明堂山 天峡
炎炎夏日武汉行,2021-07-12 出发,共4天,人均2900元,亲子,美食 暑假 夏季,2410,途经：武汉 ,行程：古琴台 黄鹤楼 武汉长江大桥 东湖 武汉大学 晴川阁 汉口江滩 户部巷 昙华林...
走近大同历史,2021-07-19 出发,共4天,人均1700元,亲子,深度游 暑假,3661,途经：大同 ,行程：华严寺 云冈石窟 大同博物馆
暑假玩转上海，这几个地方值得加入收藏夹,2021-07-01 出发,共5天,人均5000元,家庭,深度游 暑假 夏季,4.3万,途经：上海 ,行程：田子坊石库门 陆家嘴 外滩 上海千古情 泰会生活文化园 中国航海博物馆 上海和平饭
浙夏玩水，去安吉“仙”漂流--打卡《极限挑战》里的安吉仙龙峡,2021-07-19 出发,共3天,人均1800元,三五好友,深度游 美食 自驾 暑假,2.8万,途经：安吉 ,行程：竹海 仙龙峡漂流 仙龙峡运动营地 云上草原
你与世界的距离 只差一场说走就走的旅行——三亚行,2021-07-08 出发,共5天, ,亲子,暑假 第一次,1.1万,途经：三亚 ,行程：三亚湾 凤凰国际机场 海棠湾 蜈支洲岛 海神之跃 放手一搏 三亚亚特兰蒂斯酒店
2021川西小环线(9日),2021-07-17 出发,共9天,人均5000元,亲子,环游 古镇 自驾 暑假 夏季,986,途经：泸州 成都 甘孜 康定 理塘 稻城 四姑娘山siguniangshan 海螺沟Hailuogou ,行程：四季澜庭酒店(泸州高铁站西南商贸城店) 泸州老窖博物馆 泸州万达广场 成都东站 海螺...
用来虚度的，才是好时光——厦门六日行,2021-07-09 出发,共6天,人均3500元,亲子,环游 海滨海岛 暑假,6850,途经：厦门Xiamen ,行程：环岛路 厦门大学 曾厝垵 胡里山炮台 第八海鲜市场 朱记手撕鸡 八婆婆 厦门岛...
新疆自驾游,2021-07-17 出发,共17天, ,亲子,自驾 暑假,2252,途经：哈密 吐鲁番 和硕 喀什市 克孜勒苏柯尔克孜 库车 和静 新源 伊犁 北京 ,行程：哈密博物馆 哈密魔鬼城 火焰山景区 吐鲁番盆地 吐鲁番博物馆 艾丁湖 和硕葡萄公园...
不是第一次到成都的第一次成都游,2021-06-06 出发,共6天,人均4000元,独自一人,夏季 第一次,5098,途经：成都 都江堰 ,行程：春熙路 跳伞塔 火锅 青城山 都江堰景区 IFS国际金融中心 成都远洋太古里 宽窄巷...
威海暑假海滨之旅,2021-07-12 出发,共9天,人均2700元,亲子,美食 海滨海岛 暑假,9995,途经：威海 蓬莱 ,行程：韩乐坊 唐人海湾商务酒店(威海刘公岛店) 威海国际海水浴场 那香海瀛海公寓 东城路夜...
仲夏去三亚，享受不一样的玩法！,2021-07-15 出发,共5天, , ,美食 海滨海岛 潜水 摄影 夏季 冬季,1588,途经：三亚 ,行程：亚龙湾 蜈支洲岛 情人桥 南天一柱石 天涯海角 海棠湾 三亚湾 大小洞天 蜈支洲码...
美丽日本，爱我中华—我和老婆的蜜月之行,2017-05-10 出发,共7天,人均10000元,情侣,蜜月,8567,途经：日本(东京Tokyo 成田市Narita shi), 
畅游唐宋帝都的八天七夜自由行,2021-07-05 出发,共8天,人均3000元,家庭,购物 漫游 美食 暑假 摄影,7358,途经：洛阳 开封 西安 ,行程：洛邑古城 丽景门景区 天堂 白马寺 龙门石窟 隋唐洛阳城国家遗址公园天堂明堂景区...
一生痴绝处，无梦到徽州——漫步徽州，品味白墙黛瓦梦里老家,2021-04-21 出发,共1天, ,独自一人,环游 漫游 清明 自驾 踏春 第一次,2986,途经：歙县 黄山 ,行程：渔梁坝 徽州古城 灵山村 阳产土楼 深渡镇 渔梁坝和渔梁古镇 歙县芳华酒店 黟县半...
在路上——春天是一场盛大的旅行,2021-03-23 出发,共10天, ,闺蜜,环游 清明 美食 自驾 踏春 第一次,9963,途经：重庆 恩施 武汉 宜昌 ,行程：万灵古镇 重庆佰铭酒店 洪崖洞民俗风貌区 洪崖洞 重庆九街 丰都鬼城名山景区 丰都...
3天2晚唐山行：游海岛，化身捕鱼达人，品味唐山味道,2021-07-13 出发,共1天, , ,漫游 美食 海滨海岛 温泉 探险,10.1万,途经：唐山 ,行程：唐山宴 开滦国家矿山公园 开滦博物馆 唐山南湖公园 多玛乐园
【48小时 . 北巡盛京】带着老爸随心飞  2021年6月沈阳2日,2021-06-19 出发,共3天,人均450元,家庭,漫游 端午 短途周末 摄影 第一次,1.5万,途经：沈阳 ,行程：张学良旧居 桃仙国际机场 清福陵 中街 老四季(长青店)
川甘陕「重庆.敦煌.西安」--紧紧张张之旅,2021-06-15 出发,共6天, , , ,6362,途经：重庆 敦煌 西安 ,行程：李子坝 解放碑步行街 罗汉寺 龙门浩老街 长江索道 湖广会馆 洪崖洞 八一路好吃街...
梦游古都长安，五天的时间看古都两千年的繁华~,2021-07-11 出发,共1天, , , ,9326,途经：西安 ,行程：书院门 碑林 永宁门 回民街 湘子庙 西安碑林博物馆 大雁塔北广场 孙庆海特制腊牛...
9天青甘大环线自驾并2天西安自由行,2021-06-29 出发,共11天,人均7500元,家庭,环游 自驾 暑假 第一次,1万,途经：敦煌 海西 西安 ,行程：莫高窟 茶卡盐湖 雅丹地质公园 大柴旦翡翠湖旅游景区 雅丹魔鬼城 大唐不夜城 鸣沙...
说说我的2021的杭州……,2021-06-01 出发,共5天,人均1920元,三五好友,深度游 美食 摄影 夏季,1.5万,途经：杭州 ,行程：南宋御街 浙江宾馆 704工程 萧山国际机场 杨公堤 西湖 河坊街 胡雪岩故居 杭州...
骄阳下少林（登封）、洛阳、开封7日自由行,2021-07-04 出发,共7天,人均2630元,家庭,深度游 夏季,9173,途经：洛阳 开封 登封 郑州 ,行程：龙门石窟 大相国寺 白马寺 清明上河园 三皇寨 中岳庙 法王寺 开封府 洛阳龙门站...
呼伦贝尔圆梦之旅，大草原、风车群、麋鹿森林、童话世界里的城堡，全安排！,2021-06-24 出发,共5天,人均2500元,闺蜜,深度游 美食 自驾 暑假 摄影,2.4万,途经：呼伦贝尔 ,行程：呼伦贝尔大草原 海拉尔 哈乌尔河景区 中国冷极村 猛犸旅游景区 呼伦湖
夏行湘西：左手山水桥，右手苗家情（凤凰、矮寨行游记）,2021-06-20 出发,共7天, ,三五好友,漫游 古镇 自驾 摄影 夏季,3.6万,途经：凤凰 武陵源 ,行程：虹桥风雨楼 凤凰古城 吊脚楼 万寿宫 凤凰古城博物馆 陈宝箴世家 沈从文故居 沱江...
夏日度假好去处，古九州之一青州游玩攻略,2021-07-09 出发,共1天, , ,夏季,1万,途经：青州 ,行程：青州古城 范公亭公园 驼山 青州博物馆 井塘古村 云门山风景区
贵州黔北自驾游,2021-06-16 出发,共9天, ,三五好友,深度游 古镇 自驾 夏季,2109,途经：赤水 遵义 ,行程：四洞沟景区 大同古镇 赤水丹霞旅游区·大瀑布 丙安古镇 佛光岩 遵义一方酒店 海龙...
上下杭,2021-07-09 出发,共1天, , , ,3950,途经：福州 ,行程：上下杭 永德会馆 建郡会馆
国庆穷游贵州(上篇)：贵阳-黔灵山-甲秀楼→凯里-千户苗寨-民俗村-镇远古镇,2020-10-01 出发,共1天,人均2000元,家庭,穷游 古镇 国庆 第一次,2677,途经：镇远 贵阳 凯里 西江千户苗寨Xijiangmiaovillage ,行程：镇远古城
2021年暑假西安山西自驾游,2015-01-01 出发,共8天,人均2000元,亲子,自驾 暑假 毕业游,908,途经：西安 ,行程：大唐芙蓉园 陕西历史博物馆
重庆4日游,2021-07-12 出发,共4天, , ,古镇,1.1万,途经：重庆 ,行程：乌江画廊 武隆天生三桥 蚩尤九黎城 仙女山国家森林公园 解放碑步行街 洪崖洞 磁器...
雨季自驾川西，与阳光的捉迷藏游戏,2021-07-03 出发,共3天,人均500元,三五好友,自驾 暑假 短途周末 摄影 第一次,3980,途经：康定 日本(川西市Kawanishi) ,行程：斯丁措 塔公草原 塔公寺 木雅大寺 塔公镇 折多山 康定机场 新都桥 玛尼堆
再走甘青,2021-07-06 出发,共1天, , , ,8965,途经：贵德 同仁 夏河 迭部 陇南 兰州 白银 ,行程：贵德国家地质公园阿什贡七彩峰丛景区 隆务寺 拉卜楞寺 甘加草原 扎尕那 哈达铺镇...
新疆｜家的方向，也是理想的浪漫所在｜新疆旅游攻略,2021-06-01 出发,共9天,人均3500元, ,暑假 夏季,1.1万,途经：乌鲁木齐 吐鲁番 霍城 伊宁 奎屯 ,行程：博格达峰 吐鲁番 吐峪沟 果子沟大桥
张家界旅游-张家界旅游游记-张家界攻略-张家界自驾-张家界自由行-攻略大全,2021-07-06 出发,共3天,人均3000元,三五好友,购物 美食 自驾 毕业游 摄影 夏季,1万,途经：张家界 武陵源 ,行程：张家界国家森林公园 索溪峪 袁家界 天门山国家森林公园 武陵源 天子山 杨家界...
一个试睡达人 一场海岛婚礼——丽思卡尔顿海岛婚礼全攻略,2021-04-11 出发,共3天,人均10000元,家庭,蜜月 海滨海岛 五一 婚纱,1829,途经：三亚 ,行程：太阳湾 海棠湾 亚龙湾
疫情下的广东（深圳、珠海、澳门）,2021-06-11 出发,共8天,人均4300元,独自一人,端午,1927,途经：深圳 珠海 澳门Macau ,行程：世界之窗 东部华侨城大侠谷 大梅沙海滩 沙头角公园 海上世界 深圳城市规划展示厅...
【西北再西，是为海西】2021年6月端午  青甘线海西、敦煌5日自驾,2021-06-12 出发,共5天,人均4000元,三五好友,环游 端午 自驾 摄影,1.9万,途经：海西 敦煌 ,行程：西台吉乃尔湖 鸣沙山月牙泉 莫高窟 翡翠湖 小柴旦湖 艾肯泉 鸣沙山 茶卡盐湖...
啾啾游记✈️-悠悠岁月长安城,2021-06-14 出发,共3天,人均2300元,家庭,美食 端午 摄影 第一次,1.1万,途经：西安 ,行程：华清宫 回民街 西安碑林博物馆 碑林 陕西历史博物馆 秦始皇帝陵博物院(兵马俑)...
一个月 西域行,2021-05-15 出发,共31天,人均12000元,三五好友,美食 自驾 夏季,2537,途经：西宁 阿里 日喀则 ,行程：西宁南山公园 西宁北山公园 札达 仲巴帕羊青年宾馆 日喀则小布达拉宫
宝藏滨海小城湛江｜逃离城市喧嚣，寻找最南端的隐秘角落,2021-05-02 出发,共3天,人均1600元,三五好友,美食 海滨海岛 五一 短途周末,1.9万,途经：湛江 ,行程：硇洲岛 南极村 海石滩泳场（那晏海石滩） 湛江海湾大桥 湛江蚝爷
用三天两晚的时间，近距离接触醉美太湖,2021-07-02 出发,共1天, , , ,1.2万,途经：苏州 ,行程：苏州太湖万丽酒店 太湖 穹窿山
初夏是相爱的第3650天，呼伦贝尔爱之行,2021-07-02 出发,共1天, , ,婚纱 夏季,4.8万,途经：呼伦贝尔 ,行程：海拉尔 呼伦贝尔大草原 呼和诺尔湖 大兴安岭 神鹿园 满洲里
走遍神州大地 醉美多彩贵州，带您邂逅不一样的贵州,2021-07-02 出发,共1天, , ,美食,8216,途经：贵阳 镇远 荔波 黄果树Huangguoshu ,行程：龙洞堡国际机场 贵阳火车站 青龙洞 镇远古城 荔波小七孔景区 青云路夜市 甲秀楼...
承德避暑游,2021-06-28 出发,共3天,人均1000元,家庭,自驾 夏季,5563,途经：承德 ,行程：普陀宗乘之庙 须弥福寿之庙 外八庙 磬锤峰国家森林公园 棒槌山
张家界国家森林公园、天门山毕业旅游（美图、攻略）,2021-06-29 出发,共5天,人均2000元, ,深度游 环游 购物 穷游 毕业游 夏季,1.3万,途经：张家界 武陵源 新西兰(奥克兰Auckland) ,行程：十里画廊 天门山国家森林公园 张家界《魅力湘西》演出 张家界国家森林公园 百龙电梯...
杭州、绍兴7日游,2021-06-07 出发,共7天,人均7226元,家庭,深度游 端午,5042,途经：绍兴 杭州 锦州 ,行程：三味书屋 西湖 杭州东站 灵隐寺 岳王庙景区 南屏晚钟 白堤 孤山 三潭印月 印象...
塞上江南 北疆自驾行,2021-06-19 出发,共9天,人均9000元,情侣,购物 美食 自驾 暑假 摄影 夏季,4455,途经：布尔津 克拉玛依 博乐 伊犁 霍城 乌鲁木齐 伊宁 ,行程：布尔津县 北疆海岸风景区 贾登峪 神仙湾 五彩滩 世界魔鬼城 独山子大峡谷 赛里木...
吉林延边自驾6日游,2021-06-15 出发,共6天,人均2000元,亲子,美食 自驾 夏季 第一次,2083,途经：延边 ,行程：朝鲜族民俗风情园
甪直古镇，一梦入江南,2021-06-26 出发,共1天,人均800元,家庭,古镇 暑假 短途周末,3.1万,途经：苏州 ,行程：甪直古镇 苏州站 万盛米行
【皖南】雾中游两山，梦里忆徽州,2021-05-09 出发,共9天,人均4700元,亲子,古镇,1.3万,途经：青阳 黄山 歙县 黟县 ,行程：九华山 西海大峡谷 皖南古村落 天台景区 徽州古城 地藏禅寺 始信峰 屯溪老街...
人间最美四月天，再续西藏桃花缘。,2021-04-03 出发,共9天,人均6200元,情侣,深度游 清明 自驾,1.3万,途经：米林 拉萨 新沂 ,行程：索松村 南伊沟 布达拉宫 甘丹寺 南迦巴瓦峰 哲蚌寺 色拉寺 八廓街 药王山 小昭...
张家界-毕业旅行-全景深度游（一篇攻略）所有问题,2021-06-25 出发,共1天, , ,深度游 购物 美食 毕业游,1.2万,途经：张家界 ,行程：十里画廊 金鞭溪大峡谷 金鞭溪 袁家界 天子山 张家界国家森林公园 武陵源 金鞭岩...
自驾广西北部湾7天，深度体验有海山有渔村有边境口岸,2021-06-09 出发,共7天,人均4000元,三五好友,美食 温泉 自驾,6.7万,途经：南宁 北海 防城港 ,行程：邕江 金滩 白浪滩 北海金海湾红树林生态旅游区 簕山古渔村 侨港风情街 北海银滩旅...
这个夏天，到呼伦贝尔的童话世界里去撒野！,2021-06-01 出发,共7天,人均5000元, ,深度游 环游 购物 美食 自驾 夏季,23.3万,途经：呼伦贝尔 额尔古纳 海拉尔 ,行程：大兴安岭 额尔古纳湿地 铁山冷饮厅 大兴安岭林区 莫尔道嘎 莫尔道嘎国家森林公园...
呼伦贝尔的草原上，藏着这个夏天的快乐密码！,2021-06-23 出发,共7天,人均3500元, ,深度游 美食 自驾 夏季 第一次,1.1万,途经：呼伦贝尔 满洲里 ,行程：呼伦湖 猛犸旅游景区 婚礼宫 海拉尔 中苏街 大兴安岭 满洲里套娃广场-在处女地的...
台风天的海上奇遇记--福建平潭周末游,2021-06-22 出发,共3天,人均1500元,三五好友,环游 短途周末 夏季 第一次,2775,途经：平潭 郑州 福州 ,行程：东庠岛 北港村 新郑机场 长乐国际机场 平潭北港石頭会唱歌·古风草堂民宿 平潭北港...
你好巩留丨圆梦新疆，遇见天堂,2021-06-08 出发,共5天, ,三五好友,深度游 美食 自驾 摄影,60.2万,途经：巩留 伊犁 ,行程：巩留县蝶湖公园 恰甫其海水库 库尔德宁景区 恰西森林公园 野核桃沟自然保护区 巩留...
呼伦贝尔的草原上，藏着这个夏天的快乐密码！,2021-06-03 出发,共7天,人均7000元,三五好友,深度游 美食 自驾 暑假 摄影 夏季 第一次,1.2万,途经：呼伦贝尔 满洲里 海拉尔 ,行程：呼伦湖 扎赉诺尔猛犸旅游区 扎赉诺尔 婚礼宫 海拉尔 中苏街 大兴安岭 呼伦贝尔尼...
回到2年前•一人苏沪，两人乌镇「都很美好」,2019-02-20 出发,共10天, ,独自一人,深度游 漫游 古镇 踏春 第一次,2482,途经：乌镇Wuzhen 苏州 ,行程：立志书院 观前街 同里古镇 那里 三桥 拙政园 狮子林 太湖 苏州博物馆
晋在眼前 千年古县浑源精华游,2021-06-13 出发,共3天,人均2000元,三五好友,深度游 美食 自驾 暑假 摄影,1.3万,途经：浑源 大同 ,行程：悬空寺 恒山 浑源汽车站 华严寺
亲子假日，在勐远仙境度一个神仙假期,2021-06-20 出发,共1天, , ,美食 探险,7.3万,途经：西双版纳, 
春游黔蜀，休闲慢行,2021-04-06 出发,共14天,人均4500元,独自一人,深度游 古镇,1.5万,途经：自贡 宜宾 成都 大方 贵阳 毕节 ,行程：燊海井 西秦会馆 真武山古建筑群 青羊宫 宽窄巷子 千佛寺 洛带古镇 武侯祠 杜甫...
景秀江西，瓷名天下：4天3晚，翻山越岭在世界瓷都景德镇，访窑寻宝,2021-06-07 出发,共4天,人均2000元,三五好友,深度游 购物 古镇 自驾 暑假 夏季,3.3万,途经：浮梁 景德镇 瑶里Yaoli 越南(高岭Cao Lanh) ,行程：瑶里景区 三宝国际陶艺村 古窑民俗博览区 景德镇陶阳里御窑景区 皇窑景区 绕南陶瓷...
张家界旅游攻略【心之旅】一辈子的情，一万里路，欢歌笑语留情于张家界,2021-06-18 出发,共3天,人均1500元,三五好友,深度游 环游 美食 暑假 摄影 夏季,1.2万,途经：张家界 武陵源 ,行程：天门山国家森林公园 荷花机场 张家界国家森林公园 武陵源 张家界火车站 中国张家界...
带着小妞看世界，滇南之旅~玉溪、普洱、西双版纳深度自驾游,2021-06-18 出发,共18天,人均6000元,亲子,深度游 美食 古镇 自驾 暑假 夏季,3484,途经：景洪 墨江 普洱 玉溪 西双版纳 抚仙湖 ,行程：星光夜市 曼听公园 碧溪古镇 曼掌村 告庄西双景 野象谷 太阳河森林乐园 抚仙湖汐...
厦门  最美的城市看最美的风景,2018-03-26 出发,共6天,人均3000元,独自一人,深度游 环游,1635,途经：厦门Xiamen ,行程：鼓浪屿 环岛路 曾厝垵 南普陀寺 厦门大学
到贵州，邂逅一场山林水云之乐,2021-06-16 出发,共7天, , ,美食,1.2万,途经：贵阳 黎平 镇远 荔波 黄果树Huangguoshu ,行程：龙洞堡国际机场 贵阳火车站 堂安梯田 肇兴侗寨 镇远古城 荔波小七孔景区 青云路夜...
珠峰梦想计划第一站：哈巴雪山,2021-05-02 出发,共7天,人均23000元,三五好友,五一 古镇 徒步 探险,1420,途经：丽江 ,行程：狮子山 丽江古城 木府 白沙壁画 玉龙雪山
不折腾不成活！一个人的随心飞收官之行——天府之国，成都！,2021-06-07 出发,共5天,人均2000元,独自一人,漫游 美食,7475,途经：成都 ,行程：武侯祠 杜甫草堂 火锅 青羊宫 人民公园 春熙路 四川美术馆 宽窄巷子 成都东站...
在最美的季节遇见你：悉尼、昆士兰梦幻奇遇记（缤纷悉尼灯光节+心形堡礁/考拉/热带雨林超强攻略）,2019-05-27 出发,共7天, ,独自一人,漫游 潜水 徒步 探险,4125,途经：澳大利亚(悉尼Sydney 凯恩斯Cairns) ,行程：悉尼大学 环形码头 悉尼歌剧院 皇家植物园 帕罗尼拉公园 绿岛 邦迪海滩 达令港...
贰人南昌叁日穷游记,2021-06-04 出发,共3天,人均525元,家庭,穷游 端午 五一 短途周末 第一次,1万,途经：南昌 ,行程：八一广场 滕王阁 绳金塔
解锁成都的喧嚣与懒散，打卡市区里的古巷和美食,2021-06-13 出发,共1天, , ,美食,9551,途经：成都 ,行程：火锅 春熙路 兰桂坊成都 人民公园 四川科技馆 四川美术馆 武侯祠 锦里古街 井巷...
读懂景德镇：一座千年盛名的城镇，一件传承千年始终被匠人追求的china,2021-06-13 出发,共4天,人均3500元,三五好友,深度游 购物 美食 古镇 摄影 夏季 第一次,5837,途经：景德镇 ,行程：景德镇中国陶瓷博物馆 古窑民俗博览区 景德镇陶阳里御窑景区 景德镇陶瓷学院 三宝国...
吐血整理！两岁娃五次自驾三亚亲子游｜三亚亲子旅游全攻略,2021-05-01 出发,共3天,人均3000元,亲子,深度游 美食 海滨海岛 端午 自驾 夏季,1.6万,途经：三亚 ,行程：三亚海棠湾喜来登度假酒店 亚龙湾 海棠湾 后海 后海村 半山半岛帆船港 情人桥...
