标题,出发时间,逗留时间,费用,游玩人数,游玩方式,观看量,途径,行程
辣么爽！浙江小姐姐带你逛吃逛吃重庆（内附推荐、吐槽景点）,2019-08-14 出发,共2天,人均700元,三五好友,美食,4.7万,途经：重庆 ,行程：卤校长老火锅 两江国际影视城（民国街） 洪崖洞商业街 解放碑步行街 南山一棵树观景...
寻找内蒙静美的秋韵,2019-09-26 出发,共14天,人均6000元,三五好友,自驾 国庆,5683,途经：呼伦贝尔 额尔古纳 呼和浩特 满洲里 阿尔山Aershan ,行程：大兴安岭 额尔古纳湿地 室韦口岸 呼伦湖 室韦 白塔国际机场 莫尔道嘎 室韦村...
冰岛自驾环岛旅行结婚♫听冰火为我们演奏♪婚礼进行曲♪,2019-07-06 出发,共9天,人均30000元,情侣,蜜月 环游 自驾 摄影 夏季,2.3万,途经：冰岛(雷克雅未克Reykjavik 阿克雷里Akureyri) ,行程：斯奈山半岛 雷克雅未克 火山口 蓝湖 托宁湖 ﻿哈帕音乐厅和会议中心 塞里雅兰瀑布
2019.8.31在杭州对夏日的完美告别,2019-08-31 出发,共1天,人均1000元,独自一人,夏季 短途周末,5353,途经：杭州 ,行程：杭州东站 胡庆余堂药膳 浙江美术馆 赛丽美术馆 万象城 Ola Poke(万象城店) 杭州大
国庆成都怎么玩？成都土著的第N次成都攻略 必打卡地点指南,2019-09-13 出发,共1天,人均105元,三五好友,穷游 美食 短途周末,2.8万,途经：成都 ,行程：春熙路 宽窄巷子 人民公园 成都小吃 成都远洋太古里 EGO潮流广场 成都U37创意仓库...
曼谷、普吉岛懒人悠闲8日7晚游——人均5000吃龙虾，住villa,2019-08-17 出发,共8天,人均5000元,家庭,美食 海滨海岛 暑假,2658,途经：泰国(曼谷Bangkok 普吉岛Phuket) ,行程：拉差达火车夜市 唐人街 曼谷拉差贴威维拉酒店(Vela be Bangkok Ratchathewi) 曼谷瑞...
纵横西域万里行，曾见明月出天山！新疆逐梦之旅之二天山天池,2019-08-10 出发,共12天,人均6000元,独自一人,深度游 环游 暑假 夏季 第一次,3056,途经：阜康 克拉玛依 ,行程：天山天池 乌尔禾魔鬼城
八月会扬州，皆是江南好味道,2019-08-23 出发,共3天, ,三五好友,美食 温泉,12.3万,途经：扬州 ,行程：瘦西湖 趣园茶社 个园 馥园 扬州炒饭 四桥烟雨 卢氏古宅 五亭桥 何园 大虹桥
抓住夏天的小尾巴，带娃去草原约个会,2019-08-24 出发,共2天,人均500元, ,美食 自驾 暑假 短途周末 夏季 第一次,2.2万,途经：张家口 ,行程：草原天路
去三亚，看日落和大海,2019-08-29 出发,共5天,人均4000元,独自一人,深度游 美食 暑假 摄影,4.2万,途经：三亚 ,行程：鲜管家海鲜(第一市场店) 天涯镇 亚龙湾 第一市场 奥特莱斯 大东海 西岛 三亚湾...
广州美食+珠海长隆漫游记,2019-08-28 出发,共5天, ,亲子,漫游 美食,2792,途经：广州 珠海 ,行程：沙面 上下九步行街 广州南站 岭南印象园 陈家祠 点都德(花城店) 点都德
世外桃源温泉地，不止别府由布院，雨季的大分温泉之旅,2019-06-30 出发,共7天,人均7000元,亲子,深度游 购物 美食 温泉 古镇,2.5万,途经：日本(别府市Beppu 日田市Hita 福冈Fukuoka) ,行程：别府海滨美松大江亭酒店(Seaside Hotel Mimatsu Ooetei) 高崎山自然动物园 豆田町
他带着我，我带着娃，呼伦贝尔大环线自驾9日游…,2019-08-10 出发,共9天,人均4500元,亲子,自驾 夏季,3687,途经：呼伦贝尔 额尔古纳 陈巴尔虎旗Chenbaerhuqi 兴安盟Xinganmeng 满洲里 根河 ,行程：海拉尔 额尔古纳湿地 猛犸旅游景区 黑山头镇 七卡 186彩带河 老鹰嘴 呼伦湖 室...
情侣游之济州岛,2019-08-10 出发,共7天,人均6000元,情侣,海滨海岛 暑假,7419,途经：韩国(济州市Jeju 济州岛Jeju Island 西归浦Seogwipo) ,行程：济州国际机场 乐天免税店（济州店） 梨湖海水浴场 七星路步行街 济州东门传统市场...
贵州行（黄果树-荔波小七孔-西江苗寨-镇远高过河漂流-铜仁梵净山）,2019-08-09 出发,共5天,人均4000元,情侣,深度游 美食,3.6万,途经：荔波 西江千户苗寨Xijiangmiaovillage 镇远 铜仁 贵阳 安顺 ,行程：荔波小七孔景区 西江千户苗寨 高过河漂流 梵净山秋暝山居民宿 花溪牛肉粉 红云金顶...
自驾宁夏，探索神秘的未知,2019-08-25 出发,共1天,人均5000元,三五好友,美食 自驾 摄影 探险,5万,途经：银川 中卫 ,行程：西夏陵国家考古遗址公园 一百零八塔 镇北堡西部影城 河东机场 览山公园 沙坡头...
墨尔本，用影像和文字去回忆这一座城,2019-07-15 出发,共10天,人均10000元,三五好友,购物 穷游 美食 自驾 暑假 第一次,9620,途经：澳大利亚(墨尔本Melbourne) ,行程：唐人街 维多利亚州立图书馆 亚拉河 墨尔本大学 天空民宿(Sky) 墨尔本旗杆花园 皇...
广州7天深度亲子游之玩在长隆,2019-08-09 出发,共2天,人均1200元,家庭,暑假 第一次,8.4万,途经：广州 ,行程：雨林仙踪 垂直过山车 欢乐世界 漂流河
西北大环线7天游，广州出发/神州租车/自驾,2019-08-10 出发,共7天,人均5000元,家庭,环游 自驾 暑假 夏季,4641,途经：西宁 敦煌 临泽 祁连 ,行程：曹家堡机场 玉门关 莫高窟 月牙泉小镇 月牙泉 鸣沙山月牙泉 雅丹地质公园 张掖七...
重庆攻略❤爱上这山城江城 不夜城 （内附景点美食指南攻略）,2019-08-20 出发,共2天,人均2000元, ,美食,4.3万,途经：重庆 ,行程：洪崖洞商业街 老五一火锅(金岛花园店) 老火锅 解放碑步行街 李子坝 鹅岭二厂 重庆...
说走咱就走，神农架5天，自由行。神龙架双动5日游1500元,2019-08-15 出发,共5天,人均1500元,家庭,深度游 暑假 夏季 第一次,22.4万,途经：神农架 ,行程：神农架风景区 神农谷 香溪源 金猴岭 板壁岩 坪阡古镇 鹿苑 炎帝剧场 天生桥
畅游北疆四人行---北疆大环线12天自驾游,2019-08-03 出发,共12天, , ,漫游 自驾,1892,途经：布尔津 喀纳斯Kanasi 吐鲁番 乌鲁木齐 伊宁 奎屯 ,行程：五彩滩 喀纳斯景区 喀纳斯三湾 禾木风景区 布尔津县
坐火车去吧~日本九州九日游,2018-06-26 出发,共9天,人均15000元,独自一人,深度游,389,途经：日本(福冈Fukuoka) ,行程：中州
去城市度假，去海边撒野 —— 三亚旅行随笔,2019-08-19 出发,共3天,人均3000元,三五好友,美食 海滨海岛 摄影 夏季,3.7万,途经：三亚 ,行程：海棠湾 摩托艇 大东海 亚龙湾 椰梦长廊 三亚湾 蜈支洲岛 原味椰子鸡
背包三天半游大同,2019-08-19 出发,共3天,人均1000元, ,美食,871,途经：大同 浑源 ,行程：云冈石窟 悬空寺 浑源汽车站 恒山 九龙壁 华严寺 法华寺
鹤山两日休闲亲子游，与自然为伴的艺术之旅,2019-08-17 出发,共2天,人均1000元,亲子,美食 暑假 短途周末 夏季,2.1万,途经：鹤山, 
带着老爸老妈游四川~峨眉成都六日游记,2019-08-11 出发,共7天,人均2500元,家庭,深度游 自驾 暑假 摄影 夏季,7744,途经：峨眉山 成都 乐山 ,行程：金顶 武侯祠 天府广场 文殊院 锦里古街 宽窄巷子 峨眉山 乐山大佛 成都大熊猫繁...
美疆环游（下）北疆篇,2019-07-22 出发,共33天,人均16400元,家庭,环游 自驾 暑假,2122,途经：布尔津 巴里坤县Balikunhasake 阜康 奇台 乌鲁木齐 ,行程：五彩滩 巴里坤古城 天山天池 江布拉克 巴里坤湖 江布拉克草原
美疆环游（中）北疆篇,2019-07-22 出发,共33天,人均16400元,家庭,环游 自驾 暑假,2622,途经：伊犁 昭苏 霍尔果斯Huoerguosi 奎屯 特克斯 ,行程：喀拉峻草原 唐布拉风景区 伊昭公路 特克斯八卦城 夏塔旅游区 霍尔果斯国门景区
38°暴晒下的“闹心”之行,2019-08-12 出发,共5天,人均2300元,家庭,美食 暑假 第一次,1465,途经：重庆 ,行程：江北机场T3航站楼 赵二火锅 解放碑步行街 洪崖洞·洋货街 三峡博物馆 人民大礼堂...
想打死同伴的广州三日游,2019-08-13 出发,共3天,人均2680元,三五好友,美食 第一次,83万,途经：广州 ,行程：陶陶居 上下九步行街 中山大学 中山纪念堂 广东美术馆 陈家祠
孤独患者寻味记,2019-07-15 出发,共5天,人均1000元,三五好友,美食 温泉 暑假 短途周末 夏季,12.3万,途经：成都 ,行程：大院河鲜(九眼桥店) 张太婆老妈蹄花(太古里总店) 烤匠麻辣烤鱼(IFS店) 东郊记忆
美疆环游（上）南疆篇,2019-07-22 出发,共33天,人均16400元,家庭,环游 自驾 暑假,3431,途经：和静 库车 ,行程：巴音布鲁克草原 开都河 天山神秘大峡谷 大龙池 巴音布鲁克天鹅湖 九曲十八弯
金三角清莱游记  2岁6个国家30个城市，给你最好的成长就是带你看世界,2019-08-16 出发,共3天, ,亲子,深度游,3.1万,途经：泰国(清莱Chiang Rai) ,行程：辛哈公园 黑庙 金三角 清莱蓝庙 白庙 金三角象园安纳塔拉度假酒店(Anantara Golden...
重庆4日游（内附干货！）,2019-08-15 出发,共4天,人均2000元,学生,美食 夏季 第一次,7131,途经：重庆 ,行程：长江索道 洪崖洞民俗风貌区 南山一棵树观景台 陈昌银麻花 江北国际机场 重庆无忧良...
家家有水，户户有花—我们的云贵旅拍之旅,2019-08-11 出发,共8天,人均5000元,情侣,蜜月 美食 婚纱 夏季 摄影,2990,途经：贵阳 丽江 镇远 束河Shuhe ,行程：龙洞堡国际机场 束河古镇 丽江古城 丽江千古情景区 丽江三义国际机场 老凯里酸汤鱼...
玩转三亚小众景点 这个盛夏我与三亚初相见,2019-08-28 出发,共3天,人均2000元, ,美食 海滨海岛 暑假 夏季 短途周末,7.5万,途经：三亚 ,行程：第一市场 爱上读书馆 亚龙湾 后海 椰梦长廊 明申高尔夫酒店 五指山 三亚湾 海南...
去呼伦贝尔拥抱蓝天白云大草原,2019-07-24 出发,共11天,人均7000元,亲子,深度游 海滨海岛 自驾 暑假 第一次,4936,途经：呼伦贝尔 ,行程：呼伦贝尔大草原 呼伦湖 呼和诺尔湖 贝尔湖
带着爸妈去草原——呼伦贝尔,2019-07-24 出发,共8天,人均4000元,家庭,蜜月 自驾 暑假 摄影,4303,途经：满洲里 哈尔滨 额尔古纳 临江 ,行程：扎赉诺尔博物馆 松花江 圣索菲亚大教堂 室韦 黑山头镇 恩和俄罗斯族民族乡 额尔古...
广州  小长假可以在广州玩什么？,2019-06-07 出发,共4天,人均3000元,情侣,端午 第一次,1.4万,途经：广州 顺德 ,行程：上下九步行街 北京路步行街 广州塔 石室圣心大教堂 点都德(花城店) 沙面 陈家祠...
只为美食周末打个飞的去成都，佛系吃货这样逛吃逛吃游,2019-06-28 出发,共3天,人均2500元,三五好友,美食 短途周末,2.9万,途经：成都 ,行程：冰粉 鹤鸣茶社 四川大学 宽窄巷子 大慈寺
【南纬8度，千面印尼】访爪哇古城，凌星云火山，拥巴厘大海,2019-08-12 出发,共10天,人均10000元,三五好友,环游 海滨海岛 夏季 徒步 探险,4744,途经：印度尼西亚(蓝梦岛Lembongan 巴厘岛Bali) 日惹 ,行程：蓝梦岛 金银岛 蘑菇海滩 天神浴池 佩妮达岛 登巴萨
宝鸡大水川景区三日游,2019-08-02 出发,共3天,人均1000元,亲子,自驾,3.9万,途经：宝鸡 ,行程：宝鸡大水川宾馆 宝鸡九龙山国际温泉酒店
全家出动山东半岛11日游,2019-07-24 出发,共11天,人均3500元,家庭,深度游 美食 海滨海岛 暑假,2318,途经：济南 青岛 蓬莱 泰山 成都 ,行程：趵突泉景区 大明湖景区 泉城广场 芙蓉街 雅悦连锁酒店(济南泉城广场店) 五龙潭公园...
"承德,乌兰布统,塞罕坝6日家庭自驾游！",2019-07-29 出发,共6天,人均1100元,家庭,自驾 夏季,8513,途经：乌兰布统草原Wulanbutong 塞罕坝Saihanba 围场 承德 ,行程：乌兰布统旅游区 御道口风景区 将军泡子 机械林场 七星湖假鼠妇草湿地公园-凉亭 塞...
憨居居慢节奏之旅,2019-08-12 出发,共6天,人均1500元,学生,美食 毕业游 夏季,4279,途经：凤凰 长沙 吉首 ,行程：凤凰古城 湖南省博物馆 南华门 虹桥风雨楼 沈从文故居 沱江 天鹅之旅国际青年旅舍...
蓝天白云突然暴风雨，跟着我换个地方过周末,2019-08-04 出发,共2天,人均500元,三五好友,美食 短途周末,5140,途经：宁波 ,行程：周边 宁波城市展览馆 宁波文化广场 天一广场 宁波科学探索中心 老外滩 日月光(利...
追随韩剧的脚步，来一场深度釜山行,2019-07-27 出发,共4天,人均6000元,情侣,深度游 购物 美食 登山 短途周末 夏季,6155,途经：韩国(釜山Busan) ,行程：釜山 南浦洞 广安大桥 甘川文化村 海云台 BIFF广场 釜山札嘎其市场 冬柏参鸡汤...
2019年马来西亚行（一）——热浪岛风情,2019-07-23 出发,共10天,人均5000元,家庭,海滨海岛 暑假,8520,途经：马来西亚(热浪岛Pulau Redang) ,行程：热浪岛
彩云之南,2019-08-08 出发,共12天,人均8000元,三五好友,深度游 美食,5363,途经：大理 丽江 泸沽湖 玉溪 双廊Shuanglang ,行程：洱海 大理古城生活有时精品客栈 菌美大理·野生菌火锅 大理古城南门 大理古城 丽江...
带你看我眼中的日照，看花、赏竹、游泳、航拍，这样玩才最嗨！,2019-08-06 出发,共3天,人均500元,三五好友,深度游 购物 美食 中秋节 自驾 暑假 短途周末,1.4万,途经：日照 ,行程：驻龙山 竹洞天风景区 万平口风景区 吴家台 灯塔风景区 花仙子风景区 晓菡渔家乐(...
和大海约定的每一年夏天--2+2的青岛慵懒海边慢生活,2019-08-07 出发,共4天, , ,海滨海岛 暑假 夏季,6.1万,途经：青岛 ,行程：红树林度假世界 黄岛 公主楼 五月的风 五四广场 海底隧道 童乐园
记我的第一次高海拔徒步---贡嘎南坡穿越,2018-09-28 出发,共10天, ,三五好友,深度游 摄影 徒步 国庆 第一次,6.4万,途经：泸定 康定 成都 玉龙 ,行程：贡嘎山 巴王海 成都大熊猫繁育研究基地 宽窄巷子 折多山 泉华滩 子梅垭口 子梅村...
多变的旅程,2019-07-13 出发,共9天,人均4700元,家庭,古镇 暑假 徒步,2102,途经：昆明 丽江 香格里拉Xianggelila ,行程：昆明君辉商务酒店 西山风景名胜区 龙门 福照楼(锦江店) 古城大水车 阿婆腊排骨...
10天打卡迪拜所有景点，来一次自由的奢华之旅,2019-08-05 出发,共10天, ,三五好友,购物 美食 暑假 摄影,4.1万,途经：阿联酋(迪拜Dubai) ,行程：帆船酒店 哈利法塔（迪拜塔） 阿联酋购物中心 阿拉伯历史建筑群 迪拜购物中心 水世...
慢游成都，每天只做一件事,2019-07-22 出发,共7天,人均5000元,家庭,美食 古镇 暑假 短途周末 夏季,3.4万,途经：成都 ,行程：杜甫草堂 宽窄巷子 成都东站 成都大熊猫繁育研究基地 糖油果子 成都小吃 成都吃客...
重庆小日子～（不断更新）,2019-07-15 出发,共15天,人均10000元,三五好友,购物 美食 自驾 短途周末 摄影 徒步 人文,6493,途经：重庆 ,行程：好好玩童书馆(重庆万象汇站) 洪崖洞民俗风貌区 解放碑步行街 朝天门广场 WFC会仙楼...
2019暑期阿尔山、呼伦贝尔、大兴安岭、哈尔滨找北之旅,2019-07-14 出发,共13天,人均3500元,家庭,自驾 暑假 夏季,9.8万,途经：哈尔滨 ,行程：中央大街
山西 ------华夏文明，晋在山西,2019-07-20 出发,共8天,人均3000元,家庭,深度游 穷游 古镇 暑假,7212,途经：大同 五台山Wutaishan 临汾 平遥 太原 ,行程：善化寺 五台山 华严寺 尧庙 平遥古城 圣母殿 唐叔虞祠 难老泉 水镜台 晋祠博物...
4天3夜，西北自驾の青海夏日风光大赏,2019-08-02 出发,共4天,人均2000元,家庭,自驾 暑假 夏季 短途周末 摄影,5998,途经：海西 青海湖qinghaihu 门源 祁连 ,行程：茶卡盐湖 青海湖 门源百里油菜花海 祁连山风光旅游景区
摩洛哥自由行攻略（卡萨布兰卡/舍夫沙万/菲斯/撒哈拉/马拉喀什）12日全记录,2018-05-24 出发,共12天,人均15000元,三五好友,深度游 第一次,5.3万,途经：摩洛哥(卡萨布兰卡Casablanca 舍夫沙万Chefchaouen 马拉喀什Marrakesh) 奥地利(菲斯Fis... ,行程：哈桑二世清真寺 舍夫沙万 德吉玛广场
三亚吃喝玩乐全攻略-在三亚海岛城市里遇见小欧洲？,2019-08-01 出发,共5天,人均3000元,闺蜜,漫游 美食 海滨海岛 夏季 短途周末 摄影,6.1万,途经：三亚 ,行程：奥特莱斯海鲜广场 蜈支洲岛 凤凰岛 小东海 亚龙湾 三亚湾 椰梦长廊 半山半岛帆船...
暹粒之记：敲醒沉睡的吴哥王朝,2019-08-01 出发,共1天, , ,美食,4.7万,途经：柬埔寨(暹粒Siem Reap) ,行程：吴哥窟 通王城 塔普伦寺 巴戎寺 吴哥的微笑 吴哥寺 巴普昂寺 圣剑寺 吴哥夜市
十月蜜月之旅我和胡杨林的约会,2018-10-21 出发,共11天,人均5000元,情侣,蜜月 穷游 漫游 古镇,2.1万,途经：郑州 大理 额济纳旗Ejinaqi 西宁 丽江 ,行程：胡辣汤 蝴蝶泉 策克口岸 天龙八部影视城 居延海 大漠胡杨旅游区 洱海 神树 苍山...
三亚度假，一场文化和海滩的碰撞之旅,2019-07-11 出发,共5天,人均3000元,独自一人,美食 海滨海岛 暑假 探险,5.7万,途经：三亚 ,行程：南山文化旅游区 崖州古城 天涯海角 亚龙湾 椰梦长廊 亚龙湾国家旅游度假区 大东海...
不忘初心 牢记使命 七年之痒 重走蜜月路,2019-08-01 出发,共8天,人均5000元,情侣,蜜月 美食 古镇 暑假 摄影,3360,途经：香格里拉Xianggelila 大理 丽江 ,行程：香格里拉 转经筒 月光广场 独克宗古城 大佛寺 五彩雪域藏餐馆 碧塔海 洱海 崇圣...
暑假亲子游，带娃去西双版纳探寻神秘和童话,2019-07-02 出发,共6天,人均4500元, ,暑假 探险,1.6万,途经：西双版纳 ,行程：西双版纳傣族园 西双版纳热带雨林国家公园望天树景区 景真八角亭 橄榄坝 罗梭江...
初寻日本,2019-08-04 出发,共15天, , ,购物 温泉,2770,途经：日本(大阪Osaka 京都Kyoto 奈良Nara 宇治市Uji 大岛町Oshima machi 东京Tokyo 藤泽市F... ,行程：天下茶屋 大阪北滨布莱顿酒店(Hotel Brighton City Osaka Kitahama) 大阪城公园 大阪...
【AOTUMAN】孤独之城相依之旅·西澳珀斯11日自驾之旅,2018-10-02 出发,共11天,人均14000元,情侣,蜜月 自驾 摄影 国庆,3.5万,途经：澳大利亚(珀斯Perth) ,行程：卡尔巴里国家公园
点亮“1/3”的中国,2019-07-28 出发,共9天,人均4500元,家庭,自驾 暑假,3386,途经：西安 ,行程：骊山 秦始皇兵马俑博物馆 华清宫 大明宫国家遗址公园 西安城墙 钟鼓楼广场 《驼铃...
一起领略大西北的无限风光！,2019-07-07 出发,共20天,人均6500元,家庭,环游 美食 古镇 暑假 摄影,1.6万,途经：敦煌 西安 兰州 西宁 成都 贵阳 ,行程：莫高窟 西安城墙 安远门 大唐不夜城 回民街 永宁门 水盆羊肉 秦始皇陵 长乐门...
净心之旅 我的西北大环线十天自由行,2019-07-05 出发,共10天,人均7000元,家庭,环游 美食 暑假 摄影 夏季,6919,途经：敦煌 张掖 青海湖qinghaihu 西宁 ,行程：莫高窟 张掖 青海湖 塔尔寺 鸣沙山月牙泉 青海省博物馆 东关清真大寺 雅丹地质公...
漫游浙江，美景与美食一网打尽,2019-07-13 出发,共5天,人均4000元,三五好友,漫游 美食 古镇 夏季 摄影,6.8万,, 
从苏州古镇到日本，一路收获快落,2019-02-28 出发,共1天, , ,古镇,3709,途经：苏州 上海 周庄Zhouzhuang 日本(神户kobe 大阪Osaka 京都Kyoto 札幌Sapporo 小樽Otar... ,行程：苏州姑苏十号小院客栈 拙政园 苏州博物馆 一个人 山塘街 观前街 周庄偶遇江南客栈...
自驾鱼米之乡，浙里有点意思：宁波-舟山-台州-温州,2019-07-13 出发,共5天,人均4000元,三五好友,自驾 暑假 摄影,9万,途经：宁波 舟山 温州 台州 ,行程：国清寺 天一阁博物院 三毛祖居 江心屿 中山公园 鼓楼步行街(公园路) 石浦海味饭店...
游武夷山,2016-09-23 出发,共3天, ,家庭,短途周末,4.5万,途经：武夷山 ,行程：武夷山 一线天 大王峰
诗意北欧 只属于自己的仲夏童话之梦,2019-06-14 出发,共13天, , ,游轮,4319,途经：瑞典(斯德哥尔摩Stockholm) 丹麦(哥本哈根Copenhagen) 挪威(奥斯陆Oslo 卑尔根Bergen ... ,行程：斯德哥尔摩 哥本哈根 挪威王宫 卑尔根布吕根码头 弗洛伊恩山（有缆车） 阿克胡斯城...
雨桂林,2015-11-11 出发,共6天,人均3000元, , ,5769,途经：桂林 龙脊梯田The longji yao and zhuang ethnic terrace ,行程：两江四湖 正阳路步行街 漓江 银子岩
穿着汉服走过四季 给你丨长安丨所有的美,2019-07-23 出发,共10天, ,情侣,深度游 美食 自驾 摄影,3.3万,途经：西安 ,行程：秦始皇兵马俑博物馆 顺城巷 永宁门 钟楼 陕西历史博物馆 大雁塔 西安电子科技大学...
KK  游山水贵州，一览风采,2019-07-13 出发,共9天,人均3000元,家庭,深度游 古镇 自驾 暑假 登山 夏季,1.1万,途经：织金 贵阳 安顺 镇宁 ,行程：织金洞 贵阳北站 织金大峡谷 天龙屯堡 黄果树瀑布 旧州古镇 青岩古镇 夜郎谷...
相遇夏季浪漫岛屿，我们在马来西亚写下情书（内含实用“避雷”攻略）,2019-07-22 出发,共1天, , ,美食 潜水 夏季 第一次,3.1万,途经：马来西亚(仙本那Semporna 吉隆坡Kuala Lumpur) ,行程：仙本那 邦邦岛 双子塔 国家石油公司双塔大楼 军舰岛 卡帕莱岛 珍珠岛 敦沙卡兰海...
萨瓦迪，随时光倒流的琅勃拉邦,2019-07-22 出发,共1天, , , ,2.6万,途经：老挝(琅勃拉邦Luang Prabang) ,行程：湄公河 琅勃拉邦 浦西山 迈佛寺 香通寺
从阳朔到桂林，遇见米粉遇见你 | 五天四夜在桂林,2019-07-16 出发,共1天,人均2000元,闺蜜,漫游 美食 古镇 第一次,8415,途经：阳朔 桂林 ,行程：兴坪古镇 桂林千古情景区 阳朔西街美食街 龙颈河漂流 日月双塔
2019泰国甲米小众景点：你喜欢的夏天，它都有~,2019-06-20 出发,共6天,人均4000元,三五好友,深度游 美食 摄影 夏季,3万,途经：泰国(甲米Krabi) ,行程：奥南海滩
梦幻徽州我来啦！（内含多图）,2019-07-10 出发,共7天,人均2500元,三五好友,暑假 夏季 第一次,1.1万,途经：黟县 黄山 黄山区 ,行程：西递 宏村景区 黄山北站 屯溪老街 黄山得舍村宿 明代老房·官邸私厨 宏村上街客栈...
湛江-桂林亲子游,2019-07-13 出发,共6天, , , ,3050,途经：桂林 湛江 龙脊梯田The longji yao and zhuang ethnic terrace ,行程：西街 漓江风景名胜区
锦城记,2019-06-27 出发,共3天,人均2000元, ,美食,5.5万,途经：成都 ,行程：宽窄巷子 东郊记忆 鸳鸯楼 九眼桥 三圣乡基地 王小蚝(玉林店) 成都吃客(致民路店)...
三天两夜的魔都游，是什么和迪士尼最配？,2019-05-01 出发,共3天,人均1800元,情侣,美食 古镇 五一 短途周末 探险,3.9万,途经：上海迪士尼度假区Shanghai Disney Resort 上海 ,行程：点亮奇梦：夜光幻影秀 七宝古镇 1933老场坊 上海迪士尼度假区 上海南站 黄河路美食...
四天三晚，带你玩转不一样的三亚,2019-06-26 出发,共3天,人均5000元,三五好友,美食 温泉 自驾 暑假,6.2万,途经：三亚 ,行程：海棠湾 水稻国家公园 三亚亚特兰蒂斯水世界 情人岛 妈祖庙 蜈支洲岛
夏日岛屿纪事——三亚非典型亲子攻略,2019-07-06 出发,共5天,人均8000元,亲子,美食 海滨海岛 夏季 暑假 摄影,3.9万,途经：三亚 ,行程：天涯海角 大东海 滑索 海棠湾 亚龙湾 三亚天域度假酒店 三亚湾 椰梦长廊 沧海楼...
@王鋆鋆[自驾环岛婚纱照]最好的我们在冰岛，这才是青春该有的模样（含详细攻略）,2019-04-20 出发,共11天,人均20000元,情侣,深度游 环游 美食 自驾 婚纱 夏季,1.8万,途经：冰岛(雷克雅未克Reykjavik 伊萨菲尔德Isafjordur 冰岛北部区North Iceland 阿克雷里Ak... ,行程：雷克雅未克 斯奈山半岛 伊萨菲厄泽 火山口 塞里雅兰瀑布 伊萨菲厄泽酒店(Hótel Ísa...
慢行中欧，谱一曲中世纪的浪漫童话,2019-07-15 出发,共13天,人均10000元, ,深度游 美食 自驾 探险 第一次,3.2万,途经：捷克(布拉格Prague) ,行程：伏尔塔瓦河 布拉格老城广场 列侬墙 查理大桥 跳舞的房子 布拉格城堡 旧市政厅...
2019，呼伦贝尔草原行,2019-07-05 出发,共9天,人均7000元,三五好友,深度游 暑假,1.1万,途经：呼伦贝尔 额尔古纳 漠河 满洲里 ,行程：巴尔虎草原 额尔古纳湿地 莫尔道嘎国家森林公园 胭脂沟 乌苏里浅滩 九曲十八弯...
七月小游腾冲，感受火山之城的小众之美,2019-07-02 出发,共4天,人均4700元,独自一人,深度游 购物 美食 温泉 古镇 暑假 短途周末 摄影,4.2万,途经：腾冲 和顺镇Heshunzhen 保山 ,行程：和顺古镇 寸氏宗祠 和顺图书馆 西董花园餐厅 腾冲火山地质博物馆 腾冲本诺民宿...
