标题,出发时间,逗留时间,费用,游玩人数,游玩方式,观看量,途径,行程
福建攻略｜登武夷山，游九曲溪，品地道闽味,2022-12-19 出发,共1天, , ,漫游 美食,3.4万,途经：武夷山 ,行程：玉女峰 武夷山 天游峰 一线天 大王峰 虎啸岩 武夷山九曲溪 大红袍景区 武夷宫...
高松走透透,2018-08-19 出发,共4天,人均3000元,三五好友,深度游 购物 美食 暑假,5095,途经：日本(高松Takamatsu) ,行程：高松港
未命名标题,2022-12-11 出发,共1天, , , ,6580,, 
敬畏自然｜北极圈之旅的感悟（格陵兰岛篇）,2022-11-30 出发,共1天, , ,徒步,2702,途经：丹麦(哥本哈根Copenhagen) 格陵兰岛(伊卢利萨特Ilulissat) ,行程：小美人鱼像 阿美琳堡宫 新港 哥本哈根歌剧院 罗森堡宫 腓特列教堂 Citadel
【北京】二0二二之秋｜酒贱常愁客少，月明多被云妨,2022-11-07 出发,共4天, ,独自一人,深度游 赏秋,8576,, 
我是有大海的人呐（山东青烟威秋冬5日自驾）,2022-11-17 出发,共1天, , ,自驾 赏秋 冬季,8575,途经：青岛 烟台 威海 ,行程：广兴里 崂山 养马岛 火炬八街 栈桥 悦海公园 韩乐坊 青山渔村 八大关 五四广场...
敬畏自然｜北极圈之旅的感悟（冰岛篇）,2022-07-16 出发,共10天,人均20000元,亲子,深度游 环游 购物 温泉 自驾 暑假 夏季 徒步,9440,途经：冰岛(雷克雅未克Reykjavik 维克Vik 米湖Myvatn) ,行程：珍珠楼 哈尔格林姆斯大教堂 国会旧址 斯奈山半岛 太阳航海者 霍夫迪楼 辛格维利尔...
【北京】二0二二之秋，京城古迹知多少（上）,2022-09-06 出发,共5天, ,独自一人,深度游 短途周末,6757,途经：北京 ,行程：南锣鼓巷 景山公园 国家图书馆 明十三陵 银山塔林 颐和园 大雄宝殿 万寿寺 圆明...
💙印尼旅行💙站在活火山口是什么体验？火山深海全攻略❗,2017-05-01 出发,共8天,人均6000元,独自一人,深度游 五一,7994,途经：瑞典(布罗Bro) 冰岛(雷克雅未克Reykjavik), 
这样的大理你见过吗？五天四晚看不一样的大理,2022-11-06 出发,共1天,人均6000元,三五好友,自驾 赏秋,9834,途经：大理 ,行程：洱海 大理古城五彩云花苑酒店 苍山 喜洲 洱海生态廊道 崇圣寺三塔文化旅游区 大理...
锡基霍尔的蓝和奥斯洛布的大朋友,2019-07-13 出发,共10天,人均5000元,家庭,美食 自驾 潜水 暑假 摄影,911,途经：菲律宾(宿务Cebu 锡基霍尔Siquijor) ,行程：圣婴教堂
自驾湘西乾州古城、尖朵朵、矮寨奇观、十八洞村、里耶古城、茶峒古镇、凤凰古城,2022-09-19 出发,共5天,人均1999元,独自一人,古镇 自驾 赏秋,1.3万,途经：花垣 ,行程：尖朵朵瀑布 十八洞村 边城景区
瑞士日记｜手把手教你10天玩转山水王国,2022-07-12 出发,共10天,人均12000元,亲子,深度游 暑假 摄影 夏季 徒步,1.1万,途经：瑞士(劳特布龙嫩Lauterbrunnen 苏黎世Zurich 洛桑Lausanne) 上海 ,行程：少女峰 苏黎世大教堂 Wengen 班霍夫大街
2022年广西桂林北海,2022-09-24 出发,共10天,人均5300元,家庭,环游 美食 自驾 骑行 赏秋,1.4万,途经：北海 龙胜 阳朔 桂林 ,行程：涠洲岛 龙脊梯田 山水甲天下 东西巷 独秀峰 靖江王府(独秀峰) 两江四湖 日月双塔...
小鲁面の人间威海·仙境蓬莱『胶东半岛双城记』,2022-10-11 出发,共1天, , , ,1.1万,途经：威海 烟台 ,行程：林海公园 万鸟岛 九丈崖 宝塔礁 蓬莱阁 仙境源 刘公岛 韩乐坊 旗顶山炮台 长岛...
送你一朵小红花——2021暑假青海湖大环线,2021-07-01 出发,共10天,人均6000元,亲子,深度游 环游 自驾 暑假,9502,途经：嘉峪关 敦煌 祁连 西宁 ,行程：嘉峪关文物景区 嘉峪关关城 莫高窟 祁连大草原 卓尔山 塔尔寺 青海省博物馆 阳关...
千里迢迢去敦煌——2022的国庆，继续出发,2022-10-02 出发,共5天,人均5000元,家庭,美食 国庆 第一次,8691,途经：敦煌 ,行程：鸣沙山 鸣沙山月牙泉 月牙泉 莫高窟 沙洲夜市 敦煌夜市 沙洲市场 西千佛洞 玉门...
大唐亲子7日游,2022-09-28 出发,共7天,人均4500元,亲子,国庆 第一次,9002,途经：西安 ,行程：《长恨歌》演出 陕西历史博物馆 赛格国际购物中心 西安城墙 大雁塔北广场音乐喷泉...
【北京】不便出京，去昌平看望明成祖,2022-09-19 出发,共3天,人均560元,家庭,深度游 短途周末,1.1万,途经：北京 ,行程：明十三陵 银山塔林 清真寺 北京市劳动人民文化宫 中国国家博物馆 故宫 七孔桥...
四天三晚闺蜜游南丹，有趣目的地等你来探索,2022-09-26 出发,共4天, ,三五好友,探险 第一次,2.1万,途经：南丹, 
【国庆去哪儿玩】邂逅美丽多彩青城，开启3天2夜深度之旅,2022-09-15 出发,共3天,人均1000元,三五好友,深度游 美食 自驾 赏秋 国庆,2.1万,途经：呼和浩特 ,行程：内蒙古博物院 绥远城将军衙署 塞上老街 莫尼山非遗小镇 敕勒川草原 宽巷子 老绥远...
【梦华录】寻觅拾光♥来一场穿越之旅（北京慢游记）,2022-07-25 出发,共7天,人均3000元,亲子,漫游 暑假 毕业游,5286,途经：北京 ,行程：故宫 颐和园 清华大学 天安门广场 王府井 天坛 八达岭长城 四季民福 王府井天主...
我和凤凰沱江有个约定,2022-09-17 出发,共2天,人均600元,家庭,古镇 中秋节 短途周末 摄影 赏秋,7882,途经：凤凰 洪江 ,行程：凤凰古城 黔阳古城 洪江古商城 沱江跳岩 虹桥风雨楼 万名塔 黔阳古城芙蓉楼
初见平遥古城与乔家大院——千年前的穿梭与信仰,2022-09-08 出发,共5天,人均1000元,三五好友,购物 美食 穷游,8202,途经：平遥 ,行程：城隍庙 平遥古城 日升昌票号 协同庆票号(中国钱庄博物馆) 平遥文庙 明清古街 洪武...
金秋游绍兴，一半古镇情，一半山水意,2022-09-05 出发,共5天, ,三五好友,深度游 美食 古镇 夏季 赏秋,1.8万,途经：绍兴 ,行程：鉴湖 三味书屋 百草园 沈园 鲁镇 大香林·兜率天景区 徐渭艺术馆 仓桥直街 黄酒
金秋九月游湖南，吃喝玩乐走遍“长张郴”，干货攻略已为你准备好,2022-09-16 出发,共6天,人均2000元,独自一人,深度游 美食 中秋节 赏秋,9107,途经：张家界 郴州 长沙 ,行程：天门山国家森林公园 武陵源 张家界国家森林公园 仰天湖大草原 爱晚亭 岳麓山 岳麓...
偷得浮生三日闲，览胜武夷山水间,2022-09-02 出发,共3天,人均1000元,家庭,漫游 暑假 短途周末 徒步 赏秋 探险,6120,途经：武夷山 ,行程：玉女峰 岩骨花香漫游道 武夷山 天游峰 一线天 水帘洞 大王峰 虎啸岩 九曲溪竹筏...
夏日逃跑计划丨云南小环线六天五晚自驾游,2022-07-30 出发,共6天,人均1600元,三五好友,环游 美食 古镇 自驾 夏季,6479,途经：昆明 大理 ,行程：金马碧鸡坊 世界园艺博览园 黑龙潭 昆明植物园 云南民族大观园 官渡古镇 挖色镇...
一碗绍兴酒，一场水城梦，绍兴四日漫行记,2022-09-13 出发,共1天, , ,美食 古镇,1.3万,途经：绍兴 ,行程：柯桥古镇 仓桥直街 三味书屋 安昌古镇 百草园 大香林·兜率天景区 徐渭艺术馆 绍...
从海的那头到山的这头，红色遵义的东茶、西酒、南寨、北奇,2022-09-01 出发,共5天,人均3500元,三五好友,深度游 美食 古镇 自驾 赏秋 探险,8281,途经：遵义 ,行程：海龙屯 茅台天酿景区 茅台酒厂
莽山国家森林公园&五指峰，堪称小张家界,2022-09-03 出发,共2天,人均500元,情侣,自驾 赏秋,7953,途经：宜章 郴州 ,行程：莽山·五指峰景区 猴王寨风景区
奉节、巫山、张家界十三日游,2022-09-08 出发,共13天,人均6000元,亲子,美食 暑假,763,途经：张家界 ,行程：武陵源 张家界国家森林公园 金鞭溪大峡谷 天下第一桥 袁家界 黄石寨 天子山 天门...
古韵聊城，走进中国北方的威尼斯,2022-09-08 出发,共4天,人均2000元, ,深度游 美食 摄影 探险,1.7万,途经：聊城 ,行程：东昌湖 光岳楼
【北京】二0二二之夏，在闷热无聊中找寻我的清欢,2022-07-01 出发,共21天, ,独自一人,夏季,6337,途经：北京 ,行程：护国寺小吃 十七孔桥 颐和园 昆明湖 永定门 北京古代建筑博物馆 正阳门 中国国家...
呼伦贝尔｜天边那片辽阔的大草原啊,2022-08-01 出发,共7天,人均3000元,独自一人,摄影 夏季 探险,7056,途经：呼伦贝尔 ,行程：186彩带河 奥洛契庄园 呼伦贝尔大草原 大兴安岭 呼伦湖
『桂林·阳朔·龙脊梯田』❀微卷不累❀6天5晚自由行,2022-08-17 出发,共6天,人均4000元,家庭,美食 夏季 第一次,8057,途经：阳朔 桂林 龙脊梯田The longji yao and zhuang ethnic terrace ,行程：阳朔 相公山 遇龙河漂流 九马画山 漓江风景名胜区 十里画廊 遇龙河 两江四湖...
【自驾环游北中国—盛世长安】生生灯火，不及十三朝风华入梦,2021-06-20 出发,共6天, ,情侣,环游 美食 自驾,5203,途经：西安 ,行程：秦始皇帝陵博物院(兵马俑) 大唐不夜城 回民街 西安博物院 西安城墙 大雁塔 青龙寺...
七月的风，八月的雨，九月的我在云南等你,2022-08-31 出发,共4天, ,三五好友,夏季 第一次,6929,途经：大理 丽江 昆明 ,行程：大理的风花雪月 玉龙雪山 滇池 昆明站 大理站 大理古城 昆明南站 洱海 丽江古城
【大东北】，冬季冰爽七日游！（哈尔滨-雪谷-雪乡-长白山-魔界-老里可湖）,2019-02-01 出发,共7天,人均3800元,家庭,深度游 滑雪 温泉 徒步 冬季,7999,途经：哈尔滨 ,行程：松花江 名都滑雪场 中央大街 哈尔滨游乐场
好玩的 好吃的 好看的 版纳都有,2022-08-20 出发,共1天,人均1500元,三五好友,穷游 美食 中秋节,7707,途经：西双版纳 景洪 ,行程：勐景来 曼听公园 西双版纳总佛寺 基诺山寨 西双版纳傣族园 西双版纳热带雨林国家公...
总要去趟江南吧！和黟县的重逢，是执念，更是下江南的如愿！,2022-08-28 出发,共3天,人均1500元,独自一人,深度游 美食 自驾 中秋节 夏季 第一次,8195,途经：黟县 ,行程：宏村景区 木坑竹海 塔川 汪氏宗祠 月沼 南湖 屏山村 卢村 西递 敬爱堂 南屏景...
夏末西行记｜我们迎着烈日奔向喀什！,2022-08-01 出发,共7天,人均5500元,三五好友,美食 夏季,4747,途经：喀什, 
Second Journey with harbiti,2022-08-19 出发,共5天,人均2000元, , ,7947,途经：银川 捷克(萨杰Sec) 西班牙(赫罗纳Girona) ,行程：镇北堡西部影城
大美鄂尔多斯，奔赴一场沙漠与草原的约定（6天7夜之旅）,2022-08-25 出发,共1天, , ,漫游 美食 探险,3.6万,途经：达拉特旗Dalateqi 鄂尔多斯 ,行程：库布齐沙漠 鄂尔多斯博物馆 成吉思汗广场 乌兰木伦湖 响沙湾 仙沙岛 夜鸣沙旅游区...
滇西北，夏天里来一个清凉的约会,2022-08-06 出发,共17天,人均9000元,家庭,自驾 暑假 夏季,246,途经：宁蒗 香格里拉Xianggelila 德钦 丽江 ,行程：泸沽湖 虎跳峡 飞来寺 玉龙雪山 蓝月谷 独克宗古城 纳帕海 丽江古城 雨崩村...
浙南看一看，苍南第一站，桥墩镇，守在浙江南大门的宝藏旅行地,2022-08-02 出发,共3天,人均2000元,三五好友,深度游 古镇 自驾 夏季 人文,6363,途经：温州 苍南 ,行程：五凤茶园 茶山 温州苍南桥墩 莒溪大峡谷 矴步头自然风景区 苍南碗窑景区 玉苍山森...
苏州旅行｜水韵同里，全方位深度游（吃住行全攻略）,2022-08-21 出发,共1天, , ,深度游 美食 古镇,3.6万,途经：苏州 ,行程：同里古镇 耕乐堂 嘉荫堂 退思园 罗星洲 苏州站 三桥 南园茶社 太湖 同里国家湿
遇见黄姚，遇见最美古镇！,2022-07-23 出发,共2天,人均500元,家庭,深度游 古镇 夏季,9828,途经：贺州 昭平 ,行程：黄姚古镇圣旨府酒店 带龙桥 黄姚古镇 龙爪榕 古戏台 亦孔之固 吴氏宗祠 欧阳予倩...
湘西5天6夜半团之行,2022-08-12 出发,共6天,人均3400元,闺蜜,购物 暑假,5419,途经：张家界 长沙 ,行程：天门山国家森林公园 长沙市博物馆 湖南博物院 岳麓书院 爱晚亭 橘子洲 岳麓山...
夏游小兴安岭，跳出城市在森林里寻一抹绿,2022-08-08 出发,共5天,人均4000元,三五好友,美食 自驾 暑假,3.9万,途经：哈尔滨 伊春 ,行程：东北虎林园 金山鹿苑 五营国家森林公园 哈尔滨极地公园·极地馆 松花江 中央大街...
新西兰南岛|带娃漂洋过海一万公里，邂逅世界的纯净地,2022-08-18 出发,共3天, , ,美食 滑雪 探险,8501,途经：新西兰(奥克兰Auckland), 
东北东北，偷夏哈伊池,2022-08-07 出发,共6天,人均5000元,三五好友,自驾 夏季 探险,8630,途经：东北地区Northeastern China, 
柳州之旅｜宝藏级的游玩攻略，让你爱上这座城！,2022-08-17 出发,共1天, , ,美食,4.1万,途经：柳州 ,行程：白莲洞洞穴科学博物馆 中渡古镇 马鞍山公园 文昌阁 龙潭公园 柳州博物馆 白莲洞...
我是周末种草官【之】周末请上车，平遥古城乔家大院两地是目的,2022-08-06 出发,共3天,人均1000元,三五好友,深度游 购物 美食 短途周末,1万,途经：平遥 ,行程：平遥古城 洪武记饭店 明清古街 城隍庙 市楼 清虚观 日升昌票号 平遥古县衙 东岳...
10周年结婚纪念——芽庄之旅,2017-07-04 出发,共8天,人均5600元,亲子,蜜月 暑假,6196,途经：越南(芽庄Nha Trang) ,行程：珍珠岛 婆那加占婆塔 芽庄大教堂 竹岛 芽庄珍珠岛游乐园
不止班夫，More Than山湖——不走寻常路的“艾”之初体验,2022-07-01 出发,共12天,人均17000元,家庭,深度游 购物 漫游 滑雪 温泉 自驾 暑假 夏季 徒步 第一次,3354,途经：加拿大(Improvement District No. 9Improvement District No. 9 班夫Banff 班夫国家公... ,行程：班夫国家公园 冰原大道 露易丝湖 朱砂湖 Cascade of Time Garden 哥伦比亚冰川
塞上江南（宁夏）游记,2022-08-14 出发,共5天,人均5500元,家庭,美食 自驾 暑假 摄影,605,途经：中卫 银川 ,行程：北长滩 沙坡头 贺兰山国家森林公园 宁夏博物馆 镇北堡西部影城 中卫natrail迹外营...
青甘大环线7天游,2022-08-05 出发,共7天,人均5700元,三五好友,美食 暑假 摄影 第一次,2869,途经：海西 ,行程：茶卡盐湖 茶卡盐湖月栖湖酒店 大柴旦翡翠湖旅游景区 海西大柴旦像素酒店 雅丹魔鬼城...
庐山，南昌六日故地重游,2022-06-13 出发,共6天,人均2500元, ,深度游 美食 暑假 夏季 徒步,8657,途经：庐山Lushan, 
浙南看一看『苍南』第一站：5天4晚剩夏旅行，沉浸在“诗画景、山海情”,2022-08-02 出发,共5天,人均2000元,家庭,深度游 海滨海岛 夏季,9076,途经：苍南 高密 金乡 ,行程：福德湾
【浙南】拂去岁月风尘  圆我廊桥之梦,2016-10-26 出发,共6天,人均15000元,独自一人,深度游 古镇,8521,途经：景宁 泰顺 ,行程：时思寺 溪东桥
西藏✨重返高原，探秘g219，遇见极致阿里,2022-07-15 出发,共10天,人均10000元,三五好友,自驾 探险,9494,途经：拉萨 ,行程：布达拉宫 大昭寺 拉萨河
天津——惬意之旅,2018-07-01 出发,共5天,人均1500元,亲子,美食 暑假,4705,途经：天津 ,行程：西开教堂 瓷房子 南开大学 滨海国际机场 五大道 天津博物馆 意大利风情区 天津站...
你有没有见过这样的江阴？三天两晚带你玩转江阴,2022-07-30 出发,共3天,人均1000元,三五好友,暑假 短途周末 探险,1万,途经：江阴 ,行程：华西村 海澜飞马水城 花山滑翔伞基地 徐霞客故居
自驾六安800公里大别山风景道，感受车在路上行，人在景中游,2022-07-13 出发,共7天,人均5000元,三五好友,购物 美食 自驾 夏季,4.6万,途经：霍山 六安 霍邱 ,行程：大别山 九公寨 六万情峡 皖西大裂谷 大别山石窟 佛子岭水库 大别山主峰景区白马尖
山西游学  这个暑假，我们在山西画了一个圈,2022-07-17 出发,共4天, ,亲子,深度游 古镇 暑假 登山,3万,途经：平遥 ,行程：市楼 平遥古城
让人又爱又恨的四川行-----重庆,2022-08-02 出发,共7天,人均10000元,家庭,美食 夏季 第一次,2371,途经：重庆 ,行程：白公馆 磁器口古镇 龙水峡地缝 大足石刻
渝东南自驾七日游,2022-07-31 出发,共7天,人均1920元,家庭,古镇 自驾 暑假 摄影 第一次,8718,途经：铜仁 重庆 花垣 ,行程：铜仁大峡谷 酉州古城 酉阳桃花源 龚滩古镇乌江画廊 龚滩景区 阿依河景区 蚩尤九黎...
皇城——北京“暴走”之旅,2018-07-27 出发,共5天,人均2000元,亲子,暑假,7887,途经：北京 ,行程：南锣鼓巷 升旗仪式 颐和园 首都国际机场 天安门广场 王府井 天安门城楼 故宫...
邂逅了一个世外桃源浙南的这座小城，有着市井的味道，却又透着灵气,2022-08-02 出发,共1天,人均2500元,三五好友,自驾 暑假,2万,途经：温州, 
柳州旅行｜三江到融水，好山、好水、好风光,2022-07-29 出发,共3天,人均2000元,三五好友,深度游 暑假 摄影,2.1万,途经：融水 三江 ,行程：梦呜苗寨 元宝山 龙女沟景区 老君洞 程阳八寨 三江风雨桥 双龙沟 程阳风雨桥...
串联六安四县三区，自驾八百公里大别山风景道,2022-07-13 出发,共7天,人均2000元,三五好友,自驾 暑假,8550,途经：霍山 金寨 六安 ,行程：大别山 六万情峡 佛子岭水库 天堂寨 大别山石窟
夏日狂欢盛宴，在森林海度过的清凉时光,2022-08-03 出发,共1天, , ,温泉 夏季,3.5万,途经：广州 宜兰 ,行程：白水寨风景名胜区 增城 派潭镇 白水仙瀑 广州森林海温泉度假酒店 广州东站 广州站...
佛山自驾大理、丽江9天（2022.7.9）,2022-07-09 出发,共9天,人均2400元,家庭,自驾 暑假,1550,途经：大理 佛山 ,行程：洱海
【追寻山西避暑胜地】逃离酷热的八月，邂逅山西夏日的缤纷,2022-07-30 出发,共7天,人均2000元,三五好友,美食 夏季,9475,途经：平遥 壶关 忻州 晋中 ,行程：平遥古城 太行山大峡谷 红豆峡 古城楼 西大街 市楼 城隍庙 辘轳窑沟悬空寺
三过家门而不入－－－青岛2022暑假消夏之行,2022-07-24 出发,共8天,人均1000元,亲子,深度游 漫游 海滨海岛 暑假 夏季,1035,途经：青岛 缅甸(葡萄Putao) ,行程：海军博物馆 圣弥厄尔教堂 五四广场 栈桥 小青岛 中山公园 珠山国家森林公园 台东...
滇行记,2022-07-14 出发,共11天,人均5000元, ,深度游 暑假,1万,途经：普洱 景洪 澜沧 ,行程：普洱国家公园犀牛坪景区 小凹子咖啡庄园 龙摩爷圣地 老达保哈列贾乡村音乐小镇 野象...
继续走马观花游北疆,2022-07-21 出发,共8天,人均12000元, ,环游 美食 暑假 第一次,4065,途经：布尔津 ,行程：禾木风景区 布尔津县 五彩滩 喀纳斯三湾 喀纳斯景区 观鱼台 贾登峪 神仙湾 月亮...
威海、日照行,2022-07-15 出发,共8天,人均3000元, , ,9735,途经：日照 绵阳 威海 ,行程：万平口风景区
蕃尼古道，穿越千年的进藏之路,2022-07-05 出发,共5天,人均4000元,三五好友,深度游 自驾 暑假,7.3万,途经：吉隆 拉萨 ,行程：乃村 吉隆沟 开热瀑布 拉萨河 拉鲁湿地自然保护区 清政府驻藏大臣衙门旧址 宗角禄...
带两岁十个月娃去内蒙草原自驾是种怎样的体验？,2022-07-17 出发,共1天,人均2400元,家庭,深度游 自驾 暑假 第一次,5774,途经：承德 张家口, 
成都济南扬州绍兴义乌黄山长沙15日游,2022-07-24 出发,共15天,人均6000元,亲子,美食 暑假 第一次,4263,途经：成都 济南 扬州 绍兴 义乌 兰溪 黟县 黄山 长沙 ,行程：成都东站 高铁城市公园 济南西站 趵突泉景区 宽厚里 大明湖景区 五龙潭公园 纬九...
西藏骑行日记，我和我的脚踏车驰骋800km+,2022-07-23 出发,共11天,人均6000元,独自一人,深度游 骑行 暑假,1.2万,途经：拉萨 ,行程：扎耶巴寺 拉萨河
山东龙口之旅｜品饕餮美食，观山海仙境,2022-07-22 出发,共1天, , ,美食,3万,途经：龙口 ,行程：丁氏故宅 香水庵 南山大佛
背包游之武汉长江-襄阳中国唐城-十堰武当山,2022-07-17 出发,共6天, , ,暑假 第一次,3645,途经：武汉 ,行程：湖北美术馆 湖北省博物馆 亲子乐园 武汉大学 汉口站 武汉站 武汉长江大桥 武昌站...
西北大环线6日小众游,2022-07-17 出发,共6天,人均8000元,闺蜜,环游 自驾 暑假 第一次,4415,途经：海西 敦煌 酒泉 ,行程：翡翠湖 茶卡盐湖 东台吉乃尔湖 南八仙 大柴旦镇 大柴达木湖 敦煌夜市 莫高窟...
重走茶马古道（拉萨-昌都段），西藏究竟有多美,2022-07-21 出发,共8天,人均8000元,三五好友,深度游 自驾 暑假 摄影,9933,途经：昌都 拉萨 ,行程：通麦 布达拉宫 芒康 然乌湖 八廓街 大昭寺 西藏大学 然乌镇 盐井千年古盐田
江西武功山&仙凤三宝亲子游记,2022-07-21 出发,共1天,人均800元,亲子,温泉 自驾 暑假 夏季 徒步,7792,途经：萍乡 武功山wugongshan ,行程：仙凤三宝农业休闲观光园 武功山
双牌水库+树德山庄+李家大院+浯溪碑林，永州之北自驾行,2022-06-30 出发,共2天,人均300元,独自一人,深度游 自驾 夏季 第一次,8963,途经：永州 祁阳 ,行程：双牌水库 零陵古城 萍洲书院 李家大院 浯溪碑林 香零山
夏日扬州行丨逛美景吃美食，邂逅一场限定美好,2022-07-17 出发,共1天, , ,美食 夏季,2.5万,途经：扬州 ,行程：瘦西湖 五亭桥 长堤春柳 徐园 大明寺 冶春园 冶春 中国大运河博物馆 高旻寺...
扬州夏日之旅，看一眼这人间盛世（附5天4晚行程攻略）,2022-07-16 出发,共1天, , ,美食 温泉 夏季,6万,途经：扬州 ,行程：何园 冶春 汉广陵王墓博物馆 大明寺 个园 瘦西湖 茱萸湾风景区 扬州迎宾馆 扬州...
解锁清凉夏日，邯郸周边酷爽亲子游,2022-06-21 出发,共3天,人均1000元,亲子,暑假 短途周末 夏季,6.6万,途经：邯郸, 
"汉中,留坝5日游",2022-07-02 出发,共5天,人均1500元,家庭,自驾 暑假 短途周末 夏季,1.3万,途经：西安 汉中 留坝 宝鸡 ,行程：曲江旅游度假区 樊川桃花园 红寺湖风景区 龙头山国际旅游度假区 金水湾花海 芳草坪...
夏日滨城｜浪漫之都弥漫着的文艺气息,2022-07-09 出发,共1天, , ,夏季,9210,途经：大连 ,行程：渔人码头 大连博物馆 星海广场 大连贝壳博物馆 大连自然博物馆 世纪留声·世界音乐...
拯救周末计划五日自驾！天下大同！最美晋中！,2022-05-01 出发,共5天,人均2000元,三五好友,美食 五一 自驾 短途周末 摄影,1.2万,途经：大同 ,行程：华严寺 大同土林 云冈石窟 九龙壁 善化寺 凤临阁 代王府 20窟 6窟 大雄宝殿
从森林到草原——内蒙古呼伦贝尔大草原七日游,2022-06-24 出发,共7天,人均4600元,三五好友,毕业游 摄影 夏季 第一次,1万,途经：呼伦贝尔 ,行程：呼伦湖 甘珠尔庙 186彩带河
你与世界的距离 只差一场说走就走的旅行——桂林行,2022-07-01 出发,共5天,人均3500元,亲子,深度游 美食 古镇 暑假 摄影 第一次,9528,途经：桂林 阳朔 ,行程：椿记烧鹅 阳朔 相公山 十里画廊 两江四湖 东西巷 九马画山 兴坪古镇 象鼻山景区...
大连自然风光四日游，这里有绝美的海岛，还是网红打卡地,2022-06-27 出发,共4天,人均4000元,独自一人,购物 美食 海滨海岛 自驾 摄影,3.2万,途经：大连 瓦房店 ,行程：海王九岛 大连海事大学 排石景观 海之韵公园 星海广场
招商伊敦号5天4夜滨海双城游轮之旅，从深圳到厦门，探访海上浪漫花园,2022-06-30 出发,共5天,人均10988元,闺蜜,购物 美食 海滨海岛 游轮 摄影 夏季 探险 冬季,2.6万,途经：厦门Xiamen ,行程：中国唱片博物馆 白鹭洲公园 菽庄花园 鼓浪屿 钢琴博物馆 惠和石文化园 李家庄
小众假期独自一人游北疆,2022-06-18 出发,共6天,人均5000元,独自一人,自驾 夏季 第一次,1.2万,途经：伊宁 伊犁 乌鲁木齐 ,行程：伊宁机场 伊犁河民族文化旅游村 喀赞其民俗村 回族大寺 汉宾公园 伊犁河大桥 解忧...
【北京】百般红紫斗芳菲︱2022年春赏花日记（下）,2022-04-11 出发,共1天, ,独自一人,赏樱 踏春,6528,途经：北京 ,行程：国家植物园 元大都城垣遗址公园 宋庆龄故居 什刹海 银锭桥 国家植物园南园 钟鼓楼...
520爱你的海南之旅,2022-06-29 出发,共5天,人均2000元,家庭,自驾 夏季,7850,途经：陵水 海口 佛山 ,行程：分界洲岛 琼州海峡
乖，宝贝，摸摸头---厦门治愈之旅,2022-01-06 出发,共7天,人均3800元,独自一人,环游 海滨海岛 骑行 冬季,1万,途经：厦门Xiamen ,行程：朱记手撕鸡 第八海鲜市场 第八市场 中山路步行街 厦门轮渡码头 鼓浪屿 西堤咖啡一...
